"","modified","institutionCode","collectionCode","catalogNumber","scientificName","identificationQualifier","family","genus","specificEpithet","scientificNameAuthorship","identifiedBy","dateIdentified","typeStatus","recordNumber","fieldNumber","recordedBy","year","month","day","country","stateProvince","municipality","locality","decimalLongitude","decimalLatitude","occurrenceRemarks","occurrenceID","bibliographicCitation","acceptedNameUsage","infraspecificEpithet","comments"
"289","2017-10-17T00:00:00.000+0000","E","E","E00055603","Psidium myrtoides O.Berg",NA,"Myrtaceae","Psidium","myrtoides","O.Berg",NA,NA,NA,"R 7876",NA,"Ratter, J.A., Bridgewater, S., Filho, J. Fonsêca & Lima, J.C.M.",1997,11,1,"Brazil",NA,NA,NA,NA,NA,NA,"http://data.rbge.org.uk/herb/E00055603",NA,"Psidium myrtoides O.Berg",NA,NA
"290",NA,"UnB","UB","7792","Psidium myrsinoides Berg",NA,"Myrtaceae","Psidium","myrsinoides","Berg","Proença, CEB",NA,NA,"29",NA,"Lima, JCM; Ratter, JA; Bridgewater, S; Fonsêca Filho, J",1997,11,1,"Brazil","Tocantins",NA,"Área entre Palmas e Taquaral próximo do Posto da polícia rodoviária",-48.3,-10.433333,"Árvore 5m; Cerrado ralo.","BRA:UnB:UB:0000007792",NA,"Psidium myrsinoides Berg",NA,NA
"291",NA,"UFG","UFG","24027","Psidium myrsinoides Berg",NA,"Myrtaceae","Psidium","myrsinoides","Berg",NA,NA,NA,"7876",NA,"Ratter, J.A.; Bridgewater, S.; Fonseca-filho, J. & Lima, J.C.M.",1997,11,1,"Brazil","Tocantins","Palmas","32Km from Porto Nacional on the road to Palmas. In campo cerrado.",-48.3,-10.433333,"Tree, 3,5m tall, 6cm dbh, with silvery, guava-like bark pitted with shallow= spherical craters. Fruits brownish with green calyx.","BRA:UFG:UFG:0000024027",NA,"Psidium myrsinoides Berg",NA,NA
"292",NA,"UnB","UB","7842","Psidium myrsinoides Berg",NA,"Myrtaceae","Psidium","myrsinoides","Berg","Proença, CEB",NA,NA,"1840a",NA,"Proença, CEB; Ribeiro, JF; Bridgewater, S; Ratter, JA; Fonsêca Filho, J",1997,11,13,"Brazil","Tocantins","Aliança do Tocantins","12 km ao sul da cidade, Fazenda Odara do Tocantins",-48.883333,-11.433333,"Estéril.; Cerrado s.s sombreado.","BRA:UnB:UB:0000007842",NA,"Psidium myrsinoides Berg",NA,NA
"293",NA,"UFG","UFG","23202","Psidium myrsinoides Berg",NA,"Myrtaceae","Psidium","myrsinoides","Berg","Proença, C.","1997-11-11T00:00:00.000+0000",NA,"1800",NA,"Proença, C.; Bridgewater, S.; Ribeiro-Filho, J.; Ratter, J.A. & Fonseca-filho, J.",1997,11,11,"Brazil","Tocantins","Gurupi","5 km ao Sul de Gurupi. Cerrado denso.",-50.166667,-11.716667,"Arbusto de 1,3m de altura, fruto verde, casca lisa, clara.","BRA:UFG:UFG:0000023202",NA,"Psidium myrsinoides Berg",NA,NA
"295","2017-10-17T00:00:00.000+0000","E","E","E00202998","Psidium myrtoides O.Berg",NA,"Myrtaceae","Psidium","myrtoides","O.Berg",NA,NA,NA,"R1800",NA,"Ratter, James Alexander",1997,11,11,"Brazil","Mato Grosso",NA,"40km N of the Base camp of the Expedition. c. 270km N of Xavantina on the Xavantina-Sao Felix road.",-51.866667,-12.9,NA,"http://data.rbge.org.uk/herb/E00202998",NA,"Psidium myrtoides O.Berg",NA,NA
"297",NA,"UnB","UB","96533","Psidium myrsinoides Berg",NA,"Myrtaceae","Psidium","myrsinoides","Berg","Proença, CEB",NA,NA,"3622",NA,"Silva, MA; Cardoso, E; Alvarenga, D; Mendonça, RC; Azevedo, MLM",1997,11,29,"Brazil","Minas Gerais","Formoso","Parque Nacional Grande Sertão Veredas. Fazenda Mato Grande, proprietário Sr. Nenzinho Carneiro",-45.001944,-15.354444,"Folhas verdes com cheiro característico, tronco com casca lisa.; Arbusto 3,5m. Fruto imaturo verde.; Cerrado. Topologia: Plano.","BRA:UnB:UB:0000096533",NA,"Psidium myrsinoides Berg",NA,NA
"298",NA,"Universidade Federal do Ceará, UFC","EAC","25996","Psidium myrtoides O.Berg",NA,"Myrtaceae","Psidium","myrtoides","O.Berg","Costa, I.R.","2011-06-24T00:00:00.000+0000",NA,"s.n.",NA,"Silveira, E.",1997,12,2,"Brazil","Distrito Federal","Brasília","Terreno do Centro de Convenções Israel Pinheiro",0,0,"Árvore pequena.","BRA:UFC:EAC:0000025996",NA,"Psidium myrtoides O.Berg",NA,NA
"300",NA,"MBM","MBM","287553","Psidium myrtoides O.Berg",NA,"Myrtaceae","Psidium","myrtoides","O.Berg","Landrum, LR",NA,NA,"10084",NA,"Souza, VC; et al.",1996,1,11,"Brazil","Minas Gerais","Caeté","Serra da Piedade",0,0,NA,"BRA:MBM:MBM:0000287553",NA,"Psidium myrtoides O.Berg",NA,NA
"301",NA,"ASU","ASUPlants","242626","Psidium myrtoides O.Berg",NA,"Myrtaceae","Psidium","myrtoides","O.Berg",NA,NA,NA,NA,NA,"Souza et al.",1996,1,11,"Brazil","Minas Gerais",NA,"Serra da Piedade.",NA,NA,NA,NA,NA,"Psidium myrtoides O.Berg",NA,NA
"303",NA,"Cenargen","CEN","27634","Psidium myrsinoides Berg",NA,"Myrtaceae","Psidium","myrsinoides","Berg","B. M. T. Walter",NA,NA,"2990",NA,"Bruno Machado Teles Walter",1996,2,6,"Brazil","Go","URUACU","Estrada de terra da GO - 237 para a fazenda Ponte Alta (Ouro Fino, etc.), cerca de 5 km da GO - 237.",-48.9575,-14.5675,"Coletada na mancha de cerrado ""sensu stricto"". Área de influência do AHE-Serra da Mesa.","BRA:Cenargen:CEN:0000027634",NA,"Psidium myrsinoides Berg",NA,NA
"304",NA,"Cenargen","CEN","27870","Psidium myrsinoides Berg",NA,"Myrtaceae","Psidium","myrsinoides","Berg","B. M. T. Walter",NA,NA,"3229",NA,"Bruno Machado Teles Walter",1996,2,24,"Brazil","Ma","BALSAS","Reservas de cerrado entre plantios de soja. Ao sul da vila Kissy. Projeto BATAVO/CAMPO, lote 23.",-46.716666,-8.633333,"Casca lisa marrom-clara.","BRA:Cenargen:CEN:0000027870",NA,"Psidium myrsinoides Berg",NA,NA
"305","2017-10-19T02:45:35.000+0000","JBRJ","RB","RB00317522","Psidium myrsinoides Berg",NA,"Myrtaceae","Psidium","myrsinoides","Berg","Bruno M. T. Walter","1996-02-24T00:00:00.000+0000",NA,"3229",NA,"Bruno M.T. Walter; et al",1996,2,24,"Brazil","Maranhão","Balsas","Reservas de Cerrado entre plantios de soja. Ao sul da vila Kissy. Projeto Batavo/campo, lote 23.",-14.716667,-8.633333,"Árvore, 5m de altura. Diâmetro na base do rtonco 15 cm. Casca lisa marrom-clara. Fruto: imaturos verdes. Frequência: frequente.","urn:catalog:JBRJ:RB:317522",NA,"Psidium myrsinoides Berg",NA,NA
"306",NA,"Universidade Federal de Minas Gerais (UFMG)","BHCB","113277","Psidium myrtoides O.Berg",NA,"Myrtaceae","Psidium","myrtoides","O.Berg",NA,"2013-11-18T00:00:00.000+0000",NA,"2480",NA,"Gomes, JML",1996,7,17,"Brazil","Espírito Santo","Vila Velha","Glória",0,0,NA,"BRA:UFMG:BHCB:0000113277",NA,"Psidium myrtoides O.Berg",NA,NA
"307",NA,"Universidade Federal do Paraná, UFPR","EFC","6879","Psidium myrtoides O.Berg",NA,"Myrtaceae","Psidium","myrtoides","O.Berg","Sobral, M.","2015-05-08T00:00:00.000+0000",NA,"94",NA,"Koehler, A.",1996,8,25,"Brazil","Paraná","Araucária","Campina dos Martins",NA,NA,"Espécie frequente no subosque da FOM, casca lisa de coloração clara.","BRA:UFPR:EFC:0000006879",NA,"Psidium myrtoides O.Berg",NA,NA
"308",NA,"UnB","UB","7052","Psidium myrsinoides Berg",NA,"Myrtaceae","Psidium","myrsinoides","Berg","Proença, CEB",NA,NA,"1572",NA,"Proença, CEB; Oliveira, RS",1996,10,26,"Brazil","Goiás","Cristalina","RPPN Linda Serra dos Topázios",-47.666667,-16.75,"Casca lisa esfoliante tipo goiabeira, frutos muito jovens.; Arvoreta 3,5m. Flor branca. Fruto verde.; Campo cerrado.","BRA:UnB:UB:0000007052",NA,"Psidium myrsinoides Berg",NA,NA
"309",NA,"UFERSA","MOSS","9044","Psidium myrsinoides Berg",NA,"Myrtaceae","Psidium","myrsinoides","Berg","Proença, C.","1997-01-01T00:00:00.000+0000",NA,"490",NA,"Oliveira, R.C.",1996,11,11,"Brazil","Maranhão","Balsas","Projeto Geral de Balsas, lote 16.",-46.083333,-7.583333,"áerore com 1,80 m., com periderme grossa, formamndo tendas longitudinais profundas, coletada no cerrado; solo arenoso; rara; fruto maduro, amarelo.","BRA:UFERSA:MOSS:0000009044",NA,"Psidium myrsinoides Berg",NA,NA
"310",NA,"Cenargen","CEN","31716","Psidium myrsinoides Berg",NA,"Myrtaceae","Psidium","myrsinoides","Berg","B. M. T. Walter",NA,NA,"3549",NA,"Bruno Machado Teles Walter",1996,11,9,"Brazil","Ma","BALSAS","Projeto de colonização agrícola BATAVO/Campo. Região de reservas de Cerrado próximas ao córrego Tem Medo.",-46.716666,-8.633333,"Casca lisa de coloração marrom-clara.","BRA:Cenargen:CEN:0000031716",NA,"Psidium myrsinoides Berg",NA,NA
"311",NA,"UnB","UB","96511","Psidium myrsinoides Berg",NA,"Myrtaceae","Psidium","myrsinoides","Berg","Proença, CEB",NA,NA,"7675",NA,"Ratter, JA; Bridgewater, S; Fonsêca Filho, J; Garcia, AI; Santos, GB",1996,11,12,"Brazil","Mato Grosso do Sul",NA,"25km from Bodoquena on the road to Miranda (MS-339)",-56.516667,-20.383333,"Small, wide-crowned tree, 4m tall, 12cm dbh, with smooth, pitted, pinkish brown bark.; In dense mesotrophic cerradão.","BRA:UnB:UB:0000096511",NA,"Psidium myrsinoides Berg",NA,NA
"312","2017-10-17T00:00:00.000+0000","E","E","E00009558","Psidium myrtoides O.Berg",NA,"Myrtaceae","Psidium","myrtoides","O.Berg",NA,NA,NA,"R 7675",NA,"Ratter, J.A.; Bridgewater, S.; Filho, J. Fonsêca; Garcia, Alicia Ibañez & Dos Santos, Gilmar B.",1996,11,12,"Brazil",NA,NA,NA,NA,NA,NA,"http://data.rbge.org.uk/herb/E00009558",NA,"Psidium myrtoides O.Berg",NA,NA
"313",NA,"Cenargen","CEN","31770","Psidium myrsinoides Berg",NA,"Myrtaceae","Psidium","myrsinoides","Berg","B. M. T. Walter",NA,NA,"3612",NA,"Bruno Machado Teles Walter",1996,11,29,"Brazil","Go","NIQUELANDIA","Lago em processo de enchimento no AHE Serra da Mesa. Áreas sobre o trecho final do rio Tocantinzinho.",-48.283333,-13.933333,"Reservatório em formação do AHE Serra da Mesa. Frutos ainda não completamente maduros de cor vináceo-escura.","BRA:Cenargen:CEN:0000031770",NA,"Psidium myrsinoides Berg",NA,NA
"314",NA,"Jardim Botânico de Brasília (JBB)","HEPH","12330","Psidium myrtoides O.Berg",NA,"Myrtaceae","Psidium","myrtoides","O.Berg","Proença, CEB","2006-01-01T00:00:00.000+0000",NA,"600",NA,"Nóbrega, MGG",1996,11,5,"Brazil","Distrito Federal","Brasília","Jardim Botânico de Brasília próximo ao Mirante",-47.85,-15.866667,"Arvore; Com frutos imaturos de cor verde.; Cerrado","BRA:JBB:HEPH:0000012330",NA,"Psidium myrtoides O.Berg",NA,NA
"315","2018-08-09T13:58:32.000+0000","JBRJ","RB","RB00316589","Psidium corynanthum (Kiaersk.) Burret",NA,"Myrtaceae","Psidium","corynanthum","(Kiaersk.) Burret","Carolyn Proença",NA,NA,NA,NA,"Wagner Antunes Teixeira",1995,2,1,"Brazil","Minas Gerais","Itabirito","Pico do Itabirito, Coletada na Serra dos Inconfidentes.",NA,NA,"Frutos imaturos verdes com 1,0-1,5 centímetros de diâmetro, arbusto","urn:catalog:JBRJ:RB:316589",NA,"Psidium corynanthum (Kiaersk.) Burret",NA,NA
"316",NA,"Universidade Federal do Ceará, UFC","EAC","23416","Psidium myrtoides O.Berg",NA,"Myrtaceae","Psidium","myrtoides","O.Berg","Costa, I.R.","2011-03-24T00:00:00.000+0000",NA,"s.n.",NA,"Saraiva, A.A.F.",1995,3,4,"Brazil","Ceará","Crato","Barreiro Grande, estrada Crato-Moreilândia",0,0,"Subarbusto; fruto amarelo.; Cerrado","BRA:UFC:EAC:0000023416",NA,"Psidium myrtoides O.Berg",NA,NA
"317",NA,"USP","SPF","101279","Psidium myrtoides O.Berg",NA,"Myrtaceae","Psidium","myrtoides","O.Berg","Proença, C","2010-01-01T00:00:00.000+0000",NA,"471",NA,"Godoy, SAP",1995,4,19,"Brazil","São Paulo","São Paulo","Parelheiros",-46.774444,-23.9,NA,"BRA:USP:SPF:0000101279",NA,"Psidium myrtoides O.Berg",NA,NA
"319",NA,"NY","NY","1801067","Psidium myrtoides O.Berg",NA,"Myrtaceae","Psidium","myrtoides","O.Berg","M. Sobral","2004-01-01T00:00:00.000+0000",NA,"2617",NA,"J. M. A. Braga",1995,8,2,"Brazil","Rio de Janeiro",NA,"Parque Nacional de Itatiaia. Taquaral, encosta a direita (descendo) do rio Campo Belo.",-44.65833,-22.35833,NA,"fe3281c9-5f4b-4f71-8c08-b7c6ac195b2a",NA,"Psidium myrtoides O.Berg",NA,NA
"321",NA,"Cenargen","CEN","22756","Psidium myrsinoides Berg",NA,"Myrtaceae","Psidium","myrsinoides","Berg","B. M. T. Walter",NA,NA,"2727",NA,"Bruno Machado Teles Walter",1995,10,7,"Brazil","Go","NIQUELANDIA","Região da Serra Negra, margem esquerda do rio Bagagem, próximo à fazenda Aroeira, após a CODEMIN, cerca de 15 km desta.",-48.399166,-14.066388,"Botões creme esverdeado. Casca lisa levemente marrom, semelhante à ""goiabeira"". Futuro reservatório do AHE Serra da Mesa.","BRA:Cenargen:CEN:0000022756",NA,"Psidium myrsinoides Berg",NA,NA
"325","2017-10-19T02:45:10.000+0000","JBRJ","RB","RB00317118","Psidium myrsinoides Berg",NA,"Myrtaceae","Psidium","myrsinoides","Berg","C.E. Proença",NA,NA,"2896",NA,"Bruno M.T. Walter; Et all",1995,11,12,"Brazil","Bahia","Formosa do Rio Preto","Projeto Ouro-Verde. Rodovia Anel da Soja. Reservas de cerrado entre plantios de soja.",-41,-11.45,"Árvore 3,5 m altura. Diametro na base 18 cm, casca lisa. Flor cor creme; calice verde; corola creme; disco marrom. Frequênte no local.","urn:catalog:JBRJ:RB:317118",NA,"Psidium myrsinoides Berg",NA,NA
"327",NA,"Cenargen","CEN","24733","Psidium myrsinoides Berg",NA,"Myrtaceae","Psidium","myrsinoides","Berg","C. E. B. Proença",NA,NA,"2896",NA,"Bruno Machado Teles Walter",1995,11,12,"Brazil","Ba","FORMOSA DO RIO PRETO","Projeto Ouro Verde, rodovia ""Anel da Soja"", reservas de cerrado entre plantios de soja.",-46,-11.45,"Casca lisa. Cálice verde, corola creme e ""disco"" marrom.","BRA:Cenargen:CEN:0000024733",NA,"Psidium myrsinoides Berg",NA,NA
"328",NA,"UnB","UB","96529","Psidium myrsinoides Berg",NA,"Myrtaceae","Psidium","myrsinoides","Berg","Proença, CEB",NA,NA,"457",NA,"Oliveira, FCA; Fonsêca, ML; Nunes, G",1995,12,12,"Brazil","Goiás","Niquelândia","Fazenda Traíras. Estrada de chão no km 8 da rodovia Niquelândia/Uruaçú",-48.557222,-14.488611,"Folhas verdes, discolores, cartáceas.; Árvore heliófila 6m. Fruto verde-arroxeado.; Cerrado em morro cascalhento.","BRA:UnB:UB:0000096529",NA,"Psidium myrsinoides Berg",NA,NA
"329","2017-10-06T10:31:06.000+0000","JBRJ","RB","RB00476438","Psidium myrtoides O.Berg",NA,"Myrtaceae","Psidium","myrtoides","O.Berg","M. Sobral","2004-01-01T00:00:00.000+0000",NA,"3018",NA,"J.M.A. Braga; et al",1995,12,5,"Brazil","Rio de Janeiro","Itatiaia","Parque Nacional de Itatiaia. Microparcela A.",-44.566667,-22.25,"Árvore, 12 metros de altura e 8 metros de fuste. DAP: 25,4 cm. Casca esfoliante, entre-casca castanha; folhas verde-lustrosas e membranáceas com margem ondulada. Botões florais amarelados. Frutos imaturos verdes.","urn:catalog:JBRJ:RB:476438",NA,"Psidium myrtoides O.Berg",NA,NA
"331",NA,"UnB","UB","91835","Psidium myrsinoides Berg",NA,"Myrtaceae","Psidium","myrsinoides","Berg","Proença, CEB","1995-01-01T00:00:00.000+0000",NA,"1840",NA,"Silva, MA",1994,1,23,"Brazil","Goiás","Corumbá de Goiás","Corumbá de Goiás",-48.25,-15.7,NA,"BRA:UnB:UB:0000091835",NA,"Psidium myrsinoides Berg",NA,NA
"332",NA,"IAC","IAC","39798","Psidium myrtoides O.Berg",NA,"Myrtaceae","Psidium","myrtoides","O.Berg","M.E.G. Sobral","2002-10-17T00:00:00.000+0000",NA,"145",NA,"F.A.L. Moraes",1994,1,26,"Brazil","São Paulo","Campinas","IAC, Fazenda Santa Elisa, Monjolinho, Quadra Neusa Diniz, L15 - p8",-47.086761,-22.863721,"nºintrodução: 16786 ;procedência: Quadra geremias (IAC), <ll>dwc_commonname:</ll> goiabinha-preta.","BRA:IAC:IAC:0000039798",NA,"Psidium myrtoides O.Berg",NA,NA
"333",NA,"Instituto Plantarum de Estudos da Flora Ltda (HPL)","HPL","9863","Psidium myrtoides O.Berg",NA,"Myrtaceae","Psidium","myrtoides","O.Berg","H. Lorenzi","1994-01-18T00:00:00.000+0000",NA,"1263",NA,"H. Lorenzi",1994,1,18,"Brazil","Sp","Piracicaba","Coletado e cultivado na Escola Superior de Agronomia Luiz de Queiroz (ESALQ); junto ao IPEF.",NA,NA,NA,"BRA:JBP:HPL:0000009863",NA,"Psidium myrtoides O.Berg",NA,NA
"334",NA,"UnB","UB","96505","Psidium myrsinoides Berg",NA,"Myrtaceae","Psidium","myrsinoides","Berg","Incógnito",NA,NA,"212",NA,"Bridgewater, S; Fonsêca Filho, J; Paixão, JF",1994,5,30,"Brazil","Goiás",NA,"Chapada dos Veadeiros; Rio das Almas",-47.283333,-14.116667,"Bark smooth,light grey; widely spreading branching pattern; leaves shiny green, clustered at twig ends.; Tree 4,5m; High altitude rocky cerrado.","BRA:UnB:UB:0000096505",NA,"Psidium myrsinoides Berg",NA,NA
"335",NA,"ASU","ASUPlants","205004","Psidium myrtoides O.Berg",NA,"Myrtaceae","Psidium","myrtoides","O.Berg",NA,NA,NA,NA,NA,"Tamashiro et al.",1994,5,26,"Brazil","Sao Paulo",NA,"Bauru. Parque Ecologico do Bauru.",NA,NA,NA,NA,NA,"Psidium myrtoides O.Berg",NA,NA
"336",NA,"UEM","HUEM","6148","Psidium myrtoides O.Berg",NA,"Myrtaceae","Psidium","myrtoides","O.Berg","Sobral, M.","2009-08-01T00:00:00.000+0000",NA,"978",NA,"Moraes, P.L.R.; Diniz, C.C.",1994,5,21,"Brazil","São Paulo","São Miguel Arcanjo","Parque Estadual Carlos Botelho",0,0,"Árvore, ca 20m; meio de encosta; com frutos vermelhos; tronco esbranquiçado; escamante.","BRA:UEM:HUEM:0000006148",NA,"Psidium myrtoides O.Berg",NA,NA
"337",NA,"UnB","UB","96501","Psidium myrsinoides Berg",NA,"Myrtaceae","Psidium","myrsinoides","Berg","Proença, CEB",NA,NA,"659",NA,"Ramos, AE; Jesus, FPR",1994,5,13,"Brazil","Tocantins","Palmas","Serra do Lageado",-48.216667,-17,"Botões velhos parasitados.; Árvore 4,5m; Chapada.","BRA:UnB:UB:0000096501",NA,"Psidium myrsinoides Berg",NA,NA
"338",NA,"Cenargen","CEN","23520","Psidium myrtoides O.Berg",NA,"Myrtaceae","Psidium","myrtoides","O.Berg","A. Mesquita",NA,NA,"7",NA,"Marta Camargo de Assis",1994,5,5,"Brazil","Df","BRASILIA","Cerrado a 500 m da Fazenda Sucupira; Logo após o açude da fazenda.",-48.016666,-15.916666,"Botões róseos. Flores creme; fuste lisa; cinerea; cálice verde-claro; corola face abaxial rósea; adaxial creme.","BRA:Cenargen:CEN:0000023520",NA,"Psidium myrtoides O.Berg",NA,NA
"340",NA,"UnB","UB","96678","Psidium myrsinoides Berg",NA,"Myrtaceae","Psidium","myrsinoides","Berg","Proença, CEB",NA,NA,"7",NA,"Assis, MC; et al.",1994,5,5,"Brazil","Distrito Federal","Brasília","A 500m da Fazenda Sucupira; logo pós o açude da fazenda",-48.016667,-15.916667,"Botões róseos; fuste lisa; cinerea; cálice verde-claro; corola face abaxial rósea; adaxial creme.; Árvore 3m. Flor creme; Cerrado em borda de mata ciliar. Topologia: Ondulado. Solo: Latossolo.","BRA:UnB:UB:0000096678",NA,"Psidium myrsinoides Berg",NA,NA
"341",NA,"Instituto Plantarum de Estudos da Flora Ltda (HPL)","HPL","9153","Psidium myrtoides O.Berg",NA,"Myrtaceae","Psidium","myrtoides","O.Berg","H. Lorenzi","1993-02-05T00:00:00.000+0000",NA,"155",NA,"H. Lorenzi",1993,2,5,"Brazil","Sp","Jaboticabal","Fazenda Barro Preto, Usina São Francisco, em área de mata.",NA,NA,NA,"BRA:JBP:HPL:0000009153",NA,"Psidium myrtoides O.Berg",NA,NA
"342",NA,"UFSJ","HUFSJ","3797","Psidium myrtoides O.Berg",NA,"Myrtaceae","Psidium","myrtoides","O.Berg","Sobral, M","2013-01-29T00:00:00.000+0000",NA,"1829",NA,"Folli, DA",1993,3,8,"Brazil","Espírito Santo","Linhares","Próximo da Lagoa Juparanã, na praia Floresta.",0,0,"Porte arbóreo, fruto maduro roxo, fruto imaturo verde escuro, fuste achatada, superficie da casca lisa, altura total 6m , altura da fuste 2m, diâmetro da copa 3m.","BRA:UFSJ:HUFSJ:0000003797",NA,"Psidium myrtoides O.Berg",NA,NA
"343",NA,"Reserva Natural Vale (CVRD)","CVRD","4315","Psidium myrtoides O.Berg",NA,"Myrtaceae","Psidium","myrtoides","O.Berg","Sobral, M.","2013-01-29T00:00:00.000+0000",NA,"1829",NA,"Folli, D.A.",1993,3,8,"Brazil","Es","LINHARES","Próximo a Lagoa Juparanã, na Praia Floresta - Linhares ES.",NA,NA,"<ll>dwc_commonname:</ll> Araçá una","BRA:CVRD:CVRD:0000004315",NA,"Psidium myrtoides O.Berg",NA,NA
"344",NA,"Instituto Plantarum de Estudos da Flora Ltda (HPL)","HPL","9179","Psidium myrtoides O.Berg",NA,"Myrtaceae","Psidium","myrtoides","O.Berg","H. Lorenzi","1993-05-19T00:00:00.000+0000",NA,"205",NA,"H. Lorenzi",1993,5,19,"Brazil","Sp","Jaboticabal","Coletado na Fazenda Barro Preto, na Usina São Francisco.",NA,NA,NA,"BRA:JBP:HPL:0000009179",NA,"Psidium myrtoides O.Berg",NA,NA
"345",NA,"UnB","UB","96500","Psidium myrsinoides Berg",NA,"Myrtaceae","Psidium","myrsinoides","Berg","Proença, CEB",NA,NA,"6777",NA,"Ratter, JA; Bridgewater, S; Cardoso, E; Lima, VP",1993,7,8,"Brazil","Tocantins",NA,"Fazenda Bragança, near Darcinópolis",-47.8,-6.55,"With smooth bark like that of Guava.; Small tree 4,5m; In cerradão on very sandy soil.","BRA:UnB:UB:0000096500",NA,"Psidium myrsinoides Berg",NA,NA
"346","2017-12-08T00:00:00.000+0000","E","E","E00878565","Psidium myrtoides O.Berg",NA,"Myrtaceae","Psidium","myrtoides","O.Berg",NA,NA,NA,"R.6777",NA,"Ratter, J.A.; Bridgewater, S. & Cardoso, E.",1993,7,8,"Brazil","Tocantins",NA,"Fazenda Braganca, nr Darcinopolis.",-47.8,-6.55,NA,"http://data.rbge.org.uk/herb/E00878565",NA,"Psidium myrtoides O.Berg",NA,NA
"347",NA,"USP","SPF","100975","Psidium myrtoides O.Berg",NA,"Myrtaceae","Psidium","myrtoides","O.Berg","Tuler, AC",NA,NA,"CFSC13372",NA,"Campos, MTVA",1993,9,21,"Brazil","Minas Gerais","Santana do Riacho","Serra do Cipó",0,0,NA,"BRA:USP:SPF:0000100975",NA,"Psidium myrtoides O.Berg",NA,NA
"348",NA,"UnB","UB","96516","Psidium myrsinoides Berg",NA,"Myrtaceae","Psidium","myrsinoides","Berg","Proença, CEB",NA,NA,"11",NA,"Cunha, IMA; et al.",1993,9,24,"Brazil","Tocantins","Porto Nacional","Área da FAB",0,0,"Árvore; Campo cerrado.","BRA:UnB:UB:0000096516",NA,"Psidium myrsinoides Berg",NA,NA
"349",NA,"Instituto Plantarum de Estudos da Flora Ltda (HPL)","HPL","5722","Psidium myrtoides O.Berg",NA,"Myrtaceae","Psidium","myrtoides","O.Berg","H. Lorenzi","1993-10-25T00:00:00.000+0000",NA,"1056",NA,"H. Lorenzi",1993,10,25,"Brazil","Sp","Santo Antonio de Posse","Coletado na fazenda Palmital, na estrada da mata do lado direito do carreador da estrada principal.",NA,NA,NA,"BRA:JBP:HPL:0000005722",NA,"Psidium myrtoides O.Berg",NA,NA
"350",NA,"Universidade Federal de Santa Catarina (UFSC)","FLOR","29803","Psidium myrtoides O.Berg",NA,"Myrtaceae","Psidium","myrtoides","O.Berg","Mattos, J.",NA,NA,"32267",NA,"Mattos, J.",1993,11,8,"Brazil","Rio Grande do Sul","Maquiné","Cultivada na Estação Experimental de Maquiné.",NA,NA,"arbusto, flor em botão, 1,8m altura","BRA:UFSC:FLOR:0000029803",NA,"Psidium myrtoides O.Berg",NA,NA
"351",NA,"MBML","MBML-HERBARIO","6602","Psidium myrtoides O.Berg",NA,"Myrtaceae","Psidium","myrtoides","O.Berg","M. Sobral/Dez.2002",NA,NA,"42",NA,"E. Bausen",1993,11,29,"Brazil","Espírito Santo","Santa Teresa","Parque do MBML",-40.616667,-19.936111,"Árvore com +/- 5m, com botões flores brancas e frutos verdes. Subida para o pavilhão.","BRA:MBML:MBML-HERBARIO:0000006602",NA,"Psidium myrtoides O.Berg",NA,NA
"352",NA,"Instituto Plantarum de Estudos da Flora Ltda (HPL)","HPL","5720","Psidium myrtoides O.Berg",NA,"Myrtaceae","Psidium","myrtoides","O.Berg","H. Lorenzi","1993-12-16T00:00:00.000+0000",NA,"1213",NA,"H. Lorenzi",1993,12,16,"Brazil","Sp","Mogi Guaçu","Coletado no arboreto da Campininha.",NA,NA,NA,"BRA:JBP:HPL:0000005720",NA,"Psidium myrtoides O.Berg",NA,NA
"353",NA,"UFES","VIES","24645","Psidium myrtoides O.Berg",NA,"Myrtaceae","Psidium","myrtoides","O.Berg","A.C. Tuler","2015-10-08T00:00:00.000+0000",NA,"1258",NA,"L.C.S. Giordano; N. Marquete; R. Fuks; O. Marquete",1992,3,16,"Brazil","Rio de Janeiro","Rio de Janeiro","Jardim Botânico do Rio de Janeiro, Seção VIII, canteiro A (01).",NA,NA,"Árvore de cerca de 8 metros de altura, semi-heiófila, com suber destacável. Folhas membranáceas, verdes discolores. Frutos imaturos verdes, amadurecendo em cor vermelha e maduros vinosos; quando senescente possuem coloração nigrescent","BRA:UFES:VIES:0000024645",NA,"Psidium myrtoides O.Berg",NA,NA
"354",NA,"Cenargen","CEN","18042","Psidium myrsinoides Berg",NA,"Myrtaceae","Psidium","myrsinoides","Berg","C. E. B. Proença",NA,NA,"1193",NA,"Taciana Barbosa Cavalcanti",1992,3,12,"Brazil","Go","COLINAS DO SUL","A 1 km do entroncamento da estrada que vai a ponte do rio Tocantins para Minaçu; a 21 km da usina.",-48.066666,-14.2,NA,"BRA:Cenargen:CEN:0000018042",NA,"Psidium myrsinoides Berg",NA,NA
"355","2014-07-22T13:01:00.000+0000","JBRJ","RB","RB00317257","Psidium myrsinoides Berg",NA,"Myrtaceae","Psidium","myrsinoides","Berg","M. Sobral","2005-01-01T00:00:00.000+0000",NA,"813",NA,"J. Cordeiro; E. Barbosa",1992,3,11,"Brazil","Paraná","Quatro Barras","Morro Sete.",NA,NA,"Arbusto, 1.20 m, frutos imaturos.","urn:catalog:JBRJ:RB:317257",NA,"Psidium myrsinoides Berg",NA,NA
"357",NA,"Cenargen","CEN","17159","Psidium myrsinoides Berg",NA,"Myrtaceae","Psidium","myrsinoides","Berg","C. E. B. Proença","1995-01-01T00:00:00.000+0000",NA,"1383",NA,"Bruno Machado Teles Walter",1992,4,15,"Brazil","Go","NIQUELANDIA","Fazenda Aroeira, ao lado da CODEMIN, lado direito do rio Bagagem.",-48.36667,-14.16667,"Área de influência da UHE Serra da Mesa.","BRA:Cenargen:CEN:0000017159",NA,"Psidium myrsinoides Berg",NA,NA
"358",NA,"Cenargen","CEN","19599","Psidium myrsinoides Berg",NA,"Myrtaceae","Psidium","myrsinoides","Berg","C. E. B. Proença","1997-01-01T00:00:00.000+0000",NA,"18",NA,"Sebastião Pinheiro Cordovil da Silva",1992,10,5,"Brazil","Go","URUACU","Fazenda Macaco.",NA,NA,"Botões com cálice verde e pétalas levemente vináceas; o indivíduo muitas galhas.","BRA:Cenargen:CEN:0000019599",NA,"Psidium myrsinoides Berg",NA,NA
"359",NA,"UnB","UB","96504","Psidium myrsinoides Berg",NA,"Myrtaceae","Psidium","myrsinoides","Berg","Proença, CEB",NA,NA,"1332",NA,"Vieira, RF; et al.",1992,11,23,"Brazil","Goiás","Niquelândia","Futuro reservatório do Aproveitamento Hidrelétrico Serra da Mesa",-48.45,-14.466667,"Árvore 3m x 8cm. Fruto imaturo verde.; Cerrado e transição de mata, alterado. Topologia: Ondulado. Solo: Latossolo.","BRA:UnB:UB:0000096504",NA,"Psidium myrsinoides Berg",NA,NA
"360",NA,"Cenargen","CEN","36692","Psidium myrsinoides Berg",NA,"Myrtaceae","Psidium","myrsinoides","Berg","C. E. B. Proença","2001-01-01T00:00:00.000+0000",NA,"1332",NA,"Roberto Fontes Vieira",1992,11,23,"Brazil","Go","NIQUELANDIA","Futuro reservatório do Aproveitamento Hidrelétrico Serra da Mesa.",-48.45,-14.466666,NA,"BRA:Cenargen:CEN:0000036692",NA,"Psidium myrsinoides Berg",NA,NA
