"","modified","institutionCode","collectionCode","catalogNumber","scientificName","family","genus","specificEpithet","scientificNameAuthorship","identifiedBy","dateIdentified","typeStatus","recordNumber","recordedBy","year","month","day","country","stateProvince","municipality","locality","decimalLongitude","decimalLatitude","occurrenceRemarks","occurrenceID","bibliographicCitation","acceptedNameUsage"
"1",NA,"Universidade Federal de Minas Gerais (UFMG)","BHCB","109988","Psidium cauliflorum Landrum & Sobral","Myrtaceae","Psidium","cauliflorum","Landrum & Sobral",NA,"2006-02-01T00:00:00.000+0000",NA,"27","Ferreira, MHS; França, F",2006,2,12,"Brazil","Bahia","Anguera","Fazenda Retiro, Orla da mata.",-39.180833,-12.165278,"Árvore, ca. 7,0m alt. Folhas opostas concolor, cartácea. Flor com anteras amarelas, caulifloria, botões florais esverdeados.","BRA:UFMG:BHCB:0000109988",NA,"Psidium cauliflorum Landrum & Sobral"
"2",NA,"Universidade Federal da Bahia (UFBA)","ALCB","7870","Psidium cauliflorum Landrum & Sobral","Myrtaceae","Psidium","cauliflorum","Landrum & Sobral","Landrum, L","2007-01-01T00:00:00.000+0000",NA,"326","Grupo Pedra do Cavalo",1980,6,NA,"Brazil","Bahia","Cachoeira","Recôncavo Sul, Vale dos rios Jacuípe e Paraguaçu.",-39.083333,-12.533333,"Ca. 5,5 m de altura. Caulofloria com flores alvas. e frutos purpúreos do tipo baga.","BRA:UFBA:ALCB:0000007870",NA,"Psidium cauliflorum Landrum & Sobral"
"3",NA,"UEFS","HUEFS","753","Psidium cauliflorum Landrum & Sobral","Myrtaceae","Psidium","cauliflorum","Landrum & Sobral","M.Sobral","2006-12-01T00:00:00.000+0000",NA,"814","Grupo Pedra do Cavalo",1980,10,NA,"Brazil","Bahia","Conceição de Feira",NA,NA,NA,NA,"BRA:UEFS:HUEFS:0000000753",NA,"Psidium cauliflorum Landrum & Sobral"
"4","2017-10-15T10:39:13.000+0000","JBRJ","RB","RB00557180","Psidium cauliflorum Landrum & Sobral","Myrtaceae","Psidium","cauliflorum","Landrum & Sobral","Sobral","2007-01-01T00:00:00.000+0000","ISOTYPE","955","Gº Pedra do Cavalo",1980,12,NA,"Brazil","Bahia","Cachoeira","Morro Belo. Vale dos Rios Paraguaçu e Jacuipe.",-39.083333,-12.533333,"Árvore com ca. 4 m de alt.Flore alvas, muito abundantes e em glomérulos caulinares.","urn:catalog:JBRJ:RB:557180",NA,"Psidium cauliflorum Landrum & Sobral"
"5","2017-10-15T12:40:00.000+0000","JBRJ","RB","RB00542173","Psidium cauliflorum Landrum & Sobral","Myrtaceae","Psidium","cauliflorum","Landrum & Sobral","Sobral","2007-01-01T00:00:00.000+0000","ISOTYPE","955","Gº Pedra do Cavalo",1980,12,NA,"Brazil","Bahia","Cachoeira","Morro Belo. Vale dos Rios Paraguaçu e Jacuipe.",-39.083333,-12.533333,"Árvore com ca. 4 m de alt.Flore alvas, muito abundantes e em glomérulos caulinares.","urn:catalog:JBRJ:RB:542173",NA,"Psidium cauliflorum Landrum & Sobral"
"6",NA,"Universidade Federal da Bahia (UFBA)","ALCB","07843","Psidium cauliflorum Landrum & Sobral","Myrtaceae","Psidium","cauliflorum","Landrum & Sobral","Landrum, L","2007-01-01T00:00:00.000+0000",NA,"955","Grupo Pedra do Cavalo",1980,12,NA,"Brazil","Bahia","Cachoeira","Recôncavo Sul, Vale dos rios Jacuípe e Paraguaçu. Morro Belo.",-39.083333,-12.533333,"Ca. 4 m de altura. Flores alvas, muito abundantes, e em glomérulos caulinares.","BRA:UFBA:ALCB:0000007843",NA,"Psidium cauliflorum Landrum & Sobral"
"7",NA,"ASU","ASUPlants","230381","Psidium cauliflorum Landrum & Sobral","Myrtaceae","Psidium","cauliflorum","Landrum & Sobral",NA,NA,NA,NA,"Pedra do Cavalo et al.",NA,NA,NA,"Brazil","Bahia",NA,"Estacao de mata. Vale dos Rios. Paraguacu e Jacuipe. Morro Belo.",NA,NA,NA,NA,NA,"Psidium cauliflorum Landrum & Sobral"
"8",NA,"ASU","ASUPlants","230385","Psidium cauliflorum Landrum & Sobral","Myrtaceae","Psidium","cauliflorum","Landrum & Sobral",NA,NA,NA,NA,"Pedra do Cavalo et al.",NA,NA,NA,"Brazil","Bahia",NA,"Estacao de mata. Vale dos Rios. Paraguacu e Jacuipe.",NA,NA,NA,NA,NA,"Psidium cauliflorum Landrum & Sobral"
"9",NA,"Comissão Executiva do Plano da Lavoura Cacaueira (CEPLAC)","CEPEC","28172","Psidium cauliflorum Landrum & Sobral","Myrtaceae","Psidium","cauliflorum","Landrum & Sobral","L. R. Landrum",NA,"PARATYPE","814","Grupo Pedra do Cavalo",NA,NA,NA,"Brazil","Bahia","CACHOEIRA","Estação da Mata (Barragem de Bananeiras). Vale dos Rios Paraguaçú e Jacuipe.",-39.083333,-12.533333,"Ambiente: Mata. Habito: Árvore, ca. 4m.","BRA:CEPLAC:CEPEC:0000028172",NA,"Psidium cauliflorum Landrum & Sobral"
