"","modified","institutionCode","collectionCode","catalogNumber","scientificName","family","genus","specificEpithet","scientificNameAuthorship","identifiedBy","dateIdentified","typeStatus","recordNumber","fieldNumber","recordedBy","year","month","day","country","stateProvince","municipality","locality","decimalLongitude","decimalLatitude","occurrenceRemarks","occurrenceID","acceptedNameUsage","identificationQualifier","infraspecificEpithet","comments","bibliographicCitation"
"1","2015-06-25T09:42:32.000+0000","JBRJ","RB","RB00974936","Elizabetha speciosa Ducke","Fabaceae","Elizabetha","speciosa","Ducke","J.R.Mattos e M. Nadruz","2015-06-26T00:00:00.000+0000",NA,"124",NA,"J.R.Mattos",2015,6,23,"Brazil","Rio de Janeiro","Rio de Janeiro","Canteiro 20A, JBRJ.",NA,NA,"Folhas alternas, glabras, esverdeadas, compostas pinadas, com folíolos sésseis, opostos e lineares e com margem inteira. Flores com brácteas avinhadas, sépalas e pétalas avermelhadas.","urn:catalog:JBRJ:RB:974936","Elizabetha speciosa Ducke",NA,NA,NA,NA
"2","2017-10-18T18:22:02.000+0000","JBRJ","RB","RB00902934","Elizabetha speciosa Ducke","Fabaceae","Elizabetha","speciosa","Ducke","Dexter, K.G.",NA,NA,"7001",NA,"Dexter, K.G.; Correa, C.",2014,7,3,"Brazil","Amazonas","Manaus","Reserva Adolfo Ducke, North of Manaus, PPBIO plot LO8:3500.",-59.928056,-2.960556,"8,5m alt., 4,6cm DBH, brown bark with lenticels - Material no Banco de DNA","urn:catalog:JBRJ:RB:902934","Elizabetha speciosa Ducke",NA,NA,NA,NA
"3","2014-09-26T00:00:00.000+0000","Instituto Nacional de Pesquisas da Amazônia (INPA)","Coleção Botânica, Instituto Nacional de Pesquisas da Amazônia (INPA)","256550","Elizabetha speciosa Ducke","Fabaceae","Elizabetha","speciosa","Ducke","Ramos, J.F.","2013-01-15T00:00:00.000+0000",NA,"3308",NA,"Amaral, IL do",2012,10,15,"Brazil","Pará",NA,"Rio Tapajós - Canta Galo - Mamãe Anã, Margem direita do Rio Tapajós",-57.39,-5.813611,NA,"urn:catalog:inpa:herbarium:244758","Elizabetha speciosa Ducke",NA,NA,NA,NA
"4",NA,"Instituto Federal de Educação, Ciência e Tecnologia (IFAM)","EAFM","2683","Elizabetha speciosa Ducke","Fabaceae","Elizabetha","speciosa","Ducke","Gurgel-Silva, E.","2010-10-30T00:00:00.000+0000",NA,"208",NA,"Gurgel-Silva, E.; Dantas, F.M.",2010,10,30,"Brazil","Amazonas","Manaus","IFAM, Campus Manaus-Zona Leste, Ao lado da barragem.",0,0,"Arvoreta; 10 m; CAP 40 cm; folhas com folíolos opostos e com glândulas entre os mesmo; ramos com bainha que secam e se desprendem.; Vertente. ; HA","BRA:IFAM - CMZL:EAFM:0000002683","Elizabetha speciosa Ducke",NA,NA,NA,NA
"5",NA,"Instituto Federal de Educação, Ciência e Tecnologia (IFAM)","EAFM","1360","Elizabetha speciosa Ducke","Fabaceae","Elizabetha","speciosa","Ducke","Assunção, P.","2010-03-11T00:00:00.000+0000",NA,"178",NA,"Stropp, J.; Assunção, P.",2007,7,NA,"Brazil","Amazonas","São Gabriel da Cachoeira","rio Içana; igarapé Pamaali, próximo a Escola Indígena Baniwa Coripaco Pamaali.",0,0,"Floresta de terra-firme. ; HA","BRA:IFAM - CMZL:EAFM:0000001360","Elizabetha speciosa Ducke",NA,NA,NA,NA
"6","2017-10-10T23:56:31.000+0000","JBRJ","RB","RB00141501","Elizabetha speciosa Ducke","Fabaceae","Elizabetha","speciosa","Ducke",NA,NA,NA,NA,NA,"J E Meireles",2003,1,NA,"Brazil","Rio de Janeiro","Rio de Janeiro","Cult. no Jardim Botânico, canteiro 20 A.",NA,NA,NA,"urn:catalog:JBRJ:RB:141501","Elizabetha speciosa Ducke",NA,NA,NA,NA
"7","2014-09-26T00:00:00.000+0000","Instituto Nacional de Pesquisas da Amazônia (INPA)","Coleção Botânica, Instituto Nacional de Pesquisas da Amazônia (INPA)","232915","Elizabetha speciosa Ducke","Fabaceae","Elizabetha","speciosa","Ducke",NA,NA,NA,"349",NA,"Pereira, E da C.",2003,2,20,"Brazil","Amazonas",NA,"Reserva Florestal Adolfo Ducke, Rodovia Manaus-Itacoatiara, km 26. Trilha L-O2, km 4.5.",-59.55,-2.5549,NA,"urn:catalog:inpa:herbarium:215834","Elizabetha speciosa Ducke",NA,NA,NA,NA
"8","2014-09-26T00:00:00.000+0000","Instituto Nacional de Pesquisas da Amazônia (INPA)","Coleção Botânica, Instituto Nacional de Pesquisas da Amazônia (INPA)","222652","Elizabetha speciosa Ducke","Fabaceae","Elizabetha","speciosa","Ducke","Castilho, C.V. de","2007-11-01T00:00:00.000+0000",NA,"409",NA,"Pereira, E da C.",2003,3,29,"Brazil","Amazonas",NA,"Reserva Florestal Adolfo Ducke, Reserva Florestal Adolpho Ducke. Rodovia Manaus-Itacoatiara, km 26. Trilha L-O6, km 6.5.",-59.97,-2.883333,NA,"urn:catalog:inpa:herbarium:119985","Elizabetha speciosa Ducke",NA,NA,NA,NA
"9","2014-09-26T00:00:00.000+0000","Instituto Nacional de Pesquisas da Amazônia (INPA)","Coleção Botânica, Instituto Nacional de Pesquisas da Amazônia (INPA)","222653","Elizabetha speciosa Ducke","Fabaceae","Elizabetha","speciosa","Ducke","Castilho, C.V. de","2003-04-01T00:00:00.000+0000",NA,"1212",NA,"Castilho, CV",2003,4,8,"Brazil","Amazonas",NA,"Reserva Florestal Adolfo Ducke, Reserva Florestal Adolpho Ducke. Rodovia Manaus-Itacoatiara, km 26. Trilha L-O6, km 5.5. Solo argiloso.",-59.97,-2.883333,NA,"urn:catalog:inpa:herbarium:24692","Elizabetha speciosa Ducke",NA,NA,NA,NA
"10",NA,"Instituto Plantarum de Estudos da Flora Ltda (HPL)","HPL","3461","Elizabetha speciosa Ducke","Fabaceae","Elizabetha","speciosa","Ducke","H. Lorenzi","2003-11-12T00:00:00.000+0000",NA,"4167",NA,"H. Lorenzi",2003,11,12,"Brazil","Rj","Rio de Janeiro","Coletada no Jardim Botânico do Rio de Janeiro.",NA,NA,NA,"BRA:JBP:HPL:0000003461","Elizabetha speciosa Ducke",NA,NA,NA,NA
"11","2014-09-26T00:00:00.000+0000","Instituto Nacional de Pesquisas da Amazônia (INPA)","Coleção Botânica, Instituto Nacional de Pesquisas da Amazônia (INPA)","232763","Elizabetha speciosa Ducke","Fabaceae","Elizabetha","speciosa","Ducke",NA,NA,NA,"579",NA,"Castilho, CV",2002,1,19,"Brazil","Amazonas",NA,"Reserva Florestal Adolpho Ducke., Rodovia Manaus-Itacoatiara, km 26. Trilha L-O3, km 6.5. Solo arenoso.",-59.91,-2.936429,NA,"urn:catalog:inpa:herbarium:215434","Elizabetha speciosa Ducke",NA,NA,NA,NA
"12","2014-09-26T00:00:00.000+0000","Instituto Nacional de Pesquisas da Amazônia (INPA)","Coleção Botânica, Instituto Nacional de Pesquisas da Amazônia (INPA)","210076","Elizabetha speciosa Ducke","Fabaceae","Elizabetha","speciosa","Ducke","Kinupp, V.F.","2001-01-01T00:00:00.000+0000",NA,"1717",NA,"Kinupp, VF",2001,5,1,"Brazil","Amazonas",NA,"Reserva Florestal Adolfo Ducke, Reserva Florestal Adolpho Ducke",-59.97,-2.883333,NA,"urn:catalog:inpa:herbarium:77474","Elizabetha speciosa Ducke",NA,NA,NA,NA
"13","2017-10-04T12:49:02.000+0000","JBRJ","RB","RB00194782","Elizabetha speciosa Ducke","Fabaceae","Elizabetha","speciosa","Ducke","H.C.de Lima",NA,NA,"5716",NA,"H.C. DE LIMA; R. MATEUS",2000,10,31,"Brazil","Rio de Janeiro","Rio de Janeiro","ARBORETO, CANTEIRO 20-A, PRÓXIMO À REGIÃO AMAZÔNICA.",NA,NA,"ARVORETA COM 3 M ALT. INFL. ERÉCTA COM BRÁCTEAS E BRACTÉOLAS VINOSAS. FLORES VERMELHO ESCURO, PARTE BASAL ALVA OU ALVO-AVERMELHADO. FRUTOS JOVENS CASTANHO-VINOSOS. CULTIVADA.","urn:catalog:JBRJ:RB:194782","Elizabetha speciosa Ducke",NA,NA,NA,NA
"14",NA,"UEFS","HUEFS","197840","Elizabetha speciosa Ducke","Fabaceae","Elizabetha","speciosa","Ducke",NA,NA,NA,"54",NA,"Martins, L.H.P.",1997,11,12,"Brazil","Amazonas","Manaus","Reseva Florestal Ducke, Manaus-Itacoatiara, km26.",-59.966667,-2.883333,NA,"BRA:UEFS:HUEFS:0000197840","Elizabetha speciosa Ducke",NA,NA,NA,NA
"16","2012-09-11T00:00:00.000+0000","K","Herbarium","K000834705","Elizabetha speciosa Ducke","Fabaceae","Elizabetha","speciosa","Ducke","Martins, L.H.P.",NA,NA,"54",NA,"Assunção, P.A.C.L.; Silva, C.F.; Hopkins, M.J.G.; Costa, M.A.S.; Martins, L.H.P.",1997,11,12,"Brazil",NA,NA,"Reserva Florestal Ducke, Manaus-Itacoatiara, km 26. Trilha de acesso para o Tinga. Logo no início.",-59.97,-2.88,"Flora da Reserva Ducke. Overseas Development Administration","http://specimens.kew.org/herbarium/K000834705","Elizabetha speciosa Ducke",NA,NA,NA,NA
"18","2014-07-22T08:10:31.000+0000","JBRJ","RB","RB00141537","Elizabetha speciosa Ducke","Fabaceae","Elizabetha","speciosa","Ducke",NA,NA,NA,NA,NA,"A Vaz",1995,3,30,"Brazil","Rio de Janeiro","Rio de Janeiro","Jardim Botânico, cant. 20G nº4903.",NA,NA,"Arvoreta, ramos marrom c/ estipulas coriáceas caducas, fls. disc. verde. Flores c/ brácteas vinosas, hipanto creme, cálice, pétalas e filetes escarlate. Frutos imaturos verde c/ margem marrom.","urn:catalog:JBRJ:RB:141537","Elizabetha speciosa Ducke",NA,NA,NA,NA
"19","2014-09-26T00:00:00.000+0000","Instituto Nacional de Pesquisas da Amazônia (INPA)","Coleção Botânica, Instituto Nacional de Pesquisas da Amazônia (INPA)","189588","Elizabetha speciosa Ducke","Fabaceae","Elizabetha","speciosa","Ducke","Martins, L.H.P.",NA,NA,"672",NA,"Sothers, CA",1995,11,8,"Brazil","Amazonas",NA,"Reserva Florestal Adolfo Ducke, Igarapé do Tinga.",-59.97,-2.883333,NA,"urn:catalog:inpa:herbarium:188208","Elizabetha speciosa Ducke",NA,NA,NA,NA
"20",NA,"UEFS","HUEFS","197841","Elizabetha speciosa Ducke","Fabaceae","Elizabetha","speciosa","Ducke",NA,NA,NA,"125",NA,"Souza, M.P.D.",1995,11,8,"Brazil","Amazonas","Manaus","Reseva Florestal Ducke, Manaus-Itacoatiara, km26.",-59.966667,-2.883333,NA,"BRA:UEFS:HUEFS:0000197841","Elizabetha speciosa Ducke",NA,NA,NA,NA
"22","2012-09-11T00:00:00.000+0000","K","Herbarium","K000834704","Elizabetha speciosa Ducke","Fabaceae","Elizabetha","speciosa","Ducke","Martins, L.H.P.",NA,NA,"672",NA,"Souza, M.A.D.; Sothers, C.A.; Pereira, E.C.; Silva, C.F.",1995,11,8,"Brazil",NA,"Manaus","Reserva Florestal Ducke, Manaus-Itacoatiara, Km 26. Igarapé do Tinga.",-59.97,-2.88,"Flora da Reserva Ducke. Instituto Nacional de Pesquisas da Amazônia. Overseas Development","http://specimens.kew.org/herbarium/K000834704","Elizabetha speciosa Ducke",NA,NA,NA,NA
"24","2014-09-26T00:00:00.000+0000","Instituto Nacional de Pesquisas da Amazônia (INPA)","Coleção Botânica, Instituto Nacional de Pesquisas da Amazônia (INPA)","179544","Elizabetha speciosa Ducke","Fabaceae","Elizabetha","speciosa","Ducke","Martins, L.H.P.",NA,NA,"1132",NA,"Ribeiro, JELS",1993,8,12,"Brazil","Amazonas",NA,"Reserva Florestal Adolfo Ducke, Igarapé do Tinga.",-59.97,-2.883333,NA,"urn:catalog:inpa:herbarium:153170","Elizabetha speciosa Ducke",NA,NA,NA,NA
"26","2017-10-11T00:14:20.000+0000","JBRJ","RB","RB00140440","Elizabetha speciosa Ducke","Fabaceae","Elizabetha","speciosa","Ducke","H.C.de Lima",NA,NA,NA,NA,"I. de Vattimo; et al",1991,3,NA,"Brazil","Rio de Janeiro","Rio de Janeiro","JBRJ seçã o20, canteiro A, 4402.",NA,NA,NA,"urn:catalog:JBRJ:RB:140440","Elizabetha speciosa Ducke",NA,NA,NA,NA
"27","2014-09-26T00:00:00.000+0000","Instituto Nacional de Pesquisas da Amazônia (INPA)","Coleção Botânica, Instituto Nacional de Pesquisas da Amazônia (INPA)","145594","Elizabetha speciosa Ducke","Fabaceae","Elizabetha","speciosa","Ducke",NA,NA,NA,"s.n.",NA,"Carvalho, IR de",1984,2,20,"Brazil","Rio de Janeiro",NA,"Jardim Botânico, Seção XX, cant. G. placa 4903, piquete 2.",NA,NA,NA,"urn:catalog:inpa:herbarium:23946","Elizabetha speciosa Ducke",NA,NA,NA,NA
"28","2014-07-22T08:10:32.000+0000","JBRJ","RB","RB00141512","Elizabetha speciosa Ducke","Fabaceae","Elizabetha","speciosa","Ducke",NA,NA,NA,"174",NA,"GAF; I R Carvalho, R .C Costa",1984,2,20,"Brazil","Rio de Janeiro","Rio de Janeiro","Jard. Bot. do RJ, Seção XX, Cant. G.",NA,NA,"Árvore, flor vermelha.","urn:catalog:JBRJ:RB:141512","Elizabetha speciosa Ducke",NA,NA,NA,NA
"29","2014-07-22T08:10:34.000+0000","JBRJ","RB","RB00141551","Elizabetha speciosa Ducke","Fabaceae","Elizabetha","speciosa","Ducke",NA,NA,NA,"92",NA,"S M de Faria; H C Lima",1984,6,18,"Brazil","Rio de Janeiro","Rio de Janeiro","JBRJ.",NA,NA,"Muda do campo com 10 cm de alt. com cotilédones. Sem nódulos.","urn:catalog:JBRJ:RB:141551","Elizabetha speciosa Ducke",NA,NA,NA,NA
"30","2017-10-17T18:13:09.000+0000","JBRJ","RB","RB00141541","Elizabetha speciosa Ducke","Fabaceae","Elizabetha","speciosa","Ducke",NA,NA,NA,NA,NA,"H C de Lima",1977,NA,NA,"Brazil","Amazonas","Amazonas",NA,NA,NA,"Arbusto ca 3m de alt., fl. vinosas; frutos castanho-claro.","urn:catalog:JBRJ:RB:141541","Elizabetha speciosa Ducke",NA,NA,NA,NA
"31","2014-09-26T00:00:00.000+0000","Instituto Nacional de Pesquisas da Amazônia (INPA)","Coleção Botânica, Instituto Nacional de Pesquisas da Amazônia (INPA)","66587","Elizabetha speciosa Ducke","Fabaceae","Elizabetha","speciosa","Ducke","Silva, M.F. da","1980-10-01T00:00:00.000+0000",NA,"622",NA,"Mota, CDA da",1976,NA,NA,"Brazil","Amazonas",NA,"Estrada Manaus-Caracaraí, BR 174, Km 57.",NA,NA,NA,"urn:catalog:inpa:herbarium:110432","Elizabetha speciosa Ducke",NA,NA,NA,NA
"32","2014-09-26T00:00:00.000+0000","Instituto Nacional de Pesquisas da Amazônia (INPA)","Coleção Botânica, Instituto Nacional de Pesquisas da Amazônia (INPA)","27905","Elizabetha speciosa Ducke","Fabaceae","Elizabetha","speciosa","Ducke","Silva, M. da",NA,NA,"8731",NA,"Rodrigues, WA",1970,3,5,"Brazil","Amazonas",NA,"AM10, Km 68., Estrada Manaus-Itacoatiara, Km 68.",NA,NA,NA,"urn:catalog:inpa:herbarium:163487","Elizabetha speciosa Ducke",NA,NA,NA,NA
"33","2017-11-19T07:40:06.000+0000","JBRJ","RB","RB00141546","Elizabetha speciosa Ducke","Fabaceae","Elizabetha","speciosa","Ducke",NA,NA,NA,"193",NA,"E Guimarães; C Abreu",1968,6,22,"Brazil","Rio de Janeiro","Rio de Janeiro","JBRJ,  cant  XX-  A  placa  4903.",NA,NA,NA,"urn:catalog:JBRJ:RB:141546","Elizabetha speciosa Ducke",NA,NA,NA,NA
"34",NA,"US","Botany","2676980","Elizabetha speciosa Ducke","Fabaceae","Elizabetha","speciosa","Ducke",NA,NA,NA,"4850",NA,"W. A. Rodrigues & D. F. Coêlho",1962,11,30,"Brazil","Amazonas",NA,"Manaus, estrada manaus-caracarai, km 64; estacao biologica do inpa",NA,NA,NA,"http://n2t.net/ark:/65665/38e01df86-ce9e-46c7-82c3-e8369bf878a8","Elizabetha speciosa Ducke",NA,NA,NA,NA
"36",NA,"US","Botany","2676948","Elizabetha speciosa Ducke","Fabaceae","Elizabetha","speciosa","Ducke",NA,NA,NA,"4912",NA,"W. A. Rodrigues, D. F. Coêlho & A. Loureiro",1962,12,12,"Brazil","Amazonas",NA,"Manaus, estrada manaus-caracarai, km 20",NA,NA,NA,"http://n2t.net/ark:/65665/341a67dc0-db8c-4ada-bde4-74925e6847ad","Elizabetha speciosa Ducke",NA,NA,NA,NA
"38",NA,"UFSM","SMDB","644","Elizabetha speciosa Ducke","Fabaceae","Elizabetha","speciosa","Ducke",NA,NA,NA,"s.n.",NA,"Prass, OV",1951,9,8,"Brazil","Rj","Rio de Janeiro","Jardim Botânico",0,0,NA,"BRA:UFSM:SMDB:0000000644","Elizabetha speciosa Ducke",NA,NA,NA,NA
"39",NA,"Pontifícia Universidade Católica do Rio de Janeiro (PUC-RIO)","FCAB","1616","Elizabetha speciosa Ducke","Fabaceae","Elizabetha","speciosa","Ducke",NA,NA,NA,"s.n.",NA,"P. Capell S.J.",1951,11,10,"Brazil","Rio de Janeiro",NA,"Jardim Botânico",0,0,NA,"BRA:PUC-RIO:FCAB:0000001616","Elizabetha speciosa Ducke",NA,NA,NA,NA
"40","2012-09-11T00:00:00.000+0000","K","Herbarium","K000834706","Elizabetha speciosa Ducke","Fabaceae","Elizabetha","speciosa","Ducke","Ducke, A.","1943-11-30T00:00:00.000+0000",NA,"48",NA,"Ducke, A.",1943,11,30,"Brazil",NA,"Manaus","Estrada do Aleixo.",NA,NA,"II Col.","http://specimens.kew.org/herbarium/K000834706","Elizabetha speciosa Ducke",NA,NA,NA,NA
"42",NA,"MN","R","54526","Elizabetha speciosa Ducke","Fabaceae","Elizabetha","speciosa","Ducke","Cowan, R.S.","1975-10-01T00:00:00.000+0000",NA,"48",NA,"Ducke, W.A.",1935,10,17,"Brazil","Amazonas","Manaus",NA,NA,NA,NA,"BRA:MN:R:0000054526","Elizabetha speciosa Ducke",NA,NA,NA,NA
"45","2015-04-11T10:12:54.000+0000","S","VascularPlants","S-R-8731","Elizabetha speciosa Ducke","Fabaceae","Elizabetha","speciosa","Ducke",NA,NA,NA,"23730",23730,"A. Ducke",1933,10,2,"Brazil","Amazonas",NA,"[Brazil] Manáos, (civ. Amazonas), Estrada de Aleixo, Kilom. 12, silva non inundabili secus rivulum",NA,NA,NA,"S:VascularPlants:S-R-8731","Elizabetha speciosa Ducke",NA,NA,NA,NA
"46","2010-09-03T11:24:36.000+0000","Harvard University","A","barcode-00066296","Elizabetha speciosa Ducke","Fabaceae","Elizabetha","speciosa","Ducke",NA,NA,"ISOTYPE","169",169,"A. Ducke",1932,2,1,"Brazil",NA,NA,"Amazon [prope urbemManaos]",NA,NA,NA,NA,"Elizabetha speciosa Ducke",NA,NA,NA,NA
"47","2012-12-03T10:34:10.000+0000","K","Herbarium","K000858681","Elizabetha speciosa Ducke","Fabaceae","Elizabetha","speciosa","Ducke","Cowan, R.S.",NA,"ISOTYPE","s.n.",NA,"Ducke, A.",1932,2,17,"Brazil",NA,NA,"Manaus; Estrada do Aleixo km 12.",NA,NA,"Herbario do Jardim Botanico do Rio de Janeiro, Registro No. 23730.","http://specimens.kew.org/herbarium/K000858681","Elizabetha speciosa Ducke",NA,NA,NA,NA
"48","2017-10-17T13:03:14.000+0000","JBRJ","RB","RB00585840","Elizabetha speciosa Ducke","Fabaceae","Elizabetha","speciosa","Ducke",NA,NA,"HOLOTYPE",NA,NA,"Ducke, A.",1932,10,2,"Brazil","Amazonas","Manaus","Estrada do Aleixo, Km 12, mata da terra firme perto de um riachinho negro.",NA,NA,"Árv. peq. até média, botões vegetativos vermelhos, folhas novas róseas, flores rubras  (cor de sangue), fr. rubro. Estrada do Aleixo, Km 12","urn:catalog:JBRJ:RB:585840","Elizabetha speciosa Ducke",NA,NA,NA,NA
"49",NA,"US","Botany","1574592","Elizabetha speciosa Ducke","Fabaceae","Elizabetha","speciosa","Ducke",NA,NA,"ISOTYPE","23729",NA,"A. Ducke",1932,10,2,"Brazil","Amazonas",NA,"Near Manaos.",NA,NA,NA,"http://n2t.net/ark:/65665/367744a2d-4cbc-44a5-8e62-dbd0679895da","Elizabetha speciosa Ducke",NA,NA,NA,NA
"51",NA,"F","Botany",NA,"Elizabetha speciosa Ducke","Fabaceae","Elizabetha","speciosa","Ducke",NA,NA,"ISOTYPE","RB 23730",NA,"A. Ducke",1932,10,2,"Brazil","Amazonas",NA,"Manaus, Estrada do Aleixo Km 12.",NA,NA,NA,"693f3b21-4c00-4d0b-bd99-75cec2dc39e0","Elizabetha speciosa Ducke",NA,NA,NA,NA
"53",NA,"UEFS","HUEFS","161977","Elizabetha speciosa Ducke","Fabaceae","Elizabetha","speciosa","Ducke",NA,NA,NA,"RB23730",NA,"Ducke, A.",1932,10,2,"Brazil","Amazonas","Manaus","Estrada do aleixo km 12. Perto de um riachinho negro.",NA,NA,"Mata.","BRA:UEFS:HUEFS:0000161977","Elizabetha speciosa Ducke",NA,NA,NA,NA
"55",NA,"MN","R-TIPOS","28777","Elizabetha speciosa Ducke","Fabaceae","Elizabetha","speciosa","Ducke","Cowan, R.S.","1975-10-01T00:00:00.000+0000","ISOTYPE","HJBR 23730",NA,"Ducke, W.A.",1932,10,2,"Brazil","Amazonas","Manaus",NA,NA,NA,NA,"BRA:MN:R-TIPOS:0000028777","Elizabetha speciosa Ducke",NA,NA,NA,NA
"61","2008-02-21T10:23:13.000+0000","K","Herbarium","K000264882","Elizabetha speciosa Ducke","Fabaceae","Elizabetha","speciosa","Ducke",NA,NA,NA,"23730",NA,"Ducke, A.",1932,10,2,"Brazil",NA,NA,"Manaos",NA,NA,NA,"http://specimens.kew.org/herbarium/K000264882","Elizabetha speciosa Ducke",NA,NA,NA,NA
"65",NA,"Instituto de Botânica, IBT","SP","429597","Elizabetha speciosa Ducke","Fabaceae","Elizabetha","speciosa","Ducke","Cowan, RS","1975-10-01T00:00:00.000+0000","ISOTYPE","s.n.",NA,"Ducke, A",1932,10,2,"Brazil","Amazonas","Manaus","Estrada do Aleixo, km 12. Mata perto d'um riachinho negro",0,0,"Árvore pequena até mediana, flores rubras","BRA:IBt:SP:0000429597","Elizabetha speciosa Ducke",NA,NA,NA,NA
"71",NA,"NY","NY","803813","Elizabetha speciosa Ducke","Fabaceae","Elizabetha","speciosa","Ducke","K. M. Redden","2004-01-01T00:00:00.000+0000","ISOTYPE","Herb. RB No. 23730",NA,"W. A. Ducke",1932,10,2,"Brazil","Amazonas",NA,"Manaos.",-59.995308,-3.067324,NA,"68533044-d6be-4c53-8b7b-55d22fa5d9bb","Elizabetha speciosa Ducke",NA,NA,NA,NA
"75","2017-10-18T00:15:07.000+0000","JBRJ","RB","RB00141520","Elizabetha speciosa Ducke","Fabaceae","Elizabetha","speciosa","Ducke",NA,NA,NA,"3634",NA,"Fontella",NA,NA,NA,"Brazil","Rio de Janeiro","Rio de Janeiro","JB do RJ. Canteiro XX 6 120.",NA,NA,"4m altura.","urn:catalog:JBRJ:RB:141520","Elizabetha speciosa Ducke",NA,NA,NA,NA
"76","2017-10-18T02:38:11.000+0000","JBRJ","RB","RB00141517","Elizabetha speciosa Ducke","Fabaceae","Elizabetha","speciosa","Ducke",NA,NA,NA,"4903",NA,"F Fontella",NA,NA,NA,"Brazil","Rio de Janeiro","Rio de Janeiro","Jardim Botânico. Canteiro XX.",NA,NA,"11m de altura.","urn:catalog:JBRJ:RB:141517","Elizabetha speciosa Ducke",NA,NA,NA,NA
"77","2017-10-18T02:07:58.000+0000","JBRJ","RB","RB00202849","Elizabetha speciosa Ducke","Fabaceae","Elizabetha","speciosa","Ducke",NA,NA,NA,NA,NA,"M.EMERY",NA,NA,NA,"Brazil","Rio de Janeiro","Rio de Janeiro","JARDIM BOT., CANT. XX - CR.",NA,NA,NA,"urn:catalog:JBRJ:RB:202849","Elizabetha speciosa Ducke",NA,NA,NA,NA
