"","modified","institutionCode","collectionCode","catalogNumber","scientificName","family","genus","specificEpithet","scientificNameAuthorship","identifiedBy","dateIdentified","typeStatus","recordNumber","recordedBy","year","month","day","country","stateProvince","municipality","locality","decimalLongitude","decimalLatitude","occurrenceRemarks","occurrenceID","bibliographicCitation","acceptedNameUsage"
"1",NA,"FZB-BH","BHZB","10632","Dimorphandra exaltata Schott","Fabaceae","Dimorphandra","exaltata","Schott",NA,NA,NA,"419","Fernandes, F.M.",2014,11,19,"Brazil","Mg","Florestal","Fazenda do Nativo",NA,NA,"; Habitat: Floresta Estacional semidec√≠dua; Flor: com bot√µes; Fruto: com frutos; Bioma: Cerrado","BRA:FZB-BH:BHZB:0000010632",NA,"Dimorphandra exaltata Schott"
"2",NA,"FZB-BH","BHZB","10633","Dimorphandra exaltata Schott","Fabaceae","Dimorphandra","exaltata","Schott",NA,NA,NA,"420","Fernandes, F.M.",2014,11,19,"Brazil","Mg","Contagem","Fazenda das Ab√≥boras",NA,NA,"; Habitat: Floresta Estacional semidec√≠dua; Flor: com flores; Fruto: com frutos; Bioma: Cerrado","BRA:FZB-BH:BHZB:0000010633",NA,"Dimorphandra exaltata Schott"
"3",NA,"Universidade Federal de Minas Gerais (UFMG)","BHCB","174517","Dimorphandra exaltata Schott","Fabaceae","Dimorphandra","exaltata","Schott",NA,"2014-11-19T00:00:00.000+0000",NA,"s.n.","Fernandes, FM; Lemos Filho, JP",2014,11,19,"Brazil","Minas Gerais","Contagem","Fazenda das Ab√≥boras",-44.078611,-19.860278,"√Årea de pasto pr√≥ximo a fragmento de mata. Ec√≥tone Cerrado/Mata Alt√¢ntica.","BRA:UFMG:BHCB:0000174517",NA,"Dimorphandra exaltata Schott"
"4",NA,"FZB-BH","BHZB","10274","Dimorphandra exaltata Schott","Fabaceae","Dimorphandra","exaltata","Schott",NA,NA,NA,"409","Fernandes, F.M.",2013,7,2,"Brazil","Mg","Lagoa da Prata","APP da mata do Roberto",-45.033056,-19.053333,"; Habitat: Mata ciliar do Rio S. Fco; Bioma: Cerrado","BRA:FZB-BH:BHZB:0000010274",NA,"Dimorphandra exaltata Schott"
"5",NA,"UFV","VIC","40541","Dimorphandra exaltata Schott","Fabaceae","Dimorphandra","exaltata","Schott","Fernandes, J.M.","2013-06-13T00:00:00.000+0000",NA,"340","Sim√£o, M.V.R.C.",2012,10,16,"Brazil","Minas Gerais","Vi√ßosa","Mata do Para√≠so",0,0,"√Årvore, 14 m, bot√£o floral ferrug√≠neo, fruto imaturo marrom enegrecido.","BRA:UFV:VIC:0000040541",NA,"Dimorphandra exaltata Schott"
"6",NA,"FZB-BH","BHZB","8162","Dimorphandra exaltata Schott","Fabaceae","Dimorphandra","exaltata","Schott",NA,NA,NA,"264","Fernandes, F.M. et al",2011,4,12,"Brazil","Mg","Carmo do Cajur√∫",NA,-44.708611,-20.160833,"; Fruto: Fruto presente; Bioma: Cerrado","BRA:FZB-BH:BHZB:0000008162",NA,"Dimorphandra exaltata Schott"
"7",NA,"FZB-BH","BHZB","8082","Dimorphandra exaltata Schott","Fabaceae","Dimorphandra","exaltata","Schott",NA,NA,NA,"270","Fernandes, F.M.",2011,5,31,"Brazil","Mg","Serro","Proximidades √† ""Mato Grosso"". Perto da sede da fazenda Sr. Jos√© Geraldo Faria",NA,NA,"; Fruto: Frutos imaturos; Bioma: Mata Atl√¢ntica","BRA:FZB-BH:BHZB:0000008082",NA,"Dimorphandra exaltata Schott"
"8",NA,"FZB-BH","BHZB","8418","Dimorphandra exaltata Schott","Fabaceae","Dimorphandra","exaltata","Schott",NA,NA,NA,"291","Fernandes, F.M.",2011,10,25,"Brazil","Mg","Florestal",NA,-44.410556,-19.907222,"; Flor: Flor amarela; Bioma: Cerrado","BRA:FZB-BH:BHZB:0000008418",NA,"Dimorphandra exaltata Schott"
"9",NA,"FZB-BH","BHZB","7931","Dimorphandra exaltata Schott","Fabaceae","Dimorphandra","exaltata","Schott",NA,NA,NA,"226","Fernandes, F.M.",2010,4,7,"Brazil","Mg","Florestal","Fazenda Cachoeira - Propriet√°rio: Liberal",-44.483056,-19.840278,"; Fruto: Material com frutos; Bioma: Cerrado","BRA:FZB-BH:BHZB:0000007931",NA,"Dimorphandra exaltata Schott"
"10",NA,"FZB-BH","BHZB","7930","Dimorphandra exaltata Schott","Fabaceae","Dimorphandra","exaltata","Schott",NA,NA,NA,"225","Fernandes, F.M.",2010,4,7,"Brazil","Mg","Florestal","Fazenda Cachoeira - Propriet√°rio: Liberal",-44.480556,-19.837222,"; Fruto: Bot√µes florais; Bioma: Cerrado","BRA:FZB-BH:BHZB:0000007930",NA,"Dimorphandra exaltata Schott"
"11",NA,"FZB-BH","BHZB","7786","Dimorphandra exaltata Schott","Fabaceae","Dimorphandra","exaltata","Schott",NA,NA,NA,"1686","Ordones, J. et al.",2009,8,25,"Brazil","Mg","Florestal","S√≠tio Grota das Vacas.",-44.495278,-19.915,"; Habitat: Cerrado; Bioma: Cerrado","BRA:FZB-BH:BHZB:0000007786",NA,"Dimorphandra exaltata Schott"
"12",NA,"FZB-BH","BHZB","7773","Dimorphandra exaltata Schott","Fabaceae","Dimorphandra","exaltata","Schott",NA,NA,NA,"1682","Ordones, J. et al.",2009,8,24,"Brazil","Mg","Matozinhos","Fazenda Figueiredo.",-44.1,-19.59,"; Bioma: Cerrado","BRA:FZB-BH:BHZB:0000007773",NA,"Dimorphandra exaltata Schott"
"13",NA,"FZB-BH","BHZB","7787","Dimorphandra exaltata Schott","Fabaceae","Dimorphandra","exaltata","Schott",NA,NA,NA,"1687","Ordones, J. et al.",2009,8,25,"Brazil","Mg","Florestal","S√≠tio Grota das Vacas.",-44.495556,-19.915,"; Habitat: Cerrado; Flor: Bot√µes florais.; Bioma: Cerrado","BRA:FZB-BH:BHZB:0000007787",NA,"Dimorphandra exaltata Schott"
"14",NA,"FZB-BH","BHZB","7785","Dimorphandra exaltata Schott","Fabaceae","Dimorphandra","exaltata","Schott",NA,NA,NA,"1685","Ordones, J. et al.",2009,8,25,"Brazil","Mg","Florestal","S√≠tio Grota das Vacas. Pr√≥ximo √† casa.",-44.486667,-19.915,"; Habitat: Cerrado; Bioma: Cerrado","BRA:FZB-BH:BHZB:0000007785",NA,"Dimorphandra exaltata Schott"
"15",NA,"FZB-BH","BHZB","7784","Dimorphandra exaltata Schott","Fabaceae","Dimorphandra","exaltata","Schott",NA,NA,NA,"1684","Ordones, J. et al.",2009,8,25,"Brazil","Mg","Florestal","S√≠tio Grota das Vacas.",-44.494167,-19.914444,"; Bioma: Cerrado","BRA:FZB-BH:BHZB:0000007784",NA,"Dimorphandra exaltata Schott"
"16",NA,"FZB-BH","BHZB","7099","Dimorphandra exaltata Schott","Fabaceae","Dimorphandra","exaltata","Schott",NA,NA,NA,"205","Fernandes, F.M.",2008,9,25,"Brazil","Mg","Fortuna de Minas","Fazenda do Am√©rico Jos√© Rocha Guimar√£es",-44.5475,-19.592222,"; Bioma: Cerrado","BRA:FZB-BH:BHZB:0000007099",NA,"Dimorphandra exaltata Schott"
"17",NA,"FZB-BH","BHZB","7098","Dimorphandra exaltata Schott","Fabaceae","Dimorphandra","exaltata","Schott",NA,NA,NA,"206","Fernandes, F.M.",2008,10,NA,"Brazil","Mg","Fortuna de Minas","Fazenda Lagoa dos Cavalos",NA,NA,"; Bioma: Cerrado","BRA:FZB-BH:BHZB:0000007098",NA,"Dimorphandra exaltata Schott"
"18",NA,"FZB-BH","BHZB","5334","Dimorphandra exaltata Schott","Fabaceae","Dimorphandra","exaltata","Schott",NA,NA,NA,"199","Fernandes, F.M.",2005,7,7,"Brazil","Mg","Sabar√°","Fazenda Clemente",NA,NA,"; Habitat: Floresta Estacional semidec√≠dua; Fruto: Fruto presente, carpoteca 1254; Bioma: Cerrado","BRA:FZB-BH:BHZB:0000005334",NA,"Dimorphandra exaltata Schott"
"19",NA,"FZB-BH","BHZB","5295","Dimorphandra exaltata Schott","Fabaceae","Dimorphandra","exaltata","Schott",NA,NA,NA,"198","Fernandes, F.M.",2005,7,7,"Brazil","Mg","Sabar√°","Fazenda Clemente",NA,NA,"; Habitat: Floresta Estacional semidec√≠dua; Bioma: Cerrado","BRA:FZB-BH:BHZB:0000005295",NA,"Dimorphandra exaltata Schott"
"20",NA,"FZB-BH","BHZB","8466","Dimorphandra exaltata Schott","Fabaceae","Dimorphandra","exaltata","Schott",NA,NA,NA,NA,"Fernandes, F.M.",2005,9,28,"Brazil","Mg","Sabar√°","Fazenda Clemente",-43.788889,-19.83,"; Habitat: Floresta estacional Semidec√≠dua; Fruto: Presen√ßa de sementes; Bioma: Cerrado","BRA:FZB-BH:BHZB:0000008466",NA,"Dimorphandra exaltata Schott"
"21",NA,"FZB-BH","BHZB","5439","Dimorphandra exaltata Schott","Fabaceae","Dimorphandra","exaltata","Schott",NA,NA,NA,"202","Fernandes, F.M.",2005,11,17,"Brazil","Mg","Sabar√°",NA,NA,NA,"; Fruto: Frutos de 14 a 18 cm x 3,0 a 3,5 cm.; Bioma: Cerrado","BRA:FZB-BH:BHZB:0000005439",NA,"Dimorphandra exaltata Schott"
"22",NA,"FZB-BH","BHZB","4396","Dimorphandra exaltata Schott","Fabaceae","Dimorphandra","exaltata","Schott","Haroldo Lima",NA,NA,"408","Fernandes, F.M.",2004,1,29,"Brazil","Mg","Ribeir√£o das Neves","BR 040 - Km 510",NA,NA,"; Habitat: Cerrado; Bioma: Cerrado","BRA:FZB-BH:BHZB:0000004396",NA,"Dimorphandra exaltata Schott"
"23","2014-07-22T09:45:46.000+0000","JBRJ","RB","RB00202837","Dimorphandra exaltata Schott","Fabaceae","Dimorphandra","exaltata","Schott","H.C. DE LIMA","2005-01-01T00:00:00.000+0000",NA,"4396","FERNANDES, F.M.",2004,1,29,"Brazil","Minas Gerais","Minas Gerais","NEVES. BR 040 KM 510.",NA,NA,"ARB√ìREO","urn:catalog:JBRJ:RB:202837",NA,"Dimorphandra exaltata Schott"
"24",NA,"UESB","HUESB","1895","Dimorphandra exaltata Schott","Fabaceae","Dimorphandra","exaltata","Schott","H. Lima","2006-02-01T00:00:00.000+0000",NA,"1726","Macedo, G.E.L.; Paix√£o, J.L.; Paix√£o, J.L.",2004,12,10,"Brazil","Bahia","Jequi√©","Fazenda Brejo Novo., Fazenda Brejo Novo, a 10,5 Km da Av. Ot√°vio Mangabeira entrando pela Av. Exup√©rio Miranda no Bairro do Mandacar√∫.",-41.058333,-13.944722,"Localizado em solo areno argiloso-pedregoso. Habitat:Terrestre no interior da mata. Ind.1322. Parcela 26. L .Faboideae.; √Årvore de + ou - 6m. Folhas alternas, compostas, duplamente pinadas, cart√°ceas, imparipenadas.Madeira branca.; Floresta Estaciona; HA","BRA:UESB:HUESB:0000001895",NA,"Dimorphandra exaltata Schott"
"25","2017-10-19T01:17:48.000+0000","JBRJ","RB","RB00300915","Dimorphandra exaltata Schott","Fabaceae","Dimorphandra","exaltata","Schott","H.C. de Lima","2006-01-01T00:00:00.000+0000",NA,"1726","GELMacedo; J.L. Paix√£o",2004,12,10,"Brazil","Bahia","Jequi√©","Fazenda Brejo Novo, a 10,5Km da Av. Ot√°vio Mangabeira pela Exup√©rio Miranda no bairro do Mandacar√∫.",-40.109444,-13.944722,"√Årvore de ca. 6m, com folhas alternas, compostas duplamente pinadas, cart√°ceas duplamente, imparipinadas. Madeira branca. Ind. 1322. Parcela 26.","urn:catalog:JBRJ:RB:300915",NA,"Dimorphandra exaltata Schott"
"26","2018-05-28T10:25:28.000+0000","JBRJ","RB","RB01200610","Dimorphandra exaltata Schott","Fabaceae","Dimorphandra","exaltata","Schott","Silva, G.S.","2018-05-23T00:00:00.000+0000",NA,"5485","L.S. Leoni",2003,10,3,"Brazil","Minas Gerais","Divino","Fazenda Fortaleza.",NA,NA,NA,"urn:catalog:JBRJ:RB:1200610",NA,"Dimorphandra exaltata Schott"
"27","2014-07-22T08:29:37.000+0000","JBRJ","RB","RB00141681","Dimorphandra exaltata Schott","Fabaceae","Dimorphandra","exaltata","Schott","H.C. de Lima","2000-04-27T00:00:00.000+0000",NA,"nc: 85","M.L.C.V. Spolidoro et al",2000,2,3,"Brazil","Rio de Janeiro","Rio de Janeiro","Mun. Valen√ßa, Distrito de Bar√£o de Juparan√£, faz. Santa M√¥nica.",-43.716667,-22.4,"√°rvore loc. prox. a Sub parcela B4 para baixo, com 14m de alt., e CAP= 83 cm, fruto imaturo, coleta avulsa C.","urn:catalog:JBRJ:RB:141681",NA,"Dimorphandra exaltata Schott"
"28","2014-07-22T08:29:27.000+0000","JBRJ","RB","RB00141677","Dimorphandra exaltata Schott","Fabaceae","Dimorphandra","exaltata","Schott","H.C. DE LIMA",NA,NA,"5718","H.C. DE LIMA; J. CARUZO",2000,10,30,"Brazil","Rio de Janeiro","Rio de Janeiro","HORTO FLORESTAL, INICIO DA ESTRADA DONA CASTORINA, EM FRENTE AO N¬∫: 94, AO LADO DO IMPA. .",NA,NA,"√ÅRVORE COM 20M. DE ALT.; DAP64,2CM.; TRONCO COM CASCA LISA, LEVEMENTE ESTRIADA, COM AN√âIS TRANSVERSAIS POUCO EVIDENTES, PARDACENTA. INFL. ER√âCTAS, NOS BORDOS DA COPA, COM BOT√ïES ESVERDEADOS.","urn:catalog:JBRJ:RB:141677",NA,"Dimorphandra exaltata Schott"
"29",NA,"Instituto de Bot√¢nica, IBT","SP","363062","Dimorphandra exaltata Schott","Fabaceae","Dimorphandra","exaltata","Schott","Lima, HC","2000-10-01T00:00:00.000+0000",NA,"5718","Lima, HC; Caruzo, J",2000,10,30,"Brazil","Rio de Janeiro","Rio de Janeiro","Horto Florestal, in√≠cio da estrada Dona Castorina, em frente ao n¬∫ 94, ao lado do IMPA, remanescente de mata de encosta",0,0,NA,"BRA:IBt:SP:0000363062",NA,"Dimorphandra exaltata Schott"
"30",NA,"NY","NY","777859","Dimorphandra exaltata Schott","Fabaceae","Dimorphandra","exaltata","Schott","H. C. de Lima","2000-01-01T00:00:00.000+0000",NA,"5718","H. C. de Lima",2000,10,30,"Brazil","Rio de Janeiro",NA,"Horto Florestal, in√É¬≠cio da estrada Dona Castorina, em frente ao n.",-43.2076685470805,-22.9069598238154,NA,"b9044cff-e719-4c16-9d92-63a1f0788c34",NA,"Dimorphandra exaltata Schott"
"31",NA,"UNICAMP","UEC","160496","Dimorphandra exaltata Schott","Fabaceae","Dimorphandra","exaltata","Schott","Lima, H.C.","2000-10-01T00:00:00.000+0000",NA,"5718","Lima, H.C.; Caruso, J.",2000,10,30,"Brazil","Rio de Janeiro","Rio de Janeiro","Horto Florestal, Inicio da estrada dona Castorina, em frente ao n, 94, ao lado do IMPA. Remanescente de mata de encosta.",0,0,"√Årvore com 20 m alt. DAP 64,2 cm. Tronco com casca lisa, levemente estriada, com aneis transversais pouco evidentes, pardacenta. Infl. er√©ctas, nos bordos da copa, com bot√µes esverdeados.","BRA:UNICAMP:UEC:0000160496",NA,"Dimorphandra exaltata Schott"
"32",NA,"MBM","MBM","279497","Dimorphandra exaltata Schott","Fabaceae","Dimorphandra","exaltata","Schott","Lima, HC de","2000-10-01T00:00:00.000+0000",NA,"5718","Lima, HC de; et al.",2000,10,30,"Brazil","Rio de Janeiro","Rio de Janeiro","Horto Florestal, in√≠cio da estrada Dona Castorina, em frente ao n. 94 ao lado do IMPA.",0,0,"√°rvore com 20 m alt. DAP 64,2 cm. Tronco com casca lisa, levemente estraiada, com an√©is transversais pouco evidentes, pardacenta. Infl. er√©ctas, nos bordos da copa, com bot√µes esverdeados. Remanescente de mata de encosta.","BRA:MBM:MBM:0000279497",NA,"Dimorphandra exaltata Schott"
"33","2014-07-22T08:29:21.000+0000","JBRJ","RB","RB00141659","Dimorphandra exaltata Schott","Fabaceae","Dimorphandra","exaltata","Schott","H.C. DE LIMA, P.R. FARAG",NA,NA,"219","P.R. FARAG; ET AL",1996,4,10,"Brazil","Rio de Janeiro","Nova Igua√ßu","MATA DO MOACIR.",NA,NA,"√ÅRVORE CA. DE 10M. DE ALT.; DAP 26CM.; RITIDOMA CASTANHO-AVERMELHADO ENRRUGADO, CASCA VIVA AMARELA. FOLHAS CONGESTAS NO FINAL DOS RAMOS","urn:catalog:JBRJ:RB:141659",NA,"Dimorphandra exaltata Schott"
"34",NA,"UNICAMP","UEC","87156","Dimorphandra exaltata Schott","Fabaceae","Dimorphandra","exaltata","Schott","Silva, G.S.","2018-07-27T00:00:00.000+0000",NA,"283","Cavalcanti, D.C.",1996,5,28,"Brazil","S√£o Paulo","Guaratinguet√°","R.F.da Escola de Especialistas de Aeronautica-EEAR",0,0,"√Årvore ca. de 20m. frutos amarronzados.; Mata de Planalto","BRA:UNICAMP:UEC:0000087156",NA,"Dimorphandra exaltata Schott"
"35","2018-09-10T21:18:17.000+0000","JBRJ","RB","RB00424187","Dimorphandra exaltata Schott","Fabaceae","Dimorphandra","exaltata","Schott","H.C. de Lima",NA,NA,"5300","Haroldo C. de Lima; J. Caruso",1995,11,28,"Brazil","Rio de Janeiro","S√£o Francisco de Itabapoana","Manguinhos, Fazenda S√£o Pedro, Mata do Carv√£o.",NA,NA,"√Årvore com 15 metros de altura. Tronco com casca rugosa, DAP 14,2 cm. Est√©ril. Ocasional.","urn:catalog:JBRJ:RB:424187",NA,"Dimorphandra exaltata Schott"
"36","2014-07-07T17:56:25.000+0000","JBRJ","RB","RB00531468","Dimorphandra exaltata Schott","Fabaceae","Dimorphandra","exaltata","Schott",NA,NA,NA,"s.n","V. F. Gon√ßalves",1991,11,29,"Brazil","Rio de Janeiro","Rio de Janeiro","Arboreto do Jardim Botanico. canteiro 32-A.",NA,NA,"Arvore + ou - 20 m. Fuste 16m.","urn:catalog:JBRJ:RB:531468",NA,"Dimorphandra exaltata Schott"
"37",NA,"Universidade Estadual Paulista, UNESP","HRCB","15249","Dimorphandra exaltata Schott","Fabaceae","Dimorphandra","exaltata","Schott","Filho, H.F.L.","1989-01-01T00:00:00.000+0000",NA,"697","Pagano, S.N.",1989,NA,NA,"Brazil","S√£o Paulo","Rio Claro","Fazenda S√£o Jos√©",NA,NA,"Material esteril","BRA:UNESPRC:HRCB:0000015249",NA,"Dimorphandra exaltata Schott"
"38",NA,"Universidade Federal de Minas Gerais (UFMG)","BHCB","13465","Dimorphandra exaltata Schott","Fabaceae","Dimorphandra","exaltata","Schott",NA,NA,NA,"s.n.","Lopes, MA",1986,5,7,"Brazil","Minas Gerais","Caratinga","Esta√ß√£o Biol√≥gica de Caratinga",0,0,NA,"BRA:UFMG:BHCB:0000013465",NA,"Dimorphandra exaltata Schott"
"39","2017-10-04T11:52:25.000+0000","JBRJ","RB","RB00141690","Dimorphandra exaltata Schott","Fabaceae","Dimorphandra","exaltata","Schott",NA,NA,NA,"2516","H.C. DE LIMA; J.C. GOMES, P.S.S. DE OLIVEIRA",1985,1,9,"Brazil","Rio de Janeiro","Rio de Janeiro","HORTO, INICIO DA ESTRADA DONA CASTORINA.",NA,NA,"√ÅRVORE DE MAIS OU MENOS 15M. DE ALT.; TRONCO COM CASCA LISA E ACINZENTADA. DAP 70CM. INFLORESCENCIA ER√âCTA COM FLORES PASSADAS AMARELO-ESVERDEADAS.","urn:catalog:JBRJ:RB:141690",NA,"Dimorphandra exaltata Schott"
"40",NA,"UEFS","HUEFS","144467","Dimorphandra exaltata Schott","Fabaceae","Dimorphandra","exaltata","Schott",NA,NA,NA,"2516","Lima, H.C.de",1985,1,9,"Brazil","Rio de Janeiro","Rio de Janeiro","HORTO, Inicio da estrada Dona Castorina.",NA,NA,NA,"BRA:UEFS:HUEFS:0000144467",NA,"Dimorphandra exaltata Schott"
"41",NA,"UFV","VIC","37853","Dimorphandra exaltata Schott","Fabaceae","Dimorphandra","exaltata","Schott","Lima, H.C. de","1985-01-01T00:00:00.000+0000",NA,"18","Gomes, J.C.",1985,3,27,"Brazil","Rio de Janeiro","Rio de Janeiro","Horto Florestal, In√≠cio da estrada Dona Castorina. Remanescente de Mata Atl√¢ntica.",0,0,"√Årvore, c.a. de 15 metros de altura, DAP 60 cm de di√¢metro; frutos imaturos verdes. (Pau-pra-tudo).","BRA:UFV:VIC:0000037853",NA,"Dimorphandra exaltata Schott"
"42","2017-10-04T12:49:27.000+0000","JBRJ","RB","RB00141704","Dimorphandra exaltata Schott","Fabaceae","Dimorphandra","exaltata","Schott","H.C. de Lima","1985-01-01T00:00:00.000+0000",NA,"18","Jorge C. Gomes",1985,3,27,"Brazil","Rio de Janeiro","Rio de Janeiro","Horto Florestal, inicio da estrada Dona Castorina.",NA,NA,"√Årvore com 15 metros de altura, DAP 60 cent√≠metros de di√¢metro; frutos imaturos verdes","urn:catalog:JBRJ:RB:141704",NA,"Dimorphandra exaltata Schott"
"43",NA,"UEFS","HUEFS","144443","Dimorphandra exaltata Schott","Fabaceae","Dimorphandra","exaltata","Schott",NA,NA,NA,"18","Gomes, J.C.",1985,3,27,"Brazil","Rio de Janeiro","Rio de Janeiro","Horto Florestal, Inicio da estrada dona castorina.",NA,NA,NA,"BRA:UEFS:HUEFS:0000144443",NA,"Dimorphandra exaltata Schott"
"44","2008-05-27T22:02:00.000+0000","MO","MO","3246308","Dimorphandra exaltata Schott","Fabaceae","Dimorphandra","exaltata","Schott","H.C. de Lima","1985-01-01T00:00:00.000+0000",NA,"Lima 2623","H.C. de Lima",1985,11,18,"Brazil","Rio de Janeiro",NA,"Horto Florestal, pr√≥ximo a estrada Dona Castorina.",NA,NA,NA,"urn:catalog:MO:Tropicos:3246308","http://www.tropicos.org/Specimen/3246308","Dimorphandra exaltata Schott"
"45","2014-09-26T00:00:00.000+0000","Instituto Nacional de Pesquisas da Amaz√¥nia (INPA)","Cole√ß√£o Bot√¢nica, Instituto Nacional de Pesquisas da Amaz√¥nia (INPA)","130611","Dimorphandra exaltata Schott","Fabaceae","Dimorphandra","exaltata","Schott","Lima, H.C. de","1985-01-01T00:00:00.000+0000",NA,"2623","Mike Hopkins",1985,11,18,"Brazil","Rio de Janeiro",NA,"Horto Florestal, pr√≥ximo a estrada Dona Castorina.",NA,NA,NA,"urn:catalog:inpa:herbarium:82571",NA,"Dimorphandra exaltata Schott"
"46",NA,"NY","NY","470725","Dimorphandra exaltata Schott","Fabaceae","Dimorphandra","exaltata","Schott","H. C. de Lima",NA,NA,"2623","H. C. de Lima",1985,11,18,"Brazil","Rio de Janeiro",NA,"Horto Florestal, pr√É¬≥ximo a estrada Dona Castorina",0,0,NA,"a33956d5-72ae-4f47-ba0e-0d2519c2b2d5",NA,"Dimorphandra exaltata Schott"
"47",NA,"Comiss√£o Executiva do Plano da Lavoura Cacaueira (CEPLAC)","CEPEC","37849","Dimorphandra exaltata Schott","Fabaceae","Dimorphandra","exaltata","Schott","H. C. de Lima",NA,NA,"2623","H. C. de Lima",1985,11,18,"Brazil","Rio de Janeiro","RIO DE JANEIRO","Horto Florestal, prox. a estr. da D. Castorina.",NA,NA,"Ambiente: Mata de Encosta. Habito: √Årvore maior que 5m e menor 20m","BRA:CEPLAC:CEPEC:0000037849",NA,"Dimorphandra exaltata Schott"
"48",NA,"MA","MA","538182-1","Dimorphandra exaltata Schott","Fabaceae","Dimorphandra","exaltata","Schott",NA,NA,NA,"2623","H. C. de Lima, E. C. Dolcin & P. S. Oliveira",1985,11,18,"Brazil",NA,NA,"Rio de Janeiro. Horto florestal pr√≥ximo a estrada Dona Castorina",NA,NA,"√Årvore 15 m alt. Inflorescencias erectas com botoe. Horto florestal",NA,NA,"Dimorphandra exaltata Schott"
"49",NA,"NY","NY","470726","Dimorphandra exaltata Schott","Fabaceae","Dimorphandra","exaltata","Schott","H. C. de Lima",NA,NA,"2623","H. C. de Lima",1985,11,18,"Brazil","Rio de Janeiro",NA,"Horto Florestal, pr√É¬≥ximo a estrada Dona Castorina",0,0,NA,"d3710c04-0a50-4ab0-a793-b6864f353951",NA,"Dimorphandra exaltata Schott"
"50","2014-07-22T08:29:30.000+0000","JBRJ","RB","RB00141693","Dimorphandra exaltata Schott","Fabaceae","Dimorphandra","exaltata","Schott","M. Campos",NA,NA,NA,"H.C. de Lima, E.C. Dalcin et al",1985,11,18,"Brazil","Rio de Janeiro","Rio de Janeiro","Mun. do RJ., Horto Florestal, pr√≥x. a estrada Dona Castorina.",NA,NA,"√°rvore ca. 15m de alt., infl. eretas com bot√µes verdes e flores amarelas exalando cheiro desagrad√°vel, tronco com casca lisa, remanescente da mata dee encosta","urn:catalog:JBRJ:RB:141693",NA,"Dimorphandra exaltata Schott"
"51","2008-05-27T22:02:00.000+0000","MO","MO","3246428","Dimorphandra exaltata Schott","Fabaceae","Dimorphandra","exaltata","Schott","H.C. de Lima","1985-01-01T00:00:00.000+0000",NA,"Lima 2623","H.C. de Lima",1985,11,18,"Brazil","Rio de Janeiro",NA,"Horto Florestal, pr√≥ximo a estrada Dona Castorina.",NA,NA,NA,"urn:catalog:MO:Tropicos:3246428","http://www.tropicos.org/Specimen/3246428","Dimorphandra exaltata Schott"
"52","2014-09-26T00:00:00.000+0000","Instituto Nacional de Pesquisas da Amaz√¥nia (INPA)","Cole√ß√£o Bot√¢nica, Instituto Nacional de Pesquisas da Amaz√¥nia (INPA)","133568","Dimorphandra exaltata Schott","Fabaceae","Dimorphandra","exaltata","Schott",NA,NA,NA,"51","Mike Hopkins",1984,NA,NA,"Brazil","Esp√≠rito Santo",NA,"""Reserva Florestal da CVRD; Est. LOURO, ant. 351, Km 1216, lado esquerdo.""",NA,NA,NA,"urn:catalog:inpa:herbarium:43789",NA,"Dimorphandra exaltata Schott"
"53",NA,"IPA","IPA","24636","Dimorphandra exaltata Schott","Fabaceae","Dimorphandra","exaltata","Schott",NA,NA,NA,"51","Foli, D.A.",1978,11,13,"Brazil","Esp√≠rito Santo","Linhares","Reserva Florestal da CVRD",0,0,"√Årvore em floresta alta com aproximadamente 26m de altura. Flor branca e bot√£o marrom.","BRA:IPA:IPA:0000024636",NA,"Dimorphandra exaltata Schott"
"54","2014-09-26T00:00:00.000+0000","Instituto Nacional de Pesquisas da Amaz√¥nia (INPA)","Cole√ß√£o Bot√¢nica, Instituto Nacional de Pesquisas da Amaz√¥nia (INPA)","89973","Dimorphandra exaltata Schott","Fabaceae","Dimorphandra","exaltata","Schott","Silva, M.F. da","1980-02-01T00:00:00.000+0000",NA,"s.n.","Mike Hopkins",1978,NA,NA,"Brazil","Minas Gerais",NA,NA,NA,NA,NA,"urn:catalog:inpa:herbarium:147795",NA,"Dimorphandra exaltata Schott"
"55","2014-09-26T00:00:00.000+0000","Instituto Nacional de Pesquisas da Amaz√¥nia (INPA)","Cole√ß√£o Bot√¢nica, Instituto Nacional de Pesquisas da Amaz√¥nia (INPA)","105322","Dimorphandra exaltata Schott","Fabaceae","Dimorphandra","exaltata","Schott","Silva, M.F. da","1982-09-01T00:00:00.000+0000",NA,"51","Mike Hopkins",1978,NA,NA,"Brazil","Esp√≠rito Santo",NA,"Reserva Florestal da CVRD. Est. Flamengo, ant. X-1, Km 9, 700, lado esquerdo",NA,NA,NA,"urn:catalog:inpa:herbarium:43520",NA,"Dimorphandra exaltata Schott"
"56",NA,"UnB","UB","127843","Dimorphandra exaltata Schott","Fabaceae","Dimorphandra","exaltata","Schott","Silva, MF","1978-01-01T00:00:00.000+0000",NA,"2790","Gomes, V",1968,12,22,"Brazil","Minas Gerais",NA,"10km de Juiz de Fora",0,0,"√Årvore 30m.","BRA:UnB:UB:0000127843",NA,"Dimorphandra exaltata Schott"
"57",NA,"UnB","UB","127841","Dimorphandra exaltata Schott","Fabaceae","Dimorphandra","exaltata","Schott","Arroyo, MTK","1972-01-01T00:00:00.000+0000",NA,"2856","Bel√©m, RP",1966,11,7,"Brazil","Bahia","Santa Cruz Cabr√°lia",NA,0,0,"Infloresc√™ncia em bot√µes.; √Årvore 25m.; Mata costeira","BRA:UnB:UB:0000127841",NA,"Dimorphandra exaltata Schott"
"58",NA,"UNICAMP","UEC","92306","Dimorphandra exaltata Schott","Fabaceae","Dimorphandra","exaltata","Schott","Barroso, G.M.",NA,NA,"2792","Kuhlmann, M.",1951,12,28,NA,NA,NA,NA,0,0,NA,"BRA:UNICAMP:UEC:0000092306",NA,"Dimorphandra exaltata Schott"
"59",NA,"Instituto de Bot√¢nica, IBT","SP","97467","Dimorphandra exaltata Schott","Fabaceae","Dimorphandra","exaltata","Schott","Barroso, GM",NA,NA,"2792","Kuhlmann, M",1951,12,28,"Brazil","S√£o Paulo","Piracicaba","Carioba",0,0,NA,"BRA:IBt:SP:0000097467",NA,"Dimorphandra exaltata Schott"
"60","2014-07-22T08:20:04.000+0000","JBRJ","RB","RB00141717","Dimorphandra exaltata Schott","Fabaceae","Dimorphandra","exaltata","Schott","MARLENE F. DA SILVA","1978-01-01T00:00:00.000+0000",NA,"2459",NA,1946,6,6,"Brazil","Minas Gerais","Minas Gerais","ESTA√á√ÉO EXPERIMENTAL √ÅGUA LIMPA. Esta√ß√£o Experimental √Ågua Limpa",NA,NA,NA,"urn:catalog:JBRJ:RB:141717",NA,"Dimorphandra exaltata Schott"
"61","2014-07-22T08:20:01.000+0000","JBRJ","RB","RB00141762","Dimorphandra exaltata Schott","Fabaceae","Dimorphandra","exaltata","Schott","MARLENE F. DA SILVA","1978-01-01T00:00:00.000+0000",NA,"2459","EZEQUICIO PAULO HERINGER",1946,11,6,"Brazil","Minas Gerais","Piau","S√çTIOM DO BALBINO.",NA,NA,"√ÅRVORE DE GRANDE PORTE, PRODUTORA DE MADEIRA PARA CONSTRU√á√ÉO","urn:catalog:JBRJ:RB:141762",NA,"Dimorphandra exaltata Schott"
"62",NA,"NY","NY","470727","Dimorphandra exaltata Schott","Fabaceae","Dimorphandra","exaltata","Schott","M. F. da Silva",NA,NA,"2459","E. P. Heringer",1946,11,6,"Brazil","Minas Gerais",NA,"Sitio do Balbino, Municipio de Piau",0,0,NA,"4754840b-e0f6-4e96-b341-c9d1e8f927a9",NA,"Dimorphandra exaltata Schott"
