"","modified","institutionCode","collectionCode","catalogNumber","scientificName","family","genus","specificEpithet","infraspecificEpithet","scientificNameAuthorship","identifiedBy","dateIdentified","typeStatus","recordNumber","recordedBy","year","month","day","country","stateProvince","municipality","locality","decimalLongitude","decimalLatitude","occurrenceRemarks","occurrenceID","acceptedNameUsage"
"1","2016-09-13T14:45:28.000+0000","JBRJ","RB","RB00852236","Dimorphandra jorgei M.F.Silva","Fabaceae","Dimorphandra","jorgei",NA,"M.F.Silva","Lima, H.C.; Queiroz, L.P.; Lewis, G.P.","2014-03-13T00:00:00.000+0000",NA,"1740","Neves, D.M.; Lima, H.C.; Queiroz, L.P.; Pennington, R.T.; Lewis, G.P.; Vivas, C.V.; Paixao, J.L.",2014,3,13,"Brazil","Bahia","Porto Seguro","Esta√ß√£o Pau-Brasil, CEPLAC.",-39.181389,-16.386389,"√Årvore 30m, legumes coletados do ch√£o. Carp. n¬∫ 7745","urn:catalog:JBRJ:RB:852236","Dimorphandra jorgei M.F.Silva"
"2",NA,"UEFS","HUEFS","231274","Dimorphandra jorgei M.F.Silva","Fabaceae","Dimorphandra","jorgei",NA,"M.F.Silva","H.C.Lima; L.P.Queiroz & G.P.Lewis","2014-03-01T00:00:00.000+0000",NA,"1740","Neves, D.M.",2014,3,12,"Brazil","Bahia","Porto Seguro","Esta√ß√£o Pau-Brasil, CEPLAC.",-39.181389,-16.386389,"Mata ombr√≥fila densa de baixada.","BRA:UEFS:HUEFS:0000231274","Dimorphandra jorgei M.F.Silva"
"3",NA,"UESC","UESC","16374","Dimorphandra jorgei M.F.Silva","Fabaceae","Dimorphandra","jorgei",NA,"M.F.Silva",NA,NA,NA,"4","Magalh√£es, J.C.,",2014,11,13,"Brazil","Bahia","Ilh√©us",NA,NA,NA,"Floresta Mara Higr√≥fila; √Årvore, ca. De 21m de altura, Folhas esverdeadas em ambas as faces.","BRA:UESC:UESC:0000016374","Dimorphandra jorgei M.F.Silva"
"4",NA,"UEFS","HUEFS","208468","Dimorphandra jorgei M.F.Silva","Fabaceae","Dimorphandra","jorgei",NA,"M.F.Silva",NA,NA,NA,"1011","Nascimento, F.H.F.",2012,7,30,"Brazil","Bahia","Ituber√°","Reserva Michelin- Mata da Vila V.",-39.203889,-13.807778,"Floresta Ombr√≥fila Densa.","BRA:UEFS:HUEFS:0000208468","Dimorphandra jorgei M.F.Silva"
"5",NA,"UEFS","HUEFS","208469","Dimorphandra jorgei M.F.Silva","Fabaceae","Dimorphandra","jorgei",NA,"M.F.Silva",NA,NA,NA,"1012","Nascimento, F.H.F.",2012,7,30,"Brazil","Bahia","Ituber√°","Reserva Michelin- Mata da Vila V.",-39.203889,-13.807778,"Floresta Ombr√≥fila Densa.","BRA:UEFS:HUEFS:0000208469","Dimorphandra jorgei M.F.Silva"
"6",NA,"MBML","MBML-HERBARIO","44454","Dimorphandra jorgei M.F.Silva","Fabaceae","Dimorphandra","jorgei",NA,"M.F.Silva","G.M. Carvalho/Mar√ßo-2010",NA,NA,"327","G.M. Carvalho; L.C. Gomes & L. Daneu",2010,3,17,"Brazil","Bahia","Porto Seguro","RPPN Esta√ß√£o Veracel. Floresta de Tabuleiros. Floresta Alta",-39.25,-16.5,"√Årvore ca 15m alt., folhas discolores. Frutos imaturos verdes. Borda de floresta alta, plat√¥","BRA:MBML:MBML-HERBARIO:0000044454","Dimorphandra jorgei M.F.Silva"
"7",NA,"Comiss√£o Executiva do Plano da Lavoura Cacaueira (CEPLAC)","CEPEC","127639","Dimorphandra jorgei M.F.Silva","Fabaceae","Dimorphandra","jorgei",NA,"M.F.Silva",NA,NA,NA,"327","Carvalho, G. M.",2010,3,17,"Brazil","Bahia","Porto Seguro","RPPN Esta√ß√£o Veracel",-39.25,-16.5,"Floresta de Tabuleiros. Floresta Alta.","BRA:CEPLAC:CEPEC:0000127639","Dimorphandra jorgei M.F.Silva"
"8",NA,"UEFS","HUEFS","204232","Dimorphandra jorgei subsp. da Silva","Fabaceae","Dimorphandra","jorgei","da","subsp. da Silva",NA,NA,NA,"327","Carvalho, G.M.",2010,3,17,"Brazil","Bahia","Porto Seguro","RRPN Esta√ß√£o Veracel.",-39.25,-16.5,"Floresta de Tabuleiros, floresta Alta.","BRA:UEFS:HUEFS:0000204232","Dimorphandra jorgei subsp. da Silva"
"9",NA,"UESC","UESC","15682","Dimorphandra jorgei M.F.Silva","Fabaceae","Dimorphandra","jorgei",NA,"M.F.Silva",NA,NA,NA,"327","Carvalho, G.M.",2010,3,17,"Brazil","Bahia","Porto Seguro",NA,-39.25,-16.5,"Floresta de Tabuleiros. Floresta Alta.; √Årvore , ca. 15m alt.; Borda de Floresta Alta, Plat√¥.","BRA:UESC:UESC:0000015682","Dimorphandra jorgei M.F.Silva"
"10",NA,"Comiss√£o Executiva do Plano da Lavoura Cacaueira (CEPLAC)","CEPEC","135775","Dimorphandra jorgei M.F.Silva","Fabaceae","Dimorphandra","jorgei",NA,"M.F.Silva",NA,NA,NA,NA,"Carvalho, G. M.",2010,5,NA,"Brazil","Bahia","Porto Seguro","RPPN Esta√ß√£o Veracel",-39.133333,-16.333333,"Floresta Ombr√≥fila Densa","BRA:CEPLAC:CEPEC:0000135775","Dimorphandra jorgei M.F.Silva"
"11",NA,"UEFS","HUEFS","144312","Dimorphandra jorgei subsp. da Silva","Fabaceae","Dimorphandra","jorgei","da","subsp. da Silva",NA,NA,NA,"6902","Lima, H.C.de",2008,7,22,"Brazil","Bahia","Mucuri","BA-698, rodovia para Mucur√≠, Km 27.",-39.624722,-18.047222,NA,"BRA:UEFS:HUEFS:0000144312","Dimorphandra jorgei subsp. da Silva"
"12","2016-01-12T11:56:36.000+0000","JBRJ","RB","RB00531482","Dimorphandra jorgei M.F.Silva","Fabaceae","Dimorphandra","jorgei",NA,"M.F.Silva","H.C. de Lima","2008-01-01T00:00:00.000+0000",NA,"6902","Haroldo C. de Lima; F.L.R. Filardi, R.D. Ribeiro & A.G. da Silva",2008,7,22,"Brazil","Bahia","Mucuri","BA-698, rodovia para Mucur√≠, Km 27.",-39.624722,-18.047222,"√Årvore com 15 metros de altura. Tronco com casca lisa e pardacenta, DAP 35 + 20 cm. Frutos amarelos-esverdeados. RBcarpo 7858","urn:catalog:JBRJ:RB:531482","Dimorphandra jorgei M.F.Silva"
"13",NA,"Comiss√£o Executiva do Plano da Lavoura Cacaueira (CEPLAC)","CEPEC","126198","Dimorphandra jorgei M.F.Silva","Fabaceae","Dimorphandra","jorgei",NA,"M.F.Silva",NA,NA,NA,"5418","Jardim, J. G.",2008,10,16,"Brazil","Bahia","Ilh√©us","Ceplac, Rod. Ilh√©us/Itabuna km 22. Centro de Pesquisa de cacau. Arboreto.",NA,NA,NA,"BRA:CEPLAC:CEPEC:0000126198","Dimorphandra jorgei M.F.Silva"
"14",NA,"UEFS","HUEFS","165244","Dimorphandra jorgei M.F.Silva","Fabaceae","Dimorphandra","jorgei",NA,"M.F.Silva",NA,NA,NA,"5418","Jardim, J.G.",2008,10,16,"Brazil","Bahia","Ilh√©us","Ceplac, Rod. Ilh√©us / Itabuna Km 22. Centro de pesquisa de cacau",NA,NA,"Arboreto.","BRA:UEFS:HUEFS:0000165244","Dimorphandra jorgei M.F.Silva"
"15",NA,"Instituto Plantarum de Estudos da Flora Ltda (HPL)","HPL","13653","Dimorphandra jorgei M.F.Silva","Fabaceae","Dimorphandra","jorgei",NA,"M.F.Silva",NA,NA,NA,"5418","J.G. Jardim; L.C. Gomes; G. Carvalho",2008,10,16,"Brazil","Ba","Ilh√©us","Ceplac, Rod. Ilh√©us/Itabuna km 22. Centro de pesquisa de cacau. CEPLAC-126198",NA,NA,NA,"BRA:JBP:HPL:0000013653","Dimorphandra jorgei M.F.Silva"
"16",NA,"Universidade Federal de Sergipe, UFS","ASE","20563","Dimorphandra jorgei M.F.Silva","Fabaceae","Dimorphandra","jorgei",NA,"M.F.Silva","Gibau, A","2018-08-01T00:00:00.000+0000",NA,"125","Matos, IS; Santos, E",2008,12,15,"Brazil","Sergipe","Itaporanga d'Ajuda","Fazenda Trapsa, Borda da Mata.",-37.1147,-11.115,"√Årvore com cerca de 5 metros. Frutos maduros pretos. Flores amarronzadas.; √Årvore com cerca de 5 metros. Frutos maduros pretos. Flores amarronzadas.","BRA:UFS:ASE:0000020563","Dimorphandra jorgei M.F.Silva"
"17",NA,"UFES","VIES","33249","Dimorphandra jorgei M.F.Silva","Fabaceae","Dimorphandra","jorgei",NA,"M.F.Silva",NA,NA,NA,"11","Moreira, L.N.",2007,5,14,"Brazil","Esp√≠rito Santo","Cachoeiro de Itapemirim","Floresta Nacional Pacotuba.",NA,NA,"SW2041","BRA:UFES:VIES:0000033249","Dimorphandra jorgei M.F.Silva"
"18","2018-02-21T11:29:42.000+0000","JBRJ","RB","RB00593850","Dimorphandra jorgei M.F.Silva","Fabaceae","Dimorphandra","jorgei",NA,"M.F.Silva","H.C.LIMA",NA,NA,"2764","R.R. Vervloet; V. Demuner, E. Bausen & T.A. Cruz",2007,7,4,"Brazil","Esp√≠rito Santo","√Åguia Branca","Santa Luzia, Prop. Ciro Farreira.",-40.665556,-18.977778,"√Årvore com 12m., frutos imaturos de cor verde.","urn:catalog:JBRJ:RB:593850","Dimorphandra jorgei M.F.Silva"
"19","2012-11-29T00:00:00.000+0000","K","Herbarium","K000849135","Dimorphandra jorgei M.F.Silva","Fabaceae","Dimorphandra","jorgei",NA,"M.F.Silva","Queiroz, L.P.",NA,NA,"834","Messias; Cardoso, D.",2005,9,22,"Brazil",NA,"Itaberaba","ARIE Serra do Orob√≥. Faz. Gameleira.",-40.53,-12.41,"01/fev","http://specimens.kew.org/herbarium/K000849135","Dimorphandra jorgei M.F.Silva"
"20",NA,"UEFS","HUEFS","100856","Dimorphandra jorgei subsp. da Silva","Fabaceae","Dimorphandra","jorgei","da","subsp. da Silva","L.P.de Queiroz","2005-11-01T00:00:00.000+0000",NA,"834","Cardoso, D.",2005,9,22,"Brazil","Bahia","Itaberaba","ARIE Serra do Orob√≥. Faz. Gameleira.",-40.534722,-12.4075,"Floresta estacional semidecidual com bastante ep√≠fita e serrapilheira.","BRA:UEFS:HUEFS:0000100856","Dimorphandra jorgei subsp. da Silva"
"21",NA,"Reserva Natural Vale (CVRD)","CVRD","8969","Dimorphandra jorgei M.F.Silva","Fabaceae","Dimorphandra","jorgei",NA,"M.F.Silva","Domingos A. Folli","2004-11-08T00:00:00.000+0000",NA,"252","Luz, A.A. da",2004,11,3,"Brazil","Mg","MINAS GERAIS",NA,NA,NA,"<ll>dwc_commonname:</ll> Pau para tudo","BRA:CVRD:CVRD:0000008969","Dimorphandra jorgei M.F.Silva"
"22",NA,"Universidade Federal da Bahia (UFBA)","ALCB","032744","Dimorphandra jorgei subsp. da Silva","Fabaceae","Dimorphandra","jorgei","da","subsp. da Silva","Guedes, ML",NA,NA,"70","Jesus, NG de; Lima, SF; Santos, JB dos",1997,1,22,"Brazil","Bahia","Entre Rios","Litoral Norte",0,0,NA,"BRA:UFBA:ALCB:0000032744","Dimorphandra jorgei subsp. da Silva"
"23","2014-09-26T00:00:00.000+0000","Instituto Nacional de Pesquisas da Amaz√¥nia (INPA)","Cole√ß√£o Bot√¢nica, Instituto Nacional de Pesquisas da Amaz√¥nia (INPA)","205411","Dimorphandra jorgei M.F.Silva","Fabaceae","Dimorphandra","jorgei",NA,"M.F.Silva","Guedes, M.L.","1998-02-01T00:00:00.000+0000",NA,"70","Mike Hopkins",1997,1,22,"Brazil","Bahia",NA,"Litoral Norte, entre Rios, RPPN Fazenda Lontra/Saudade",NA,NA,NA,"urn:catalog:inpa:herbarium:75777","Dimorphandra jorgei M.F.Silva"
"24",NA,"UEFS","HUEFS","56262","Dimorphandra jorgei M.F.Silva","Fabaceae","Dimorphandra","jorgei",NA,"M.F.Silva","L.P.de Queiroz","2001-11-01T00:00:00.000+0000",NA,"70","Jesus, N.G.",1997,1,22,"Brazil","Bahia","Entre Rios","RPPN Fazenda Lontra/ Saudade.",-40.215556,-12.915278,"Floresta subperenifolia.","BRA:UEFS:HUEFS:0000056262","Dimorphandra jorgei M.F.Silva"
"25",NA,"Universidade Federal da Bahia (UFBA)","ALCB","032734","Dimorphandra jorgei subsp. da Silva","Fabaceae","Dimorphandra","jorgei","da","subsp. da Silva","Guedes, ML",NA,NA,"0132","Jesus, NG de; Lima, SF; Santos, JB dos",1997,9,21,"Brazil","Bahia","Entre Rios","Litoral Norte",0,0,NA,"BRA:UFBA:ALCB:0000032734","Dimorphandra jorgei subsp. da Silva"
"26",NA,"UEFS","HUEFS","55395","Dimorphandra jorgei M.F.Silva","Fabaceae","Dimorphandra","jorgei",NA,"M.F.Silva","L.P.de Queiroz","2001-11-01T00:00:00.000+0000",NA,"185","Jesus, N.G.",1997,11,9,"Brazil","Bahia","Entre Rios","RPPN Fazenda Lontra/ Saudade.",-41.933333,-12.9,"Floresta subperenifolia.","BRA:UEFS:HUEFS:0000055395","Dimorphandra jorgei M.F.Silva"
"27",NA,"Universidade Federal de Minas Gerais (UFMG)","BHCB","36469","Dimorphandra jorgei M.F.Silva","Fabaceae","Dimorphandra","jorgei",NA,"M.F.Silva",NA,"2009-04-01T00:00:00.000+0000",NA,"s.n.","Brina, AE",1996,3,NA,"Brazil","Minas Gerais","Medina","Vale do Jequitinhonha.",0,0,NA,"BRA:UFMG:BHCB:0000036469","Dimorphandra jorgei M.F.Silva"
"28",NA,"Universidade Estadual Paulista, UNESP","HRCB","31833","Dimorphandra jorgei M.F.Silva","Fabaceae","Dimorphandra","jorgei",NA,"M.F.Silva","Tamashiro, J.","1997-03-01T00:00:00.000+0000",NA,"283","Cavalcanti, D.C.",1996,4,26,"Brazil","S√£o Paulo","Guaratinguet√°",NA,NA,NA,"√Årvore ca. 20m, frutos amarronzados; folhas inteiras coletadas em 28/05/96","BRA:UNESPRC:HRCB:0000031833","Dimorphandra jorgei M.F.Silva"
"29",NA,"NY","NY","471057","Dimorphandra jorgei M.F.Silva","Fabaceae","Dimorphandra","jorgei",NA,"M.F.Silva","R. C. Barneby",NA,NA,"812","J. G. Jardim",1996,5,1,"Brazil","Bahia",NA,"Reserva Biol√É¬≥gica do Mico-le√É¬£o (IBAMA). Entrada no km 46 da Rod. BA-001 Ilh√É¬©us/Una",-39.08,-15.15,NA,"6693af03-f1c6-4930-aab5-e4e0b5502a7a","Dimorphandra jorgei M.F.Silva"
"30",NA,"UEFS","HUEFS","72209","Dimorphandra jorgei M.F.Silva","Fabaceae","Dimorphandra","jorgei",NA,"M.F.Silva",NA,NA,NA,"45","Jost, T.",1994,11,30,"Brazil","Bahia","Conde","Fazenda do Bu, Mata do da Mar√©.",-43.716667,-12.045278,"Floresta Ombr√≥fila Aberta.","BRA:UEFS:HUEFS:0000072209","Dimorphandra jorgei M.F.Silva"
"31","2014-07-22T08:19:51.000+0000","JBRJ","RB","RB00141722","Dimorphandra jorgei M.F.Silva","Fabaceae","Dimorphandra","jorgei",NA,"M.F.Silva","G.C.P.Pinto",NA,NA,"45","T. Jost",1994,11,30,"Brazil","Bahia","Conde","Fazenda do Bu.",-37.728611,-12.035278,"√Ärvore com ca. de 20m de altura, tronco reto at√© ca. de 10m bifurca√ß√£o com copa regular de grande beleza, folhas levemente discolores, inflorescencia ereta com bot√µes florais verdes; flores com c√°lice verde e corola verde amarelada miudas congestas em cachos.","urn:catalog:JBRJ:RB:141722","Dimorphandra jorgei M.F.Silva"
"32",NA,"Reserva Natural Vale (CVRD)","CVRD","3702","Dimorphandra jorgei M.F.Silva","Fabaceae","Dimorphandra","jorgei",NA,"M.F.Silva","Domingos A. Folli","1992-01-15T00:00:00.000+0000",NA,"293","Souza, V.D.",1992,1,15,"Brazil","Ba","CARAVELAS","Lado direito da estrada indo de Ponta de Areia p/ Barra de Caravelas, 5 km do asfalto.",NA,NA,"<ll>dwc_commonname:</ll> Pau para tudo","BRA:CVRD:CVRD:0000003702","Dimorphandra jorgei M.F.Silva"
"33",NA,"Reserva Natural Vale (CVRD)","CVRD","4053","Dimorphandra jorgei M.F.Silva","Fabaceae","Dimorphandra","jorgei",NA,"M.F.Silva","Domingos A. Folli","1992-10-29T00:00:00.000+0000",NA,"1716","Folli, D.A.",1992,10,29,"Brazil","Es","LINHARES","Pr√≥ximo √† Torre.",NA,NA,"<ll>dwc_commonname:</ll> Pau para tudo","BRA:CVRD:CVRD:0000004053","Dimorphandra jorgei M.F.Silva"
"34","2014-07-22T15:03:14.000+0000","JBRJ","RB","RB00452765","Dimorphandra jorgei M.F.Silva","Fabaceae","Dimorphandra","jorgei",NA,"M.F.Silva","D. A. Folli","1992-10-29T00:00:00.000+0000",NA,"1716","D. A. Folli",1992,10,29,"Brazil","Esp√≠rito Santo","Linhares","Reserva Natural da CVRD - Estrada: Flamengo. Pr√≥ximo √† torre. .",NA,NA,"Forma de Vida: Terrestre; Porte: Arb√≥reo; Altura Total: 32; Altura do Fuste: 20; CAP do Fuste: 82,5; Di√¢metro da Copa: 15; Exsuda√ß√£o: Seiva; Descama√ß√£o: Ausente; Forma do Fuste: ci√≠ndrico; Superf√≠cie da Casca: √Åspera; Cor da Exsuda√ß√£o: Incolor; Cor do Fruto Maduro: Preto; Cor do Fruto Imaturo: Verde escuro","urn:catalog:JBRJ:RB:452765","Dimorphandra jorgei M.F.Silva"
"35","2007-03-20T14:34:19.000+0000","K","Herbarium","K000057401","Dimorphandra jorgei M.F.Silva","Fabaceae","Dimorphandra","jorgei",NA,"M.F.Silva","Lewis, G.P.",NA,NA,"296","Pennington, R.T.; Carvalho, F.A.",1991,6,19,"Brazil",NA,"Porto Seguro","Esta√ß√£o Ecol√≥gica do Pau Brasil. Arboreto.",-39.17,-16.43,NA,"http://specimens.kew.org/herbarium/K000057401","Dimorphandra jorgei M.F.Silva"
"36",NA,"Comiss√£o Executiva do Plano da Lavoura Cacaueira (CEPLAC)","CEPEC","44360","Dimorphandra jorgei subsp. da Silva","Fabaceae","Dimorphandra","jorgei","da","subsp. da Silva","T. S. dos Santos",NA,NA,"4476","T. S. dos Santos",1989,1,3,"Brazil","Bahia","ILH√âUS","Arboreto do CEPEC.",NA,NA,"Ambiente: Mata Higrofila. Habito: √Årvore","BRA:CEPLAC:CEPEC:0000044360","Dimorphandra jorgei subsp. da Silva"
"37",NA,"Reserva Natural Vale (CVRD)","CVRD","2156","Dimorphandra jorgei M.F.Silva","Fabaceae","Dimorphandra","jorgei",NA,"M.F.Silva","Haroldo C. de Lima","1990-06-15T00:00:00.000+0000",NA,"858","Folli, D.A.",1989,1,11,"Brazil","Ba","PORTO SEGURO","Nome vulgar na RFL: Pau para tudo.",NA,NA,"<ll>dwc_commonname:</ll> Pau para tudo","BRA:CVRD:CVRD:0000002156","Dimorphandra jorgei M.F.Silva"
"38",NA,"Cenargen","CEN","57377","Dimorphandra jorgei M.F.Silva","Fabaceae","Dimorphandra","jorgei",NA,"M.F.Silva","H. C. Lima",NA,NA,"858","D. A. Farias - Pau-Brasil",1989,1,11,"Brazil","Ba","PORTO SEGURO","Coleta de flor GLF. 243",NA,NA,"Doa√ßa√µ do Banco Gen√©tico do Pau-Brasil. Cole√ßa√µ de Refer√™ncia. EMBRAPA, CEPLAC, VERACEL","BRA:Cenargen:CEN:0000057377","Dimorphandra jorgei M.F.Silva"
"39","2014-07-08T03:38:59.000+0000","JBRJ","RB","RB00420418","Dimorphandra jorgei M.F.Silva","Fabaceae","Dimorphandra","jorgei",NA,"M.F.Silva",NA,NA,NA,"310","S. M. Farias",1989,6,1,"Brazil","Bahia","Porto Seguro","Estrada para Santa Cruz.",NA,NA,"6 √°rvores observadas com n√≥dulos.","urn:catalog:JBRJ:RB:420418","Dimorphandra jorgei M.F.Silva"
"40","2012-11-29T00:00:00.000+0000","K","Herbarium","K000849136","Dimorphandra jorgei M.F.Silva","Fabaceae","Dimorphandra","jorgei",NA,"M.F.Silva",NA,NA,NA,"2961","Lewis, G.P.; Lima, H.C.; Gomes, J.C.; Mor√£o, L.M.M.",1987,5,13,"Brazil",NA,"Linhares","BR 101, Km 120, Reserva da Cia. Vale do Rio doce. Pr√≥x. ao final da estrada do Flamengo (X-1).",NA,NA,"Estudo de √°reas remanensentes de ""Pau Brasil"". Expedi√ß√£o I-RJ, ES. BA. Per√≠odo: 04-20 de maio de 1987. See carp.colection","http://specimens.kew.org/herbarium/K000849136","Dimorphandra jorgei M.F.Silva"
"41","2017-10-04T12:41:44.000+0000","JBRJ","RB","RB00452337","Dimorphandra jorgei M.F.Silva","Fabaceae","Dimorphandra","jorgei",NA,"M.F.Silva","H. C. de Lima","1989-01-01T00:00:00.000+0000",NA,"2961","H. C. de Lima",1987,5,13,"Brazil","Esp√≠rito Santo","Linhares","BR - 101, km 120, Reserva da Cia. Vale do Rio Doce, pr√≥x. ao final da estrada do Flamengo (X-1). Reserva da Cia. Vale do Rio Doce",NA,NA,"√Årvore com 27 m alt. DAP 59 cm. Casca lisa e acizentada. Frutos passados no ch√£o. Ocasional","urn:catalog:JBRJ:RB:452337","Dimorphandra jorgei M.F.Silva"
"42",NA,"NY","NY","471055","Dimorphandra jorgei M.F.Silva","Fabaceae","Dimorphandra","jorgei",NA,"M.F.Silva",NA,NA,NA,"2961","H. C. de Lima",1987,5,13,"Brazil","Esp√É¬≠rito Santo",NA,"BR 101, km 120, Reserva da Cia. Vale do Rio Doce, prox. ao final da estrada do Flamengo (X-1)",-39.961174,-19.138199,NA,"41380b40-5159-430d-8e1d-117cd682e185","Dimorphandra jorgei M.F.Silva"
"43",NA,"Universidade Federal da Bahia (UFBA)","ALCB","15714","Dimorphandra jorgei subsp. da Silva","Fabaceae","Dimorphandra","jorgei","da","subsp. da Silva","Santos, TS dos","1985-05-01T00:00:00.000+0000",NA,"s/n","Santos, TS dos",1985,5,17,"Brazil","Bahia","Ilh√©us","Litoral Sul",0,0,NA,"BRA:UFBA:ALCB:0000015714","Dimorphandra jorgei subsp. da Silva"
"44",NA,"Comiss√£o Executiva do Plano da Lavoura Cacaueira (CEPLAC)","CEPEC","36632","Dimorphandra jorgei subsp. da Silva","Fabaceae","Dimorphandra","jorgei","da","subsp. da Silva","T. S. dos Santos","1985-05-21T00:00:00.000+0000",NA,"3966","T. S. dos Santos",1985,5,17,"Brazil","Bahia","ILH√âUS","Arboreto do CEPEC. Parcela no. 18.",NA,NA,"Ambiente: Mata Higrofila. Habito: √Årvore","BRA:CEPLAC:CEPEC:0000036632","Dimorphandra jorgei subsp. da Silva"
"45",NA,"UEFS","HUEFS","5713","Dimorphandra jorgei M.F.Silva","Fabaceae","Dimorphandra","jorgei",NA,"M.F.Silva",NA,NA,NA,"3966","Santos, T.S.dos",1985,5,17,"Brazil","Bahia","Ilh√©us",NA,NA,NA,NA,"BRA:UEFS:HUEFS:0000005713","Dimorphandra jorgei M.F.Silva"
"46","2014-09-26T00:00:00.000+0000","Instituto Nacional de Pesquisas da Amaz√¥nia (INPA)","Cole√ß√£o Bot√¢nica, Instituto Nacional de Pesquisas da Amaz√¥nia (INPA)","130284","Dimorphandra jorgei M.F.Silva","Fabaceae","Dimorphandra","jorgei",NA,"M.F.Silva","Silva, M. da","1986-01-01T00:00:00.000+0000",NA,"3966","Mike Hopkins",1985,NA,NA,"Brazil","Bahia",NA,"√Årea do CEPEC (Centro de Pesquisas do Cacau), Km 22 da Rodovia Ilh√©us/Itabuna (BR 415). Regi√£o de Mata Higr√≥fila Sul Baiana. Quadra, parcela n.18.",NA,NA,NA,"urn:catalog:inpa:herbarium:171535","Dimorphandra jorgei M.F.Silva"
"47",NA,"Comiss√£o Executiva do Plano da Lavoura Cacaueira (CEPLAC)","CEPEC","34066","Dimorphandra jorgei subsp. da Silva","Fabaceae","Dimorphandra","jorgei","da","subsp. da Silva","G. P. Lewis",NA,NA,"181","F. S. Santos",1984,1,19,"Brazil","Bahia","SANTA CRUZ CABR√ÅLIA","Area da ESPAB.",NA,NA,"Ambiente: Mata Higrofila. Habito: √Årvore","BRA:CEPLAC:CEPEC:0000034066","Dimorphandra jorgei subsp. da Silva"
"48","2007-03-20T14:34:19.000+0000","K","Herbarium","K000057400","Dimorphandra jorgei M.F.Silva","Fabaceae","Dimorphandra","jorgei",NA,"M.F.Silva","Lewis, G.P.",NA,NA,"181","Santos, F.S.",1984,1,19,"Brazil",NA,"Santa Cruz de Cabr√°lia","Area da Esta√ß√£o Ecol√≥gica do Pau-brasil (ESPAB), ca. 16km a W de Porto seguro, rodovia BR-367 (Porto Seguro-Eun√°polis).",-39.13,-16.38,NA,"http://specimens.kew.org/herbarium/K000057400","Dimorphandra jorgei M.F.Silva"
"49",NA,"Reserva Natural Vale (CVRD)","CVRD","1183","Dimorphandra jorgei M.F.Silva","Fabaceae","Dimorphandra","jorgei",NA,"M.F.Silva","Haroldo C. de Lima","1984-12-03T00:00:00.000+0000",NA,"51","Farias, G.L.",1984,11,30,"Brazil","Es","LINHARES",NA,NA,NA,"<ll>dwc_commonname:</ll> Pau para tudo","BRA:CVRD:CVRD:0000001183","Dimorphandra jorgei M.F.Silva"
"50","2014-07-22T08:20:02.000+0000","JBRJ","RB","RB00141700","Dimorphandra jorgei M.F.Silva","Fabaceae","Dimorphandra","jorgei",NA,"M.F.Silva","G. Barroso & H.C.de Lima",NA,NA,"51","G.L.Farias",1984,11,30,"Brazil","Esp√≠rito Santo","Linhares","Est. Louro, ant. 351, Km 1,216, lado esquerdo.",NA,NA,"√Årvore em floresta alta, +ou- 25m de altura e fuste de +ou- 17m, DAP 42cm, di√¢m. da copa +ou-8m. Com flor amarela e bot√£o verde. Fuste cil√≠ndrico e casca √°epera. Matriz n¬∞ 01","urn:catalog:JBRJ:RB:141700","Dimorphandra jorgei M.F.Silva"
"51","2014-07-22T08:19:57.000+0000","JBRJ","RB","RB00141739","Dimorphandra jorgei M.F.Silva","Fabaceae","Dimorphandra","jorgei",NA,"M.F.Silva","H.C.de Lima","1987-01-01T00:00:00.000+0000",NA,"51","G.L.Farias",1984,11,30,"Brazil","Esp√≠rito Santo","Linhares","Reserva Florestal da CVRD. Est. Louro, ant. 351, Km 1216, lado esquerdo. Reserva Florestal da CVRD",NA,NA,"√Årvore em floresta alta, +ou- 25m de altura e fuste de +ou- 17m, DAP 42c, di√¢m. +ou- 8m. Com flor amarela e bot√£o verde. Fuste cil√≠ndrico e casca √°spera. Matriz n¬∞ 01.","urn:catalog:JBRJ:RB:141739","Dimorphandra jorgei M.F.Silva"
"52",NA,"NY","NY","471058","Dimorphandra jorgei M.F.Silva","Fabaceae","Dimorphandra","jorgei",NA,"M.F.Silva","R. C. Barneby",NA,NA,"51","G. L. Farias",1984,11,30,"Brazil","Esp√É¬≠rito Santo",NA,"Reserva Florestal da CVRD. Est. Louro, ant. 351, km 1216, lado direito",-40.071853011446,-19.3949002236543,NA,"2d3be85e-b2e3-43b4-b64b-8f2211910dc1","Dimorphandra jorgei M.F.Silva"
"53",NA,"Reserva Natural Vale (CVRD)","CVRD","1184","Dimorphandra jorgei M.F.Silva","Fabaceae","Dimorphandra","jorgei",NA,"M.F.Silva","Haroldo C. de Lima","1987-09-22T00:00:00.000+0000",NA,"52","Farias, G.L.",1984,11,30,"Brazil","Es","LINHARES",NA,NA,NA,"<ll>dwc_commonname:</ll> Pau para tudo","BRA:CVRD:CVRD:0000001184","Dimorphandra jorgei M.F.Silva"
"54","2017-10-10T14:14:22.000+0000","JBRJ","RB","RB00142150","Dimorphandra jorgei M.F.Silva","Fabaceae","Dimorphandra","jorgei",NA,"M.F.Silva","H C Freitas, L C R Barroso",NA,NA,"52","G L Freitas",1984,11,30,"Brazil","Esp√≠rito Santo","Esp√≠rito Santo",NA,NA,NA,"Arvore, 28m de altura, e fuste de +-20m dap 45cm, 0 da copa +-14m. Com flor amarela e botao verde. Fuste cilindrico e casca aspera","urn:catalog:JBRJ:RB:142150","Dimorphandra jorgei M.F.Silva"
"55","2014-07-22T15:03:29.000+0000","JBRJ","RB","RB00452338","Dimorphandra jorgei M.F.Silva","Fabaceae","Dimorphandra","jorgei",NA,"M.F.Silva","H. C. de Lima","1989-01-01T00:00:00.000+0000",NA,"1762","A. L. Peixoto; H. C. de Lima",1983,4,20,"Brazil","Esp√≠rito Santo","Linhares","Reserva Florestal da CVRD, Mata alta. Reserva Florestal da CVRD",NA,NA,"√Årvoreta com ca. de 25 m alt. crescendo em mata alta. Frutos maduros indeiscentes, nigrescentes.","urn:catalog:JBRJ:RB:452338","Dimorphandra jorgei M.F.Silva"
"56",NA,"Comiss√£o Executiva do Plano da Lavoura Cacaueira (CEPLAC)","CEPEC","27963","Dimorphandra jorgei subsp. da Silva","Fabaceae","Dimorphandra","jorgei","da","subsp. da Silva","S. A. Mori",NA,NA,"14020","S. A. Mori",1981,5,14,"Brazil","Bahia","UNA","33Km SW Rod. Olivenca/Buerarema. Maruim. Faz. 2 de Julho.",NA,NA,"Ambiente: Mata Higrofila. Habito: √Årvore maior que 20m e menor que 50m","BRA:CEPLAC:CEPEC:0000027963","Dimorphandra jorgei subsp. da Silva"
"57",NA,"IPA","IPA","45860","Dimorphandra jorgei M.F.Silva","Fabaceae","Dimorphandra","jorgei",NA,"M.F.Silva","Lima, H.C. de","2008-07-01T00:00:00.000+0000",NA,"8779","Andrade-Lima",1979,10,12,"Brazil","Alagoas",NA,NA,0,0,NA,"BRA:IPA:IPA:0000045860","Dimorphandra jorgei M.F.Silva"
"58",NA,"UEFS","HUEFS","76052","Dimorphandra jorgei subsp. da Silva","Fabaceae","Dimorphandra","jorgei","da","subsp. da Silva",NA,NA,NA,"-9636-","Mori, S.",1978,3,17,"Brazil","Bahia","Caravelas","Entre Barra de Caravelas e Ponta de Areia.",NA,NA,"Restinga","BRA:UEFS:HUEFS:0000076052","Dimorphandra jorgei subsp. da Silva"
"59",NA,"NY","NY","4356","Dimorphandra jorgei M.F.Silva","Fabaceae","Dimorphandra","jorgei",NA,"M.F.Silva",NA,NA,"ISOTYPE","9636","S. A. Mori",1978,3,17,"Brazil","Bahia",NA,"Munic√É¬≠pio de Caravelas. Entre Barra de Caravelas e Ponta de Areia.",0,0,NA,"3aa49538-aa39-450d-969e-5c4eb595a05a","Dimorphandra jorgei M.F.Silva"
"60","2014-07-22T08:29:19.000+0000","JBRJ","RB","RB00141682","Dimorphandra jorgei M.F.Silva","Fabaceae","Dimorphandra","jorgei",NA,"M.F.Silva","M.F.da Silva","1980-01-01T00:00:00.000+0000",NA,"9636","S.A.Mori; L.A.Mattos Silva, J.A.Kallunki, T.S. dos Santos & A.V.Pereira dos Santos",1978,3,17,"Brazil","Bahia","Caravelas","Entre Barra de Caravelas e Ponta de Areia.",NA,NA,"√Årvore, 10m x 35cm. Peranto esverdeado, estamonoidos cremes, estames marrons.","urn:catalog:JBRJ:RB:141682","Dimorphandra jorgei M.F.Silva"
