"","modified","institutionCode","collectionCode","catalogNumber","scientificName","family","genus","specificEpithet","scientificNameAuthorship","identifiedBy","dateIdentified","typeStatus","recordNumber","recordedBy","year","month","day","country","stateProvince","municipality","locality","decimalLongitude","decimalLatitude","occurrenceRemarks","occurrenceID","bibliographicCitation","acceptedNameUsage"
"1",NA,"NY","NY","1365045","Parkia lutea H.C.Hopkins","Fabaceae","Parkia","lutea","H.C.Hopkins",NA,NA,"ISOTYPE","3219","J. L. Zarucchi",1983,7,27,"Brazil","Amazonas",NA,"Along Rio Apoquitaua above confluence of Rio Pacoval",-57.88,-3.9,NA,"a755da79-baf7-4c52-9f04-920c97dad72e",NA,"Parkia lutea H.C.Hopkins"
"3","2012-12-03T00:00:00.000+0000","K","Herbarium","K000849439","Parkia lutea H.C.Hopkins","Fabaceae","Parkia","lutea","H.C.Hopkins",NA,NA,NA,"2945","Zarucchi, J.L.; Nelson, B.W.; Santos, J.L.; Hill, S.R.; Todzia, C.A.; Oliveira, J.G.; Cid Ferreira, C.A.",1983,7,4,"Brazil",NA,NA,"Mun. de Axinim, basin of Rio Abacaxis, ca. 4km from mouth of Igarapé Surubim.",-58.57,-4.52,"Projeto Flora Amazônica. Plants collected under the joint sponsorship of the Conselho Nacional de Desenvolvimento Cientifico e Tecnológico and the National Science Foundation in a collaboration between the Instituto Nacional de Pesquisas da Amazônia (INPA","http://specimens.kew.org/herbarium/K000849439",NA,"Parkia lutea H.C.Hopkins"
"4","2007-10-16T09:29:41.000+0000","K","Herbarium","K000504678","Parkia lutea H.C.Hopkins","Fabaceae","Parkia","lutea","H.C.Hopkins",NA,NA,"ISOTYPE","3219","Zarucchi, J.L.; Nelson, B.W.; Santos, J.L.; Ferreria, C.A.C.; Hill, S.R.; Todzia, C.A.; Oliveira, J.G.",1983,7,27,"Brazil",NA,NA,"Mun. de Maués, along Rio Apoquitaua above confluence of Rio Pacoval",-57.88,-3.9,"possibly cultivated ?","http://specimens.kew.org/herbarium/K000504678",NA,"Parkia lutea H.C.Hopkins"
"5",NA,"US","Botany","3130295","Parkia lutea H.C.Hopkins","Fabaceae","Parkia","lutea","H.C.Hopkins",NA,NA,NA,"2930","J. L. Zarucchi",1983,7,1,"Brazil","Amazonas",NA,"Rio abacaxix, lower rio paca 1 km from confluence with rio marimari",-58.9667,-4.1167,NA,"http://n2t.net/ark:/65665/30f866989-e96e-4f16-8d8c-619bc032e7fa",NA,"Parkia lutea H.C.Hopkins"
"9","2012-12-03T00:00:00.000+0000","K","Herbarium","K000849440","Parkia lutea H.C.Hopkins","Fabaceae","Parkia","lutea","H.C.Hopkins",NA,NA,NA,"2930","Zarucchi, J.L.; Nelson, B.W.; Santos, J.L.; Hill, S.R.; Todzia, C.A.; Oliveira, J.G.",1983,7,1,"Brazil",NA,NA,"Axinim, basin of Rio Abacaxis, lower Rio Paca ca. 1Km from its confluence with the Rio Marimari.",-58.97,-4.12,"See Carpological Collection - Plants collected under the joint sponsorship of the Conselho Nacional de Desenvolvimento Científico e Tecnológico and the National Science Foundation in a collaboration between the Instituto Nacional de Pesquisas da Amazônia","http://specimens.kew.org/herbarium/K000849440",NA,"Parkia lutea H.C.Hopkins"
"10","2008-05-27T22:02:00.000+0000","MO","MO","2921855","Parkia lutea H.C.Hopkins","Fabaceae","Parkia","lutea","H.C.Hopkins","H.C. Hopkins","2000-01-01T00:00:00.000+0000","ISOTYPE","Zarucchi 3219","James L. Zarucchi",1983,7,27,"Brazil","Amazonas",NA,"Mun. Maués: along Rio Apoquitaua above confluence of Rio Pacoval.",-57.88333,-3.9,NA,"urn:catalog:MO:Tropicos:2921855","http://www.tropicos.org/Specimen/2921855","Parkia lutea H.C.Hopkins"
"12","2008-05-27T22:02:00.000+0000","MO","MO","2921978","Parkia lutea H.C.Hopkins","Fabaceae","Parkia","lutea","H.C.Hopkins","H.C. Hopkins","2000-01-01T00:00:00.000+0000",NA,"Zarucchi 2945","James L. Zarucchi",1983,7,4,"Brazil","Amazonas",NA,"Mun. de Axinim, basin of Rio Abacaxis, ca. 4 km from mouth of Igarapé Surubim, open white sand campina.",-58.56666,-4.51666,NA,"urn:catalog:MO:Tropicos:2921978","http://www.tropicos.org/Specimen/2921978","Parkia lutea H.C.Hopkins"
