"","modified","institutionCode","collectionCode","catalogNumber","scientificName","identificationQualifier","family","genus","specificEpithet","infraspecificEpithet","scientificNameAuthorship","identifiedBy","dateIdentified","typeStatus","recordNumber","fieldNumber","recordedBy","year","month","day","country","stateProvince","municipality","locality","decimalLongitude","decimalLatitude","occurrenceRemarks","occurrenceID","comments","bibliographicCitation","acceptedNameUsage"
"1","","","RB","RB01387637","Aspidosperma carapanauba Pichon","","Apocynaceae","Aspidosperma","carapanauba","","Pichon","H. Medeiros","2017-01-01","","2640","","H. Medeiros; Ilnaira G. Sousa, Elinio M. Soares, Raimundo N. Soares, Daniel S. Costa & Adriano S. Lima","2017","10","17","brazil","Acre","Sena Madureira","Reserva Extrativista do Cazumbá-Iracema, Programa de Monitoramente da Biodiversidade, Unidade Amostral 01 (Cazumbá), PÁ ""N"".","-68.951111","-9.168889","Árvore 11 m, estéril. Placa #41.","","original coordinates","GBIF","Aspidosperma carapanauba Pichon"
"2","","","HERBAM","10956","Aspidosperma carapanauba Pichon","","Apocynaceae","Aspidosperma","carapanauba","","Pichon","Rodrigues, L","2017-07-18","","068544","","Rodrigues, L; Lopes, A R; Sardinha, S M; Lourençoni, T","2014","8","11","brazil","Mato Grosso","Alta Floresta","Casa de Sementes - Estrela do Sul, Área seca, Quintal, Planície.","-55.880444","-9.793028","Projeto Sementes do Portal Fase 2.","","original coordinates","GBIF","Aspidosperma carapanauba Pichon"
"3","","","HERBAM","10271","Aspidosperma carapanauba Pichon","","Apocynaceae","Aspidosperma","carapanauba","","Pichon","F.Citadella","2014-12-30","","CL 3038229","","Soares-Lopes, CRA; Lima, WM; Benetti, E; Fernandes, E; Filho, JI; Da Silva, WL","2014","12","22","brazil","Mato Grosso","Alta Floresta","PCH Cabeça-de-boi, Canteiro Industrial 02, Terra firme","-56.365843","-10.055171","Complexo Hidrelétrico Apiacás","","centroide mpo","GBIF","Aspidosperma carapanauba Pichon"
"4","","","UEC","198021","Aspidosperma carapanauba Pichon","","Apocynaceae","Aspidosperma","carapanauba","","Pichon","Piva, J.H.","2011-10-18","","8229","","Soares, C.R.A.; et al.","2011","10","18","brazil","Mato Grosso","Paranaíta","","-56.776389","-9.337778","árvore de 17m de altura, cap 80cm, folhas discolor cartáceas, lactescentes. folículos imaturos, rugosos, imaturos verdes; terra firme","","original coordinates","GBIF","Aspidosperma carapanauba Pichon"
"5","","","HERBAM","6830","Aspidosperma carapanauba Pichon","","Apocynaceae","Aspidosperma","carapanauba","","Pichon","Soares, CRA","","","Verde 324115","","Soares, CRA; Duarte, JAS; Matos, DL; Oliveira, PS","2011","10","10","brazil","Mato Grosso","Paranaíta","Terra Firme.","-56.781667","-9.329167","UHE Teles Pires","","original coordinates","GBIF","Aspidosperma carapanauba Pichon"
"6","","","HERBAM","6944","Aspidosperma carapanauba Pichon","","Apocynaceae","Aspidosperma","carapanauba","","Pichon","Piva, JH","2011-10-18","","Amarelo 114301","","Soares, CRA; Matos, DL; Damasceno, ASV; Piva, JH; Petini-Benelli, A","2011","10","18","brazil","Mato Grosso","Paranaíta","Terra Firme.","-56.776389","-9.337778","UHE Teles Pires","","original coordinates","GBIF","Aspidosperma carapanauba Pichon"
"7","","","UEC","198003","Aspidosperma carapanauba Pichon","","Apocynaceae","Aspidosperma","carapanauba","","Pichon","Soares, C.R.A.","","","4115","","Soares, C.R.A.; et al.","2011","10","11","brazil","Mato Grosso do Sul","Paranaíba","","-56.781667","-9.329167","árvore com 25m de altura; cap: 45 cm. folhas discolor, cartácea. frutos secos, indeiscentes; terra firme","","original coordinates","GBIF","Aspidosperma carapanauba Pichon"
"8","","","EAFM","425","Aspidosperma carapanauba Pichon","","Apocynaceae","Aspidosperma","carapanauba","","Pichon","Kinupp, V.F.","2009-03-25","","3669","","Kinupp, V.F.; Ming, L.C.; Vieira, D.A.F. & Araújo, A.A.","2009","3","25","brazil","Amazonas","Santa Isabel do Rio Negro","Comunidade Camarú","-65.52098","-0.318629","Árvore; 12 m; folha verde-escura com ovos que a planta desenvolve e se transforma em uma galha; material estéril; de uso medicinal para malária.; Floresta de terra-firme. ; HA","","centroide mpo (0)","GBIF","Aspidosperma carapanauba Pichon"
"9","","","Herbarium","K000447737","Aspidosperma carapanauba Pichon","","Apocynaceae","Aspidosperma","carapanauba","","Pichon","Sasaki , D.","","","1377","","Piva, J.H.; Henicka, G.S.; Monteiro, M.; Sasaki, D.; Nascimento, J.","2007","1","22","brazil","","Novo Mundo","Propriedade particular de preservação ambiental delimitada pelo Parque Estadual Cristalino e pelos rios Teles Pires e Cristalino. Próximo ao Cristalino Jungle Lodge.GPS :A 337","-55.92","-9.61","Common Name: guarantã","","original coordinates","GBIF","Aspidosperma carapanauba Pichon"
"10","","","Herbarium","K000447738","Aspidosperma carapanauba Pichon","","Apocynaceae","Aspidosperma","carapanauba","","Pichon","Ramos, J.F.","","","432","","Projeto Flora Cristalino; Piva, J.H.; Vieira, I.; Sasaki, D.","2006","9","27","brazil","","Novo Mundo","Área particular de preservação ambiental, delimitada pelo Parque Estadual Cristalino e pelos Rios Teles Pires e Cristalino. Nas proximidades da estrada de terra que leva à base do Limão.GPS :A 047","-55.89","-9.54","Common Name: guarantã","","original coordinates","GBIF","Aspidosperma carapanauba Pichon"
"11","","","Coleção Botânica, Instituto Nacional de Pesquisas da Amazônia (INPA)","224065","Aspidosperma carapanauba Pichon","","Apocynaceae","Aspidosperma","carapanauba","","Pichon","Phytodemographic Project","2006-01-01","","25","","Julịo, GR","2005","9","29","brazil","Amazonas","","Cabo Frio. Terra firme.","-59.91","-2.399583","","","original coordinates","GBIF","Aspidosperma carapanauba Pichon"
"12","","","HPL","2129","Aspidosperma carapanauba Pichon","","Apocynaceae","Aspidosperma","carapanauba","","Pichon","R. Tsuji","2004-11-24","","932","","R. Tsuji , L.C. Bernacci & E. Franco","2004","11","24","brazil","Mt","Liquilândia","Coletada em beira de estrada na BR322.","-52.064472","-11.606056","","","original coordinates","GBIF","Aspidosperma carapanauba Pichon"
"13","","","SPFW","3824","Aspidosperma carapanauba Pichon","","Apocynaceae","Aspidosperma","carapanauba","","Pichon","IPT","","","4","","Nunes, I.N.","2002","1","1","brazil","Rondônia","Costa Marques","Reserva Extrativista Estadual Rio Cautário","-64.131111","-11.994722","madeira usada para cabo e lenha, mais informações na pasta Resex","","original coordinates","GBIF","Aspidosperma carapanauba Pichon"
"14","","","MBM","250388","Aspidosperma carapanauba Pichon","","Apocynaceae","Aspidosperma","carapanauba","","Pichon","Marcondes-Ferreira Neto, W","1997-09-01","","4000","","Árbocz, GF; Ivanauskas, NM; Silva, MMR","1997","6","7","brazil","Mato Grosso","Alta Floresta","Adjacências do Hotel Floresta Amazônica.","-56.365843","-10.055171","Árvore 25m. Látex branco leitoso. Botões creme-esverdeados.; Floresta Ombrófila Aberta. Relevo suave ondulado. Solo tipo Podzólico.","","centroide mpo (0)","GBIF","Aspidosperma carapanauba Pichon"
"15","","","UEC","114299","Aspidosperma carapanauba Pichon","","Apocynaceae","Aspidosperma","carapanauba","","Pichon","Marcondes-Ferreira, W.","2013-11-01","","4033","","Árbocz, G.F.; Assis, M.C.; Zanella, J.; Silva, M.R.","1997","7","3","brazil","Mato Grosso","Aripuanã","Margem da MT-420 a 5 km da cidade.","-59.407222","-10.208056","flor, Árvore de 22m. Tronco canelado. Látex branco leitoso. Folhas novas verdes-claras. Flores creme. Solo tipo podzólico.","","original coordinates","GBIF","Aspidosperma carapanauba Pichon"
"16","","","SPF","126581","Aspidosperma carapanauba Pichon","","Apocynaceae","Aspidosperma","carapanauba","","Pichon","Oliveira, AA","1993-01-01","","261","","Oliveira, AA","1993","2","","brazil","Amazonas","Manaus","Reserva 1501 (km 41) do PDBFF. 90 km NNE de Manaus. Mata de terra firme.","-59.763889","-2.425278","Árvore no. 0512. DAP de 20,5 cm. Parcela 13-14. Estéril.","","original coordinates","GBIF","Aspidosperma carapanauba Pichon"
"17","","","Herbarium","K000988451","Aspidosperma carapanauba Pichon","","Apocynaceae","Aspidosperma","carapanauba","","Pichon","","","","6522","","Lima, R.P. de; Ackerly, C.; Pirani, J.; Thomas, W.W.; Oliveira, J.G.; Cid Ferreira, C.A.; Coelho, J.A.","1985","10","17","brazil","","São Félix do Araguaia","Mt. Estr. da Faz. Sta. Cecília, a 15 km N do cruz. das estr. BR158 e MT-285 (Posto da Mata); 15km da BR 158.","-51.87","-11.2","Convênio CNPq/NSF (INPA - MPEG - New York Botanical Garden)","","original coordinates","GBIF","Aspidosperma carapanauba Pichon"
"18","","","Coleção Botânica, Instituto Nacional de Pesquisas da Amazônia (INPA)","158591","Aspidosperma carapanauba Pichon","","Apocynaceae","Aspidosperma","carapanauba","","Pichon","","","","5296","","Silva, NT da","1983","6","3","brazil","Amapá","","Área do Felipe 03. Floresta primária de terra firme.","-52.3","-0.666667","","","original coordinates","GBIF","Aspidosperma carapanauba Pichon"
"19","","","Botany","WAG.1475835","Aspidosperma carapanauba Pichon","","Apocynaceae","Aspidosperma","carapanauba","","Pichon","","","","","","Mori S; et al.","1983","9","17","brazil","","","Brazil. Amapa: Camaipi. Embrapa reserve and vicinity.","-51.616667","-0.166667","","","original coordinates","GBIF","Aspidosperma carapanauba Pichon"
"20","","","NY","01172379","Aspidosperma carapanauba Pichon","","Apocynaceae","Aspidosperma","carapanauba","","Pichon","","","","16243","","S. A. Mori","1983","9","17","brazil","AmapÃ¡","","Camaipi. EMBRAPA reserve and vicinity","-51.62","0.17","","","original coordinates","GBIF","Aspidosperma carapanauba Pichon"
"21","","","Coleção Botânica, Instituto Nacional de Pesquisas da Amazônia (INPA)","127738","Aspidosperma carapanauba Pichon","","Apocynaceae","Aspidosperma","carapanauba","","Pichon","","","","4300","","Silva, MG da","1979","1","17","brazil","Mato Grosso","","Km 238 da BR 174, Núcleo Juína, área Urbana. Mata de terra firme, solo areno-argiloso.","","","","","","GBIF","Aspidosperma carapanauba Pichon"
"22","","","Botany","V0421150F","Aspidosperma carapanauba Pichon","","Apocynaceae","Aspidosperma","carapanauba","","Pichon","","","","4300","","M. G. da Silva","1979","1","17","brazil","","","","-52.8731","-10.8339","","","original coordinates","GBIF","Aspidosperma carapanauba Pichon"
"23","","","SPF","186080","Aspidosperma carapanauba Pichon","","Apocynaceae","Aspidosperma","carapanauba","","Pichon","Silva, MG","1979-01-01","","4847","","Silva, MG","1979","6","10","brazil","Mato Grosso","","Rod. BR 174; margem da Fazenda Vale do Tucanã. Mata de terra firme, solo argiloso.","","","Árvore de 25 m de alt., 60 cm de diam.; flores em botões verdes-esbranquiçadas.","","","GBIF","Aspidosperma carapanauba Pichon"
"24","","","Coleção Botânica, Instituto Nacional de Pesquisas da Amazônia (INPA)","92256","Aspidosperma carapanauba Pichon","","Apocynaceae","Aspidosperma","carapanauba","","Pichon","","","","80","","Rankin, JM","1979","11","","brazil","Amazonas","","Distrito Agropecuário, ZF3, Fazenda Esteio, ZF-3, Distrito Agropecuário da SUFRMA. Floresta densa da terra firme, solo argiloso.","","","","","","GBIF","Aspidosperma carapanauba Pichon"
"25","","","Coleção Botânica, Instituto Nacional de Pesquisas da Amazônia (INPA)","65754","Aspidosperma carapanauba Pichon","","Apocynaceae","Aspidosperma","carapanauba","","Pichon","","","","313","","Nascimento, JR","1977","9","20","brazil","Amazonas","","Estrada Manaus-Caracaraí Km 39, Reserva Experimental de Silvicultura Tropical. Terra firme, solo argiloso-arenoso.","","","","","","GBIF","Aspidosperma carapanauba Pichon"
"26","","","Coleção Botânica, Instituto Nacional de Pesquisas da Amazônia (INPA)","58958","Aspidosperma carapanauba Pichon","","Apocynaceae","Aspidosperma","carapanauba","","Pichon","","","","76-1125","","Monteiro, OP","1976","5","29","brazil","Mato Grosso","","","","","","","","GBIF","Aspidosperma carapanauba Pichon"
"27","","","Coleção Botânica, Instituto Nacional de Pesquisas da Amazônia (INPA)","63037","Aspidosperma carapanauba Pichon","","Apocynaceae","Aspidosperma","carapanauba","","Pichon","","","","170","","Gomes, M","1976","8","11","brazil","Mato Grosso","","Mata de terra firme, solo argiloso.","","","","","","GBIF","Aspidosperma carapanauba Pichon"
"28","","","Coleção Botânica, Instituto Nacional de Pesquisas da Amazônia (INPA)","35204","Aspidosperma carapanauba Pichon","","Apocynaceae","Aspidosperma","carapanauba","","Pichon","","","","70","","Silva, MF da","1972","3","2","brazil","Amazonas","","Estrada Manaus-Caracaraí, Km 30. Ocasional na mata de terra firme, argilosa.","","","","","","GBIF","Aspidosperma carapanauba Pichon"
"29","","","UEC","20077","Aspidosperma carapanauba Pichon","","Apocynaceae","Aspidosperma","carapanauba","","Pichon","Marcondes-Ferreira, W.","2013-11-01","","4300","","Silva, M.G.; Pinheiro, A.","1971","1","17","brazil","Mato Grosso","Aripuanã","Núcleo juina, área urbana, km 238 da BR","-59.838692","-10.188355","árvore de 35 m x 80 cm de diâmetro, látex branco. Fruto imaturo verde, fuste sulcado, mata de terra firme, solo areno-argiloso.","","centroide mpo (0)","GBIF","Aspidosperma carapanauba Pichon"
"30","","","Coleção Botânica, Instituto Nacional de Pesquisas da Amazônia (INPA)","31029","Aspidosperma carapanauba Pichon","","Apocynaceae","Aspidosperma","carapanauba","","Pichon","","","","458","","Albuquerque, BWP de","1971","10","13","brazil","Amazonas","","Estrada Manaus-Itacoatiara, Km 155. Mata de terra firme.","","","","","","GBIF","Aspidosperma carapanauba Pichon"
"31","","","Coleção Botânica, Instituto Nacional de Pesquisas da Amazônia (INPA)","27715","Aspidosperma carapanauba Pichon","","Apocynaceae","Aspidosperma","carapanauba","","Pichon","","","","8608","","Rodrigues, WA","1969","11","5","brazil","Amazonas","","AM10, Km 145, picada 10 árvo, Estrada Manaus-Itacoatiara, Km 145, picada 10 árvore nº 11.","","","","","","GBIF","Aspidosperma carapanauba Pichon"
"32","","","NY","01252815","Aspidosperma carapanauba Pichon","","Apocynaceae","Aspidosperma","carapanauba","","Pichon","W. Marcondes-Ferreira","1997-01-01","","4076","","E. de Oliveira","1968","2","2","brazil","Pará","","Rio Jarí, Monte Dourado, Planalto.","-52.600822","-0.880931","","","original coordinates","GBIF","Aspidosperma carapanauba Pichon"
"33","","","NY","01172377","Aspidosperma carapanauba Pichon","","Apocynaceae","Aspidosperma","carapanauba","","Pichon","F. Markgraf","1969-01-01","","7014","","G. T. Prance","1968","8","16","brazil","Rondônia","","Porto Velho to Cuiabá highway. Vicinity of Santa Barbara, 15 Km east of Km 117","-63.026951","-9.253256","","","original coordinates","GBIF","Aspidosperma carapanauba Pichon"
"34","","","Botany","U.1079635","Aspidosperma carapanauba Pichon","","Apocynaceae","Aspidosperma","carapanauba","","Pichon","","","","","","Prance GT; Ramos JF","1968","8","16","brazil","","","Plants of Brazilian Amazonia, Territory of Rondónia, Porto Velho to Cuiabá Highway, Viciniry of Santa Barbaram 15 km east of Km. 117.","","","","","no coordinates, municipality or state provided","GBIF","Aspidosperma carapanauba Pichon"
"35","","","Botany","V0421029F","Aspidosperma carapanauba Pichon","","Apocynaceae","Aspidosperma","carapanauba","","Pichon","","","","912","","N. T. da Silva","1968","9","9","brazil","","","","-52.8731","-10.8339","","","original coordinates","GBIF","Aspidosperma carapanauba Pichon"
"36","","","NY","01172378","Aspidosperma carapanauba Pichon","","Apocynaceae","Aspidosperma","carapanauba","","Pichon","","","","3799","","E. de Oliveira","1967","12","3","brazil","Pará","","R. Jari, Monte Dourado, a 3 km da margem","-52.539719","-0.867854","","","original coordinates","GBIF","Aspidosperma carapanauba Pichon"
"37","","","Coleção Botânica, Instituto Nacional de Pesquisas da Amazônia (INPA)","15771","Aspidosperma carapanauba Pichon","","Apocynaceae","Aspidosperma","carapanauba","","Pichon","","","","7109","","Rodrigues, WA","1965","9","2","brazil","Amazonas","","Estrada AM-1, Km 84. Solo de mata de terra firme,, Estrada AM-1, Km 84. Solo de mata de terra firme, argilosa.","","","","","","GBIF","Aspidosperma carapanauba Pichon"
"38","","","Coleção Botânica, Instituto Nacional de Pesquisas da Amazônia (INPA)","8160","Aspidosperma carapanauba Pichon","","Apocynaceae","Aspidosperma","carapanauba","","Pichon","","","","1796","","Rodrigues, WA","1960","9","28","brazil","Amazonas","","AM10, Km 32. Mata de terra f, Estrada Manaus-Itacoatiara, Km 32. Mata de terra firme, solo argiloso.","","","","","","GBIF","Aspidosperma carapanauba Pichon"
"39","","","Botany","L.0966018","Aspidosperma carapanauba Pichon","","Apocynaceae","Aspidosperma","carapanauba","","Pichon","","","","","","Krukoff BA","1933","8","24","brazil","","","Basin of Rio SolimoesTerritory of Acre: near mouth of Rio Macauhan (tributary of Rio Yaco)","-69","-9.333333","","","original coordinates","GBIF","Aspidosperma carapanauba Pichon"
"40","","","RB","RB00535104","Geissospermum excelsum Kuhlmann","","Apocynaceae","Aspidosperma","excelsum","","Kuhlmann","Markgraf","1938-01-01","","","","Ducke, A.","1932","9","6","brazil","Amazonas","Parintins","Mattas ao oeste do Lago Uaicurapá, em direção ao Andirá.","-56.855812","-2.68652","Árvore grande com troncos sulcados e limellado, flor branca. n.vulgar: ""Carapanaúba""","","centroide mpo","GBIF","Geissospermum excelsum Kuhlmann"
"41","","","Botany",NA,"Geissospermum excelsum Kuhlmann","","Apocynaceae","Aspidosperma","excelsum","","Kuhlmann","","","","","","A. Ducke","1932","9","6","brazil","","","","-52.8731","-10.8339","","","original coordinates","GBIF","Geissospermum excelsum Kuhlmann"
"42","","","Botany","V0092447F","Aspidosperma carapanauba Pichon","","Apocynaceae","Aspidosperma","carapanauba","","Pichon","","","","136","","A. Ducke","1932","9","6","brazil","","","","-52.8731","-10.8339","","","original coordinates","GBIF","Aspidosperma carapanauba Pichon"
"43","","","Herbarium","K000587684","Aspidosperma carapanauba Pichon","","Apocynaceae","Aspidosperma","carapanauba","","Pichon","","","","24471","","Ducke, A.","1932","9","6","brazil","","","Circa lacum Uaicurapá (prope Parintino, civit. Amazonas), silva terris altis","","","N.V. ""carapanaúba""","","no coordinates, municipality or state provided","GBIF","Aspidosperma carapanauba Pichon"
"44","","","Botany","1615859","Geissospermum excelsum Kuhlmann","","Apocynaceae","Aspidosperma","excelsum","","Kuhlmann","","","","24471","","A. Ducke","1932","9","6","brazil","Amazonas","","Uaicurapa, prope Parintins.","","","","","","GBIF","Geissospermum excelsum Kuhlmann"
"45","","","Botany","USw9692","Geissospermum excelsum Kuhlmann","","Apocynaceae","Aspidosperma","excelsum","","Kuhlmann","","","","5639","","B. A. Krukoff","","","","brazil","Acre","","Near mouth of Rio Macauhan, basin of Rio Purus","","","","","","GBIF","Geissospermum excelsum Kuhlmann"
"46","","","RB","RB00043366","Aspidosperma carapanauba Pichon","","Apocynaceae","Aspidosperma","carapanauba","","Pichon","M.G.Silva","","","4300","","M.G.Silva; A. Pinheiro","","","","brazil","Mato Grosso","Aripuanã","km 238 da BR.174 Núcleo juina, área Urbana.","-59.838692","-10.188355","Árvore de 35m x 80 cm de diâmetro, latex branco, fruto imaturo verde, fruto sulcado.","","centroide mpo","GBIF","Aspidosperma carapanauba Pichon"
"47","","","Coleção Botânica, Instituto Nacional de Pesquisas da Amazônia (INPA)","75564","Aspidosperma carapanauba Pichon","","Apocynaceae","Aspidosperma","carapanauba","","Pichon","","","","14","","Roth, L","","","","brazil","Mato Grosso","","Mata de terra firme.","","","","","","GBIF","Aspidosperma carapanauba Pichon"
"48","","","RB","RB00043355","Aspidosperma carapanauba Pichon","","Apocynaceae","Aspidosperma","carapanauba","","Pichon","M.G.Silva","1979-01-01","","4847","","M.G.Silva; C.Rosário","","","","brazil","Mato Grosso","Mato Grosso","km 330 da rod. BR-174; margem da fazenda Vale do Tucunã. Mata de terra Firme, Solo argiloso.","","","Árvore de 25m de altura, 60 cm de diâmetro; flores em botões verde-esbranquiçados.","","centroide mpo","GBIF","Aspidosperma carapanauba Pichon"
"49","","","UEC","198001","Aspidosperma carapanauba Pichon","","Apocynaceae","Aspidosperma","carapanauba","","Pichon","Citadella, F.","","","8229","","Soares-Lopes, C.R.A.; et al.","","","","brazil","Mato Grosso","Alta Floresta","PCH cabeça de boi, canteiro industrial 02","-56.365843","-10.055171","árvore de 20m de altura, fuste acanalado e casca sujo ou áspero. casca morta cinza e casca viva marrom, e alburno palha. folhas discolor e cartácea. frutos secos de cor verde; terra firme","","centroide mpo (0)","GBIF","Aspidosperma carapanauba Pichon"
