"","modified","institutionCode","collectionCode","catalogNumber","scientificName","family","genus","specificEpithet","scientificNameAuthorship","identifiedBy","dateIdentified","typeStatus","recordNumber","recordedBy","year","month","day","country","stateProvince","municipality","locality","decimalLongitude","decimalLatitude","occurrenceRemarks","occurrenceID","acceptedNameUsage"
"1","2014-09-26T00:00:00.000+0000","Instituto Nacional de Pesquisas da Amazônia (INPA)","Coleção Botânica, Instituto Nacional de Pesquisas da Amazônia (INPA)","202393","Byrsonima souzae W.R.Anderson","Malpighiaceae","Byrsonima","souzae","W.R.Anderson","Lemos, M.C.","1997-10-01T00:00:00.000+0000",NA,"159","Mike Hopkins",1997,NA,NA,"Brazil","Amazonas",NA,"Estação Esperimental de Silvicultura Tropical - ZF2.",NA,NA,NA,"urn:catalog:inpa:herbarium:81959","Byrsonima souzae W.R.Anderson"
"2",NA,"NY","NY","1802500","Byrsonima souzae W.R.Anderson","Malpighiaceae","Byrsonima","souzae","W.R.Anderson",NA,NA,NA,"7168","W. A. Rodrigues",1965,9,14,"Brazil","Amazonas",NA,"Estrada Torquato Tapajos, km 105, lado direito.",0,0,NA,"70faddc5-59d7-4f60-a441-f8173b3be7fe","Byrsonima souzae W.R.Anderson"
"3","2014-09-26T00:00:00.000+0000","Instituto Nacional de Pesquisas da Amazônia (INPA)","Coleção Botânica, Instituto Nacional de Pesquisas da Amazônia (INPA)","15831","Byrsonima souzae W.R.Anderson","Malpighiaceae","Byrsonima","souzae","W.R.Anderson","Anderson, W.R.","1982-01-01T00:00:00.000+0000",NA,"7168","Mike Hopkins",1965,9,14,"Brazil","Amazonas",NA,"AM10, Km 106, lado direito., Estrada Manaus-Itacoatiara, Km 106, lado direito. Solo argiloso.",NA,NA,NA,"urn:catalog:inpa:herbarium:162126","Byrsonima souzae W.R.Anderson"
"4",NA,"NY","NY","55591","Byrsonima souzae W.R.Anderson","Malpighiaceae","Byrsonima","souzae","W.R.Anderson",NA,NA,"ISOTYPE","2462","W. A. Rodrigues",1961,5,4,"Brazil","Amazonas",NA,"Manaus, Km 45 da BR-17",0,0,NA,"4b59885d-784b-4eff-ab76-d87b1b020d9e","Byrsonima souzae W.R.Anderson"
"5","2014-09-26T00:00:00.000+0000","Instituto Nacional de Pesquisas da Amazônia (INPA)","Coleção Botânica, Instituto Nacional de Pesquisas da Amazônia (INPA)","8968","Byrsonima souzae W.R.Anderson","Malpighiaceae","Byrsonima","souzae","W.R.Anderson","Anderson, W.R.","1982-01-01T00:00:00.000+0000",NA,"2462","Mike Hopkins",1961,5,3,"Brazil","Amazonas",NA,"Km 45 da BR-174. Terra firme, solo argiloso, mata, Km 45 da BR-174. Terra firme, solo argiloso, mata virgem.",NA,NA,NA,"urn:catalog:inpa:herbarium:158653","Byrsonima souzae W.R.Anderson"
"6",NA,"Instituto de Botânica, IBT","SP","75111","Byrsonima souzae W.R.Anderson","Malpighiaceae","Byrsonima","souzae","W.R.Anderson","Anderson, WR","1982-01-01T00:00:00.000+0000","ISOTYPE","2462","Rodrigues, W; Coêlho, D",1961,5,3,"Brazil","Amazonas","Manaus","Km 45 da BR 17. Terra firme, argiloso, mata virgem",0,0,"Flores vermelhas, glândulas brancas. Árvore 15 m","BRA:IBt:SP:0000075111","Byrsonima souzae W.R.Anderson"
"7","2/06/17 16:02","INPA","INPA","15831","Byrsonima souzae","Malpighiaceae","Byrsonima",NA,"W.R.Anderson","Anderson, WR",NA,"paratype",NA,NA,NA,NA,NA,"Brasil","Amazonas",NA,"AM 010, Km 106., Estrada Manaus-Itacoatiara, Km 106, lado direito. Solo argiloso.",NA,NA,NA,NA,"Byrsonima souzae W.R.Anderson"
"8","2/06/17 16:02","INPA","INPA","202393","Byrsonima souzae","Malpighiaceae","Byrsonima",NA,"W.R.Anderson","Lemos, MC",NA,NA,NA,NA,NA,NA,NA,"Brasil","Amazonas",NA,"Esta̤̣o Esperimental de Silvicultura Tropical - ZF2.",NA,NA,NA,NA,"Byrsonima souzae W.R.Anderson"
"9","2/06/17 16:02","INPA","INPA","8968","Byrsonima souzae","Malpighiaceae","Byrsonima",NA,"W.R.Anderson","Anderson, WR",NA,"holotype",NA,NA,NA,NA,NA,"Brasil","Amazonas",NA,"BR174, Km 45, Km 45 da BR-174. Terra firme, solo argiloso, mata virgem.",NA,NA,NA,NA,"Byrsonima souzae W.R.Anderson"
