"","modified","institutionCode","collectionCode","catalogNumber","scientificName","family","genus","specificEpithet","scientificNameAuthorship","identifiedBy","dateIdentified","typeStatus","recordNumber","fieldNumber","recordedBy","year","month","day","country","stateProvince","municipality","locality","decimalLongitude","decimalLatitude","occurrenceRemarks","occurrenceID","bibliographicCitation","acceptedNameUsage","identificationQualifier","infraspecificEpithet","comments","FID","NOME","GEOCODIGO","POINT_X","POINT_Y","NOMEUF","SIGLAUF","estados_shp","x_estado","y_estado","new_Lat","new_Lon"
"134",NA,"IPA","IPA","64431","Alseis pickelii Pilg. & Schmale","Rubiaceae","Alseis","pickelii","Pilg. & Schmale","Barbosa, M.R.","2006-11-27T00:00:00.000+0000",NA,"858",NA,"Ferreira, M.C.; Jost, T.; Jost, T.",1996,1,31,"brazil","bahia","conde","Fazenda do Bu, Mata da Maré.",-37.717778,-12.035278,"Árvore ca. 8 m; folhas cartáceas glabras; flores verdes.","BRA:IPA:IPA:0000064431",NA,"Alseis pickelii Pilg. & Schmale",NA,NA,NA,3622,"Conde",2908606,-37.67734,-11.827324,"BAHIA","BA","Bahia",-41.73007713,-12.47331113,-12.035278,-37.717778
"135",NA,"Universidade Federal de Sergipe, UFS","ASE","6454","Alseis pickelii Pilg. & Schmale","Rubiaceae","Alseis","pickelii","Pilg. & Schmale","Viana, G","2015-06-09T00:00:00.000+0000",NA,"6454",NA,"Viana, G; Magalhães, SG",1996,3,23,"brazil","sergipe","tomar do geru","Faz. Mãe Luzia",-37.840556,-11.373333,"Árvore com ca. de 8m de altura. Frutos maduros marrons.; Mata Atlântica","BRA:UFS:ASE:0000006454",NA,"Alseis pickelii Pilg. & Schmale",NA,NA,NA,3693,"Tomar do Geru",2807501,-37.880927,-11.362308,"SERGIPE","SE","Sergipe",-37.44606645,-10.59088956,-11.373333,-37.840556
"136",NA,"Universidade Federal de Sergipe, UFS","ASE","6691","Alseis pickelii Pilg. & Schmale","Rubiaceae","Alseis","pickelii","Pilg. & Schmale","Barbosa, MR","2010-07-05T00:00:00.000+0000",NA,"942",NA,"Landim, M",1996,6,20,"brazil","sergipe","santa luzia do itanhy","Mata do Crasto",-37.425861,-11.385528,"Árvore. 14.5. m. Pêlos urticantes na base das folhas e na nervura central da face inferior. Casca com ritidomas.; Árvore. 14.5. m. Pêlos urticantes na base das folhas e na nervura central da face inferior. Casca com ritidomas.; Mata","BRA:UFS:ASE:0000006691",NA,"Alseis pickelii Pilg. & Schmale",NA,NA,NA,3694,"Santa Luzia do Itanhy",2806305,-37.507024,-11.361095,"SERGIPE","SE","Sergipe",-37.44606645,-10.59088956,-11.385528,-37.425861
"137","2014-07-22T13:12:13.000+0000","JBRJ","RB","RB00333539","Alseis pickelii Pilg. & Schmale","Rubiaceae","Alseis","pickelii","Pilg. & Schmale",NA,NA,NA,"1076",NA,"M.Clara Ferreira; T. Jost",1996,9,13,"brazil","bahia","conde","Fazenda do Bu Mata da Maré.",-37.728611,-12.035278,"Arvore de aproximadamente 10,0m, folha opostas, cartáceas, dicolores, glabras, frutos jovens marrons em espigas","urn:catalog:JBRJ:RB:333539",NA,"Alseis pickelii Pilg. & Schmale",NA,NA,NA,3622,"Conde",2908606,-37.67734,-11.827324,"BAHIA","BA","Bahia",-41.73007713,-12.47331113,-12.035278,-37.728611
"138",NA,"UEFS","HUEFS","65423","Alseis pickelii Pilg. & Schmale","Rubiaceae","Alseis","pickelii","Pilg. & Schmale","J.G.Jardim & E.B.Souza","2012-06-01T00:00:00.000+0000",NA,"9",NA,"Jesus, N.G.",1996,11,12,"brazil","bahia","entre rios","RPPN Fazenda Lontra/Saudade.",-40.215556,-12.915278,"Floresta subperenifolia.","BRA:UEFS:HUEFS:0000065423",NA,"Alseis pickelii Pilg. & Schmale",NA,NA,NA,3584,"Entre Rios",2910503,-38.042945,-12.073204,"BAHIA","BA","Bahia",-41.73007713,-12.47331113,-12.915278,-40.215556
"139",NA,"UFPB","JPB","23437","Alseis pickelii Pilg. & Schmale","Rubiaceae","Alseis","pickelii","Pilg. & Schmale",NA,NA,NA,"1421",NA,"Barbosa, MR",1995,1,18,"brazil","paraiba","joao pessoa","Campus I da UFPB, Remanescente de Mata.",0,0,"Árvore pequena, inflorescência no apice dos ramos, flores amarelo-esverdeadas, perfumadas. ; DE","BRA:UFPB:JPB:0000023437",NA,"Alseis pickelii Pilg. & Schmale",NA,NA,NA,4512,"João Pessoa",2507507,-34.869897,-7.1651,"PARAIBA","PB","Paraíba",-36.87254734,-7.14256856,-7.1651,-34.869897
"140",NA,"Universidade Federal do Ceará, UFC","EAC","48253","Alseis pickelii Pilg. & Schmale","Rubiaceae","Alseis","pickelii","Pilg. & Schmale","Barbosa, M.R.","2010-07-05T00:00:00.000+0000",NA,"338",NA,"Souza, M.F.L.",1995,5,3,"brazil","sergipe","santa luzia do itanhy","Mata do Crasto, borda da mata",0,0,"Árvore, 6m, folha oposta cruzada, fruto imaturo de cor marrom (deiscente); Mata","BRA:UFC:EAC:0000048253",NA,"Alseis pickelii Pilg. & Schmale",NA,NA,NA,3694,"Santa Luzia do Itanhy",2806305,-37.507024,-11.361095,"SERGIPE","SE","Sergipe",-37.44606645,-10.59088956,-11.361095,-37.507024
"141","2017-10-04T12:29:41.000+0000","JBRJ","RB","RB00420694","Alseis pickelii Pilg. & Schmale","Rubiaceae","Alseis","pickelii","Pilg. & Schmale","Mario Gomes",NA,NA,"131",NA,"P. R. Farág; H. C. de Lima",1995,7,11,"brazil","rio de janeiro","cabo frio","Mata do centrinho, estrada para lixeira.",NA,NA,"Árvore ca. 8 m de altura. Folhas levemente discolores e flores amarelas.","urn:catalog:JBRJ:RB:420694",NA,"Alseis pickelii Pilg. & Schmale",NA,NA,NA,1449,"Cabo Frio",3300704,-42.058216,-22.716047,"RIO DE JANEIRO","RJ","Rio de Janeiro",-42.66135386,-22.19491892,-22.716047,-42.058216
"142",NA,"Universidade Federal da Bahia (UFBA)","ALCB","62472","Alseis pickelii Pilg. & Schmale","Rubiaceae","Alseis","pickelii","Pilg. & Schmale","Jardim, J","2011-12-01T00:00:00.000+0000",NA,"03",NA,"Pereira, A; et al.",1995,12,14,"brazil","bahia","conde","Fazenda do Bu. Mata da Maré.",-37.725,-12.040833,"Com ca. de 10m de altura; folhas novas, membranáceas, racemos terminais; flores cremes, filetes muito longos.; Floresta Ombrófila Aberta.","BRA:UFBA:ALCB:0000062472",NA,"Alseis pickelii Pilg. & Schmale",NA,NA,NA,3622,"Conde",2908606,-37.67734,-11.827324,"BAHIA","BA","Bahia",-41.73007713,-12.47331113,-12.040833,-37.725
"143",NA,"UFERSA","MOSS","8741","Alseis pickelii Pilg. & Schmale","Rubiaceae","Alseis","pickelii","Pilg. & Schmale",NA,NA,NA,"2878",NA,"Lyra-Lemos, R.P. de",1994,1,14,"brazil","alagoas","maceio","Fazenda Bamburral.",NA,NA,"arbusto ramificado, em floração; coletado em tabuleira, borda da mata atlântica, área de influência do Rio Pratagy; flor cremes; frutos deiscentes, ferrugíneos, maduros.","BRA:UFERSA:MOSS:0000008741",NA,"Alseis pickelii Pilg. & Schmale",NA,NA,NA,3998,"Maceió",2704302,-35.710579,-9.523014,"ALAGOAS","AL","Alagoas",-36.62319562,-9.51555361,-9.523014,-35.710579
"144",NA,"Universidade Federal Rural de Pernambuco, UFRPE","HST","16956","Alseis pickelii Pilg. & Schmale","Rubiaceae","Alseis","pickelii","Pilg. & Schmale","J.G.Jardim","2010-01-01T00:00:00.000+0000",NA,"s.n.",NA,"A.M.Miranda",1994,3,12,"brazil","pernambuco","maraial","próximo ao rio Pirangi",NA,NA,"Árvore ca. 5,0 m alt.; restos florais; frutos maduros secos.","BRA:UFRPE:HST:0000016956",NA,"Alseis pickelii Pilg. & Schmale",NA,NA,NA,4123,"Maraial",2609204,-35.762307,-8.834052,"PERNAMBUCO","PE","Pernambuco",-37.99888227,-8.32604424,-8.834052,-35.762307
"145",NA,"IPA","IPA","56288","Alseis pickelii Pilg. & Schmale","Rubiaceae","Alseis","pickelii","Pilg. & Schmale","Barbosa, M.R.","2006-11-27T00:00:00.000+0000",NA,"253",NA,"Martins, M.L.L.",1994,5,29,"brazil","rio grande do norte","tibau do sul","Santuário Ecológico de Pipa, praia de Pipa.",0,0,"Árvore ca. 6m; frutos secos.","BRA:IPA:IPA:0000056288",NA,"Alseis pickelii Pilg. & Schmale",NA,NA,NA,4814,"Tibau do Sul",2414209,-35.100328,-6.241321,"RIO GRANDE DO NORTE","RN","Rio Grande do Norte",-36.68216571,-5.84698535,-6.241321,-35.100328
"146",NA,"UFPB","JPB","23303","Alseis pickelii Pilg. & Schmale","Rubiaceae","Alseis","pickelii","Pilg. & Schmale",NA,NA,NA,"15",NA,"Gadelha Neto, PC",1993,5,3,"brazil","paraiba","joao pessoa","Campus I da UFPB",0,0,"Arbórea, flor branca. ; DE","BRA:UFPB:JPB:0000023303",NA,"Alseis pickelii Pilg. & Schmale",NA,NA,NA,4512,"João Pessoa",2507507,-34.869897,-7.1651,"PARAIBA","PB","Paraíba",-36.87254734,-7.14256856,-7.1651,-34.869897
"147",NA,"UFPB","JPB","19942","Alseis pickelii Pilg. & Schmale","Rubiaceae","Alseis","pickelii","Pilg. & Schmale",NA,NA,NA,"1089",NA,"Moura, OT",1993,9,4,"brazil","paraiba","joao pessoa","Mangabeira, Próximo cabeceira do Rio do Cabelo. Terrestre.",0,0,"Arbustivo; flor amarela. ; DE","BRA:UFPB:JPB:0000019942",NA,"Alseis pickelii Pilg. & Schmale",NA,NA,NA,4512,"João Pessoa",2507507,-34.869897,-7.1651,"PARAIBA","PB","Paraíba",-36.87254734,-7.14256856,-7.1651,-34.869897
"148",NA,"Universidade Federal de Sergipe, UFS","ASE","5488","Alseis pickelii Pilg. & Schmale","Rubiaceae","Alseis","pickelii","Pilg. & Schmale","Barbosa, MR","2010-07-05T00:00:00.000+0000",NA,"4343",NA,"André M. Carvalho; S.C.Santana; Jomar G. Jardim; J. Delabie; J. Argol",1993,10,5,"brazil","sergipe","santa luzia do itanhy","Povoado do Castro, Ca. 2 Km na estrada Crasto para Sta. Luzia do itanhi",-37.448333,-11.350833,"Árvore. 8. m. Folhas discolores com face inferior mais clara. Frutos castanhos.; Árvore. 8. m. Folhas discolores com face inferior mais clara. Frutos castanhos.; Mata Costeira, restinga arbórea intercalada com coqueiral, Várzea e Camp","BRA:UFS:ASE:0000005488",NA,"Alseis pickelii Pilg. & Schmale",NA,NA,NA,3694,"Santa Luzia do Itanhy",2806305,-37.507024,-11.361095,"SERGIPE","SE","Sergipe",-37.44606645,-10.59088956,-11.350833,-37.448333
"149","2017-10-04T12:15:55.000+0000","JBRJ","RB","RB00333544","Alseis pickelii Pilg. & Schmale","Rubiaceae","Alseis","pickelii","Pilg. & Schmale","Mario",NA,NA,"3011",NA,"C.Farney; J.C.Gomes",1992,1,29,"brazil","sergipe","santo amaro das brotas","Localidade de Aldeia- Matas remanescentes prox. as Poços de Petróleo.",NA,NA,"Arvoreta, +/- 6m, folhas verdes, discolores, inflorescencia c/ flores e raque verdes, frutos passados castanhos","urn:catalog:JBRJ:RB:333544",NA,"Alseis pickelii Pilg. & Schmale",NA,NA,NA,3775,"Santo Amaro das Brotas",2806602,-36.979729,-10.770663,"SERGIPE","SE","Sergipe",-37.44606645,-10.59088956,-10.770663,-36.979729
"150",NA,"UFPB","JPB","19619","Alseis pickelii Pilg. & Schmale","Rubiaceae","Alseis","pickelii","Pilg. & Schmale","Barbosa, MR","1993-02-01T00:00:00.000+0000",NA,"920",NA,"Agra, MF; Pereira, MG",1992,6,26,"brazil","paraiba","cuite","Terrestre.",0,0,NA,"BRA:UFPB:JPB:0000019619",NA,"Alseis pickelii Pilg. & Schmale",NA,NA,NA,4719,"Cuité",2505105,-36.077378,-6.54871,"PARAIBA","PB","Paraíba",-36.87254734,-7.14256856,-6.54871,-36.077378
"151","2017-10-19T03:33:56.000+0000","JBRJ","RB","RB00333572","Alseis pickelii Pilg. & Schmale","Rubiaceae","Alseis","pickelii","Pilg. & Schmale","C. Farney","1991-01-01T00:00:00.000+0000",NA,"2763",NA,"C. Farney; et al",1991,6,21,"brazil","sergipe","santo amaro das brotas","Sape-Faz Arauari. Mata primária próxima a torre da embratel.",NA,NA,"Árvore, ca. 12m, folhas verdes discolores, tronco de casca lisa, frutos imaturos castanhos.","urn:catalog:JBRJ:RB:333572",NA,"Alseis pickelii Pilg. & Schmale",NA,NA,NA,3775,"Santo Amaro das Brotas",2806602,-36.979729,-10.770663,"SERGIPE","SE","Sergipe",-37.44606645,-10.59088956,-10.770663,-36.979729
"152",NA,"UFRPE","PEUFR","12009","Alseis pickelii Pilg. & Schmale","Rubiaceae","Alseis","pickelii","Pilg. & Schmale",NA,NA,NA,NA,NA,"A. Trindade",1990,2,20,"brazil","rio grande do norte","natal","Parque Estadual das Dunas",NA,NA,"Árvore mais ou menos 10m de altura com 50cm. Folhas longas, espatuladas com lobos lisos.","BRA:UFRPE:PEUFR:0000012009",NA,"Alseis pickelii Pilg. & Schmale",NA,NA,NA,4933,"Natal",2408102,-35.228798,-5.803114,"RIO GRANDE DO NORTE","RN","Rio Grande do Norte",-36.68216571,-5.84698535,-5.803114,-35.228798
"153",NA,"UFPB","JPB","15953","Alseis pickelii Pilg. & Schmale","Rubiaceae","Alseis","pickelii","Pilg. & Schmale",NA,NA,NA,"231",NA,"Moura, OT",1986,10,1,"brazil","paraiba","joao pessoa","Campus I da UFPB, Solo de terra preta.",0,0,"Árvore, flor alva. ; DE","BRA:UFPB:JPB:0000015953",NA,"Alseis pickelii Pilg. & Schmale",NA,NA,NA,4512,"João Pessoa",2507507,-34.869897,-7.1651,"PARAIBA","PB","Paraíba",-36.87254734,-7.14256856,-7.1651,-34.869897
"154",NA,"IPA","IPA","44365","Alseis pickelii Pilg. & Schmale","Rubiaceae","Alseis","pickelii","Pilg. & Schmale","Rita Pereira","1985-06-20T00:00:00.000+0000",NA,"IPA-44365",NA,"Lopes, R.J.V.",1985,5,16,"brazil","pernambuco","recife","Jardim Botânico do Curado",0,0,NA,"BRA:IPA:IPA:0000044365",NA,"Alseis pickelii Pilg. & Schmale",NA,NA,NA,4261,"Recife",2611606,-34.933243,-8.03913,"PERNAMBUCO","PE","Pernambuco",-37.99888227,-8.32604424,-8.03913,-34.933243
"155",NA,"UFPB","JPB","56689","Alseis pickelii Pilg. & Schmale","Rubiaceae","Alseis","pickelii","Pilg. & Schmale","Pereira, R","1984-12-18T00:00:00.000+0000",NA,"JPB56689",NA,"Alonso, C; Maciel, S",1984,1,17,"brazil","paraiba","joao pessoa","Campus I da UFPB",-34.848611,-7.1375,"Fruto seco e deiscente arbusto.","BRA:UFPB:JPB:0000056689",NA,"Alseis pickelii Pilg. & Schmale",NA,NA,NA,4512,"João Pessoa",2507507,-34.869897,-7.1651,"PARAIBA","PB","Paraíba",-36.87254734,-7.14256856,-7.1375,-34.848611
"156",NA,"UFERSA","MOSS","10411","Alseis pickelii Pilg. & Schmale","Rubiaceae","Alseis","pickelii","Pilg. & Schmale","Jardim, J.G.","2009-09-01T00:00:00.000+0000",NA,"s.n.",NA,"Fernandes, A.G.",1984,10,11,"brazil","rio grande do norte",NA,"Rodovia Natal/João Pessoa.",NA,NA,"arvoreta.","BRA:UFERSA:MOSS:0000010411",NA,"Alseis pickelii Pilg. & Schmale",NA,NA,NA,NA,NA,NA,NA,NA,NA,NA,"Rio Grande do Norte",-36.68216571,-5.84698535,-5.84698535,-36.68216571
"157",NA,"IMA","MAC","4343","Alseis pickelii Pilg. & Schmale","Rubiaceae","Alseis","pickelii","Pilg. & Schmale","M.R.V.Barbosa","2008-01-01T00:00:00.000+0000",NA,"479",NA,"M.N.Rodrigues; R.P.Lyra-Lemos",1982,3,9,"brazil","alagoas","barra de santo antonio","Mata dos Morros, degradada, Beira da estrada AL-101, solo argilo-arenoso.",-35.554842,-9.372017,"Árvore; Frutos marrons; Mata Atlântica","BRA:IMA:MAC:0000004343",NA,"Alseis pickelii Pilg. & Schmale",NA,NA,NA,4021,"Barra de Santo Antônio",2700508,-35.560855,-9.379086,"ALAGOAS","AL","Alagoas",-36.62319562,-9.51555361,-9.372017,-35.554842
"158","2014-07-22T13:12:17.000+0000","JBRJ","RB","RB00333559","Alseis pickelii Pilg. & Schmale","Rubiaceae","Alseis","pickelii","Pilg. & Schmale","Mario Gomes",NA,NA,"3730",NA,"J.P.P. Carauta; et al",1981,4,28,"brazil","rio de janeiro","rio de janeiro","Santo Antônio de Pádua, Humaitá, prope estrada para Ibitiguaçu.",NA,NA,"Arbusto na orla da floresta, ramos com a casca levemente vinácea.","urn:catalog:JBRJ:RB:333559",NA,"Alseis pickelii Pilg. & Schmale",NA,NA,NA,1360,"Rio de Janeiro",3304557,-43.45231,-22.924471,"RIO DE JANEIRO","RJ","Rio de Janeiro",-42.66135386,-22.19491892,-22.924471,-43.45231
"159","2014-07-22T13:12:17.000+0000","JBRJ","RB","RB00333555","Alseis pickelii Pilg. & Schmale","Rubiaceae","Alseis","pickelii","Pilg. & Schmale","Mario Gomes",NA,NA,"1722",NA,"V.F. Ferreira",1981,5,10,"brazil","espirito santo","cachoeiro de itapemirim","Sítio Caramarca, em frente ao BNH.",NA,NA,"Arvore, heliófila, fruto jovem castanho","urn:catalog:JBRJ:RB:333555",NA,"Alseis pickelii Pilg. & Schmale",NA,NA,NA,2161,"Cachoeiro de Itapemirim",3201209,-41.188735,-20.769195,"ESPIRITO SANTO","ES","Espírito Santo",-40.66114896,-19.64267182,-20.769195,-41.188735
"160",NA,"F","Botany",NA,"Alseis pickelii Pilg. & Schmale","Rubiaceae","Alseis","pickelii","Pilg. & Schmale","B. M. Boom","1984-01-01T00:00:00.000+0000",NA,"1198",NA,"B. M. Boom",1981,6,14,"brazil","bahia",NA,NA,-42,-11,NA,"87e8d223-4663-4010-8553-17f5af4b4a3e",NA,"Alseis pickelii Pilg. & Schmale",NA,NA,NA,NA,NA,NA,NA,NA,NA,NA,"Bahia",-41.73007713,-12.47331113,-11,-42
"161","2008-05-27T22:02:00.000+0000","MO","MO","3090886","Alseis pickelii Pilg. & Schmale","Rubiaceae","Alseis","pickelii","Pilg. & Schmale","B.Boom","1984-01-01T00:00:00.000+0000",NA,"Boom 1198",NA,"Brian M. Boom",1981,6,14,"brazil","bahia",NA,"Municipality of Iraquara, Fazenda Pratinha, margin of Rio Santo Antonio, ca. 16km SSE of Iraquara; caatinga",NA,NA,NA,"urn:catalog:MO:Tropicos:3090886","http://www.tropicos.org/Specimen/3090886","Alseis pickelii Pilg. & Schmale",NA,NA,NA,NA,NA,NA,NA,NA,NA,NA,"Bahia",-41.73007713,-12.47331113,-12.47331113,-41.73007713
"162","2014-07-22T13:12:18.000+0000","JBRJ","RB","RB00333564","Alseis pickelii Pilg. & Schmale","Rubiaceae","Alseis","pickelii","Pilg. & Schmale","Mario Gomes",NA,NA,"3816",NA,"J.P.P. Carauta; et al",1981,8,25,"brazil","rio de janeiro","rio de janeiro","Santo Antônio de ádua, estrada Pádua-Miracema. RJ 116 próx. km 232.",NA,NA,"Árvore de pequeno porte, heliófila, viária, com frutos secos de cor marrom com formigas.","urn:catalog:JBRJ:RB:333564",NA,"Alseis pickelii Pilg. & Schmale",NA,NA,NA,1360,"Rio de Janeiro",3304557,-43.45231,-22.924471,"RIO DE JANEIRO","RJ","Rio de Janeiro",-42.66135386,-22.19491892,-22.924471,-43.45231
"163",NA,"IPA","IPA","44639","Alseis pickelii Pilg. & Schmale","Rubiaceae","Alseis","pickelii","Pilg. & Schmale","Andrade-Lima","1981-06-01T00:00:00.000+0000",NA,"IPA-44639",NA,"Ehrendorrfer, F.",1981,NA,NA,"brazil","pernambuco","recife","Dois Irmãos",0,0,NA,"BRA:IPA:IPA:0000044639",NA,"Alseis pickelii Pilg. & Schmale",NA,NA,NA,4261,"Recife",2611606,-34.933243,-8.03913,"PERNAMBUCO","PE","Pernambuco",-37.99888227,-8.32604424,-8.03913,-34.933243
"164",NA,"IPA","IPA","46366","Alseis pickelii Pilg. & Schmale","Rubiaceae","Alseis","pickelii","Pilg. & Schmale","Barbosa, M.R.","2006-11-27T00:00:00.000+0000",NA,"IPA-46366",NA,"Andrade-Lima; Lima, V.C.; Bocage, A.; Rita Pereira; Alberto, M.; Lima, V.C.; Bocage, A.; Rita Pereira; Alberto, M.",1980,8,8,"brazil","pernambuco","sao lourenco da mata","Mata do Toró",0,0,NA,"BRA:IPA:IPA:0000046366",NA,"Alseis pickelii Pilg. & Schmale",NA,NA,NA,4263,"São Lourenço da Mata",2613701,-35.10282,-8.023366,"PERNAMBUCO","PE","Pernambuco",-37.99888227,-8.32604424,-8.023366,-35.10282
"165","2017-10-10T19:48:36.000+0000","JBRJ","RB","RB00652652","Alseis pickelii Pilg. & Schmale","Rubiaceae","Alseis","pickelii","Pilg. & Schmale","M.P.M.de Lima",NA,NA,"250",NA,"Walmor da Fonseca",1980,8,19,"brazil","bahia","caldeirao grande",NA,-40.333333,-11.066667,"Flor infero-ovariada. Inflorescência com todas as flores dirigidas para um lado. Frequente.","urn:catalog:JBRJ:RB:652652",NA,"Alseis pickelii Pilg. & Schmale",NA,NA,NA,3735,"Caldeirão Grande",2905503,-40.221016,-11.042832,"BAHIA","BA","Bahia",-41.73007713,-12.47331113,-11.066667,-40.333333
"166",NA,"UFERSA","MOSS","2173","Alseis pickelii Pilg. & Schmale","Rubiaceae","Alseis","pickelii","Pilg. & Schmale",NA,NA,NA,"211",NA,"Projeto Parque das Dunas",1980,10,25,"brazil","rio grande do norte","natal",NA,-35.216667,-5.8,"árvore; coletada no interior de mata; n.v. pau-candeia.","BRA:UFERSA:MOSS:0000002173",NA,"Alseis pickelii Pilg. & Schmale",NA,NA,NA,4933,"Natal",2408102,-35.228798,-5.803114,"RIO GRANDE DO NORTE","RN","Rio Grande do Norte",-36.68216571,-5.84698535,-5.8,-35.216667
"167",NA,"IPA","IPA","46977","Alseis pickelii Pilg. & Schmale","Rubiaceae","Alseis","pickelii","Pilg. & Schmale","Barbosa, M.R.","2006-11-27T00:00:00.000+0000",NA,"809771",NA,"Andrade-Lima; et al.; et al.",1980,10,28,"brazil","alagoas",NA,NA,0,0,NA,"BRA:IPA:IPA:0000046977",NA,"Alseis pickelii Pilg. & Schmale",NA,NA,NA,NA,NA,NA,NA,NA,NA,NA,"Alagoas",-36.62319562,-9.51555361,-9.51555361,-36.62319562
"168",NA,"IPA","IPA","47112","Alseis pickelii Pilg. & Schmale","Rubiaceae","Alseis","pickelii","Pilg. & Schmale","Barbosa, M.R.","2006-11-27T00:00:00.000+0000",NA,"809789",NA,"Andrade-Lima; et al.; et al.",1980,10,28,"brazil","alagoas",NA,NA,0,0,NA,"BRA:IPA:IPA:0000047112",NA,"Alseis pickelii Pilg. & Schmale",NA,NA,NA,NA,NA,NA,NA,NA,NA,NA,"Alagoas",-36.62319562,-9.51555361,-9.51555361,-36.62319562
"169","2014-07-22T13:12:16.000+0000","JBRJ","RB","RB00333554","Alseis pickelii Pilg. & Schmale","Rubiaceae","Alseis","pickelii","Pilg. & Schmale","Mario Gomes",NA,NA,"16",NA,"A.M. Lino",1972,3,7,"brazil","espirito santo","espirito santo","Reserva Florestal de Linhares C.V.R.D. - Próximo Estrada 154 talhão 507. Reserva Florestal de Linhares",NA,NA,"Árvore com ca. 20mts de altura, fusta com ca. 9 mts de altura crescendo em árvore de tabuleiro. Botão floral de cor cinza esverdeado.","urn:catalog:JBRJ:RB:333554",NA,"Alseis pickelii Pilg. & Schmale",NA,NA,NA,NA,NA,NA,NA,NA,NA,NA,"Espírito Santo",-40.66114896,-19.64267182,NA,NA
"170",NA,"Universidade Federal Rural de Pernambuco, UFRPE","HST","3772","Alseis pickelii Pilg. & Schmale","Rubiaceae","Alseis","pickelii","Pilg. & Schmale","J.Jardim","2012-06-01T00:00:00.000+0000",NA,"12744",NA,"D.P.Lima",1971,11,24,"brazil","bahia","santa cruz de cabralia","Mata da Fazenda Embiruçú",NA,NA,"Árvore de grande porte ca. 13 m alt. e 20 cm de diâmetro; casca pouco escamosa cizenta; flores amarelo-claro, com perfume agradável.","BRA:UFRPE:HST:0000003772",NA,"Alseis pickelii Pilg. & Schmale",NA,NA,NA,NA,NA,NA,NA,NA,NA,NA,"Bahia",-41.73007713,-12.47331113,NA,NA
"171",NA,"US","Botany","2869067","Alseis pickelii Pilg. & Schmale","Rubiaceae","Alseis","pickelii","Pilg. & Schmale",NA,NA,NA,"910",NA,"T. S. Santos",1970,7,6,"brazil","bahia",NA,"Ba. Aunapolis, Itabela, Itamaraju",NA,NA,NA,"http://n2t.net/ark:/65665/37df8b494-6bde-461d-b86b-32065c8d8ef2",NA,"Alseis pickelii Pilg. & Schmale",NA,NA,NA,NA,NA,NA,NA,NA,NA,NA,"Bahia",-41.73007713,-12.47331113,-12.47331113,-41.73007713
"172",NA,"US","Botany","3071430","Alseis pickelii Pilg. & Schmale","Rubiaceae","Alseis","pickelii","Pilg. & Schmale",NA,NA,NA,"484",NA,"T. S. Santos",1969,11,11,"brazil","bahia",NA,"Regiao Cacaueira da Bahia. BA. Municipio de Una. Faz. Sao Rafael. Mata",NA,NA,NA,"http://n2t.net/ark:/65665/3266d7e0a-f92c-4864-8896-90fec5e2759b",NA,"Alseis pickelii Pilg. & Schmale",NA,NA,NA,NA,NA,NA,NA,NA,NA,NA,"Bahia",-41.73007713,-12.47331113,-12.47331113,-41.73007713
"173",NA,"IPA","IPA","14828","Alseis pickelii Pilg. & Schmale","Rubiaceae","Alseis","pickelii","Pilg. & Schmale","Giulietti, A.M.","1968-02-01T00:00:00.000+0000",NA,"59",NA,"Giulietti, A.M.",1968,2,9,"brazil","pernambuco","ponta de pedra","Córrego do Bispo.",0,0,"Árvore 5-6m, apresentando apenas folhas jovens na época da floração; flores alvas.","BRA:IPA:IPA:0000014828",NA,"Alseis pickelii Pilg. & Schmale",NA,NA,NA,NA,NA,NA,NA,NA,NA,NA,"Pernambuco",-37.99888227,-8.32604424,NA,NA
"174",NA,"IPA","IPA","74914","Alseis pickelii Pilg. & Schmale","Rubiaceae","Alseis","pickelii","Pilg. & Schmale","Cano, O.","2008-08-29T00:00:00.000+0000",NA,"22839",NA,"Monteiro, M.T.",1968,11,4,"brazil","alagoas","sao miguel dos campos","Fábrica Sebastião Ferreira.",0,0,"Flôres pequenas, Esbranquiçadas,perfume agradável.","BRA:IPA:IPA:0000074914",NA,"Alseis pickelii Pilg. & Schmale",NA,NA,NA,3948,"São Miguel dos Campos",2708600,-36.097101,-9.766314,"ALAGOAS","AL","Alagoas",-36.62319562,-9.51555361,-9.766314,-36.097101
"175",NA,"UFPE","UFP","3653","Alseis pickelii Pilg. & Schmale","Rubiaceae","Alseis","pickelii","Pilg. & Schmale","Barbosa","2006-01-01T00:00:00.000+0000",NA,"104",NA,"Costa, J.T.",1967,9,1,"brazil","paraiba","pedra de fogo",NA,0,0,"HABITAT:Cerrrado.; DESC:Arbusto.;","BRA:UFPE:UFP:0000003653",NA,"Alseis pickelii Pilg. & Schmale",NA,NA,NA,NA,NA,NA,NA,NA,NA,NA,"Paraíba",-36.87254734,-7.14256856,NA,NA
"176",NA,"IPA","IPA","75365","Alseis pickelii Pilg. & Schmale","Rubiaceae","Alseis","pickelii","Pilg. & Schmale","Mercês, P.F.F. das","2011-01-17T00:00:00.000+0000",NA,"21849",NA,"Monteiro, M.T.",1967,12,17,"brazil","alagoas","sao miguel dos campos","Mata do Sinimbu",-36.16,-9.796667,"Flores amarelo-claro, com perfume agradável.","BRA:IPA:IPA:0000075365",NA,"Alseis pickelii Pilg. & Schmale",NA,NA,NA,3948,"São Miguel dos Campos",2708600,-36.097101,-9.766314,"ALAGOAS","AL","Alagoas",-36.62319562,-9.51555361,-9.796667,-36.16
"177","2014-07-07T21:50:25.000+0000","JBRJ","RB","RB00652822","Alseis pickelii Pilg. & Schmale","Rubiaceae","Alseis","pickelii","Pilg. & Schmale","Mario Gomes",NA,NA,"2299",NA,"R.P.Belém; R.S.Pinheiro",1966,5,25,"brazil","bahia",NA,"Juçaré. Plantação de cacau.",NA,NA,"Árvore de 5mX12cm diâm.;frutos marrons. (Herbario Universidade de Brasília-Plantas do Brasil-Bahia).","urn:catalog:JBRJ:RB:652822",NA,"Alseis pickelii Pilg. & Schmale",NA,NA,NA,NA,NA,NA,NA,NA,NA,NA,"Bahia",-41.73007713,-12.47331113,-12.47331113,-41.73007713
"178","2017-10-10T19:48:41.000+0000","JBRJ","RB","RB00652778","Alseis pickelii Pilg. & Schmale","Rubiaceae","Alseis","pickelii","Pilg. & Schmale","M.V.L.Pereira Moure",NA,NA,"2572",NA,"R.P.Belém; R.S.Pinheiro",1966,7,15,"brazil","bahia","santa cruz de cabralia",NA,NA,NA,"Árvore de 15m X 12cm diâm; frutos marrons. Coleção de Madeira. (Herbário Universidade de Brasília - Plantas do Brasil- BAHIA).","urn:catalog:JBRJ:RB:652778",NA,"Alseis pickelii Pilg. & Schmale",NA,NA,NA,NA,NA,NA,NA,NA,NA,NA,"Bahia",-41.73007713,-12.47331113,NA,NA
"179","2015-09-04T19:52:46.000+0000","MNHN","P","P00118049","Alseis pickelii Pilg. & Schmale","Rubiaceae","Alseis","pickelii","Pilg. & Schmale",NA,NA,NA,NA,2572,"Belém, R.P.|Pinheiro, R.S.",1966,7,15,"brazil",NA,NA,NA,NA,NA,NA,"http://coldb.mnhn.fr/catalognumber/mnhn/p/p00118049",NA,"Alseis pickelii Pilg. & Schmale",NA,NA,NA,NA,NA,NA,NA,NA,NA,NA,NA,NA,NA,NA,NA
"180",NA,"UnB","UB","185995","Alseis pickelii Pilg. & Schmale","Rubiaceae","Alseis","pickelii","Pilg. & Schmale","Moura, MVLP","2001-10-01T00:00:00.000+0000",NA,"2860",NA,"Belém, RP; Pinheiro, RS",1966,11,7,"brazil","bahia","santa cruz cabralia",NA,0,0,"Árvore de 7m x 15cm de diâmetro; flores cremes, estames amarelos.; Mata costeira.","BRA:UnB:UB:0000185995",NA,"Alseis pickelii Pilg. & Schmale",NA,NA,NA,3034,"Santa Cruz Cabrália",2927705,-39.203176,-16.228954,"BAHIA","BA","Bahia",-41.73007713,-12.47331113,-16.228954,-39.203176
