"","modified","institutionCode","collectionCode","catalogNumber","scientificName","family","genus","specificEpithet","scientificNameAuthorship","identifiedBy","dateIdentified","typeStatus","recordNumber","fieldNumber","recordedBy","year","month","day","country","stateProvince","municipality","locality","decimalLongitude","decimalLatitude","occurrenceRemarks","occurrenceID","bibliographicCitation","acceptedNameUsage","identificationQualifier","infraspecificEpithet","comments"
"269",NA,"US","Botany","3298163","Theobroma grandiflorum Schum.","Malvaceae","Theobroma","grandiflorum","Schum.","Dorr, L. J., (BOT), Smithsonian Institution - National Museum of Natural History (UNITED STATES)",NA,NA,"1669",NA,"D. C. Daly, R. Callejas, M. G. Silva, E. L. Taylor, C. S. Rosário & M. R. Santos",NA,NA,NA,"Brazil","Pará",NA,"Near Rio Itacaiunas: Approx. 80 km from Marabá; 37 km S on PA 150 and 50 km WNW on service road. Clearing site for railway construction.",NA,NA,NA,"http://n2t.net/ark:/65665/39a4edd86-0f70-4047-b1f0-f9762f7c237d",NA,"Theobroma grandiflorum Schum.",NA,NA,NA
"270","2015-02-06T00:00:00.000+0000","BR",NA,"BR0000013704896","Theobroma grandiflorum Schum.","Malvaceae","Theobroma","grandiflorum","Schum.",NA,NA,NA,"9467",NA,"Burchell W.J.",NA,NA,NA,"Brazil",NA,NA,NA,NA,NA,NA,"http://www.botanicalcollections.be/specimen/BR0000013704896",NA,"Theobroma grandiflorum Schum.",NA,NA,NA
"271",NA,"Comissão Executiva do Plano da Lavoura Cacaueira (CEPLAC)","CEPEC","56952","Theobroma grandiflorum Schum.","Malvaceae","Theobroma","grandiflorum","Schum.","C. L. Cristóbal",NA,NA,"262",NA,"S. C. de Sant'Ana",NA,NA,NA,"Brazil","Bahia","ILHÉUS","Quadra I' do CEPEC.",NA,NA,"Ambiente: Mata Higrofila. Habito: Árvore menor que 5m","BRA:CEPLAC:CEPEC:0000056952",NA,"Theobroma grandiflorum Schum.",NA,NA,NA
"273",NA,"UEPA","MFS","000923","Theobroma grandiflorum Schum.","Malvaceae","Theobroma","grandiflorum","Schum.",NA,NA,NA,"63",NA,"Pereira, A.S.S.",NA,NA,NA,"Brazil","Pará","Belém","Campus de pesquisa do Museu Paraense Emilio Goeldi.",-48.466711,-1.445414,"Árvore de 5m de altura. Fruto imaturo marrom.","BRA:UEPA:MFS:0000000923",NA,"Theobroma grandiflorum Schum.",NA,NA,NA
"275",NA,"MBM","MBM","100778","Theobroma grandiflorum Schum.","Malvaceae","Theobroma","grandiflorum","Schum.","Jangoux, J",NA,NA,"581",NA,"Jangoux, J; Bahia, RP",NA,NA,NA,"Brazil","Maranhão",NA,"Colônia Três Setubas",0,0,NA,"BRA:MBM:MBM:0000100778",NA,"Theobroma grandiflorum Schum.",NA,NA,NA
"277","2016-01-04T00:00:00.000+0000","K","Herbarium","K001213376","Theobroma grandiflorum Schum.","Malvaceae","Theobroma","grandiflorum","Schum.",NA,NA,NA,"9643",NA,"Glaziou, A.",NA,NA,NA,"Brazil",NA,"Rio de Janeiro","Cultivated at Rio Janeiro.",NA,NA,"Comm. M. Glaziou, Dec. 1878","http://specimens.kew.org/herbarium/K001213376",NA,"Theobroma grandiflorum Schum.",NA,NA,NA
