"","modified","institutionCode","collectionCode","catalogNumber","scientificName","family","genus","specificEpithet","scientificNameAuthorship","identifiedBy","dateIdentified","typeStatus","recordNumber","fieldNumber","recordedBy","year","month","day","country","stateProvince","municipality","locality","decimalLongitude","decimalLatitude","occurrenceRemarks","occurrenceID","bibliographicCitation","acceptedNameUsage","identificationQualifier","infraspecificEpithet","comments"
"1",NA,"MBML","MBML-HERBARIO","51452","Elvasia gigantifolia Fraga & Saavedra","Ochnaceae","Elvasia","gigantifolia","Fraga & Saavedra","C.N. Fraga/12-05-2017",NA,NA,"3720",NA,"C. N. de Fraga; F.R.M. Fraga, M.F.O. Silva",2016,12,12,"Brazil","Espírito Santo","Cariacica","São Paulo de Viana, na estrada para subida para o Ex. Condomínio Rural Cantinho do Céu",-40.5475,-20.295,"Mata Atlântica de Encosta. Arvore, ca. 10m. Folhas verde disoclores, face abaxial brilhosa e com nervuras paralelas. Flores com sépalas verdes, pétalas amarelo claro, estames amarelo escuro. Ginesceu verde com estilete verde claro","BRA:MBML:MBML-HERBARIO:0000051452",NA,"Elvasia gigantifolia Fraga & Saavedra",NA,NA,NA
"2","2017-10-17T18:24:51.000+0000","JBRJ","RB","RB00557332","Elvasia gigantifolia Fraga & Saavedra","Ochnaceae","Elvasia","gigantifolia","Fraga & Saavedra","A. P. Fontana","2009-01-17T00:00:00.000+0000",NA,"5823",NA,"A. P. Fontana; P. Labiak, P. B. Schwartsburd, R. C. Forzza, R. Goldenberg & C. N. Fraga",2009,1,17,"Brazil","Espírito Santo","Cariacica","Pau Amarelo, beira da estrada. Floresta Ombrófila Densa Montana. Reserva Biológica de Duas Bocas",NA,NA,"Arvoreta, ca. 5m. Frutos verdes.","urn:catalog:JBRJ:RB:557332",NA,"Elvasia gigantifolia Fraga & Saavedra",NA,NA,NA
"3",NA,"MBML","MBML-HERBARIO","35698","Elvasia gigantifolia Fraga & Saavedra","Ochnaceae","Elvasia","gigantifolia","Fraga & Saavedra","A. P. Fontana","2008-04-15T00:00:00.000+0000",NA,"4970",NA,"A. P. Fontana; L. Kollmann & K. A. Brahim",2008,4,15,"Brazil","Espírito Santo","Santa Leopoldina","Rio das Farinhas, propriedade da Sra. Maria Knak Ule. Mata, dossel 12m.",-40.608222,-20.110278,"Árvore, ca. 9m. Infl. com flores secas.","BRA:MBML:MBML-HERBARIO:0000035698",NA,"Elvasia gigantifolia Fraga & Saavedra",NA,NA,NA
"4",NA,"MBML","MBML-HERBARIO","40213","Elvasia gigantifolia Fraga & Saavedra","Ochnaceae","Elvasia","gigantifolia","Fraga & Saavedra","A.P. Fontana/2007",NA,NA,"2735",NA,"A. P. Fontana; K.A. Brahim",2007,1,27,"Brazil","Espírito Santo","Santa Leopoldina","Rio Bonito, propriedade do Sr. Valdomiro Plaster. Floresta Ombrófila Aberta, mata de encosta.",-40.612222,-20.060583,"Arvoreta ca 4m. Frutos verdes. Flores secas","BRA:MBML:MBML-HERBARIO:0000040213",NA,"Elvasia gigantifolia Fraga & Saavedra",NA,NA,NA
"5","2014-07-07T18:23:56.000+0000","JBRJ","RB","RB00542374","Elvasia gigantifolia Fraga & Saavedra","Ochnaceae","Elvasia","gigantifolia","Fraga & Saavedra","C.N. Fraga",NA,"ISOTYPE","560",NA,"Fraga, C.N.",1999,12,22,"Brazil","Espírito Santo","Cariacica","Condominio rural Cantinho do Céu, Pau Amarelo, divisa com a Reserva Duas Bocas.",NA,NA,"Árvore ca. 10 m de alt.folhas verdes, coriáceas, flores com pétalas e sépalas e estames amarelos, ovário vinho","urn:catalog:JBRJ:RB:542374",NA,"Elvasia gigantifolia Fraga & Saavedra",NA,NA,NA
