"","modified","institutionCode","collectionCode","catalogNumber","scientificName","identificationQualifier","family","genus","specificEpithet","infraspecificEpithet","scientificNameAuthorship","identifiedBy","dateIdentified","typeStatus","recordNumber","fieldNumber","recordedBy","year","month","day","country","stateProvince","municipality","locality","decimalLongitude","decimalLatitude","occurrenceRemarks","occurrenceID","bibliographicCitation","acceptedNameUsage","comments"
"346",NA,"UESC","UESC","5741","Cupania racemosa Radlk.",NA,"Sapindaceae","Cupania","racemosa",NA,"Radlk.",NA,NA,NA,"4193",NA,"Mattos-Silva L.A",2000,10,5,"Brazil","Bahia","Nova Viçosa",NA,-39.454167,-17.949167,"Restinga arbórea. Solo arenoso.; Árvore, 3,5 m de altura.","BRA:UESC:UESC:0000005741",NA,"Cupania racemosa Radlk.",NA
"347",NA,"UEFS","HUEFS","59889","Cupania racemosa Radlk.",NA,"Sapindaceae","Cupania","racemosa",NA,"Radlk.","R.Perdiz","2010-08-01T00:00:00.000+0000",NA,"4193",NA,"Mattos-Silva, L.A.",2000,10,5,"Brazil","Bahia","Nova Viçosa","Km 6 da Rodovia BA 001, trecho Nova Viçosa/Mucuri. Ramal à esquerda para o sítio Canto do Sabiá, em direção à praia. Restinga arbórea. Solo arenoso.",-39.454167,-17.949167,"Mata Atlântica","BRA:UEFS:HUEFS:0000059889",NA,"Cupania racemosa Radlk.",NA
"348",NA,"Universidade Federal da Bahia (UFBA)","ALCB","48595","Cupania racemosa Radlk.",NA,"Sapindaceae","Cupania","racemosa",NA,"Radlk.","Somner, GV","2009-06-01T00:00:00.000+0000",NA,"PL0738",NA,"Jesus, NG de; Santos, JB dos; Santana, I; Rodrigues, N",1999,1,30,"Brazil","Bahia","Entre Rios","Litoral Norte",-38.083333,-11.933333,"parcela 15, n° 785. Tronco de casca lisa, marrom-claro. Folhas compostas, imparipenadas, folíolos 5-7, alternas, semi-crassas, discolores.","BRA:UFBA:ALCB:0000048595",NA,"Cupania racemosa Radlk.",NA
"349",NA,"MBML","MBML-HERBARIO","10671","Cupania racemosa Radlk.",NA,"Sapindaceae","Cupania","racemosa",NA,"Radlk.","R. Perdiz/2011",NA,NA,"2640",NA,"L. Kollmann; E. Bausen & W. Pizziolo",1999,6,22,"Brazil","Espírito Santo","Santa Teresa","Dois Pinheiros",-40.59,-19.933333,"Mata de encosta. Arvoreto 13m.Dap 12cm.Fuste 10m. Frutos verdes.","BRA:MBML:MBML-HERBARIO:0000010671",NA,"Cupania racemosa Radlk.",NA
"350","2017-10-18T16:58:42.000+0000","JBRJ","RB","RB00452016","Cupania racemosa Radlk.",NA,"Sapindaceae","Cupania","racemosa",NA,"Radlk.","G.V.Somner","2004-03-15T00:00:00.000+0000",NA,"3918",NA,"C.Farney; T.F.Alves, R.C.Sá",1999,6,NA,"Brazil","Rio de Janeiro","Saquarema","Reserva Ecológica Estadual de Jacarepiá. Mata de Restinga. Reserva Ecológica Estadual de Jacarepiá",NA,NA,"Arvoreta; 5 m; folhas verdes, discolores; flores creme esverdeadas.","urn:catalog:JBRJ:RB:452016",NA,"Cupania racemosa Radlk.",NA
"351",NA,"USP","SPF","200789","Cupania racemosa Radlk.",NA,"Sapindaceae","Cupania","racemosa",NA,"Radlk.","Somner, GV","2009-03-15T00:00:00.000+0000",NA,"3918",NA,"Farney, C",1999,6,NA,"Brazil","Rio de Janeiro","Saquarema",NA,0,0,NA,"BRA:USP:SPF:0000200789",NA,"Cupania racemosa Radlk.",NA
"352","2017-10-18T17:59:48.000+0000","JBRJ","RB","RB00443306","Cupania racemosa Radlk.",NA,"Sapindaceae","Cupania","racemosa",NA,"Radlk.","G.V.Somner","2007-11-23T00:00:00.000+0000",NA,"786",NA,"C.Luchiari; et al.",1999,7,16,"Brazil","Rio de Janeiro","Silva Jardim","Trilha do Cambuí Preto. Reserva Biólogica de Poço das Antas",-42.25,-22.5,"Árvore, ca. 11 m, heliófita, folhas discolores, face superior verde escuro brilhante, face inferior verde, fruto (tricocó) imaturo verde claro.","urn:catalog:JBRJ:RB:443306",NA,"Cupania racemosa Radlk.",NA
"353","2017-10-19T10:52:16.000+0000","JBRJ","RB","RB00531336","Cupania racemosa Radlk.",NA,"Sapindaceae","Cupania","racemosa",NA,"Radlk.",NA,NA,NA,"988",NA,"S. de V.A.Pessoa",1999,8,18,"Brazil","Rio de Janeiro","Silva Jardim","Fragmento E. Reserva Biológica de Poço das Antas",-42.233333,-22.566667,"Árvore, 12m. de altura, heliófila, folhas discolores verdes, frutos imaturos verdes, ind. FE 924.","urn:catalog:JBRJ:RB:531336",NA,"Cupania racemosa Radlk.",NA
"354",NA,"UNICAMP","UEC","119852","Cupania racemosa Radlk.",NA,"Sapindaceae","Cupania","racemosa",NA,"Radlk.","Ferrucci, M.S.","2000-07-01T00:00:00.000+0000",NA,"760",NA,"Alencar, M.E.; Castro, A.J.; Albino, R.S.",1999,8,20,"Brazil","Piauí","Brasileira","PARNA de Sete Cidades, Baixa do Barreiro (6ª cidade)",-41.705556,-4.123611,"Arbusto ca. 3,5m, flores amarelas, frutos imaturos avermelhados.; Subst. arenoso.&nf;Cerrado típico.","BRA:UNICAMP:UEC:0000119852",NA,"Cupania racemosa Radlk.",NA
"355",NA,"Universidade Federal Rural de Pernambuco, UFRPE","HST","17379","Cupania racemosa Radlk.",NA,"Sapindaceae","Cupania","racemosa",NA,"Radlk.","T.Costa Lima","1999-01-01T00:00:00.000+0000",NA,"10",NA,"T.Costa Lima",1999,9,6,"Brazil","Pernambuco","Recife","Parque de Dois Irmãos",NA,NA,"Árvore ca. 7 m alt.; frutos imaturos verdes.","BRA:UFRPE:HST:0000017379",NA,"Cupania racemosa Radlk.",NA
"356",NA,"MBML","MBML-HERBARIO","10720","Cupania racemosa Radlk.",NA,"Sapindaceae","Cupania","racemosa",NA,"Radlk.","R. Perdiz/2011",NA,NA,"8",NA,"V. Demuner; E. Bausen",1999,9,16,"Brazil","Espírito Santo","Santa Teresa","Mata do Banestes",-40.59,-19.933333,"Arvore 10m de altura, Dap 18cm, fuste 7m. Frutos verdes.","BRA:MBML:MBML-HERBARIO:0000010720",NA,"Cupania racemosa Radlk.",NA
"357",NA,"UNICAMP","UEC","119851","Cupania racemosa Radlk.",NA,"Sapindaceae","Cupania","racemosa",NA,"Radlk.","Ferrucci, M.S.","2000-07-01T00:00:00.000+0000",NA,"796",NA,"Alencar, M.E.",1999,10,17,"Brazil","Piauí","Brasileira","PARNA de Sete Cidades, Baixa do Barreiro (6ª cidade)",-41.705556,-4.123611,"Arbusto ca. 3,5m, frutos maduros avermelhados.; Subst. arenoso.&nf;Cerrado típico.","BRA:UNICAMP:UEC:0000119851",NA,"Cupania racemosa Radlk.",NA
"358",NA,"MBML","MBML-HERBARIO","7957","Cupania racemosa Radlk.",NA,"Sapindaceae","Cupania","racemosa",NA,"Radlk.","R. Perdiz/2011",NA,NA,"166",NA,"L. Kollmann; E. Bausen & W. Pizziolo",1998,6,30,"Brazil","Espírito Santo","Santa Teresa","Dois Pinheiros",-40.59,-19.933333,"Fundo de vale, beira estrada. Arvoreto 6m. Frutos verdes.","BRA:MBML:MBML-HERBARIO:0000007957",NA,"Cupania racemosa Radlk.",NA
"359",NA,"MBML","MBML-HERBARIO","7963","Cupania racemosa Radlk.",NA,"Sapindaceae","Cupania","racemosa",NA,"Radlk.","R. Perdiz/2011",NA,NA,"184",NA,"L. Kollmann; E. Bausen & W. Pizziolo",1998,7,8,"Brazil","Espírito Santo","Santa Teresa","São Lourenço",-40.620556,-19.931111,"Mata de encosta. Arvoreto 7m. DAP 18cm. Frutos verdes.","BRA:MBML:MBML-HERBARIO:0000007963",NA,"Cupania racemosa Radlk.",NA
"360",NA,"MBML","MBML-HERBARIO","7958","Cupania racemosa Radlk.",NA,"Sapindaceae","Cupania","racemosa",NA,"Radlk.","R. Perdiz/2011",NA,NA,"209",NA,"L. Kollmann; E. Bausen & W. Pizziolo",1998,7,9,"Brazil","Espírito Santo","Santa Teresa","Penha. Sítio do Zurlo",-40.534444,-19.950556,"Mata de encosta. Árvore 15m. DAP 15cm. Frutos verdes.","BRA:MBML:MBML-HERBARIO:0000007958",NA,"Cupania racemosa Radlk.",NA
"361",NA,"MBML","MBML-HERBARIO","7955","Cupania racemosa Radlk.",NA,"Sapindaceae","Cupania","racemosa",NA,"Radlk.","R. Perdiz/2011",NA,NA,"389",NA,"L. Kollmann; E. Bausen & W. Pizziolo",1998,8,18,"Brazil","Espírito Santo","Santa Leopoldina","Rio do Norte",-40.596389,-20.054167,"Beira de estrada. Arvoreto 6m. Frutos verdes.","BRA:MBML:MBML-HERBARIO:0000007955",NA,"Cupania racemosa Radlk.",NA
"362",NA,"MBML","MBML-HERBARIO","7956","Cupania racemosa Radlk.",NA,"Sapindaceae","Cupania","racemosa",NA,"Radlk.","R. Perdiz/2011",NA,NA,"353",NA,"L. Kollmann; E. Bausen & W. Pizziolo",1998,8,13,"Brazil","Espírito Santo","Santa Teresa","São Lourenço",-40.620556,-19.931111,"Mata de encosta. Árvore 8m. Frutos verdes.","BRA:MBML:MBML-HERBARIO:0000007956",NA,"Cupania racemosa Radlk.",NA
"363",NA,"MBML","MBML-HERBARIO","8408","Cupania racemosa Radlk.",NA,"Sapindaceae","Cupania","racemosa",NA,"Radlk.","V. Demuner/15-05-2003",NA,NA,"629",NA,"L. Kollmann; E. Bausen & W. Pizziolo",1998,9,29,"Brazil","Espírito Santo","Santa Teresa","Estação Biológica de Santa Lúcia",-40.530278,-19.971389,"Mata baixa de pedra. Árvore 8m. DAP 20cm. Fuste 3m. Frutos verdes.","BRA:MBML:MBML-HERBARIO:0000008408",NA,"Cupania racemosa Radlk.",NA
"364","2014-07-07T22:03:07.000+0000","JBRJ","RB","RB00674387","Cupania racemosa Radlk.",NA,"Sapindaceae","Cupania","racemosa",NA,"Radlk.","G.V. Somner",NA,NA,"82",NA,"C.H.R. De Paula",1998,9,27,"Brazil","Rio de Janeiro","Rio de Janeiro","Trilha do morro da Urca, platô no meio da trilha.",NA,NA,"Arbusto heliófilo, +- 5 m. de alt., caule liso; folhas membranáceas discolores; frutos maduros lignificados (Marrons); sementes pretas envoltas até quase o ápice por arilo de cor laranja.","urn:catalog:JBRJ:RB:674387",NA,"Cupania racemosa Radlk.",NA
"365",NA,"MBML","MBML-HERBARIO","8733","Cupania racemosa Radlk.",NA,"Sapindaceae","Cupania","racemosa",NA,"Radlk.","R. Perdiz/2011",NA,NA,"810",NA,"L. Kollmann; E. Bausen & W. Pizziolo",1998,10,28,"Brazil","Espírito Santo","Santa Teresa","São Lourenço, Mata Fria",-40.683611,-19.931111,"Mata de encosta. Arvoreto 10m. DAP 20cm. Fuste 4m. Frutos verdes.","BRA:MBML:MBML-HERBARIO:0000008733",NA,"Cupania racemosa Radlk.",NA
"366",NA,"IMA","MAC","9845","Cupania racemosa Radlk.",NA,"Sapindaceae","Cupania","racemosa",NA,"Radlk.","E.C.O.Chagas","2009-03-16T00:00:00.000+0000",NA,"1368",NA,"M.N.Rodrigues; R.P.Lyra-Lemos",1998,11,17,"Brazil","Alagoas","Pilar","Mata da Fazenda Lamarão.",0,0,"Árvore ca. 3 m de alt. Frutos imaturos.; Mata Atlântica em encosta de tabuleiro.","BRA:IMA:MAC:0000009845",NA,"Cupania racemosa Radlk.",NA
"367",NA,"IPA","IPA","64674","Cupania racemosa Radlk.",NA,"Sapindaceae","Cupania","racemosa",NA,"Radlk.","Pereira, L.A.","2012-09-28T00:00:00.000+0000",NA,"s.n.",NA,"Eugênio, C.",1997,6,20,"Brazil","Pernambuco","Paulista","Reserva Ecológica de Caetés",0,0,"Árvore.","BRA:IPA:IPA:0000064674",NA,"Cupania racemosa Radlk.",NA
"368","2008-05-27T22:02:00.000+0000","MO","MO","2993473","Cupania racemosa Radlk.",NA,"Sapindaceae","Cupania","racemosa",NA,"Radlk.","R.E. Gereau","1999-01-01T00:00:00.000+0000",NA,"Mendonça 3375",NA,"Roberta C. de Mendonça",1997,NA,NA,"Brazil","Minas Gerais",NA,"Município de Formoso; Parque Nacional Grande Sertão Veredas; barra do Rio Puero com o Riacho Santa Rita; Fazenda do Sr. Porcillo Teixeira Muniz; reboleira de cerredo na vereda do Rio Preto; solo arenoso; relevo plano.",-45.76972,-15.18194,NA,"urn:catalog:MO:Tropicos:2993473","http://www.tropicos.org/Specimen/2993473","Cupania racemosa Radlk.",NA
"369","2017-10-10T22:58:39.000+0000","JBRJ","RB","RB00383537","Cupania racemosa Radlk.",NA,"Sapindaceae","Cupania","racemosa",NA,"Radlk.","G. M. Somner","1997-06-23T00:00:00.000+0000",NA,"1141",NA,"M. C. L. Ramos",1996,4,NA,"Brazil","Rio de Janeiro","Maricá","Ponta do Fundão, margem da lagoa da Barra.",NA,NA,"Arbusto de 6,2m altura. Dois caules a partir do solo. DAS único =10,7 cm Copa no sol. Englobada por um cupinzeiro no solo.","urn:catalog:JBRJ:RB:383537",NA,"Cupania racemosa Radlk.",NA
"370","2017-10-10T22:58:47.000+0000","JBRJ","RB","RB00383521","Cupania racemosa Radlk.",NA,"Sapindaceae","Cupania","racemosa",NA,"Radlk.","Genise V. Somner","1997-06-23T00:00:00.000+0000",NA,"1116",NA,"M. C. L. Ramos",1996,4,NA,"Brazil","Rio de Janeiro","Maricá","Planta do Fundão, margem da L.da Barra.",NA,NA,NA,"urn:catalog:JBRJ:RB:383521",NA,"Cupania racemosa Radlk.",NA
"371",NA,"IMA","MAC","9149","Cupania racemosa Radlk.",NA,"Sapindaceae","Cupania","racemosa",NA,"Radlk.","E.C.O.Chagas","2009-03-16T00:00:00.000+0000",NA,"66",NA,"N.T. Mendonça",1996,5,11,"Brazil","Alagoas","Maceió","Reserva do IBAMA.",0,0,"Árvore ca. 7 m de alt. Botões florais jovens.; Mata Atlântica em tabuleiro, encosta.","BRA:IMA:MAC:0000009149",NA,"Cupania racemosa Radlk.",NA
"372",NA,"UFES","VIES","18900","Cupania racemosa Radlk.",NA,"Sapindaceae","Cupania","racemosa",NA,"Radlk.","Assis, A.M.","1996-05-16T00:00:00.000+0000",NA,"218",NA,"Assis, A.M.; Passamani, F.; Silva, G.H. & Souza, R.L.D.",1996,5,16,"Brazil","Espírito Santo","Linhares","Pontal do Ipiranga.",NA,NA,"SW1939","BRA:UFES:VIES:0000018900",NA,"Cupania racemosa Radlk.",NA
"373",NA,"UFES","VIES","32699","Cupania racemosa Radlk.",NA,"Sapindaceae","Cupania","racemosa",NA,"Radlk.","Dutra, R.L.S.","1996-06-20T00:00:00.000+0000",NA,"40",NA,"Dutra, R.L.S.; Assis, A.M. & Passamani, F.",1996,6,20,"Brazil","Espírito Santo","Linhares","Pontal do Ipiranga.",NA,NA,"SW1940","BRA:UFES:VIES:0000032699",NA,"Cupania racemosa Radlk.",NA
"374","2017-10-19T04:08:06.000+0000","JBRJ","RB","RB00416099","Cupania racemosa Radlk.","cf.","Sapindaceae","Cupania","racemosa",NA,"Radlk.","I.E. Santo",NA,NA,"132 (21/13)",NA,"C. Bohrer",1996,7,NA,"Brazil","Rio de Janeiro","Nova Friburgo","Rio das Flores, REM Macaé de Cima.",-42.5,-22.416667,"Árvore CAP 52 cm, H 13 m.","urn:catalog:JBRJ:RB:416099",NA,"Cupania racemosa Radlk.",NA
"375","2011-03-24T18:28:00.000+0000","MO","MO","2479386","Cupania racemosa Radlk.",NA,"Sapindaceae","Cupania","racemosa",NA,"Radlk.","Ferrucci, M. S., //","1996-01-01T00:00:00.000+0000",NA,"Ferrucci 954",NA,"M. Silvia Ferrucci|G.V. Somner",1996,7,31,"Brazil","Rio de Janeiro",NA,"Saquarema. Reserva Estadual de Jacarepiá. Mata de restinga",NA,NA,NA,"urn:catalog:MO:Tropicos:2479386","http://www.tropicos.org/Specimen/2479386","Cupania racemosa Radlk.",NA
"376",NA,"UFES","VIES","32695","Cupania racemosa Radlk.",NA,"Sapindaceae","Cupania","racemosa",NA,"Radlk.","Dutra, R.L.S.","1996-08-04T00:00:00.000+0000",NA,"94",NA,"Dutra, R.L.S.; Assis, A.M. & Hupps, G.",1996,8,4,"Brazil","Espírito Santo","Linhares","Pontal do Ipiranga.",NA,NA,"SW1940","BRA:UFES:VIES:0000032695",NA,"Cupania racemosa Radlk.",NA
"377","2014-07-08T03:30:04.000+0000","JBRJ","RB","RB00420713","Cupania racemosa Radlk.",NA,"Sapindaceae","Cupania","racemosa",NA,"Radlk.","R.Perdiz","2011-01-01T00:00:00.000+0000",NA,"166",NA,"A. Lobão; S. Cordeiro",1996,9,18,"Brazil","Rio de Janeiro","Cabo Frio","Praia do Peró. Borda da mata com trilha. Àrea perturbada.",NA,NA,"Árvore; folhas discolores verdes coreáceas; caule levemente piloso; fruto imaturo verde.","urn:catalog:JBRJ:RB:420713",NA,"Cupania racemosa Radlk.",NA
"378",NA,"UFES","VIES","32701","Cupania racemosa Radlk.",NA,"Sapindaceae","Cupania","racemosa",NA,"Radlk.","Dutra, R.L.S.","1996-10-24T00:00:00.000+0000",NA,"158",NA,"Dutra, R.L.S.; Assis, A.M.",1996,10,24,"Brazil","Espírito Santo","Linhares","Pontal do Ipiranga.",NA,NA,"SW1940","BRA:UFES:VIES:0000032701",NA,"Cupania racemosa Radlk.",NA
"379",NA,"UFES","VIES","32698","Cupania racemosa Radlk.",NA,"Sapindaceae","Cupania","racemosa",NA,"Radlk.","Dutra, R.L.S.","1996-10-24T00:00:00.000+0000",NA,"164",NA,"Dutra, R.L.S.; Assis, A.M.",1996,10,24,"Brazil","Espírito Santo","Linhares","Pontal do Ipiranga.",NA,NA,"SW1940","BRA:UFES:VIES:0000032698",NA,"Cupania racemosa Radlk.",NA
"380","2017-10-19T03:38:11.000+0000","JBRJ","RB","RB00385026","Cupania racemosa Radlk.",NA,"Sapindaceae","Cupania","racemosa",NA,"Radlk.","María S. Ferrucci & Genise V. Somner","2006-01-01T00:00:00.000+0000",NA,"08",NA,"A.C.B. Lins e Silva; M.J.N. Rodal",1995,5,31,"Brazil","Pernambuco","Recife","Curado, mata do Comando Militar do Nordeste/ CMNE. Área de 43,40 ha.",-34.965,-8.071111,"Árvore ca. 8 m , fuste a 2 m. Flores com cálice verde claro e corola branca, gineceu verde claro.","urn:catalog:JBRJ:RB:385026",NA,"Cupania racemosa Radlk.",NA
"381","2017-10-19T03:46:41.000+0000","JBRJ","RB","RB00387872","Cupania racemosa Radlk.",NA,"Sapindaceae","Cupania","racemosa",NA,"Radlk.","María S. Ferrucci & Genise V. Somner","2006-01-01T00:00:00.000+0000",NA,"07",NA,"A.C.B. Lins e Silva; M.J.N. Rodal",1995,5,31,"Brazil","Pernambuco","Recife","Curado- Mata do Comando Militar do Nordeste/CMNE. Área de 43,40 ha.",-34.965,-8.071111,"Árvore ca. 7 m , fuste 1m , botões branco-esverdeados, folha levemente discolor.","urn:catalog:JBRJ:RB:387872",NA,"Cupania racemosa Radlk.",NA
"382",NA,"UFPB","JPB","60114","Cupania racemosa Radlk.",NA,"Sapindaceae","Cupania","racemosa",NA,"Radlk.","Landim, M","2010-07-01T00:00:00.000+0000",NA,"497",NA,"Landim, M",1995,7,31,"Brazil","Sergipe","Santa Luzia do Itanhy","Mata de Castro",-37.425861,-11.385528,"Árvore. 4.5. metro. Presença de flores pequenas esverdeadas.; Árvore. 4.5. metro. Presença de flores pequenas esverdeadas.; Mata","BRA:UFPB:JPB:0000060114",NA,"Cupania racemosa Radlk.",NA
"383",NA,"Universidade Federal de Sergipe, UFS","ASE","6242","Cupania racemosa Radlk.",NA,"Sapindaceae","Cupania","racemosa",NA,"Radlk.","Landim, M","2010-07-01T00:00:00.000+0000",NA,"497",NA,"Landim, M",1995,7,31,"Brazil","Sergipe","Santa Luzia do Itanhy","Mata do Crasto",-37.425861,-11.385528,"Árvore. 4.5. metro. Presença de flores pequenas esverdeadas.; Árvore. 4.5. metro. Presença de flores pequenas esverdeadas.; Mata","BRA:UFS:ASE:0000006242",NA,"Cupania racemosa Radlk.",NA
"384",NA,"Escola Superior de Agricultura Luiz de Queiroz, ESALQ","ESA","ESA065976","Cupania racemosa Radlk.",NA,"Sapindaceae","Cupania","racemosa",NA,"Radlk.",NA,NA,NA,"62939",NA,"Hatschbach, G. et al.",1995,8,10,"Brazil","Espírito Santo","Linhares",NA,NA,NA,NA,"BRA:ESALQ:ESA:0ESA065976",NA,"Cupania racemosa Radlk.",NA
"385",NA,"UNICAMP","UEC","79520","Cupania racemosa Radlk.",NA,"Sapindaceae","Cupania","racemosa",NA,"Radlk.","Somner, G.V.","1996-12-18T00:00:00.000+0000",NA,"42",NA,"Hoffmann, A.",1995,9,29,"Brazil","Rio de Janeiro","Araruama",NA,-24.291389,-22.6175,"Red-black fruits, 8-20m hight.; Mata.","BRA:UNICAMP:UEC:0000079520",NA,"Cupania racemosa Radlk.",NA
"386","2017-10-18T12:36:48.000+0000","JBRJ","RB","RB00442121","Cupania racemosa Radlk.",NA,"Sapindaceae","Cupania","racemosa",NA,"Radlk.",NA,NA,NA,"178",NA,"D.S.Farias; et al.",1994,3,16,"Brazil","Rio de Janeiro","Silva Jardim","Trilha Rodolfo Sul. Reserva Biológica de Poço das Antas",-42.25,-22.5,"N.V.: camboatá-mirim. Arvoreta ca. de 6m de alt. e 4,1cm de DAP. Ritidoma  pardo-acinzentado. Casca viva creme. Alimento/fauna.","urn:catalog:JBRJ:RB:442121",NA,"Cupania racemosa Radlk.",NA
"387","2017-10-18T14:16:09.000+0000","JBRJ","RB","RB00443047","Cupania racemosa Radlk.",NA,"Sapindaceae","Cupania","racemosa",NA,"Radlk.",NA,NA,NA,"370",NA,"C.Luchiari; et al.",1994,4,21,"Brazil","Rio de Janeiro","Silva Jardim","Parcela 4C. Reserva Biológica de Poço das Antas",-42.25,-22.5,"árvore, 6m, heliófita, folha discolor, face superior verde escuro, face inferior verde, botão creme esverdeado. FENOLOGIA 568.","urn:catalog:JBRJ:RB:443047",NA,"Cupania racemosa Radlk.",NA
"388","2017-10-18T13:23:58.000+0000","JBRJ","RB","RB00514504","Cupania racemosa Radlk.",NA,"Sapindaceae","Cupania","racemosa",NA,"Radlk.",NA,NA,NA,"1615",NA,"R. Marquete; M. do C. M. Marques, Cristiane, Joel, Claudio",1994,4,13,"Brazil","Rio de Janeiro","Paraty","Trilha Ponta Negra / Praia dos Antigos.",NA,NA,"Heliófila. Árvore com ca. 12 m de alt. Tronco com casca fissurada, cor cinza; Folhas cartáceas, discolores verdes; Inflorescência ereta. Flores com cálice verdes e corola creme, botões esverdeados.","urn:catalog:JBRJ:RB:514504",NA,"Cupania racemosa Radlk.",NA
"389","2017-10-04T12:41:20.000+0000","JBRJ","RB","RB00383612","Cupania racemosa Radlk.",NA,"Sapindaceae","Cupania","racemosa",NA,"Radlk.","Genise V. Somner & Maria S. Ferrucci","2006-01-01T00:00:00.000+0000",NA,"3322",NA,"Cyl Farney; D. Araujo; J.C. Gomes & M.A. Oliveira",1994,4,25,"Brazil","Rio de Janeiro","Saquarema",NA,NA,NA,"Árvore; cerca. 8 metros de altura.; folhas verdes discolores; flores com pedúnculo esverdeado; pedicelo esverdeado; cálice esverdeado e corola alvescente; estames alvos.","urn:catalog:JBRJ:RB:383612",NA,"Cupania racemosa Radlk.",NA
"390","2014-07-22T14:02:38.000+0000","JBRJ","RB","RB00383714","Cupania racemosa Radlk.",NA,"Sapindaceae","Cupania","racemosa",NA,"Radlk.","R.Perdiz","2011-01-01T00:00:00.000+0000",NA,"1594",NA,"L. C. Giordano",1994,4,4,"Brazil","Rio de Janeiro","Rio de Janeiro","Ilha do Governador, Pitangueiras, terreno da Rua Flávio José da Costa, após ao nº 445.",NA,NA,"Arvoreta em rebrota com folíolos cartáceos e discolores. Estéril. Planta heliófila.","urn:catalog:JBRJ:RB:383714",NA,"Cupania racemosa Radlk.",NA
"391","2017-10-18T14:51:34.000+0000","JBRJ","RB","RB00442049","Cupania racemosa Radlk.",NA,"Sapindaceae","Cupania","racemosa",NA,"Radlk.",NA,NA,NA,"206",NA,"D.S.Farias; et al.",1994,5,3,"Brazil","Rio de Janeiro","Silva Jardim","Trilha Rodolfo Norte. Reserva Biológica de Poço das Antas",-42.25,-22.5,"Arv. ca. de 15m de alt. Flores alvas dispostas em panículas axilares no final dos ramos.","urn:catalog:JBRJ:RB:442049",NA,"Cupania racemosa Radlk.",NA
"392",NA,"IAP","PACA-AGP","103672","Cupania racemosa Radlk.",NA,"Sapindaceae","Cupania","racemosa",NA,"Radlk.",NA,NA,NA,"206",NA,"D.S. Farias",1994,5,3,"Brazil","Rj","Silva Jardim","Reserva Biológica Poço das Antas, trilha Rodolfo Norte.",-42.25,-22.5,"arv. 15 m alt.; flores alvas disposta em panículas exilares no final dos ramos&nf;RB 329036","BRA:IAP:PACA-AGP:0000103672",NA,"Cupania racemosa Radlk.",NA
"393",NA,"UEFS","HUEFS","135310","Cupania racemosa Radlk.",NA,"Sapindaceae","Cupania","racemosa",NA,"Radlk.",NA,NA,NA,"206",NA,"Farias, D.S.",1994,5,3,"Brazil","Rio de Janeiro","Silva Jardim","Reserva Biológica Poço das Antas.Trilha Rodolfo Norte.Área FP029",-42.25,-22.5,NA,"BRA:UEFS:HUEFS:0000135310",NA,"Cupania racemosa Radlk.",NA
"394","2008-05-27T22:02:00.000+0000","MO","MO","3403764","Cupania racemosa Radlk.",NA,"Sapindaceae","Cupania","racemosa",NA,"Radlk.",NA,NA,NA,"Jardim 461",NA,"Jomar G. Jardim",1994,6,14,"Brazil","Sergipe",NA,"Mpio de Santa Luzia do Itanhi. Entrada 2 Km à esquerda na entrada Sta. Luzia/Crasto. Mata em solo silico-argiloso.",-37.43861,-11.26833,NA,"urn:catalog:MO:Tropicos:3403764","http://www.tropicos.org/Specimen/3403764","Cupania racemosa Radlk.",NA
"395","2017-10-18T16:38:39.000+0000","JBRJ","RB","RB00443118","Cupania racemosa Radlk.",NA,"Sapindaceae","Cupania","racemosa",NA,"Radlk.",NA,NA,NA,"452",NA,"C.Luchiari; et al.",1994,6,22,"Brazil","Rio de Janeiro","Silva Jardim","Trilha do Cambuí Preto. Reserva Biológica de Poço das Antas",-42.25,-22.5,"Árvore, 9m, semi-sombreada, folha discolor, face superior verde escuro brilhante, face inferior verde, fruto imaturo verde claro.","urn:catalog:JBRJ:RB:443118",NA,"Cupania racemosa Radlk.",NA
"396",NA,"NY","NY","585400","Cupania racemosa Radlk.",NA,"Sapindaceae","Cupania","racemosa",NA,"Radlk.",NA,NA,NA,"461",NA,"J. G. Jardim",1994,6,14,"Brazil","Sergipe",NA,"Entrada 2 km Ã  esquerda na estrada Sta. Luzia/Crasto",-37.4386,-11.2683,NA,"232eaa90-a340-463b-81b4-b9407d1776bb",NA,"Cupania racemosa Radlk.",NA
"397",NA,"Universidade Federal de Sergipe, UFS","ASE","5757","Cupania racemosa Radlk.",NA,"Sapindaceae","Cupania","racemosa",NA,"Radlk.","Landim, M","2010-07-01T00:00:00.000+0000",NA,"461",NA,"J. G. Jardim; Silva, LAM; S.C. Sant'Ana; E. B. dos Santos",1994,6,14,"Brazil","Sergipe","Santa Luzia do Itanhy","Estrada Santa Luzia - Crasto, Entrada 2 km à esquerda na estrada Santa Luzia/Cra. Solo síltico-argiloso",-37.424278,-11.378056,"Árvore. 7. metro. Flores creme. 15 cm de diâmetro; Árvore. 7. metro. Flores creme. 15 cm de diâmetro; Mata","BRA:UFS:ASE:0000005757",NA,"Cupania racemosa Radlk.",NA
"398",NA,"US","Botany","3698503","Cupania racemosa Radlk.",NA,"Sapindaceae","Cupania","racemosa",NA,"Radlk.","Acevedo-Rodríguez, P., (BOT), Smithsonian Institution - National Museum of Natural History (UNITED STATES)",NA,NA,"461",NA,"J. G. Járdim, L. A. Mattos Silva, S. C. Sant'Ana & E. B. Santos",1994,6,14,"Brazil","Sergipe",NA,"Município de Santa Luzia do Itanhi. entrada 2 km à esquerda na estrada Sta. Luzia/Crasto",-37.4386,-11.2683,NA,"http://n2t.net/ark:/65665/34ea4598d-46ec-4dc9-983e-32321e85551e",NA,"Cupania racemosa Radlk.",NA
"399","2009-05-07T09:03:00.000+0000","MO","MO","100185467","Cupania racemosa Radlk.",NA,"Sapindaceae","Cupania","racemosa",NA,"Radlk.",NA,NA,NA,"Farias 303",NA,"D.S. Farias",1994,8,31,"Brazil","Rio de Janeiro",NA,"Silva Jardim. Reserva Biológica Poço das Antas. Ilha dos barbados. Área FP041.",-42.25,-22.5,NA,"urn:catalog:MO:Tropicos:100185467","http://www.tropicos.org/Specimen/100185467","Cupania racemosa Radlk.",NA
"400",NA,"MBML","MBML-HERBARIO","35310","Cupania racemosa Radlk.",NA,"Sapindaceae","Cupania","racemosa",NA,"Radlk.",NA,NA,NA,"303",NA,"D. S. Farias; et al",1994,8,31,"Brazil","Rio de Janeiro",NA,"Silva Jardim. Reserva Biológica Poço das Antas",-42.266667,-22.505,NA,"BRA:MBML:MBML-HERBARIO:0000035310",NA,"Cupania racemosa Radlk.",NA
"401","2017-10-19T11:28:55.000+0000","JBRJ","RB","RB00442148","Cupania racemosa Radlk.",NA,"Sapindaceae","Cupania","racemosa",NA,"Radlk.",NA,NA,NA,"303",NA,"D.S.Farias; et al.",1994,8,31,"Brazil","Rio de Janeiro","Silva Jardim","Ilha dos barbados. Reserva Biológica de Poço das Antas",-42.25,-22.5,"Arv. ca. de 9m de alt. e 57cm de CAP. Ritiudoma pardo-acinzentado. Casca viva avermelhada. Frutos imaturos verdes, tricoca.","urn:catalog:JBRJ:RB:442148",NA,"Cupania racemosa Radlk.",NA
"402",NA,"IPA","IPA","56822","Cupania racemosa Radlk.",NA,"Sapindaceae","Cupania","racemosa",NA,"Radlk.","Arns, K.N.Y.","1998-05-13T00:00:00.000+0000",NA,"IPA-56822",NA,"Rita Pereira; et al.; et al.",1994,10,11,"Brazil","Pernambuco","Recife","Mata do Curado (Exército) - Área de Mata Atlântica.",0,0,NA,"BRA:IPA:IPA:0000056822",NA,"Cupania racemosa Radlk.",NA
"403",NA,"IPA","IPA","56811","Cupania racemosa Radlk.",NA,"Sapindaceae","Cupania","racemosa",NA,"Radlk.","Arns, K.N.Y.","1998-05-13T00:00:00.000+0000",NA,"IPA-56811",NA,"Rita Pereira; et al.; et al.",1994,10,11,"Brazil","Pernambuco","Recife","Mata do Curado (Exército).",0,0,NA,"BRA:IPA:IPA:0000056811",NA,"Cupania racemosa Radlk.",NA
