"","modified","institutionCode","collectionCode","catalogNumber","scientificName","identificationQualifier","family","genus","specificEpithet","scientificNameAuthorship","identifiedBy","dateIdentified","typeStatus","recordNumber","fieldNumber","recordedBy","year","month","day","country","stateProvince","municipality","locality","decimalLongitude","decimalLatitude","occurrenceRemarks","occurrenceID","acceptedNameUsage"
"1","2018-07-24T11:00:45.000+0000","JBRJ","RB","RB01386601","Cupania ludowigii Somner & Ferrucci",NA,"Sapindaceae","Cupania","ludowigii","Somner & Ferrucci","M. Verdi","2018-07-19T00:00:00.000+0000",NA,"1630",NA,"C. Baez; E.P.Fernandez, T.Lima, R.C.Gomes",2018,4,19,"Brazil","Rio de Janeiro","Resende","Bosque do Visconde. Trilha da Família. Parque Estadual da Pedra Selada",-44.538611,-22.335278,"Árvore matriz nº 60; CAP 71+48 cm; Fruto imaturo verde.","urn:catalog:JBRJ:RB:1386601","Cupania ludowigii Somner & Ferrucci"
"2",NA,"Universidade Federal de Minas Gerais (UFMG)","BHCB","189747","Cupania ludowigii Somner & Ferrucci",NA,"Sapindaceae","Cupania","ludowigii","Somner & Ferrucci",NA,"2017-08-01T00:00:00.000+0000",NA,"644",NA,"Quaresma, AS; Brina, AE; Oliveira, CT",2017,8,14,"Brazil","Minas Gerais","Mariana","Fazenda Itacolomy",-43.396389,-19.009167,NA,"BRA:UFMG:BHCB:0000189747","Cupania ludowigii Somner & Ferrucci"
"3",NA,"Universidade Federal dos Vales do Jequitinhonha e Mucuri (UFVJM)","HDJF","4025","Cupania ludowigii Somner & Ferrucci",NA,"Sapindaceae","Cupania","ludowigii","Somner & Ferrucci","Faria, JEQ","2016-06-01T00:00:00.000+0000",NA,"6063",NA,"Faria, JEQ; Batista, DS; Takahashi, RS",2016,6,28,"Brazil","Minas Gerais","Conceição do Mato Dentro","Gondó, Fazenda Água Limpa, propriedade da Anglo American",-43.411944,-18.939167,"Árvore ca. 4,5 m de altura, frutos imaturos verdes; Mata de encosta com afloramento rochoso","BRA:UFVJM:HDJF:0000004025","Cupania ludowigii Somner & Ferrucci"
"5",NA,"Universidade Federal dos Vales do Jequitinhonha e Mucuri (UFVJM)","HDJF","4845","Cupania ludowigii Somner & Ferrucci",NA,"Sapindaceae","Cupania","ludowigii","Somner & Ferrucci","Moreira, SN","2016-06-12T00:00:00.000+0000",NA,"2087",NA,"Moreira, SN; Pereira, E",2016,8,18,"Brazil","Minas Gerais","Conceição do Mato Dentro",NA,-43.4275,-18.904722,"Fruto Castanho; Remanescente de Floresta Estacional Semidecidual em transição com Cerrado","BRA:UFVJM:HDJF:0000004845","Cupania ludowigii Somner & Ferrucci"
"6","2017-04-03T08:42:45.000+0000","JBRJ","RB","RB01298112","Cupania ludowigii Somner & Ferrucci",NA,"Sapindaceae","Cupania","ludowigii","Somner & Ferrucci","R. Moura","2017-03-14T00:00:00.000+0000",NA,"247",NA,"Gaui­, T. D.",2015,8,4,"Brazil","Rio de Janeiro","São José do Vale do Rio Preto","Conglomerado 120-2-1-1. UTM do Ponto Central: E (713490m) N (7550226m). Fuso do GPS (23K)",NA,NA,"Árvore, com 7 m de altura. Base reta. Casca interna avermelhada e externa marrom, fina, lisa. Fruto imaturo, com 2,5 cm de diâmetro, com formato de coração, internamente e externamente verde, seco, com arilo.  Nome Vulgar: camboatá-miudo","urn:catalog:JBRJ:RB:1298112","Cupania ludowigii Somner & Ferrucci"
"8","2017-03-22T09:06:40.000+0000","JBRJ","RB","RB01298106","Cupania ludowigii Somner & Ferrucci",NA,"Sapindaceae","Cupania","ludowigii","Somner & Ferrucci","R. Moura","2017-03-14T00:00:00.000+0000",NA,"715",NA,"Luan Silva",2015,9,29,"Brazil","Rio de Janeiro","Rio das Flores","Conglomerado 85-4-2-9. UTM do Ponto Central: E (657784m) N (7550881m). Fuso do GPS (23K)",NA,NA,"Árvore, com 8 m de altura. Base reta. casca interna vermelha e externa cinza, fina, estriada. Fruto maduro, com 2,0 cm de diâmetro, externamente amarelo, seco","urn:catalog:JBRJ:RB:1298106","Cupania ludowigii Somner & Ferrucci"
"9","2017-04-03T08:54:16.000+0000","JBRJ","RB","RB01297932","Cupania ludowigii Somner & Ferrucci",NA,"Sapindaceae","Cupania","ludowigii","Somner & Ferrucci","R. Moura","2017-03-14T00:00:00.000+0000",NA,"1019A",NA,"Luis Gustavo C. Rigon",2015,11,4,"Brazil","Rio de Janeiro","Piraí","Conglomerado 92-2-1-7A. UTM do Ponto Central: E (610441m) N (7491499m). Fuso do GPS (23K)",NA,NA,"Árvore, com 12,5 m de altura. Base reta. Casca interna amarela e externa cinza, fina, leticelada, indeiscente, não apresentando odor quando cortada. Fruto imaturo, com 2,0 x 2,5 cm de diâmetro, com formato de coração, internamente e externamente verde, seco, com arilo","urn:catalog:JBRJ:RB:1297932","Cupania ludowigii Somner & Ferrucci"
"10",NA,"UFPB","JPB","57894","Cupania ludowigii Somner & Ferrucci",NA,"Sapindaceae","Cupania","ludowigii","Somner & Ferrucci","Pereira, LA","2016-05-10T00:00:00.000+0000",NA,"4064",NA,"Nusbaumer, L; Ammann, M",2014,5,18,"Brazil","Alagoas","Quebrangulo","Reserva Biológica da Pedra Talhada, Localité de Quebrangulo.",-36.450136,-9.24017,"arbre, 20 m, 25 cm DBH; fr. vert en forme de cSur, recouvert de duvet roux, apiculé à l'apex, dans l'échancrure du cSur, déhiscent; récolte photographiée in situ; échantillon séché à l'air chaud; Forêt ombrophile submontagnarde de pla","BRA:UFPB:JPB:0000057894","Cupania ludowigii Somner & Ferrucci"
"11",NA,"IAC","IAC","56128","Cupania ludowigii Somner & Ferrucci",NA,"Sapindaceae","Cupania","ludowigii","Somner & Ferrucci","G.A.D.C. Franco","2015-02-25T00:00:00.000+0000",NA,"250",NA,"C.F. Nardin; J.F. Benedito & L.C. Bernacci",2014,5,14,"Brazil","São Paulo","Louveira","Fragmento A",-46.871944,-23.078611,"coordenadas originais: 23°04#?#43""S, 46°52#?#19""W","BRA:IAC:IAC:0000056128","Cupania ludowigii Somner & Ferrucci"
"12",NA,"Escola Superior de Agricultura Luiz de Queiroz, ESALQ","ESA","ESA128228","Cupania ludowigii Somner & Ferrucci",NA,"Sapindaceae","Cupania","ludowigii","Somner & Ferrucci",NA,NA,NA,"1941",NA,"Flores, T.B.",2013,4,2,"Brazil","São Paulo","Tapirai","Reserva da Votorantim. Estrada entre a portaria e o alojamento. 6-8 Km da portaria.",NA,NA,NA,"BRA:ESALQ:ESA:0ESA128228","Cupania ludowigii Somner & Ferrucci"
"13",NA,"Universidade Federal de Juiz de Fora (UFJF)","CESJ","62977","Cupania ludowigii Somner & Ferrucci",NA,"Sapindaceae","Cupania","ludowigii","Somner & Ferrucci","B.E. Conde","2013-05-20T00:00:00.000+0000",NA,"253",NA,"B.E. Conde",2013,5,15,"Brazil","Minas Gerais","Santos Dumont","São Sebastião da Boa Vista",0,0,"Árvore lenhosa amarronzada, com folhas levemente falciformes, obtusas com bordas revolutas. Vagens orbiculares com ápice sagitado, marrons revolutos.","BRA:UFJF:CESJ:0000062977","Cupania ludowigii Somner & Ferrucci"
"14",NA,"Universidade Federal de Minas Gerais (UFMG)","BHCB","185574","Cupania ludowigii Somner & Ferrucci",NA,"Sapindaceae","Cupania","ludowigii","Somner & Ferrucci",NA,NA,NA,"5480",NA,"Tameirão Neto, E; Vidal, CV",2013,11,27,"Brazil","Minas Gerais","Conceição do Mato Dentro",NA,-43.365436,-19.088,NA,"BRA:UFMG:BHCB:0000185574","Cupania ludowigii Somner & Ferrucci"
"16",NA,"Universidade Federal de Juiz de Fora (UFJF)","CESJ","57581","Cupania ludowigii Somner & Ferrucci",NA,"Sapindaceae","Cupania","ludowigii","Somner & Ferrucci","D.S. Pifano","2012-03-21T00:00:00.000+0000",NA,"3221",NA,"F.R.G. Salimena; L. Menini Neto; P.H. Nobre; J.H.C. Ribeiro",2011,2,25,"Brazil","Minas Gerais","Juiz de Fora","Jardim Botânico UFJF - Mata do Krambeck, Trilha da Divisa, saindo da Ponte. Próximo ao portão.",0,0,"Árvore 6m, flores alvas.","BRA:UFJF:CESJ:0000057581","Cupania ludowigii Somner & Ferrucci"
"17",NA,"Universidade Federal de Juiz de Fora (UFJF)","CESJ","57580","Cupania ludowigii Somner & Ferrucci",NA,"Sapindaceae","Cupania","ludowigii","Somner & Ferrucci","D.S. Pifano","2012-03-21T00:00:00.000+0000",NA,"3220",NA,"F.R.G. Salimena; L. Menini Neto; P.H. Nobre; J.H.C. Ribeiro",2011,2,25,"Brazil","Minas Gerais","Juiz de Fora","Jardim Botânico UFJF - Mata do Krambeck, Trilha da Divisa, saindo da Ponte.",0,0,"Árvore 8m, frutos maduros secos. Em interior de mata.","BRA:UFJF:CESJ:0000057580","Cupania ludowigii Somner & Ferrucci"
"18",NA,"Escola Superior de Agricultura Luiz de Queiroz, ESALQ","ESA","ESA115319","Cupania ludowigii Somner & Ferrucci",NA,"Sapindaceae","Cupania","ludowigii","Somner & Ferrucci","Coelho, R.L.G",NA,NA,"585",NA,"Meirelles, J.",2011,4,18,"Brazil","Espírito Santo","Linhares",NA,NA,NA,NA,"BRA:ESALQ:ESA:0ESA115319","Cupania ludowigii Somner & Ferrucci"
"20","2014-07-08T00:59:09.000+0000","JBRJ","RB","RB00767456","Cupania ludowigii Somner & Ferrucci",NA,"Sapindaceae","Cupania","ludowigii","Somner & Ferrucci","R. Coelho","2011-04-19T00:00:00.000+0000",NA,"586",NA,"J. Meirelles; et al",2011,4,18,"Brazil","Espírito Santo","Linhares","Reserva Natural da Vale. Estrada da Boleira. Nativo da Gávea.",-39.965278,-19.209444,"Arvoreta ca. 6m alt","urn:catalog:JBRJ:RB:767456","Cupania ludowigii Somner & Ferrucci"
"22",NA,"Universidade Federal de Juiz de Fora (UFJF)","CESJ","58418","Cupania ludowigii Somner & Ferrucci",NA,"Sapindaceae","Cupania","ludowigii","Somner & Ferrucci","R.M. Castro","2011-08-31T00:00:00.000+0000",NA,"54",NA,"C.N. Silva; R.M. Castro; J.F.S. Pessôa",2011,8,31,"Brazil","Minas Gerais","Juiz de Fora","Jardim Botânico da UFJF, Brasil, Minas Gerais, Juiz de Fora. Jardim Botânico da UFJF - Mata do Krambeck.",0,0,"Árvore, ca. de 6m de alt., frutos verdes. Na trilha.","BRA:UFJF:CESJ:0000058418","Cupania ludowigii Somner & Ferrucci"
"23",NA,"UFES","VIES","21346","Cupania ludowigii Somner & Ferrucci",NA,"Sapindaceae","Cupania","ludowigii","Somner & Ferrucci","Zorzanelli, J.P.F.","2012-03-29T00:00:00.000+0000",NA,"266",NA,"Zorzanelli, J.P.F.; Silva, A.E.",2011,12,31,"Brazil","Espírito Santo","Iúna","Serra do Valentim.",NA,NA,"SW2041","BRA:UFES:VIES:0000021346","Cupania ludowigii Somner & Ferrucci"
"24",NA,"USP","SPF","212983","Cupania ludowigii Somner & Ferrucci",NA,"Sapindaceae","Cupania","ludowigii","Somner & Ferrucci","Ferrucci, MS","2010-01-01T00:00:00.000+0000",NA,"149",NA,"Silva, KF",2010,2,18,"Brazil","Minas Gerais","Santana do Riacho","Serra do Cipó",-43.508028,-19.22975,NA,"BRA:USP:SPF:0000212983","Cupania ludowigii Somner & Ferrucci"
"26",NA,"Universidade Regional de Blumenau, FURB","FURB","38917","Cupania ludowigii Somner & Ferrucci",NA,"Sapindaceae","Cupania","ludowigii","Somner & Ferrucci","Ribas, OS","2010-10-01T00:00:00.000+0000",NA,"343",NA,"Uhlmann, A.",2010,4,5,"Brazil","Rio de Janeiro","Itaboraí","Área do COMPERJ.",-42.808889,-22.649722,NA,"BRA:FURB:FURB:0000038917","Cupania ludowigii Somner & Ferrucci"
"27",NA,"Universidade Regional de Blumenau, FURB","FURB","38898","Cupania ludowigii Somner & Ferrucci",NA,"Sapindaceae","Cupania","ludowigii","Somner & Ferrucci","Ribas, OS","2010-10-01T00:00:00.000+0000",NA,"345",NA,"Uhlmann, A.",2010,4,5,"Brazil","Rio de Janeiro","Itaboraí","Área do COMPERJ.",NA,NA,"bastante frequnte","BRA:FURB:FURB:0000038898","Cupania ludowigii Somner & Ferrucci"
"28",NA,"USP","SPF","212928","Cupania ludowigii Somner & Ferrucci",NA,"Sapindaceae","Cupania","ludowigii","Somner & Ferrucci","Silva, KF","2010-05-01T00:00:00.000+0000",NA,"170",NA,"Silva, KF",2010,5,28,"Brazil","Minas Gerais","Itambé do Mato Dentro","Serra do Cipó",-43.401722,-19.397583,NA,"BRA:USP:SPF:0000212928","Cupania ludowigii Somner & Ferrucci"
"29",NA,"IPA","IPA","84927","Cupania ludowigii Somner & Ferrucci",NA,"Sapindaceae","Cupania","ludowigii","Somner & Ferrucci","Pereira, L.A.","2012-09-28T00:00:00.000+0000",NA,"312",NA,"Silva, L.R.",2010,7,8,"Brazil","Pernambuco","Gravatá","Engenho Jussara, Mata Benedito.",0,0,"Árvore ca. 8,5m de altura; folhas levemente coriáceas; frutos imaturos verdes.","BRA:IPA:IPA:0000084927","Cupania ludowigii Somner & Ferrucci"
"31",NA,"Universidade Regional de Blumenau, FURB","FURB","42339","Cupania ludowigii Somner & Ferrucci",NA,"Sapindaceae","Cupania","ludowigii","Somner & Ferrucci","Uhlmann, A","2013-10-08T00:00:00.000+0000",NA,"608",NA,"Uhlmann, A.",2010,8,6,"Brazil","Rio de Janeiro","Cachoeiras de Macacu","Parque Estadual Três Picos.",-42.609444,-22.419722,NA,"BRA:FURB:FURB:0000042339","Cupania ludowigii Somner & Ferrucci"
"32",NA,"Reserva Natural Vale (CVRD)","CVRD","13116","Cupania ludowigii Somner & Ferrucci",NA,"Sapindaceae","Cupania","ludowigii","Somner & Ferrucci","Geovane S. Siqueira","2011-05-16T00:00:00.000+0000",NA,"6679",NA,"Folli, D.A.",2010,8,27,"Brazil","Es","GUAÇUÍ",NA,-41.709618,-20.892169,"<ll>dwc_commonname:</ll> Camboatá baratinha","BRA:CVRD:CVRD:0000013116","Cupania ludowigii Somner & Ferrucci"
"34",NA,"UFPR","UPCB","85306","Cupania ludowigii Somner & Ferrucci",NA,"Sapindaceae","Cupania","ludowigii","Somner & Ferrucci","Uhlmann, A.","2010-08-06T00:00:00.000+0000",NA,"362",NA,"Uhlmann, A. et al.",2010,8,6,"Brazil","Rio de Janeiro","Cachoeiras de Macaú","Parque Estadual de Três Picos",-42.609444,-22.419722,"Árvore 12 m, com frutos imaturos, em floresta alterada..","BRA:UFPR:UPCB:0000085306","Cupania ludowigii Somner & Ferrucci"
"36",NA,"Reserva Natural Vale (CVRD)","CVRD","13178","Cupania ludowigii Somner & Ferrucci",NA,"Sapindaceae","Cupania","ludowigii","Somner & Ferrucci","Geovane S. Siqueira","2011-05-16T00:00:00.000+0000",NA,"6729",NA,"Folli, D.A.",2010,9,28,"Brazil","Es","SANTA TERESA",NA,-40.496607,-19.964271,"<ll>dwc_commonname:</ll> Camboatá baratinha","BRA:CVRD:CVRD:0000013178","Cupania ludowigii Somner & Ferrucci"
"37",NA,"US","Botany","3637647","Cupania ludowigii Somner & Ferrucci",NA,"Sapindaceae","Cupania","ludowigii","Somner & Ferrucci","Acevedo-Rodríguez, P., (BOT), Smithsonian Institution - National Museum of Natural History (UNITED STATES)",NA,NA,"6729",NA,"D. Folli",2010,9,28,"Brazil","Espirito Santo",NA,"Santa Teresa, Sta. Teresa/Sta. Maria Jetibá",NA,NA,NA,"http://n2t.net/ark:/65665/311d41827-a543-4a78-b30c-906728d11539","Cupania ludowigii Somner & Ferrucci"
"38",NA,"Universidade Federal da Bahia (UFBA)","ALCB","88901","Cupania ludowigii Somner & Ferrucci",NA,"Sapindaceae","Cupania","ludowigii","Somner & Ferrucci","Ferrucci, MS; Perdiz, R","2010-11-16T00:00:00.000+0000",NA,"2050",NA,"Roque, N; Alunos de Botânica III",2009,5,23,"Brazil","Bahia","Mucugê","Chapada Diamantina, trilha Cruzeiro dos Bêbados até Medonha",-41.366667,-13,"ca. 6m alt., folhas levemente discolores. Fruto imaturo verde, fruto maduro amarelo-castanho.; ecótono entre campos rupestre e Mata Semidecídua.","BRA:UFBA:ALCB:0000088901","Cupania ludowigii Somner & Ferrucci"
"40",NA,"Universidade Federal de Juiz de Fora (UFJF)","CESJ","53844","Cupania ludowigii Somner & Ferrucci",NA,"Sapindaceae","Cupania","ludowigii","Somner & Ferrucci","G.V.Somner","2010-05-27T00:00:00.000+0000",NA,"168",NA,"J.H.C. Ribeiro; F.S. Souza; J.A. Oliveira",2009,7,16,"Brazil","Minas Gerais","Lima Duarte","Serra Negra, Fazenda Serra Negra. Estrada para a Cachoeira do Véber.",0,0,"Arvoreta, 3m, no campo rupestre degradado. Frutos imaturos verdes.","BRA:UFJF:CESJ:0000053844","Cupania ludowigii Somner & Ferrucci"
"41","2016-10-04T14:36:24.000+0000","JBRJ","RB","RB01183578","Cupania ludowigii Somner & Ferrucci",NA,"Sapindaceae","Cupania","ludowigii","Somner & Ferrucci","L.S. Leoni","2010-05-13T00:00:00.000+0000",NA,"19",NA,"M.A. Cupertino; C.R. Reis",2009,12,19,"Brazil","Minas Gerais","Caratinga","Pedra Itaúna.",NA,NA,NA,"urn:catalog:JBRJ:RB:1183578","Cupania ludowigii Somner & Ferrucci"
"42","2016-10-04T14:37:34.000+0000","JBRJ","RB","RB01183583","Cupania ludowigii Somner & Ferrucci",NA,"Sapindaceae","Cupania","ludowigii","Somner & Ferrucci","L.S. Leoni",NA,NA,"33",NA,"C.A.S. Silva",2009,12,19,"Brazil","Minas Gerais","Caputira","Fazendas Dutra/Santa Helena.",NA,NA,NA,"urn:catalog:JBRJ:RB:1183583","Cupania ludowigii Somner & Ferrucci"
"43",NA,"USP","SPF","196505","Cupania ludowigii Somner & Ferrucci",NA,"Sapindaceae","Cupania","ludowigii","Somner & Ferrucci","Ferrucci, MS","2009-01-01T00:00:00.000+0000",NA,"110",NA,"Serafim, H",2008,1,13,"Brazil","São Paulo","São José do Barreiro",NA,-44.661444,-22.638611,NA,"BRA:USP:SPF:0000196505","Cupania ludowigii Somner & Ferrucci"
"44",NA,"IF","SPSF","39967","Cupania ludowigii Somner & Ferrucci",NA,"Sapindaceae","Cupania","ludowigii","Somner & Ferrucci","L.A.Pereira","2012-08-27T00:00:00.000+0000",NA,"1065",NA,"F.M.Souza & R.C.Sousa & D.Souza & L.G.L.Araújo",2008,2,25,"Brazil","Sp","São Paulo","Parque Estadual do Jaraguá",-46.766111,-23.473889,"COLETA: Árvore, 15m. Botões amarelados e perfumados.; GEOGRAFIA: Trilha das Garças;","BRA:IF:SPSF:0000039967","Cupania ludowigii Somner & Ferrucci"
"45",NA,"MBML","MBML-HERBARIO","33495","Cupania ludowigii Somner & Ferrucci",NA,"Sapindaceae","Cupania","ludowigii","Somner & Ferrucci","R. Perdiz/2011",NA,NA,"1557",NA,"M. Simonelli; F. A. R. Matos, L. F. Magnago",2008,4,13,"Brazil","Espírito Santo","Santa Leopoldina","Suiça",-40.615,-20.087778,"frutos verdes, 8 m. de altura","BRA:MBML:MBML-HERBARIO:0000033495","Cupania ludowigii Somner & Ferrucci"
"46","2016-10-04T14:54:30.000+0000","JBRJ","RB","RB01183604","Cupania ludowigii Somner & Ferrucci",NA,"Sapindaceae","Cupania","ludowigii","Somner & Ferrucci","M.S. Ferrucci","2009-01-01T00:00:00.000+0000",NA,"151",NA,"M.J.R. Rocha",2008,6,15,"Brazil","Minas Gerais","Faria Lemos","Fazenda Santa Rita, parcela 9, nº 41.",NA,NA,NA,"urn:catalog:JBRJ:RB:1183604","Cupania ludowigii Somner & Ferrucci"
"47",NA,"US","Botany","3592791","Cupania ludowigii Somner & Ferrucci",NA,"Sapindaceae","Cupania","ludowigii","Somner & Ferrucci","Acevedo-Rodríguez, P., (BOT), Smithsonian Institution - National Museum of Natural History (UNITED STATES)",NA,NA,"6158",NA,"D. Folli",2008,7,20,"Brazil","Espirito Santo",NA,"Guaçuí, Parc 17, Sao José Calçcado",NA,NA,NA,"http://n2t.net/ark:/65665/37a4be658-046d-4b7a-aefc-948f06680041","Cupania ludowigii Somner & Ferrucci"
"48","2017-10-18T17:07:16.000+0000","JBRJ","RB","RB00544731","Cupania ludowigii Somner & Ferrucci",NA,"Sapindaceae","Cupania","ludowigii","Somner & Ferrucci","Ferrucci","2010-01-01T00:00:00.000+0000",NA,"5404",NA,"A. P. Fontana; L. Kollmann, C. N. Fraga, P. Labiak, R. Goldenberg, P. Vianna, M. Saavedra, Tedesco",2008,7,17,"Brazil","Espírito Santo","Castelo","Trilha para as piscinas. Floresta Ombrófila Densa Altomontana com inselbergues. Parque Estadual do Forno Grande",-41.083611,-20.516111,"Árvore, 6m. Frutoa verdes.","urn:catalog:JBRJ:RB:544731","Cupania ludowigii Somner & Ferrucci"
"50",NA,"Reserva Natural Vale (CVRD)","CVRD","11378","Cupania ludowigii Somner & Ferrucci",NA,"Sapindaceae","Cupania","ludowigii","Somner & Ferrucci","Pedro Acevedo Rodriguez","2011-03-21T00:00:00.000+0000",NA,"6158",NA,"Folli, D.A.",2008,7,20,"Brazil","Es","GUAÇUÍ","Parc. 17",-41.708438,-20.893325,"<ll>dwc_commonname:</ll> Camboatá baratinha","BRA:CVRD:CVRD:0000011378","Cupania ludowigii Somner & Ferrucci"
"51",NA,"Universidade Federal de Juiz de Fora (UFJF)","CESJ","52017","Cupania ludowigii Somner & Ferrucci",NA,"Sapindaceae","Cupania","ludowigii","Somner & Ferrucci","D.S. Pifano","2012-03-21T00:00:00.000+0000",NA,"647",NA,"L. Menini Neto; I.A. Costa, PAglais, A",2008,8,20,"Brazil","Minas Gerais","Juiz de Fora","Área de Proteção Ambiental Mata do Krambeck",0,0,"Árvore, ca. 8m alt., frequente na borda e interior de mata, frutos imaturos verdes.","BRA:UFJF:CESJ:0000052017","Cupania ludowigii Somner & Ferrucci"
"52",NA,"Universidade Federal de Juiz de Fora (UFJF)","CESJ","51689","Cupania ludowigii Somner & Ferrucci",NA,"Sapindaceae","Cupania","ludowigii","Somner & Ferrucci","D.S. Pifano","2012-03-21T00:00:00.000+0000",NA,"627",NA,"L. Menini Neto; T.M. Machado, IACosta, B",2008,8,30,"Brazil","Minas Gerais","Juiz de Fora","Área de Proteção Ambiental Mata do Krambeck",0,0,"Árvore, ca. 10m alt., no interior da mata, frutos maduros amarelos.","BRA:UFJF:CESJ:0000051689","Cupania ludowigii Somner & Ferrucci"
"53","2016-10-04T14:45:24.000+0000","JBRJ","RB","RB01183596","Cupania ludowigii Somner & Ferrucci",NA,"Sapindaceae","Cupania","ludowigii","Somner & Ferrucci","M.S. Ferrucci","2009-01-01T00:00:00.000+0000",NA,"177",NA,"M.J.R. Rocha",2008,10,15,"Brazil","Minas Gerais","Faria Lemos","Fazenda Santa Rita, parcela 91, nº 4.",NA,NA,NA,"urn:catalog:JBRJ:RB:1183596","Cupania ludowigii Somner & Ferrucci"
"54",NA,"Instituto Plantarum de Estudos da Flora Ltda (HPL)","HPL","7039","Cupania ludowigii Somner & Ferrucci",NA,"Sapindaceae","Cupania","ludowigii","Somner & Ferrucci","Coelho, R.L.S.","2010-04-14T00:00:00.000+0000",NA,"1624",NA,"R. Tsuji, H. Lorenzi et al.",2007,1,31,"Brazil","Mg","Carangola","Coletado em borda de estrada próximo à cidade.",NA,NA,NA,"BRA:JBP:HPL:0000007039","Cupania ludowigii Somner & Ferrucci"
"55","2017-10-16T23:27:39.000+0000","JBRJ","RB","RB00611364","Cupania ludowigii Somner & Ferrucci",NA,"Sapindaceae","Cupania","ludowigii","Somner & Ferrucci","G.V. Somner","2013-01-30T00:00:00.000+0000",NA,"1780",NA,"Cláudia M.Vieira; M.A.Louzada & I.Aximoff",2007,4,6,"Brazil","Rio de Janeiro","Itaboraí","Fazenda Pedra Bonita.",NA,NA,"Árvore na borda da mata.Folhas verdes discolores.Frutos verdes.","urn:catalog:JBRJ:RB:611364","Cupania ludowigii Somner & Ferrucci"
"56","2016-10-04T14:53:05.000+0000","JBRJ","RB","RB01183603","Cupania ludowigii Somner & Ferrucci",NA,"Sapindaceae","Cupania","ludowigii","Somner & Ferrucci","M.S. Ferrucci","2009-01-01T00:00:00.000+0000",NA,"42",NA,"J.P.D. Heleno",2007,5,1,"Brazil","Minas Gerais","Dores do Turvo","Fazenda Beira Rio.",NA,NA,NA,"urn:catalog:JBRJ:RB:1183603","Cupania ludowigii Somner & Ferrucci"
"57",NA,"Universidade Federal da Bahia (UFBA)","ALCB","78102","Cupania ludowigii Somner & Ferrucci",NA,"Sapindaceae","Cupania","ludowigii","Somner & Ferrucci","Ferrucci, MS; Perdiz, R","2010-11-16T00:00:00.000+0000",NA,"13315",NA,"Guedes, ML; Alunos de Botânica Econômica",2007,5,1,"Brazil","Bahia","Mucugê","Chapada Diamantina, Próximo ao cemitério",-41.340833,-12.988333,"de ca 4m. Folhas com foliolos coriáceos, discolores. Frutos imaturos verdes. Ocasional.","BRA:UFBA:ALCB:0000078102","Cupania ludowigii Somner & Ferrucci"
"58",NA,"Universidade Federal de Juiz de Fora (UFJF)","CESJ","48918","Cupania ludowigii Somner & Ferrucci",NA,"Sapindaceae","Cupania","ludowigii","Somner & Ferrucci","D.S. Pifano","2012-03-21T00:00:00.000+0000",NA,"402",NA,"L. Menini Neto; M.A. Manhães; A.L. Santiago",2007,5,11,"Brazil","Minas Gerais","Juiz de Fora","Mata do Krambeck",0,0,"Arvoreta, no interior da mata, sub-bosque, semi-escandente, frutos creme.","BRA:UFJF:CESJ:0000048918","Cupania ludowigii Somner & Ferrucci"
"59",NA,"USP","SPF","198116","Cupania ludowigii Somner & Ferrucci",NA,"Sapindaceae","Cupania","ludowigii","Somner & Ferrucci","Silva","2010-03-01T00:00:00.000+0000",NA,"140",NA,"Santos, MF",2007,8,24,"Brazil","Minas Gerais","Itambé do Mato Dentro","Serra do Cipó",-43.401611,-19.397,NA,"BRA:USP:SPF:0000198116","Cupania ludowigii Somner & Ferrucci"
"60",NA,"IF","SPSF","40040","Cupania ludowigii Somner & Ferrucci",NA,"Sapindaceae","Cupania","ludowigii","Somner & Ferrucci","L.A.Pereira","2012-08-27T00:00:00.000+0000",NA,"196",NA,"R.Esteves & R.C.Sousa & J.B.Silva & A.N.Oliveira",2007,8,8,"Brazil","Sp","São Paulo","Parque Estadual do Jaraguá",-46.774722,-23.453611,"COLETA: Árvore, 18m. Frutos verdes.; GEOGRAFIA: Trilha do Mauro;","BRA:IF:SPSF:0000040040","Cupania ludowigii Somner & Ferrucci"
"61",NA,"UEFS","HUEFS","141416","Cupania ludowigii Somner & Ferrucci",NA,"Sapindaceae","Cupania","ludowigii","Somner & Ferrucci","R.Perdiz","2010-08-01T00:00:00.000+0000",NA,"2287",NA,"Rezende, S.G.",2007,10,9,"Brazil","Minas Gerais","Santa Bárbara","Região Semidouro.",-43.501667,-20.023056,NA,"BRA:UEFS:HUEFS:0000141416","Cupania ludowigii Somner & Ferrucci"
"62",NA,"USP","SPF","196504","Cupania ludowigii Somner & Ferrucci",NA,"Sapindaceae","Cupania","ludowigii","Somner & Ferrucci","Ferrucci, MS","2009-01-01T00:00:00.000+0000",NA,"111",NA,"Serafim, H",2007,10,28,"Brazil","São Paulo","São José do Barreiro",NA,-44.656667,-22.642778,NA,"BRA:USP:SPF:0000196504","Cupania ludowigii Somner & Ferrucci"
"63",NA,"Escola Superior de Agricultura Luiz de Queiroz, ESALQ","ESA","ESA132679","Cupania ludowigii Somner & Ferrucci",NA,"Sapindaceae","Cupania","ludowigii","Somner & Ferrucci","Coelho, R.L.G.","2011-08-15T00:00:00.000+0000",NA,"8950",NA,"Kollmann, L. ; Kollmann, R.L.",2006,4,29,"Brazil","Espírito Santo","Castelo",NA,NA,NA,NA,"BRA:ESALQ:ESA:0ESA132679","Cupania ludowigii Somner & Ferrucci"
"64",NA,"Escola Superior de Agricultura Luiz de Queiroz, ESALQ","ESA","ESA132665","Cupania ludowigii Somner & Ferrucci",NA,"Sapindaceae","Cupania","ludowigii","Somner & Ferrucci","Coelho, R.L.G.","2012-09-14T00:00:00.000+0000",NA,"8860",NA,"Kollmann, L. et al.",2006,4,26,"Brazil","Espírito Santo","Santa Teresa",NA,NA,NA,NA,"BRA:ESALQ:ESA:0ESA132665","Cupania ludowigii Somner & Ferrucci"
"65",NA,"MBML","MBML-HERBARIO","28385","Cupania ludowigii Somner & Ferrucci",NA,"Sapindaceae","Cupania","ludowigii","Somner & Ferrucci","R. Perdiz/2011",NA,NA,"1060",NA,"L. F. S. Magnago; V. Demuner, T. Cruz e Elias Bausen",2006,5,18,"Brazil","Espírito Santo","Santa Leopoldina","Morro Agudo, Prop.: Dona Maria",-40.431667,-20.093889,"Árvore 22m de alt. DAP 65cm. Fuste 4m. Frutos verdes. Mata em estágio de regeneração.","BRA:MBML:MBML-HERBARIO:0000028385","Cupania ludowigii Somner & Ferrucci"
"66","2014-07-07T18:21:30.000+0000","JBRJ","RB","RB00549794","Cupania ludowigii Somner & Ferrucci",NA,"Sapindaceae","Cupania","ludowigii","Somner & Ferrucci","G.V. Somner",NA,NA,"620",NA,"C. V. Vidal; W. A. C. Carvalho",2006,7,27,"Brazil","Minas Gerais","São Gonçalo do Rio Abaixo","CVRD, Projeto Barragem Norte da Mina de Brucutu, Rio Una.",NA,NA,"Arbóreo.","urn:catalog:JBRJ:RB:549794","Cupania ludowigii Somner & Ferrucci"
