"","modified","institutionCode","collectionCode","catalogNumber","scientificName","identificationQualifier","family","genus","specificEpithet","infraspecificEpithet","scientificNameAuthorship","identifiedBy","dateIdentified","typeStatus","recordNumber","fieldNumber","recordedBy","year","month","day","country","stateProvince","municipality","locality","decimalLongitude","decimalLatitude","occurrenceRemarks","occurrenceID","bibliographicCitation","acceptedNameUsage","comments"
"467",NA,"IF","SPSF","08569","Cupania racemosa Radlk.",NA,"Sapindaceae","Cupania","racemosa",NA,"Radlk.",NA,NA,NA,NA,NA,"J.P.M. Carvalho & D.A.Pereira",1984,7,10,"Brazil","Sp","Campos do Jordão","P.E. de Campos do Jordão",NA,NA,"COLETA: XLS: SPSFAntigo;","BRA:IF:SPSF:0000008569",NA,"Cupania racemosa Radlk.",NA
"468",NA,"MBML","MBML-HERBARIO","3388","Cupania racemosa Radlk.",NA,"Sapindaceae","Cupania","racemosa",NA,"Radlk.","Genise V. Sommer/22-09-1990",NA,NA,"219",NA,"R. M. Pizziolo",1984,8,1,"Brazil","Espírito Santo","Fundão","Três Barras",-40.449444,-19.925,"Arbusto com 4m, frutos jovens, solo escuro.","BRA:MBML:MBML-HERBARIO:0000003388",NA,"Cupania racemosa Radlk.",NA
"469","2017-10-19T03:43:20.000+0000","JBRJ","RB","RB00385104","Cupania racemosa Radlk.",NA,"Sapindaceae","Cupania","racemosa",NA,"Radlk.","María S. Ferrucci & Genise V. Somner","2006-01-01T00:00:00.000+0000",NA,"369",NA,"F. Souza Santos; et.al",1984,9,18,"Brazil","Bahia","Santa Cruz de Cabrália","Área da Estação Ecológica do Pau-Brasil ( ESPAB ), cerca de 16 km a W de Porto Seguro. Rodovia BR 367 ( Porto Seguro/ Eunápolis ). . Estação Ecológica do Pau-Brasil",-39.133333,-16.383333,"Árvore de 4 m de altura, flores branca e botôes  marrons.","urn:catalog:JBRJ:RB:385104",NA,"Cupania racemosa Radlk.",NA
"470","2017-10-19T03:41:51.000+0000","JBRJ","RB","RB00383553","Cupania racemosa Radlk.",NA,"Sapindaceae","Cupania","racemosa",NA,"Radlk.","G.V. Somner",NA,NA,"2166",NA,"H.C. de Lima; Cyl F.C. de Sá, J. Hatton",1984,10,14,"Brazil","Rio de Janeiro","Magé","Paraíso, área do Centro de Primatologia do Rio de Janeiro. Centro de Primatologia",NA,NA,"arvoreta, 7m, folhas discolores verdes, frutos imaturos castanhos esverdeados; sementes nigrescentes com arilo amarelo alaranjado; DAP 80cm","urn:catalog:JBRJ:RB:383553",NA,"Cupania racemosa Radlk.",NA
"471","2017-10-10T19:31:22.000+0000","JBRJ","RB","RB00450088","Cupania racemosa Radlk.",NA,"Sapindaceae","Cupania","racemosa",NA,"Radlk.","O. Thier","2011-03-31T00:00:00.000+0000",NA,"11",NA,"L.Pinder",1984,11,17,"Brazil","Rio de Janeiro","Rio de Janeiro",NA,NA,NA,NA,"urn:catalog:JBRJ:RB:450088",NA,"Cupania racemosa Radlk.",NA
"472",NA,"MBML","MBML-HERBARIO","4873","Cupania racemosa Radlk.",NA,"Sapindaceae","Cupania","racemosa",NA,"Radlk.","R. Perdiz/2011",NA,NA,"619",NA,"B. Weinberg",1983,5,10,"Brazil","Espírito Santo","Vitória","Goiabeiras, UFES",-40.304444,-20.276667,NA,"BRA:MBML:MBML-HERBARIO:0000004873",NA,"Cupania racemosa Radlk.",NA
"473","2015-09-05T07:12:48.000+0000","MNHN","P","P04857286","Cupania racemosa Radlk.",NA,"Sapindaceae","Cupania","racemosa",NA,"Radlk.",NA,NA,NA,NA,216,"Cardoso, J.",1983,7,16,"Brazil","Rio de Janeiro",NA,NA,NA,NA,NA,"http://coldb.mnhn.fr/catalognumber/mnhn/p/p04857286",NA,"Cupania racemosa Radlk.",NA
"474","2014-09-26T00:00:00.000+0000","Instituto Nacional de Pesquisas da Amazônia (INPA)","Coleção Botânica, Instituto Nacional de Pesquisas da Amazônia (INPA)","124668","Cupania racemosa Radlk.",NA,"Sapindaceae","Cupania","racemosa",NA,"Radlk.",NA,NA,NA,"46767",NA,"Hatschbach, GG",1983,8,6,"Brazil","Espírito Santo",NA,"Ponta do Mansaraz",NA,NA,NA,"urn:catalog:inpa:herbarium:67694",NA,"Cupania racemosa Radlk.",NA
"475","2017-10-10T17:45:25.000+0000","JBRJ","RB","RB00383550","Cupania racemosa Radlk.",NA,"Sapindaceae","Cupania","racemosa",NA,"Radlk.","G. V. Somner","2005-11-11T00:00:00.000+0000",NA,"358",NA,"R. R. Guedes; et al",1983,8,20,"Brazil","Rio de Janeiro","Magé",NA,NA,NA,"Árvore, ca. 5m. Folhas compostas alternas- espiraladas. Frutificada. Frutos ainda verdes, parecendo ser uma capsula triolocular.","urn:catalog:JBRJ:RB:383550",NA,"Cupania racemosa Radlk.",NA
"476",NA,"US","Botany","3034593","Cupania racemosa Radlk.",NA,"Sapindaceae","Cupania","racemosa",NA,"Radlk.","Pennington, T. D., (K)",NA,NA,"46767",NA,"G. Hatschbach",1983,8,6,"Brazil","Espírito Santo",NA,"Mun. Linhares, Ponta do Mansaraz.",NA,NA,NA,"http://n2t.net/ark:/65665/3978f3113-268d-42bc-a79f-4d35806ff625",NA,"Cupania racemosa Radlk.",NA
"477",NA,"NY","NY","448009","Cupania racemosa Radlk.",NA,"Sapindaceae","Cupania","racemosa",NA,"Radlk.","T. D. Pennington",NA,NA,"46767",NA,"G. G. Hatschbach",1983,8,6,"Brazil","EspÃ­rito Santo",NA,"Ponta do Mansaraz.",-40.071853011446,-19.3949002236543,NA,"7106a6cf-49f4-4709-9b22-9ab450236aa7",NA,"Cupania racemosa Radlk.",NA
"478","2008-05-27T22:02:00.000+0000","MO","MO","2993621","Cupania racemosa Radlk.",NA,"Sapindaceae","Cupania","racemosa",NA,"Radlk.","M.S. Ferrucci","1984-01-01T00:00:00.000+0000",NA,"Hatschbach 46767",NA,"Gert G. Hatschbach",1983,8,6,"Brazil","Espírito Santo",NA,"Ponta do Mansaraz (mun. Linhares).",NA,NA,NA,"urn:catalog:MO:Tropicos:2993621","http://www.tropicos.org/Specimen/2993621","Cupania racemosa Radlk.",NA
"479",NA,"IPA","IPA","32055","Cupania racemosa Radlk.",NA,"Sapindaceae","Cupania","racemosa",NA,"Radlk.","Pereira, L.A.","2012-09-28T00:00:00.000+0000",NA,"CFPE663",NA,"Lima, R.; Chiappeta, A.; Barreto, R.; Lima, V.C.; Gallindo, F.; Chiappeta, A.; Barreto, R.; Lima, V.C.; Gallindo, F.",1983,9,13,"Brazil","Pernambuco","São Lourenço da Mata","Mata do Toró.",0,0,"Árvore ca. 5,0m de altura. Botões florais acastanhados protegidos por brácteas também acastanhadas; muito visitado por formigas.","BRA:IPA:IPA:0000032055",NA,"Cupania racemosa Radlk.",NA
"480",NA,"IPA","IPA","31940","Cupania racemosa Radlk.",NA,"Sapindaceae","Cupania","racemosa",NA,"Radlk.","Pereira, L.A.","2012-09-28T00:00:00.000+0000",NA,"97",NA,"Barreto, R.",1983,9,2,"Brazil","Pernambuco","Recife","Mata de Dois Irmãos. Estação da COMPESA. Açude do Prata. À beira do açude.",0,0,"Árvore ca. 6,5m de altura; tronco com 20cm de área DAP; flores com sépalas verdes e pétalas alvas. Habitada por Bromeliáceas.","BRA:IPA:IPA:0000031940",NA,"Cupania racemosa Radlk.",NA
"481",NA,"IPA","IPA","31943","Cupania racemosa Radlk.",NA,"Sapindaceae","Cupania","racemosa",NA,"Radlk.","Pereira, L.A.","2012-09-28T00:00:00.000+0000",NA,"99",NA,"Barreto, R.",1983,9,2,"Brazil","Pernambuco","Recife","Mata de Dois Irmãos. Estação da COMPESA. Açude do Prata.",0,0,"Árvore ca. 6m de altura; tronco com 20 cm de área DAP; frutos verdes imaturos.","BRA:IPA:IPA:0000031943",NA,"Cupania racemosa Radlk.",NA
"482",NA,"IPA","IPA","32082","Cupania racemosa Radlk.",NA,"Sapindaceae","Cupania","racemosa",NA,"Radlk.","Pereira, L.A.","2012-09-28T00:00:00.000+0000",NA,"CFPE839",NA,"Chiappeta, A.; Lima, V.C.; Barreto, R.; Lima, V.C.; Barreto, R.",1983,11,30,"Brazil","Pernambuco","Camaragibe","Sítio Sapucaia.",0,0,"Arboreta ca. 3,5m de altura, frutos verdes, castanhos quando maduros, sementes castanho-escuras muito lustrosas.","BRA:IPA:IPA:0000032082",NA,"Cupania racemosa Radlk.",NA
"483",NA,"IPA","IPA","32175","Cupania racemosa Radlk.",NA,"Sapindaceae","Cupania","racemosa",NA,"Radlk.","Pereira, L.A.","2012-09-28T00:00:00.000+0000",NA,"CFPE859",NA,"Barreto, R.; Lima, R.; Lima, R.",1983,12,14,"Brazil","Pernambuco","Recife","Dois Irmãos. Estação da COMPESA. Açude do Prata.",0,0,"Árvore ca. 5-6 m de altura; ca. 15 cm em DAP; frutos imaturos verdes, tendendo a róseas com o amadurecimento.","BRA:IPA:IPA:0000032175",NA,"Cupania racemosa Radlk.",NA
"484","2014-07-07T22:02:43.000+0000","JBRJ","RB","RB00674021","Cupania racemosa Radlk.",NA,"Sapindaceae","Cupania","racemosa",NA,"Radlk.","Graziela Barroso",NA,NA,"374",NA,"R.H.P. Andreata",1982,1,14,"Brazil","Rio de Janeiro","Niterói","Itaipuaçú, Pico Alto Moirão.",NA,NA,"Árvore, estéril, altura de 3 m, diâmetro de 5 cm.","urn:catalog:JBRJ:RB:674021",NA,"Cupania racemosa Radlk.",NA
"485",NA,"UNICAMP","UEC","45230","Cupania racemosa Radlk.",NA,"Sapindaceae","Cupania","racemosa",NA,"Radlk.","Leitão Filho, H.F.",NA,NA,"s.n.",NA,"Bertoni, J.E.A.",1982,6,22,"Brazil","São Paulo","Porto Ferreira","Reserva estadual",0,0,"Árvore, 6m, no cerrado, com flores creme.; Cerrado.","BRA:UNICAMP:UEC:0000045230",NA,"Cupania racemosa Radlk.",NA
"486",NA,"MBML","MBML-HERBARIO","4828","Cupania racemosa Radlk.",NA,"Sapindaceae","Cupania","racemosa",NA,"Radlk.","Genise V. Sommer/15-03-1993",NA,NA,"404",NA,"B. Weinberg",1982,7,NA,"Brazil","Espírito Santo","Guarapari","Setiba",-40.426389,-20.626944,"Árvore ornamental.","BRA:MBML:MBML-HERBARIO:0000004828",NA,"Cupania racemosa Radlk.",NA
"487",NA,"MBML","MBML-HERBARIO","4827","Cupania racemosa Radlk.",NA,"Sapindaceae","Cupania","racemosa",NA,"Radlk.","Genise V. Sommer/15-03-1993",NA,NA,"403",NA,"B. Weinberg",1982,7,NA,"Brazil","Espírito Santo","Guarapari","Setiba",-40.426389,-20.626944,"Árvore ornamental.","BRA:MBML:MBML-HERBARIO:0000004827",NA,"Cupania racemosa Radlk.",NA
"488",NA,"IPA","IPA","25968","Cupania racemosa Radlk.",NA,"Sapindaceae","Cupania","racemosa",NA,"Radlk.","Pereira, L.A.","2012-09-28T00:00:00.000+0000",NA,"05",NA,"Andrade-Lima; Rita Pereira; Bocage, A.; Rita Pereira; Bocage, A.",1981,6,8,"Brazil","Alagoas","Flexeiras","Fazenda São Lourenço. Dentro da mata. Solo areno-argiloso. Frequente.",0,0,"Árvore ca. 3-4 m de altura. Flores alvas.","BRA:IPA:IPA:0000025968",NA,"Cupania racemosa Radlk.",NA
"489",NA,"NY","NY","448018","Cupania racemosa Radlk.",NA,"Sapindaceae","Cupania","racemosa",NA,"Radlk.","T. D. Pennington",NA,NA,"732",NA,"A. M. V. de Carvalho",1981,7,18,"Brazil","Bahia",NA,"Litoral Sul. Cana Brava, 5 km ao S de OlivenÃ§a.",-39.0490868076529,-14.7929067831182,NA,"7e372ef3-f8b6-41ac-8b24-4b5b0ba1ee65",NA,"Cupania racemosa Radlk.",NA
"490","2014-09-26T00:00:00.000+0000","Instituto Nacional de Pesquisas da Amazônia (INPA)","Coleção Botânica, Instituto Nacional de Pesquisas da Amazônia (INPA)","120196","Cupania racemosa Radlk.",NA,"Sapindaceae","Cupania","racemosa",NA,"Radlk.",NA,NA,NA,"8938",NA,"Plowman, T",1980,2,19,"Brazil","Pará",NA,"100 Km south of Redenção on road (PA-150) to Barreiras dos Campos. Fazenda Inajaporã between Rio Inajazinho and Rio Inajá",-50.42,-8.75,NA,"urn:catalog:inpa:herbarium:126007",NA,"Cupania racemosa Radlk.",NA
"491",NA,"IMA","MAC","1114","Cupania racemosa Radlk.",NA,"Sapindaceae","Cupania","racemosa",NA,"Radlk.","E.C.O.Chagas","2009-03-16T00:00:00.000+0000",NA,"108",NA,"R.P.Lyra-Lemos",1980,3,17,"Brazil","Alagoas","Coruripe","Margem da AL-101, Ao Norte do p. de coruripe e sul do Rio Poxim.",-36.298889,-10.083333,"Área de cerrado, solo bem drenado-arenoso; Cerrado.","BRA:IMA:MAC:0000001114",NA,"Cupania racemosa Radlk.",NA
"492","2015-12-08T21:26:00.000+0000","MO","MO","2993515","Cupania racemosa Radlk.",NA,"Sapindaceae","Cupania","racemosa",NA,"Radlk.","T.D. Pennington","1994-01-01T00:00:00.000+0000",NA,"Mattos Silva 817",NA,"L.A. Mattos Silva|Talmon S. dos Santos",1980,5,21,"Brazil",NA,NA,"Município de Alcobaça. Km 32 da Rodovia Teixeira de Freitas/Alcobaça. Região de Mata Higrófila Sul Baiana. Mata bastante estragada. Solo sílico-argiloso. Alt. 50 m. Folha SE-24 (18-39a).",NA,NA,NA,"urn:catalog:MO:Tropicos:2993515","http://www.tropicos.org/Specimen/2993515","Cupania racemosa Radlk.",NA
"493",NA,"NY","NY","448019","Cupania racemosa Radlk.",NA,"Sapindaceae","Cupania","racemosa",NA,"Radlk.","T. D. Pennington",NA,NA,"817",NA,"L. A. Mattos Silva",1980,5,21,"Brazil","Bahia",NA,"Km 32 da Rodovia Teixeiraa de Freitas/Alcobaça. Folha SE-24 (18-39a).",-39.399574,-17.503488,NA,"2e7f4868-a5b6-4cd9-8258-e38a3fa06643",NA,"Cupania racemosa Radlk.",NA
"494",NA,"IPA","IPA","25539","Cupania racemosa Radlk.",NA,"Sapindaceae","Cupania","racemosa",NA,"Radlk.","Pereira, L.A.","2012-09-28T00:00:00.000+0000",NA,"IPA-25539",NA,"Andrade-Lima; Gallindo, F.; Correia-Lima; Gallindo, F.; Correia-Lima",1980,6,11,"Brazil","Alagoas","Messias","Engenho Oriente. Serra da Cachoeira.",0,0,"Arboreta esgalhada ca. 6m de altura. Flores creme-claras.","BRA:IPA:IPA:0000025539",NA,"Cupania racemosa Radlk.",NA
"495",NA,"IPA","IPA","30694","Cupania racemosa Radlk.",NA,"Sapindaceae","Cupania","racemosa",NA,"Radlk.","Pereira, L.A.","2012-09-28T00:00:00.000+0000",NA,"IPA-30694",NA,"Brito, Z.; Bocage, A.; Bocage, A.",1980,9,17,"Brazil","Pernambuco","Recife","Horto de Dois Irmãos.",0,0,NA,"BRA:IPA:IPA:0000030694",NA,"Cupania racemosa Radlk.",NA
"496","2014-09-26T00:00:00.000+0000","Instituto Nacional de Pesquisas da Amazônia (INPA)","Coleção Botânica, Instituto Nacional de Pesquisas da Amazônia (INPA)","110234","Cupania racemosa Radlk.",NA,"Sapindaceae","Cupania","racemosa",NA,"Radlk.",NA,NA,NA,"819",NA,"Nelson, BW",1980,10,26,"Brazil","Acre",NA,"Estrada Rio Branco-Porto Acre, km 8., Estrada Rio Branco - Quixadá, Km 8, sede da Colônia Cinco Mil (Seita do Cipó)",-67.83,-10,NA,"urn:catalog:inpa:herbarium:115417",NA,"Cupania racemosa Radlk.",NA
"497","2014-09-26T00:00:00.000+0000","Instituto Nacional de Pesquisas da Amazônia (INPA)","Coleção Botânica, Instituto Nacional de Pesquisas da Amazônia (INPA)","110243","Cupania racemosa Radlk.",NA,"Sapindaceae","Cupania","racemosa",NA,"Radlk.",NA,NA,NA,"828",NA,"Nelson, BW",1980,10,27,"Brazil","Acre",NA,"Estrada Rio Branco-Porto Acre, km 8., Estrada Rio Branco - Porto Acre, Km 8",-67.83,-10,NA,"urn:catalog:inpa:herbarium:115426",NA,"Cupania racemosa Radlk.",NA
"498",NA,"IPA","IPA","28113","Cupania racemosa Radlk.",NA,"Sapindaceae","Cupania","racemosa",NA,"Radlk.","Pereira, L.A.","2012-09-28T00:00:00.000+0000",NA,"11",NA,"Maia Filho, M.A.",1980,10,16,"Brazil","Pernambuco","Brejo da Madre de Deus","Propriedade Bituri. Mata de brejo, solo argiloso.",0,0,"Árvore ca. 10m de altura; frutos imaturos, verdes; semente preta com arilo amarelo. Frequente.","BRA:IPA:IPA:0000028113",NA,"Cupania racemosa Radlk.",NA
"499","2017-10-19T03:42:15.000+0000","JBRJ","RB","RB00383791","Cupania racemosa Radlk.",NA,"Sapindaceae","Cupania","racemosa",NA,"Radlk.","R.Perdiz","2011-01-01T00:00:00.000+0000",NA,"32",NA,"José C.C.Ururahy",1980,11,28,"Brazil",NA,"Brasil",NA,-42.384167,-22.404167,"Árvore de 6,5m, frutos verdes, frequência fraca.","urn:catalog:JBRJ:RB:383791",NA,"Cupania racemosa Radlk.",NA
"500","2014-07-22T14:02:47.000+0000","JBRJ","RB","RB00383749","Cupania racemosa Radlk.",NA,"Sapindaceae","Cupania","racemosa",NA,"Radlk.","R. Perdiz","2013-07-18T00:00:00.000+0000",NA,"991",NA,"E.F.Guimarães",1979,7,23,"Brazil","Bahia","Nova Viçosa","Fazenda Campo Grande.",NA,NA,"Arvoreta  frequente, comestivel pelos pássaros, folhas discolor brilhantes na face ventral","urn:catalog:JBRJ:RB:383749",NA,"Cupania racemosa Radlk.",NA
"501","2015-03-26T13:39:38.000+0000","JBRJ","RB","RB00383633","Cupania racemosa Radlk.",NA,"Sapindaceae","Cupania","racemosa",NA,"Radlk.","Genise V. Somner & María S. Ferrucci","2006-10-13T00:00:00.000+0000",NA,"080/78",NA,"J.S.",1978,5,8,"Brazil","Espírito Santo","Linhares","Reserva Florestal da CVRD. Jacarandá, ant. 232, 50 m antes da Est. de G. T-305. Reserva Florestal da CVRD",NA,NA,"Árvore em Floresta Alta, + 20 m de altura e fuste e ca. 15m, DAP 34 cm, diâmetro da copa + 8m. Com flor branca e botão verde-claro. Fuste cilíndrico e casca áspera.","urn:catalog:JBRJ:RB:383633",NA,"Cupania racemosa Radlk.",NA
"502","2014-12-15T13:31:10.000+0000","JBRJ","RB","RB00384174","Cupania racemosa Radlk.",NA,"Sapindaceae","Cupania","racemosa",NA,"Radlk.","R. Perdiz","2013-07-18T00:00:00.000+0000",NA,"10182",NA,"S.Mori; F.Benton e I.White",1978,6,17,"Brazil","Bahia","Una","Estrada que liga a Rod.BR 101 com BA 215 a 17 km da entrada.",NA,NA,"Árvore 5 m x 10 cm, flores brancas","urn:catalog:JBRJ:RB:384174",NA,"Cupania racemosa Radlk.",NA
"503",NA,"NY","NY","448008","Cupania racemosa Radlk.",NA,"Sapindaceae","Cupania","racemosa",NA,"Radlk.","T. D. Pennington",NA,NA,"80/78 - B",NA,"C. Raben",1978,8,10,"Brazil","EspÃ­rito Santo",NA,"Reserva Florestal do CVRD. Est. 232, 50 m antes da estrada do guarda, talhao 305.",-40.071853011446,-19.3949002236543,"Collector on label is: ""J.S.""","ec9c9046-9c7a-4156-a907-fe644302d226",NA,"Cupania racemosa Radlk.",NA
"504","2017-10-19T03:42:17.000+0000","JBRJ","RB","RB00383914","Cupania racemosa Radlk.",NA,"Sapindaceae","Cupania","racemosa",NA,"Radlk.","R.Perdiz","2011-01-01T00:00:00.000+0000",NA,"2051",NA,"G. Martinelli; et alli",1977,5,13,"Brazil","Espírito Santo","Linhares","Estrada do Barro.",NA,NA,"Umbrófila; folhas discolor; flores com cálice, verde-claro, corola alva, botões verdes.","urn:catalog:JBRJ:RB:383914",NA,"Cupania racemosa Radlk.",NA
"505",NA,"UNICAP","HUCPE","490","Cupania racemosa Radlk.",NA,"Sapindaceae","Cupania","racemosa",NA,"Radlk.","E. Tavares","1977-12-28T00:00:00.000+0000",NA,"275",NA,"Khlon, A.",1977,8,6,"Brazil","Maranhão",NA,"Km 151 - BR - Santa Inês - Açailandia (COMARCO). E",0,0,"Árvore com mais ou menos 20m de altura por 18cm de diâmetro. Flores alvas, perfumadas.","BRA:UNICAP:HUCPE:0000000490",NA,"Cupania racemosa Radlk.",NA
"506",NA,"UFOP","OUPR","22557","Cupania racemosa Radlk.",NA,"Sapindaceae","Cupania","racemosa",NA,"Radlk.","Badini, J.","1976-05-15T00:00:00.000+0000",NA,"s.n.",NA,"Badini, J.",1976,3,27,"Brazil","Minas Gerais","Ouro Preto","Granjeiras",0,0,"Mata. Árvore. Flores brancas","BRA:UFOP:OUPR:0000022557",NA,"Cupania racemosa Radlk.",NA
"507","2014-07-22T14:06:21.000+0000","JBRJ","RB","RB00383632","Cupania racemosa Radlk.",NA,"Sapindaceae","Cupania","racemosa",NA,"Radlk.","María S. Ferrucci & Genise V. Somner","2006-01-01T00:00:00.000+0000",NA,"667",NA,"M.C. Vianna; et.al",1976,4,2,"Brazil","Rio de Janeiro","Silva Jardim","Lagoa de Juturuaíba.",NA,NA,"Abusto a beira  da lagoa.","urn:catalog:JBRJ:RB:383632",NA,"Cupania racemosa Radlk.",NA
"508",NA,"UFOP","OUPR","22565","Cupania racemosa Radlk.",NA,"Sapindaceae","Cupania","racemosa",NA,"Radlk.","Lisboa, M.A.; Lisboa, C.E.",NA,NA,"s.n.",NA,"Badini, J.",1976,12,27,NA,NA,NA,NA,0,0,"Dentro das matas entre rochas de quartzito.","BRA:UFOP:OUPR:0000022565",NA,"Cupania racemosa Radlk.",NA
"509",NA,"UNICAP","HUCPE","345","Cupania racemosa Radlk.",NA,"Sapindaceae","Cupania","racemosa",NA,"Radlk.","E. Tavares","1975-09-02T00:00:00.000+0000",NA,"13384",NA,"Lima, D. .P.",1975,7,19,"Brazil","Maranhão","São Domingos","Fazenda São Dominguinhos.",-44.38266,-5.562126,"Árvore com mais ou menos 4m de altura por 3cm de diametro. Flores cor de gelo com perfume agradável.","BRA:UNICAP:HUCPE:0000000345",NA,"Cupania racemosa Radlk.",NA
"510",NA,"UEFS","HUEFS","216864","Cupania racemosa Radlk.",NA,"Sapindaceae","Cupania","racemosa",NA,"Radlk.",NA,NA,NA,"13384",NA,"Lima, D.P.",1975,7,19,"Brazil","Maranhão","São Domingos","Fazenda São Domiguinhos.",NA,NA,NA,"BRA:UEFS:HUEFS:0000216864",NA,"Cupania racemosa Radlk.",NA
"511","2015-07-08T14:53:26.000+0000","JBRJ","RB","RB00981583","Cupania racemosa Radlk.",NA,"Sapindaceae","Cupania","racemosa",NA,"Radlk.","E. Tavares",NA,NA,"13384",NA,"D.P. Lima",1975,7,19,"Brazil","Maranhão","São Domingos do Azeitão","Fazenda São Dominguinhos.",NA,NA,"Árvore ca 4 m alt.; 3 cm de diametro, flores cor de gelo com perfume agradável","urn:catalog:JBRJ:RB:981583",NA,"Cupania racemosa Radlk.",NA
"512",NA,"Universidade Estadual de Londrina, UEL","FUEL","16351","Cupania racemosa Radlk.",NA,"Sapindaceae","Cupania","racemosa",NA,"Radlk.","Tavares, E","1975-09-02T00:00:00.000+0000",NA,"13384",NA,"Lima, DP",1975,7,19,"Brazil","Maranhão","São Domingos","Fazenda São Dominguinhos",0,0,"Árvore ca. 4m alt por 3cm de diâmetro, flores cor de gelo com perfume agradavel","BRA:UEL:FUEL:0000016351",NA,"Cupania racemosa Radlk.",NA
"513",NA,"Universidade Federal Rural de Pernambuco, UFRPE","HST","20803","Cupania racemosa Radlk.",NA,"Sapindaceae","Cupania","racemosa",NA,"Radlk.","E.Tavares","1975-09-02T00:00:00.000+0000",NA,"13384",NA,"D.P.Lima",1975,7,19,"Brazil","Maranhão","São Domingos","Fazenda São Dominguinhos",NA,NA,"Árvore ca. 4m alt. por 3cm de diâmetro; flores cor de gelo com perfume agradável.","BRA:UFRPE:HST:0000020803",NA,"Cupania racemosa Radlk.",NA
"514",NA,"Universidade Federal de Juiz de Fora (UFJF)","CESJ","13424","Cupania racemosa Radlk.",NA,"Sapindaceae","Cupania","racemosa",NA,"Radlk.","G.M. Barroso","1979-10-09T00:00:00.000+0000",NA,"CESJ13424",NA,"L. Krieger",1974,11,20,"Brazil","Minas Gerais","Matias Barbosa","Sítio do Sossego",0,0,"Árvore regular, frutos maduros. Sementes providas de arilo alaranjado. Sementes negras. Material exclusivo da carpoteca.","BRA:UFJF:CESJ:0000013424",NA,"Cupania racemosa Radlk.",NA
"515","2014-07-22T14:17:44.000+0000","JBRJ","RB","RB00385075","Cupania racemosa Radlk.",NA,"Sapindaceae","Cupania","racemosa",NA,"Radlk.","María S. Ferrucci & Genise V. Somner","2006-01-01T00:00:00.000+0000",NA,"247",NA,"J. Spada",1973,5,5,"Brazil","Espírito Santo","Linhares","Reserva Florestal de Linhares( CVRD ). Depois da estrada contra mão a primeira do talhão 507. Reserva Florestal de Linhares",NA,NA,"Árvore com mais ou menos 6 m de altura, com fuste de mais ou menos 4 m de altura, com flor branca e botão floral verde.","urn:catalog:JBRJ:RB:385075",NA,"Cupania racemosa Radlk.",NA
"516","2014-07-22T14:02:39.000+0000","JBRJ","RB","RB00383740","Cupania racemosa Radlk.",NA,"Sapindaceae","Cupania","racemosa",NA,"Radlk.","G.V. Somner",NA,NA,"46",NA,"A.M.Lino",1972,5,22,"Brazil","Espírito Santo","Espírito Santo","Reserva Florestal de Linhares-C.V.R.D. Próximo Estrada 142 Talhão 402. Reserva Florestal de Linhares",NA,NA,"Árvore com ca. de 15m de altura com fuste de ca. de 10m de altura, com flor de cor amarela, botão floral amarelo.","urn:catalog:JBRJ:RB:383740",NA,"Cupania racemosa Radlk.",NA
"517",NA,"Reserva Natural Vale (CVRD)","CVRD","255","Cupania racemosa Radlk.",NA,"Sapindaceae","Cupania","racemosa",NA,"Radlk.","Pedro Acevedo Rodriguez","1992-03-15T00:00:00.000+0000",NA,"46",NA,"Lino, A.M",1972,5,22,"Brazil","Es","LINHARES","Próxima a um Óleo amarelo e uma Pelada",NA,NA,"<ll>dwc_commonname:</ll> Cambuatá mirim","BRA:CVRD:CVRD:0000000255",NA,"Cupania racemosa Radlk.",NA
"518","2017-10-19T03:42:16.000+0000","JBRJ","RB","RB00383902","Cupania racemosa Radlk.",NA,"Sapindaceae","Cupania","racemosa",NA,"Radlk.","G.V. Somner",NA,NA,"7701",NA,"D.Sucre",1971,9,22,"Brazil","Rio de Janeiro","Rio de Janeiro","Estrada da Vista Chinesa.",NA,NA,"Árvore com ca de 6m. de altura, umbróflo, crescendo em formação de mata, fruto ainda verde.","urn:catalog:JBRJ:RB:383902",NA,"Cupania racemosa Radlk.",NA
"519","2017-10-19T22:22:08.000+0000","JBRJ","RB","RB00383624","Cupania racemosa Radlk.",NA,"Sapindaceae","Cupania","racemosa",NA,"Radlk.","Genise V. Somner & Maria S. Ferrucci","2006-01-01T00:00:00.000+0000",NA,"7745",NA,"D. Sucre",1971,10,3,"Brazil","Rio de Janeiro","Rio de Janeiro","Est. da Guanabara, Mata do Rumo.",NA,NA,"Árvore com ca. 12mts. de altura. Fruto ainda verde; quando maduro muito comido por arapongas","urn:catalog:JBRJ:RB:383624",NA,"Cupania racemosa Radlk.",NA
"520",NA,"UFPE","UFP","03151","Cupania racemosa Radlk.",NA,"Sapindaceae","Cupania","racemosa",NA,"Radlk.","Oliveira, M.","1997-11-01T00:00:00.000+0000",NA,"592",NA,"Mariz, G.",1970,11,19,"Brazil","Pernambuco","Camaragibe","Mata de Camaragibe. Perto do açude.",0,0,"DESC:Árvore - frutos.;","BRA:UFPE:UFP:0000003151",NA,"Cupania racemosa Radlk.",NA
"521",NA,"NY","NY","448022","Cupania racemosa Radlk.",NA,"Sapindaceae","Cupania","racemosa",NA,"Radlk.","G. M. Barroso",NA,NA,"s.n.",NA,"R. Burle-Marx",1969,5,NA,"Brazil","Rio de Janeiro",NA,"Estado de Guanabara-Sitio de Roberto Burlemax.",-43.2076685470805,-22.9069598238154,"[Collector on labels reads: ""Roberto Burlemax""]","d9515d05-ae2c-4177-b342-126455fa46cf",NA,"Cupania racemosa Radlk.",NA
"522","2014-07-22T14:02:51.000+0000","JBRJ","RB","RB00383775","Cupania racemosa Radlk.",NA,"Sapindaceae","Cupania","racemosa",NA,"Radlk.",NA,NA,NA,"5487",NA,"D. Sucre",1969,7,12,"Brazil","Espírito Santo","Espírito Santo","Mata de Tabuleiro, situada do lado Norte da Sede da Reserva de Sooretama.",NA,NA,"Árvore com ca. 20m de altura.","urn:catalog:JBRJ:RB:383775",NA,"Cupania racemosa Radlk.",NA
"523","2017-11-19T09:07:18.000+0000","JBRJ","RB","RB00385132","Cupania racemosa Radlk.",NA,"Sapindaceae","Cupania","racemosa",NA,"Radlk.","María S. Ferrucci & Genise V. Somner",NA,NA,"5550",NA,"D. Sucre",1969,7,14,"Brazil","Espírito Santo","Espírito Santo","Mata  do  lado  norte  da  sede  Reserva  de  Sooretama.",NA,NA,"Árvore com mais ou menos 21 m de altura, fruto ainda verde , segundo os mateiros a madeira é dura.","urn:catalog:JBRJ:RB:385132",NA,"Cupania racemosa Radlk.",NA
"524",NA,"US","Botany","2840827","Cupania racemosa Radlk.",NA,"Sapindaceae","Cupania","racemosa",NA,"Radlk.","Guarim Neto, G.",NA,NA,"3521",NA,"R. Belém",1968,5,9,"Brazil","Espirito Santo",NA,"Bahia, Maraú, mata litorânea, 4 km ao Sul de Maraú.",NA,NA,NA,"http://n2t.net/ark:/65665/3c5a74754-cc08-4e85-8d09-afaaad6940cd",NA,"Cupania racemosa Radlk.",NA
"525",NA,NA,"Botany","U.1591792","Cupania racemosa Radlk.",NA,"Sapindaceae","Cupania","racemosa",NA,"Radlk.",NA,NA,NA,NA,NA,"Belém RP",1968,5,9,"Brazil",NA,NA,"Regiao Bahia-Esperito Santo. Bahia, Marau, mata litoranea, 4 km ao Sul de Marau.",NA,NA,NA,"http://data.biodiversitydata.nl/naturalis/specimen/U.1591792",NA,"Cupania racemosa Radlk.",NA
"526",NA,"NY","NY","448016","Cupania racemosa Radlk.",NA,"Sapindaceae","Cupania","racemosa",NA,"Radlk.","J. A. Kallunki",NA,NA,"3521",NA,"R. P. BelÃ©m",1968,5,9,"Brazil","Bahia",NA,"4 km ao Sul de MaraÃº.",-39.015412,-14.140141,NA,"688a0476-4314-4832-a95a-fcd7f8c904d6",NA,"Cupania racemosa Radlk.",NA
