"","modified","institutionCode","collectionCode","catalogNumber","scientificName","family","genus","specificEpithet","scientificNameAuthorship","identifiedBy","dateIdentified","typeStatus","recordNumber","recordedBy","year","month","day","country","stateProvince","municipality","locality","decimalLongitude","decimalLatitude","occurrenceRemarks","occurrenceID","bibliographicCitation","acceptedNameUsage","identificationQualifier","infraspecificEpithet","fieldNumber","comments"
"1","2014-09-26T00:00:00.000+0000","Instituto Nacional de Pesquisas da Amazônia (INPA)","Coleção Botânica, Instituto Nacional de Pesquisas da Amazônia (INPA)","232173","Caraipa rodriguesii Paula","Calophyllaceae","Caraipa","rodriguesii","Paula",NA,NA,NA,"1175",NA,2003,2,25,"Brazil","Amazonas",NA,"Reserva Florestal Adolpho Ducke., Rodovia Manaus-Itacoatiara, km 26. Trilha L-O3, km 3.5. Solo arenoso.",-59.94,-2.940641,NA,"urn:catalog:inpa:herbarium:215850",NA,"Caraipa rodriguesii Paula",NA,NA,NA,NA
"2","2014-09-26T00:00:00.000+0000","Instituto Nacional de Pesquisas da Amazônia (INPA)","Coleção Botânica, Instituto Nacional de Pesquisas da Amazônia (INPA)","232086","Caraipa rodriguesii Paula","Calophyllaceae","Caraipa","rodriguesii","Paula",NA,NA,NA,"1291","Castilho, CV",2003,5,17,"Brazil","Amazonas",NA,"Reserva Florestal Adolpho Ducke., Rodovia Manaus-Itacoatiara, km 26. Trilha L-O8, km 3.5. Solo arenoso.",-59.93,-2.984993,NA,"urn:catalog:inpa:herbarium:215375",NA,"Caraipa rodriguesii Paula",NA,NA,NA,NA
"3","2014-09-26T00:00:00.000+0000","Instituto Nacional de Pesquisas da Amazônia (INPA)","Coleção Botânica, Instituto Nacional de Pesquisas da Amazônia (INPA)","232246","Caraipa rodriguesii Paula","Calophyllaceae","Caraipa","rodriguesii","Paula",NA,NA,NA,"1285","Castilho, CV",2003,5,16,"Brazil","Amazonas",NA,"Reserva Florestal Adolpho Ducke., Rodovia Manaus-Itacoatiara, km 26. Trilha L-O8, km 3.5. Solo arenoso.",-59.93,-2.984993,NA,"urn:catalog:inpa:herbarium:215371",NA,"Caraipa rodriguesii Paula",NA,NA,NA,NA
"4","2016-01-04T14:41:00.000+0000","MO","MO","3083589","Caraipa rodriguesii Paula","Calophyllaceae","Caraipa","rodriguesii","Paula","F.N. Cabral","2015-01-01T00:00:00.000+0000",NA,"Assunção 836","P. A. Costa Lima Assunção|C. Fernandes da Silva|E. da C. Pereira",1998,4,13,"Brazil","Amazonas",NA,"Reserva Florestal Ducke, Manaus-Itacoatiara, km 26. Floresta de Baixio. Arvore. Solo arenoso. Tronco cilindrico. Ritidoma vermelo-pardo. lenticelado. Ao corte casca vermelho-escuro; latex branco ferruginoso, viscoso, pegajoso;alburno amarelo.",-59.966667,2.883333,NA,"urn:catalog:MO:Tropicos:3083589","http://www.tropicos.org/Specimen/3083589","Caraipa rodriguesii Paula",NA,NA,NA,NA
"5",NA,"NY","NY","01301745","Caraipa rodriguesii Paula","Calophyllaceae","Caraipa","rodriguesii","Paula","J. E. L. S. Ribeiro",NA,NA,"836","P. A. C. L. AssunÃ§Ã£o",1998,4,13,"Brazil","Amazonas",NA,"Reserva Florestal Ducke, Manaus-Itacoatiara, km 26.",0,0,NA,"a89aecf4-0998-4a0b-81b4-91627034a2b6",NA,"Caraipa rodriguesii Paula",NA,NA,NA,NA
"6",NA,NA,"Botany","U.1209392","Caraipa rodriguesii Paula","Calophyllaceae","Caraipa","rodriguesii","Paula","Ribeiro JELS",NA,NA,NA,"Assunção PACL",1998,4,13,"Brazil","Amazonas",NA,NA,NA,NA,NA,"http://data.biodiversitydata.nl/naturalis/specimen/U.1209392",NA,"Caraipa rodriguesii Paula",NA,NA,NA,NA
"8",NA,"UNICAMP","UEC","105273","Caraipa rodriguesii Paula","Calophyllaceae","Caraipa","rodriguesii","Paula",NA,NA,NA,"191955","Assunção, P.A.C.L.; Silva, C.F.; Pereira, E da C",1998,4,13,"Brazil","Amazonas",NA,"Reserva Florestal Ducke, Manaus-Itacoatiara, km 26.",-59.966667,-2.883333,"Árvore. Tronco cilíndrico. Ritidoma vermelho-pardo, lenticelado. Ao corte, casca vermelho-escuro; látex branco-ferruginoso, viscoso, pegajoso; alburno amarelo.&nf;&nf;Frutos maduros castanho ferrugineos.&nf;; Floresta de baixio. Solo arenoso","BRA:UNICAMP:UEC:0000105273",NA,"Caraipa rodriguesii Paula",NA,NA,NA,NA
"10","2014-11-24T00:00:00.000+0000","K","Herbarium","K001071802","Caraipa rodriguesii Paula","Calophyllaceae","Caraipa","rodriguesii","Paula","Ribeiro, J.E.L.S.",NA,NA,"836","Assunção, P.A.C.L.; Pereira, E.C.; Silva, C.F. da",1998,4,13,"Brazil",NA,"Manaus","Reserva Florestal Ducke, Manaus-Itacoatiara, km 26.",-59.97,-2.88,"Planta fichada:2403-20. Flora da Reserva Ducke, Amazonas, Brasil. Instituto Nacional de Pesquisas da Amazônia. Overseas Development Administration","http://specimens.kew.org/herbarium/K001071802",NA,"Caraipa rodriguesii Paula",NA,NA,NA,NA
"11",NA,NA,"Botany","U.1208801","Caraipa rodriguesii Paula","Calophyllaceae","Caraipa","rodriguesii","Paula","Nunes Cabral F","2015-05-20T00:00:00.000+0000",NA,NA,"Ribeiro JELS; Berg CC; Assunção PACL",1995,11,16,"Brazil","Amazonas",NA,"Reserva Florestal Ducke, Manaus-Itacoatiara, km 26. Igarape do Barro Branco a jusante do alojamento. Floresta de Baixio.",-59.966667,-2.883333,NA,"http://data.biodiversitydata.nl/naturalis/specimen/U.1208801",NA,"Caraipa rodriguesii Paula",NA,NA,NA,NA
"12","2015-06-24T15:32:56.000+0000","JBRJ","RB","RB00119797","Caraipa rodriguesii Paula","Calophyllaceae","Caraipa","rodriguesii","Paula","F.N.CABRAL",NA,NA,"1761","Ribeiro, J.E.L.S.; Berg, C.C. ; Assunção, P.A.C.L.",1995,11,16,"Brazil","Amazonas","Manaus","Reserva Florestal Ducke, Manaus-Itacoatiara, km 26. Igarapé do Barro Branco a jusante do alojamento.",-59.966667,-2.883333,"Árvore. Tronco cilíndrico. Ritidoma vermelho-pardo, lenticelado. Ao corte casca vermelho-escuro; látex branco-ferruginoso, viscoso, pegajoso; alburno amarelo. Cálice marrom, pétala branca com mancha marrom externamente e branca internamente, filetes branco-amarelados, anteras castanhas com região mais clara no ápice, perfumadas.","urn:catalog:JBRJ:RB:119797",NA,"Caraipa rodriguesii Paula",NA,NA,NA,NA
"14",NA,"UNICAMP","UEC","106282","Caraipa rodriguesii Paula","Calophyllaceae","Caraipa","rodriguesii","Paula","Bittrich, V.","1995-11-01T00:00:00.000+0000",NA,"185503","Ribeiro, J.E.L.S.; Berg, C.C.; Assunção, P.A.C.L.",1995,11,16,"Brazil","Amazonas",NA,"Reserva Florestal Ducke, Manaus-Itacoatiara, km 26.&nf;Igarapé do Barro Branco a jusante do alojamento.",-59.966667,-2.883333,"Árvore. Tronco cilíndrico. Ritidoma vermelho-pardo, lenticelado. Ao corte casca vermelho-escuro; látex branco-ferruginoso, viscoso, pegajoso; alburno amarelo.&nf;Cálice marrom, pétala branca com mancha marrom externamente e branca intern","BRA:UNICAMP:UEC:0000106282",NA,"Caraipa rodriguesii Paula",NA,NA,NA,NA
"16","2016-01-05T15:25:00.000+0000","MO","MO","100271078","Caraipa rodriguesii Paula","Calophyllaceae","Caraipa","rodriguesii","Paula","F. Cabral","2015-01-01T00:00:00.000+0000",NA,"Ribeiro 1761","José Eduardo L. da S. Ribeiro",1995,11,16,"Brazil","Amazonas",NA,"Reserva Florestal Ducke, Manaus-Itacoatiara, km 26.",-59.966667,-2.883333,NA,"urn:catalog:MO:Tropicos:100271078","http://www.tropicos.org/Specimen/100271078","Caraipa rodriguesii Paula",NA,NA,NA,NA
"17","2014-09-26T00:00:00.000+0000","Instituto Nacional de Pesquisas da Amazônia (INPA)","Coleção Botânica, Instituto Nacional de Pesquisas da Amazônia (INPA)","16650","Caraipa rodriguesii Paula","Calophyllaceae","Caraipa","rodriguesii","Paula","Paula, J.E. de",NA,NA,"7312","Rodrigues, WA",1965,11,27,"Brazil","Amazonas",NA,"AM-1, Km 175, picada 23 a 740 m da estrada., AM-1, Km 175, picada 23 a 740 m da estrada",NA,NA,NA,"urn:catalog:inpa:herbarium:243049",NA,"Caraipa rodriguesii Paula",NA,NA,NA,NA
"26",NA,"SNSB-M","BSMvplantscoll","M-0112099 / 33284 / 24074","Caraipa rodriguesii Paula","Calophyllaceae","Caraipa","rodriguesii","Paula",NA,NA,"ISOTYPE",NA,"Coêlho, D.",1965,11,27,"Brazil",NA,NA,"Amazonas, Estrada Manaus-Itacoatiara, km 175, picada 23 a 740 m da estrada.",-55,-10,NA,"http://id.snsb.info/snsb/collection/24506/33284/24074",NA,"Caraipa rodriguesii Paula",NA,NA,NA,NA
