"","modified","institutionCode","collectionCode","catalogNumber","scientificName","family","genus","specificEpithet","scientificNameAuthorship","identifiedBy","dateIdentified","typeStatus","recordNumber","fieldNumber","recordedBy","year","month","day","country","stateProvince","municipality","locality","decimalLongitude","decimalLatitude","occurrenceRemarks","occurrenceID","acceptedNameUsage","identificationQualifier","infraspecificEpithet","comments","bibliographicCitation"
"1",NA,"Jardim Botânico de Brasília (JBB)","HEPH","33941","Eremanthus goyazensis Sch.Bip.","Asteraceae","Eremanthus","goyazensis","Sch.Bip.","Rosa, PO","2018-06-01T00:00:00.000+0000",NA,"2235",NA,"Rosa, PO; Rivaroli, GV; Cardoso, PPM; Pereira, MG; Silva, DS",2018,5,11,"Brazil","Goiás","Pirenópolis","Mosteiro Zen Horyu-Zan Eisho-Ji",-48.931944,-15.721667,"Árvore, ca. de 2,0m. Inflorescência creme-esverdeada; Cerrado s.s.","BRA:JBB:HEPH:0000033941","Eremanthus goyazensis Sch.Bip.",NA,NA,NA,NA
"2","2017-01-24T13:51:05.000+0000","JBRJ","RB","RB01216281","Eremanthus goyazensis Sch.Bip.","Asteraceae","Eremanthus","goyazensis","Sch.Bip.","V.C. Souza","2016-03-24T00:00:00.000+0000",NA,"40219",NA,"V.C. Souza; T.B. Flores; R.L.G. Coelho; M.A.S.S.C. Souza",2016,3,24,"Brazil","Distrito Federal","Brasília","Reserva Ecológica do IBGE",NA,NA,NA,"urn:catalog:JBRJ:RB:1216281","Eremanthus goyazensis Sch.Bip.",NA,NA,NA,NA
"4","2017-02-13T15:31:50.000+0000","JBRJ","RB","RB01223779","Eremanthus goyazensis Sch.Bip.","Asteraceae","Eremanthus","goyazensis","Sch.Bip.","V.C. Souza","2016-03-25T00:00:00.000+0000",NA,"40281",NA,"V.C. Souza; T.B. Flores; R.L.G. Coelho; M.A.S.S.C. Souza",2016,3,25,"Brazil","Distrito Federal","Brasília","Reserva Ecológica do IBGE. Divisa Oeste (FAL)",NA,NA,NA,"urn:catalog:JBRJ:RB:1223779","Eremanthus goyazensis Sch.Bip.",NA,NA,NA,NA
"5",NA,"Cenargen","CEN","104392","Eremanthus goyazensis Sch.Bip.","Asteraceae","Eremanthus","goyazensis","Sch.Bip.","J. B. Bringel",NA,NA,"1205",NA,"João Bernardo de Azevedo Bringel Jr.",2015,2,26,"Brazil","Df","BRASILIA","Rodovia BR - 060, próximo ao entroncamento com a DF - 180.",-48.15,-15.9125,NA,"BRA:Cenargen:CEN:0000104392","Eremanthus goyazensis Sch.Bip.",NA,NA,NA,NA
"6",NA,"UFU","HUFU","70567","Eremanthus goyazensis Sch.Bip.","Asteraceae","Eremanthus","goyazensis","Sch.Bip.","Nakajima, J.N.",NA,NA,"1605",NA,"Martins, C.R.",2015,3,31,"Brazil","Distrito Federal","Brasília","Parque Nacional de Brasília, Entrono da erosão lado esquerdo da estrada de acesso a Cascalheira do Exército.",-47.938611,-15.738611,"Campo sujo.","BRA:UFU:HUFU:0000070567","Eremanthus goyazensis Sch.Bip.",NA,NA,NA,NA
"7",NA,"Cenargen","CEN","91860","Eremanthus goyazensis Sch.Bip.","Asteraceae","Eremanthus","goyazensis","Sch.Bip.","J. N. Nakajima",NA,NA,"1531",NA,"Carlos Romero Martins",2015,3,1,"Brazil","Df","BRASILIA","Parque Nacional de Brasília - Entorno da Cascalheira do Entrocamento.",-47.933333,-15.735833,"Doação Flora do Brasil - Distrito Federal.","BRA:Cenargen:CEN:0000091860","Eremanthus goyazensis Sch.Bip.",NA,NA,NA,NA
"8",NA,"UFU","HUFU","70544","Eremanthus goyazensis Sch.Bip.","Asteraceae","Eremanthus","goyazensis","Sch.Bip.","Nakajima, J.N.","2015-06-01T00:00:00.000+0000",NA,"1528",NA,"Martins, C.R.",2015,3,1,"Brazil","Distrito Federal","Brasília","Parque Nacional de Brasília, Campo sujo entorno da Cascalheira do Entroncamento.",-47.933611,-15.735833,"Árvore 1,8 m alt. e no início do período reprodutivo.; Campo sujo Cascalhento.","BRA:UFU:HUFU:0000070544","Eremanthus goyazensis Sch.Bip.",NA,NA,NA,NA
"9",NA,"UnB","UB","202377","Eremanthus goyazensis Sch.Bip.","Asteraceae","Eremanthus","goyazensis","Sch.Bip.","Proença, CEB",NA,NA,"8181",NA,"Munhoz, CBR; Turma de Vegetação do Cerrado",2014,4,12,"Brazil","Goiás","Paraúna",NA,-50.834444,-17.172778,"Arbusto, 1,0 metro.; Floresta estacional semidecidual","BRA:UnB:UB:0000202377","Eremanthus goyazensis Sch.Bip.",NA,NA,NA,NA
"10",NA,"UFU","HUFU","70881","Eremanthus goyazensis Sch.Bip.","Asteraceae","Eremanthus","goyazensis","Sch.Bip.","Nakajima, J.N.","2016-03-01T00:00:00.000+0000",NA,"4570",NA,"Rezende, S.G.; Justo, A.G.",2014,7,2,"Brazil","Minas Gerais","Ouro Preto","Distrito Miguel Burnier, Mina da Gerdau",0,0,"Arbóreo (arboreta); Cerrado sentido Restrito","BRA:UFU:HUFU:0000070881","Eremanthus goyazensis Sch.Bip.",NA,NA,NA,NA
"11",NA,"FZB-BH","BHZB","10694","Eremanthus goyazensis Sch.Bip.","Asteraceae","Eremanthus","goyazensis","Sch.Bip.",NA,NA,NA,"4570",NA,"Rezende, S.G.",2014,7,2,"Brazil","Mg","Ouro Preto","Distrito de Miguel Burnier, Mina da Gerdau",-43.801944,-20.44,"; Habitat: Cerrado Sentido Restrito; Bioma: Cerrado","BRA:FZB-BH:BHZB:0000010694","Eremanthus goyazensis Sch.Bip.",NA,NA,NA,NA
"12",NA,"Cenargen","CEN","93704","Eremanthus goyazensis Sch.Bip.","Asteraceae","Eremanthus","goyazensis","Sch.Bip.","B. M. T. Walter",NA,NA,"1326",NA,"Carlos Romero Martins",2013,5,12,"Brazil","Df","BRASILIA","Parque Nacional de Brasília. Entorno da antiga pista de ultraleve",-47.926388,-15.731111,"Doação Flora do Brasil - Distrito Federal.","BRA:Cenargen:CEN:0000093704","Eremanthus goyazensis Sch.Bip.",NA,NA,NA,NA
"13",NA,"UFU","HUFU","67009","Eremanthus goyazensis Sch.Bip.","Asteraceae","Eremanthus","goyazensis","Sch.Bip.","Nakajima, J.N.","2016-03-01T00:00:00.000+0000",NA,"611",NA,"Versiane, A.F.A.; Pacheco, R.A.",2013,5,22,"Brazil","Goiás","Cocalzinho de Goiás","Serra dos Pireneus, Estrada para Faz. Mª dos Anjos, ca. 13 Km de Cocalzinho de Goiás.",-48.918889,-15.760556,"Arvoreta, ca. 2.5m alt. Brácteas involucrais castanhas, papus creme.; Campo sujo.","BRA:UFU:HUFU:0000067009","Eremanthus goyazensis Sch.Bip.",NA,NA,NA,NA
"14",NA,"UnB","UB","208419","Eremanthus goyazensis Sch.Bip.","Asteraceae","Eremanthus","goyazensis","Sch.Bip.","Bringel, JBA",NA,NA,"124",NA,"Rios, MNS",2013,7,10,"Brazil","Distrito Federal","Planaltina","Reserva da Embrapa Cerrados",-47.716667,-15.633333,"Projeto Década; Árvore de ca. de 1,4m; folhas simples, alternas; flores esbranquiçadas; Cerrado sentido restrito","BRA:UnB:UB:0000208419","Eremanthus goyazensis Sch.Bip.",NA,NA,NA,NA
"15","2014-07-08T00:47:20.000+0000","JBRJ","RB","RB00757913","Eremanthus goyazensis Sch.Bip.","Asteraceae","Eremanthus","goyazensis","Sch.Bip.","B. Loeuille","2012-01-01T00:00:00.000+0000",NA,"528",NA,"L.M. Borges; P.C. Baleeiro; M.T.C. Watanabe",2012,3,19,"Brazil","Goiás","Cristalina","Serra dos Cristais. Rodovia BR 050, Cristalina-Brasília, ca. 5km após Cristalina. Estrada de terra saindo à direita da rodovia.",-47.641944,-16.718611,"Árvore ca. 2.5m alt. Ramos marrom-acinzentados. Folhas cartáceas, discolores, albo-esverdeadas na face abaxial, verde-escuras na adaxial. Flores albo-rosadas. Papus bege-claro","urn:catalog:JBRJ:RB:757913","Eremanthus goyazensis Sch.Bip.",NA,NA,NA,NA
"16",NA,"USP","SPF","209054","Eremanthus goyazensis Sch.Bip.","Asteraceae","Eremanthus","goyazensis","Sch.Bip.","Loeuille, B","2012-01-01T00:00:00.000+0000",NA,"595",NA,"Borges, LM; Baleeiro, PC; Watanabe, MTC",2012,3,23,"Brazil","Goiás","Cavalcante","Chapada dos Veadeiros, Rodovia BR 010, Teresina de Goiás-Alto Paraíso de Goiás, ca. de 24 km de Teresina; margem esquerda da estrada.",-47.348361,-13.896111,"Arvoreta ca. 1,5 m alt. Ramos albo-amarelados. Folhas verdes, discolores; face abaxial albo-esverdeada, levemente brilhante. Brácteas involucrais verde-claras. Papus creme. Amostra em sílica.; Campo rupestre e afloramentos rochosos.","BRA:USP:SPF:0000209054","Eremanthus goyazensis Sch.Bip.",NA,NA,NA,NA
"19",NA,"UFU","HUFU","62886","Eremanthus goyazensis Sch.Bip.","Asteraceae","Eremanthus","goyazensis","Sch.Bip.","Nakajima, J.N.","2016-03-01T00:00:00.000+0000",NA,"731",NA,"Pacheco, R.A.; Versiane, A.F.A.; Contro, F.L. & Nakajima, J.N.",2012,4,24,"Brazil","Goiás","Cocalzinho de Goiás","Serra dos Pireneus, BR 070, ca. 10 Km da cidade.",-48.881111,-15.788889,"Arvoreta, ca. 2 m alt. Brácteas involucrais verde-creme, corola e ramos do estilete creme.; Afloramentos rochosos.","BRA:UFU:HUFU:0000062886","Eremanthus goyazensis Sch.Bip.",NA,NA,NA,NA
"20",NA,"UFU","HUFU","63038","Eremanthus goyazensis Sch.Bip.","Asteraceae","Eremanthus","goyazensis","Sch.Bip.","Nakajima, J.N.","2016-03-01T00:00:00.000+0000",NA,"769",NA,"Pacheco, R.A.; Nakajima, J.N.; Contro, F.L. & Versiane, A.F.A.",2012,4,25,"Brazil","Goiás","Cocalzinho de Goiás","Serra dos Pireneus, ca. 500 m antes da entrada para a Fazenda Colina.",NA,NA,"Arvoreta, ca. 2 m alt. Brácteas involucrais verde claro, corola lilás, ramos do estilete e papus alvos.; Afloramentos rochosos.","BRA:UFU:HUFU:0000063038","Eremanthus goyazensis Sch.Bip.",NA,NA,NA,NA
"21",NA,"UFU","HUFU","66704","Eremanthus goyazensis Sch.Bip.","Asteraceae","Eremanthus","goyazensis","Sch.Bip.","Nakajima, J.N.","2016-03-01T00:00:00.000+0000",NA,"s.n.",NA,"Deus, F.F.",2012,6,13,"Brazil","Minas Gerais","Uberlândia","Estação Ecológica do Panga",0,0,"Campo cerrado.","BRA:UFU:HUFU:0000066704","Eremanthus goyazensis Sch.Bip.",NA,NA,NA,NA
"22",NA,"Universidade Federal de Minas Gerais (UFMG)","BHCB","147195","Eremanthus goyazensis Sch.Bip.","Asteraceae","Eremanthus","goyazensis","Sch.Bip.",NA,"2015-06-01T00:00:00.000+0000",NA,"s.n.",NA,"Lemos Filho, JP; Lovato, MB",2011,1,26,"Brazil","Goiás","Alto Paraíso de Goiás","Parque Nacional da Chapada dos Veadeiros.",-48.390722,-14.281389,NA,"BRA:UFMG:BHCB:0000147195","Eremanthus goyazensis Sch.Bip.",NA,NA,NA,NA
"23",NA,"UnB","UB","170299","Eremanthus goyazensis Sch.Bip.","Asteraceae","Eremanthus","goyazensis","Sch.Bip.","Silva Júnior, MC","2011-07-01T00:00:00.000+0000",NA,"1305",NA,"Faria, JEQ; Silva Júnior, MC; Cazella, FM; Araújo, LM; Oliveira, PFD",2011,7,17,"Brazil","Goiás","Alto Paraíso de Goiás","Margem da estrada entre Alto Paraíso de Goiás e São Jorge",0,0,"Arvoreta ca. 2 m de altura, frutos creme; Cerrado sensu stricto","BRA:UnB:UB:0000170299","Eremanthus goyazensis Sch.Bip.",NA,NA,NA,NA
"24",NA,"Cenargen","CEN","80004","Eremanthus goyazensis Sch.Bip.","Asteraceae","Eremanthus","goyazensis","Sch.Bip.","B. Loeuille",NA,NA,"1305",NA,"Jair Eustáquio Quintino de Faria Jr.",2011,7,17,"Brazil","Go","ALTO PARAISO DE GOIAS","Margem da estrada entre Alto Paraiso de Goiás e São Jorge.",NA,NA,"Espigas eretas e recurvadas. HERBÁRIO UB - Goiás.","BRA:Cenargen:CEN:0000080004","Eremanthus goyazensis Sch.Bip.",NA,NA,NA,NA
"25",NA,"UnB","UB","137910","Eremanthus goyazensis Sch.Bip.","Asteraceae","Eremanthus","goyazensis","Sch.Bip.","Proença, CEB","2010-04-28T00:00:00.000+0000",NA,"107",NA,"Nogales, T; Ianhez, ML",2010,3,26,"Brazil","Distrito Federal","Brasília","Memorial das Idades do Brasíl",-47.804444,-15.78,"Cerrado Sensu Stricto","BRA:UnB:UB:0000137910","Eremanthus goyazensis Sch.Bip.",NA,NA,NA,NA
"26","2014-07-07T22:12:51.000+0000","JBRJ","RB","RB00672419","Eremanthus goyazensis Sch.Bip.","Asteraceae","Eremanthus","goyazensis","Sch.Bip.","João Bernardo Bringel Jr.",NA,NA,"2188",NA,"A.E.Ramos; et al.",2010,8,5,"Brazil","Goiás","Luziânia","Fazendinha JK 5.Coordenadas em UTM:0186148/8185159.",NA,NA,"Frutos de cor amarelo-dourado.","urn:catalog:JBRJ:RB:672419","Eremanthus goyazensis Sch.Bip.",NA,NA,NA,NA
"27","2014-09-26T00:00:00.000+0000","Instituto Nacional de Pesquisas da Amazônia (INPA)","Coleção Botânica, Instituto Nacional de Pesquisas da Amazônia (INPA)","232931","Eremanthus goyazensis Sch.Bip.","Asteraceae","Eremanthus","goyazensis","Sch.Bip.","Aparecida da Silva, M.","2009-05-24T00:00:00.000+0000",NA,"7082",NA,"Silva, MA da",2009,5,24,"Brazil","Distrito Federal",NA,"Reserva Ecológica do IBGE. Folha: SD-23-Y-C. Entre a guarita e a sede da Reserva. Vegetação: campo sujo de cerrado com queima bienal modal.",-47.87,-15.950278,NA,"urn:catalog:inpa:herbarium:211946","Eremanthus goyazensis Sch.Bip.",NA,NA,NA,NA
"28",NA,"US","Botany","3602322","Eremanthus goyazensis Sch.Bip.","Asteraceae","Eremanthus","goyazensis","Sch.Bip.",NA,NA,NA,"88765",NA,"M. L. Guedes & Sanches, F. G.",2009,5,2,"Brazil","Bahia",NA,"Chapada Diamantina, Piatã, Caminho para os Três morros. Ponto 01",-41.7975,-13.0736,NA,"http://n2t.net/ark:/65665/3967d9d87-2c3c-498a-8e91-ee36c0313515","Eremanthus goyazensis Sch.Bip.",NA,NA,NA,NA
"29",NA,"UnB","UB","113629","Eremanthus goyazensis Sch.Bip.","Asteraceae","Eremanthus","goyazensis","Sch.Bip.","Proença, CEB","2009-06-04T00:00:00.000+0000",NA,"24",NA,"Nogales, T; Ianhez, ML; Silva, JS",2009,6,4,"Brazil","Distrito Federal","Brasília","Memorial das Idades do Brasil",-47.804444,-15.78,"Flores em glomérulos brancos; Arbusto 1,2m. Flor branca; Cerrado sensu-stricto.","BRA:UnB:UB:0000113629","Eremanthus goyazensis Sch.Bip.",NA,NA,NA,NA
"30",NA,"UFG","UFG","41385","Eremanthus goyazensis Sch.Bip.","Asteraceae","Eremanthus","goyazensis","Sch.Bip.","Hashimoto, M.Y.","2009-07-08T00:00:00.000+0000",NA,"2635",NA,"Hashimoto, M.Y.; et al.",2009,6,25,"Brazil","Goiás","Rio Quente",NA,-48.748333,-17.779444,NA,"BRA:UFG:UFG:0000041385","Eremanthus goyazensis Sch.Bip.",NA,NA,NA,NA
"31",NA,"UnB","UB","120209","Eremanthus goyazensis Sch.Bip.","Asteraceae","Eremanthus","goyazensis","Sch.Bip.","Alkimim, W",NA,NA,"34",NA,"Alkimim, W; Zanatta, MRV",2009,6,30,"Brazil","Distrito Federal","Brasília","Jardim Botânico de Brasília Trilha Ecológica",-47.835,-15.874167,"Árvore; 1,70m.; Cerrado sensu stricto","BRA:UnB:UB:0000120209","Eremanthus goyazensis Sch.Bip.",NA,NA,NA,NA
"33",NA,"Escola Superior de Agricultura Luiz de Queiroz, ESALQ","ESA","ESA110776","Eremanthus goyazensis Sch.Bip.","Asteraceae","Eremanthus","goyazensis","Sch.Bip.","Egea-Monge, M. & Morais, G.","2008-03-01T00:00:00.000+0000",NA,"289",NA,"Egea-Monge, M.",2008,3,20,"Brazil","Goiás","Caldas Novas",NA,NA,NA,NA,"BRA:ESALQ:ESA:0ESA110776","Eremanthus goyazensis Sch.Bip.",NA,NA,NA,NA
"34",NA,"Jardim Botânico de Brasília (JBB)","HEPH","24101","Eremanthus goyazensis Sch.Bip.","Asteraceae","Eremanthus","goyazensis","Sch.Bip.","Haidar, RF",NA,NA,"558",NA,"Haidar, RF; et al.",2008,5,9,"Brazil","Distrito Federal","Brasília","Jardim Botânico de Brasília",0,0,"Levantamento feito para o Plano de Manejo.; Arvoreta, Com frutos; Cerrado rupestre; Relevo mais ou menos plano","BRA:JBB:HEPH:0000024101","Eremanthus goyazensis Sch.Bip.",NA,NA,NA,NA
"35",NA,"Cenargen","CEN","76222","Eremanthus goyazensis Sch.Bip.","Asteraceae","Eremanthus","goyazensis","Sch.Bip.","J. B. Bringel",NA,NA,"711",NA,"Juliene Roveratti Santos",2007,1,31,"Brazil","Df","BRASILIA","Parque Nacional de Brasília.",-47.994722,-15.741666,NA,"BRA:Cenargen:CEN:0000076222","Eremanthus goyazensis Sch.Bip.",NA,NA,NA,NA
"36",NA,"UnB","UB","107844","Eremanthus goyazensis Sch.Bip.","Asteraceae","Eremanthus","goyazensis","Sch.Bip.","Carvalho, PS","2008-01-01T00:00:00.000+0000",NA,"150",NA,"Carvalho, PS; Miranda, SC; Bezerra, KMG",2007,3,23,"Brazil","Distrito Federal","Brasília","Fazenda Sucupira",-48.001389,-16.503889,"Presença de galhas; Subarbusto 1,50 m. Flor rósea. Fruto dispersando.; cerrado rupestre. Solo: afloramento rochoso.","BRA:UnB:UB:0000107844","Eremanthus goyazensis Sch.Bip.",NA,NA,NA,NA
"38",NA,"Cenargen","CEN","74993","Eremanthus goyazensis Sch.Bip.","Asteraceae","Eremanthus","goyazensis","Sch.Bip.","J. B. Bringel",NA,NA,"482",NA,"Eduarda Barreto Andrade Dias",2007,3,6,"Brazil","Df","BRASILIA","Parque Nacional de Brasília.",NA,NA,NA,"BRA:Cenargen:CEN:0000074993","Eremanthus goyazensis Sch.Bip.",NA,NA,NA,NA
"39",NA,"Cenargen","CEN","74992","Eremanthus goyazensis Sch.Bip.","Asteraceae","Eremanthus","goyazensis","Sch.Bip.","J. B. Bringel",NA,NA,"481",NA,"Eduarda Barreto Andrade Dias",2007,3,6,"Brazil","Df","BRASILIA","Parque Nacional de Brasília.",NA,NA,NA,"BRA:Cenargen:CEN:0000074992","Eremanthus goyazensis Sch.Bip.",NA,NA,NA,NA
"40",NA,"USP","SPF","223432","Eremanthus goyazensis Sch.Bip.","Asteraceae","Eremanthus","goyazensis","Sch.Bip.","Carvalho, PS","2007-01-01T00:00:00.000+0000",NA,"180",NA,"Carvalho, PS",2007,4,5,"Brazil","Distrito Federal","Brasília","Fazenda Sucupira.",-48.001389,-16.503889,NA,"BRA:USP:SPF:0000223432","Eremanthus goyazensis Sch.Bip.",NA,NA,NA,NA
"42",NA,"UNICAMP","UEC","169429","Eremanthus goyazensis Sch.Bip.","Asteraceae","Eremanthus","goyazensis","Sch.Bip.","Semir, J.","2007-01-01T00:00:00.000+0000",NA,"022007",NA,"Verola, C.F.; Costa, I.R.",2007,4,10,"Brazil","Distrito Federal","Brasília","Jardim Botânico, trilha em frente ao ""mirante""",0,0,NA,"BRA:UNICAMP:UEC:0000169429","Eremanthus goyazensis Sch.Bip.",NA,NA,NA,NA
"43",NA,"UNICAMP","UEC","169505","Eremanthus goyazensis Sch.Bip.","Asteraceae","Eremanthus","goyazensis","Sch.Bip.","Semir, J.","2007-01-01T00:00:00.000+0000",NA,"122002",NA,"Verola, C.F.; Costa, I.R.",2007,4,12,"Brazil","Goiás","Alto Paraíso de Goiás","Chapada dos Veadeiros, Rod. GO-118, próximo ao Km 162, logo na entrada de fazenda",0,0,NA,"BRA:UNICAMP:UEC:0000169505","Eremanthus goyazensis Sch.Bip.",NA,NA,NA,NA
"44",NA,"UnB","UB","107852","Eremanthus goyazensis Sch.Bip.","Asteraceae","Eremanthus","goyazensis","Sch.Bip.","Correia, CAS","2008-01-01T00:00:00.000+0000",NA,"162",NA,"Carvalho, PS",2007,4,5,"Brazil","Distrito Federal","Brasília","Fazenda Sucupira",-48.001389,-16.503889,"Botões, pendão floral ferrugíneo; Subarbusto; cerrado rupestre. Solo: afloramento rochoso.","BRA:UnB:UB:0000107852","Eremanthus goyazensis Sch.Bip.",NA,NA,NA,NA
"45",NA,"UEG-UNUCET","HUEG","5323","Eremanthus goyazensis Sch.Bip.","Asteraceae","Eremanthus","goyazensis","Sch.Bip.","Incógnito",NA,NA,"s.n.",NA,"Ratter, J.A.; Miranda, S.C.",2007,4,6,"Brazil","Goiás","Mossâmedes","serra dourada",0,0,"arbusto flor creme parcela 4; cerrado rupestre","BRA:UEG-UNUCET:HUEG:0000005323","Eremanthus goyazensis Sch.Bip.",NA,NA,NA,NA
"46",NA,"UnB","UB","105869","Eremanthus goyazensis Sch.Bip.","Asteraceae","Eremanthus","goyazensis","Sch.Bip.","Miranda, SC","2007-05-06T00:00:00.000+0000",NA,"1059",NA,"Miranda, SC",2007,4,6,"Brazil","Goiás","Mossâmedes","Serra Dourada, Estância Quinta da Serra",0,0,"Parcela 4; Arbusto. Flor creme; Cerrado rupestre.","BRA:UnB:UB:0000105869","Eremanthus goyazensis Sch.Bip.",NA,NA,NA,NA
"47","2017-10-19T06:27:53.000+0000","JBRJ","RB","RB00494975","Eremanthus goyazensis Sch.Bip.","Asteraceae","Eremanthus","goyazensis","Sch.Bip.","B.Loenille",NA,NA,"4499",NA,"R.C. Forzza; R. F. Monteiro, M. M. Saavedra, R. Moura & M. G. Avelar",2007,7,18,"Brazil","Goiás","Pirenópolis","Serra de Pirenópolis. Morro da antena. Cerrado com afloramentos rochosos.",-48.968889,-15.830556,"Árvore, ca. 3 m alt. Folhas discolores, glaucas na face abaxial.","urn:catalog:JBRJ:RB:494975","Eremanthus goyazensis Sch.Bip.",NA,NA,NA,NA
"48",NA,"UnB","UB","89065","Eremanthus goyazensis Sch.Bip.","Asteraceae","Eremanthus","goyazensis","Sch.Bip.","Loeuille, B","2007-07-01T00:00:00.000+0000",NA,"18",NA,"Matos, MQ",2006,2,7,"Brazil","Distrito Federal","Brasília","Parque Ecológico Dom Bosco",-47.8,-15.783333,"Árvore 2m. Casca de cor bege ou amarelada, com fissurs e cristas sinuosas e descontinuas. Flores de até 1cm de comprimento de cor creme ou lilás com cinco pétalas; Cerrado sentido restrito sobre cambissolo","BRA:UnB:UB:0000089065","Eremanthus goyazensis Sch.Bip.",NA,NA,NA,NA
"49",NA,"UnB","UB","19298","Eremanthus goyazensis Sch.Bip.","Asteraceae","Eremanthus","goyazensis","Sch.Bip.","Proença, CEB","2006-02-01T00:00:00.000+0000",NA,"3154",NA,"Proença, CEB; Andrade, MC; Barros, MLS; Ferreira, LNC; Dias, AR; Martins, RC",2006,2,18,"Brazil","Goiás","Padre Bernardo","Assentamento da Reforma Agrária Colônia I",-48.249444,-15.626667,"Uso: artesanato.&nf;Parte usada: Inflorescência.; Arbusto 2m. Fruto creme.; Cerrado.","BRA:UnB:UB:0000019298","Eremanthus goyazensis Sch.Bip.",NA,NA,NA,NA
"50",NA,"Cenargen","CEN","84739","Eremanthus goyazensis Sch.Bip.","Asteraceae","Eremanthus","goyazensis","Sch.Bip.","G. D. Vale",NA,NA,"78",NA,"Gabriel Damasco do Vale",2006,9,18,"Brazil","Df","BRASILIA","Fazenda Sucupira - Campo sujo ao lado da estrada de entrada da fazenda (mais ou menos 1 km do término do asfalto). Terreno levemente acidentado ao lado da encosta.",-48.008055,-15.897222,"Remanescentes de flores e frutos.","BRA:Cenargen:CEN:0000084739","Eremanthus goyazensis Sch.Bip.",NA,NA,NA,NA
"51","2017-11-19T08:47:02.000+0000","JBRJ","RB","RB00855584","Eremanthus goyazensis Sch.Bip.","Asteraceae","Eremanthus","goyazensis","Sch.Bip.","G.D. Vale",NA,NA,"78",NA,"G.D. Vale; C.G. Fontes; G.A. Moreira",2006,9,18,"Brazil","Distrito Federal","Brasília","Fazenda  Sucupira  -  Campo  sujo  ao  lado  da  estrada  de  entrada  da  fazenda  (Imais  ou  menos  1km  do  término  do  asfalto).",-48.008056,-15.897222,"Árvore com cerca de 2m de altura; Remanescentes de flores e frutos","urn:catalog:JBRJ:RB:855584","Eremanthus goyazensis Sch.Bip.",NA,NA,NA,NA
"53",NA,"Cenargen","CEN","84798","Eremanthus goyazensis Sch.Bip.","Asteraceae","Eremanthus","goyazensis","Sch.Bip.","B. M. T. Walter",NA,NA,"138",NA,"Gabriel Damasco do Vale",2006,9,25,"Brazil","Df","BRASILIA","Fazenda Sucupira - Vale na margem esquerda do córrego Riacho Fundo.",-48.015,-15.904166,NA,"BRA:Cenargen:CEN:0000084798","Eremanthus goyazensis Sch.Bip.",NA,NA,NA,NA
"54",NA,"Cenargen","CEN","66994","Eremanthus goyazensis Sch.Bip.","Asteraceae","Eremanthus","goyazensis","Sch.Bip.","J. B. Bringel",NA,NA,"9903",NA,"Glocimar Pereira-Silva",2005,4,11,"Brazil","Go","LUZIANIA","Margem direita do rio Alagado.",-48.198611,-16.286944,NA,"BRA:Cenargen:CEN:0000066994","Eremanthus goyazensis Sch.Bip.",NA,NA,NA,NA
"55",NA,"Universidade Federal de Mato Grosso (UFMT)","CNMT","4034","Eremanthus goyazensis Sch.Bip.","Asteraceae","Eremanthus","goyazensis","Sch.Bip.","Bringel, J.B.","2009-01-01T00:00:00.000+0000",NA,"9903",NA,"Silva, G.P.",2005,4,11,"Brazil","Goiás","Luziânia","Margen direita do Rio Alagado",-48.198611,-16.286944,NA,"BRA:UFMT:CNMT:0000004034","Eremanthus goyazensis Sch.Bip.",NA,NA,NA,NA
"56",NA,"UFU","HUFU","66244","Eremanthus goyazensis Sch.Bip.","Asteraceae","Eremanthus","goyazensis","Sch.Bip.","Nakajima, J.N.","2016-03-01T00:00:00.000+0000",NA,"4535",NA,"Sevilha, A.C.; Sinigaglia, C.; Amaral, J.P.; Santos, J.R.; Bianchetti, L.B. & Barbosa, N.F.",2005,5,27,"Brazil","Minas Gerais","Grão Mogol","Assentamento Americana, Cerrado de coleta de cagaita. Ponto 3.",-42.985556,-16.35,"Árvore. Flor branca.; Cerrado sensu stricto, relevo suave ondulado, solo areno-argiloso com matações.","BRA:UFU:HUFU:0000066244","Eremanthus goyazensis Sch.Bip.",NA,NA,NA,NA
"57",NA,"UnB","UB","92040","Eremanthus goyazensis Sch.Bip.","Asteraceae","Eremanthus","goyazensis","Sch.Bip.","Incógnito",NA,NA,"122",NA,"Pereira, FFO",2004,2,25,"Brazil","Distrito Federal",NA,"Fazenda Sucupira, Riacho Fundo",-47.509333,-14.072694,"Arvoreta 2m. Folhas maduras. Inflorescência creme. Flores em botões; Cerrado rupestre","BRA:UnB:UB:0000092040","Eremanthus goyazensis Sch.Bip.",NA,NA,NA,NA
"58",NA,"Jardim Botânico de Brasília (JBB)","HEPH","20504","Eremanthus goyazensis Sch.Bip.","Asteraceae","Eremanthus","goyazensis","Sch.Bip.","Paiva, VF","2005-01-19T00:00:00.000+0000",NA,"73B",NA,"Moreira, KRS; Azevedo, INC de; Paiva, VF; Castro, TB",2004,4,6,"Brazil","Distrito Federal","Brasília","Estação Ecológica do Jardim Botânico de Brasília, Área do Cristo Redentor",-47.881111,-15.881831,"Coordenadas em UTM 0191503 8238176, parcela 2/1; Flor creme; Inflorescencia lilas; Campo sujo, Latossolo vermelho escuro; Relevo mais ou menos plano","BRA:JBB:HEPH:0000020504","Eremanthus goyazensis Sch.Bip.",NA,NA,NA,NA
"59",NA,"UNITINS","HUTO","5879","Eremanthus goyazensis Sch.Bip.","Asteraceae","Eremanthus","goyazensis","Sch.Bip.","Bringel, J.B.A.","2007-05-01T00:00:00.000+0000",NA,"167",NA,"Bringel, J.B.A.",2004,6,13,"Brazil","Goiás","Cristalina","Serra dos Topásios, do outro riacho. Relevo levemente inclinado. Latossolo.",-47.693611,-16.726944,"Arbusto com casca grossa. Cerdas do papus ferrugínea.; Campo sujo","BRA:UNITINS:HUTO:0000005879","Eremanthus goyazensis Sch.Bip.",NA,NA,NA,NA
"60",NA,"UFU","HUFU","64859","Eremanthus goyazensis Sch.Bip.","Asteraceae","Eremanthus","goyazensis","Sch.Bip.",NA,NA,NA,"5207",NA,"Walter, B.M.T.; Walter, M.C.; Costa, M.B.W.; Costa, m.l.W. & Walter, M.C.",2004,6,10,"Brazil","Distrito Federal","Brasília","Lago Sul, QI 28. Áreas savânicas e campestres abaixo da mata do Parque Copaíbas, descendo na direção do lago Paranoá.",-47.9,-15.933333,"Original - Cerrado denso. Área urbanizada de chácara. Relevo plano, latossolo vermelho, profundo.","BRA:UFU:HUFU:0000064859","Eremanthus goyazensis Sch.Bip.",NA,NA,NA,NA
"61",NA,"Cenargen","CEN","55749","Eremanthus goyazensis Sch.Bip.","Asteraceae","Eremanthus","goyazensis","Sch.Bip.","J. B. Bringel",NA,NA,"167",NA,"João Bernardo de Azevedo Bringel Jr.",2004,6,13,"Brazil","Go","CRISTALINA","Serra dos Topásios, do outro lado do riacho (lado oposto a estrada). Long.: 47°41'37,4'' O.",-47.693611,-16.726944,"Arbusto com casca grossa. Cerdas do papus ferrugínea.","BRA:Cenargen:CEN:0000055749","Eremanthus goyazensis Sch.Bip.",NA,NA,NA,NA
"64",NA,"Cenargen","CEN","58873","Eremanthus goyazensis Sch.Bip.","Asteraceae","Eremanthus","goyazensis","Sch.Bip.","B. Loeuille","2011-01-01T00:00:00.000+0000",NA,"5207",NA,"Bruno Machado Teles Walter",2004,6,10,"Brazil","Df","BRASILIA","QI 28 - Lago Sul. Áreas savanicas e campestres abaixo da Mata do ""Parque das Copaíbas,"" descendo na direção do Lago Paranoá.",-47.816666,-15.816666,"Restos florais estramíneos. Coletado próximo à pequena grota.","BRA:Cenargen:CEN:0000058873","Eremanthus goyazensis Sch.Bip.",NA,NA,NA,NA
