"","modified","institutionCode","collectionCode","catalogNumber","scientificName","family","genus","specificEpithet","scientificNameAuthorship","identifiedBy","dateIdentified","typeStatus","recordNumber","recordedBy","year","month","day","country","stateProvince","municipality","locality","decimalLongitude","decimalLatitude","occurrenceRemarks","occurrenceID","acceptedNameUsage","identificationQualifier","infraspecificEpithet","fieldNumber","comments","bibliographicCitation"
"1",NA,"USP","SPF","213419","Xylopia langsdorfiana A.St.-Hil. & Tul.","Annonaceae","Xylopia","langsdorfiana","A.St.-Hil. & Tul.","Lopes, JC","2016-01-01T00:00:00.000+0000",NA,"381","Lopes, JC",2013,3,14,"Brazil","São Paulo","Cubatão","Parque Estadual da Serra do Mar, Núcleo Itutinga-Pilões. Via Anchieta entre os km 48 e 49 no ramal que liga os dois sentidos da via Anchieta.",-46.509722,-23.896111,"Árvore 3 m alt. Folhas discolores verde-brilhantes na face superior e verde-claras na inferior. Sépalas verdes, pétalas externas amarelas e internas alvas. Flores maduras com as pétalas externas eretas e as internas patentes. Frutos","BRA:USP:SPF:0000213419","Xylopia langsdorfiana A.St.-Hil. & Tul.",NA,NA,NA,NA,NA
"2","2017-10-16T23:04:58.000+0000","JBRJ","RB","RB00487064","Xylopia langsdorfiana A.St.-Hil. & Tul.","Annonaceae","Xylopia","langsdorfiana","A.St.-Hil. & Tul.","Adriana Quintella Lobão",NA,NA,"6633","H.C. de Lima; R.D. Ribeiro A.A. Calvet & W. Silva",2007,5,24,"Brazil","Rio de Janeiro","Nova Iguaçu","Trilha para o Pico de Tinguá.",-43.400833,-22.589444,"Arvoreta com 3 metros de altura. Frutos alaranjados. Ocasional.","urn:catalog:JBRJ:RB:487064","Xylopia langsdorfiana A.St.-Hil. & Tul.",NA,NA,NA,NA,NA
"3",NA,"MBML","MBML-HERBARIO","39446","Xylopia langsdorfiana A.St.-Hil. & Tul.","Annonaceae","Xylopia","langsdorfiana","A.St.-Hil. & Tul.","A. Lobão/VII-2009",NA,NA,"1359","A. Lobão; M.Nadruz, A.C.G.Ramos, N.L.Nunes & C.Cronemberg.",2007,9,27,"Brazil","Rio de Janeiro","Magé","Santo Aleixo. Trilha Coruja-Italianos. Floresta Ombrófila Densa Submontana.",-43.040278,-22.657778,"Arvoreta; ca. 4m alt., folhas lustrosas na face adaxial, botões florais verdes, frutos imaturas verdes. Rara na área.","BRA:MBML:MBML-HERBARIO:0000039446","Xylopia langsdorfiana A.St.-Hil. & Tul.",NA,NA,NA,NA,NA
"4",NA,"NY","NY","1039206","Xylopia langsdorfiana A.St.-Hil. & Tul.","Annonaceae","Xylopia","langsdorfiana","A.St.-Hil. & Tul.","A. Q. LobÃ£o","2009-01-01T00:00:00.000+0000",NA,"1359","A. Q. LobÃ£o",2007,9,27,"Brazil","Rio de Janeiro",NA,"Santo Aleixo. Trilha Coruja-Italianos.",-43.0407567358403,-22.6566559506376,NA,"04d1d2cd-2384-4b95-bb0a-84ecf065cb32","Xylopia langsdorfiana A.St.-Hil. & Tul.",NA,NA,NA,NA,NA
"5",NA,"Escola Superior de Agricultura Luiz de Queiroz, ESALQ","ESA","ESA088466","Xylopia langsdorfiana A.St.-Hil. & Tul.","Annonaceae","Xylopia","langsdorfiana","A.St.-Hil. & Tul.","Lopes, J.C.","2012-01-01T00:00:00.000+0000",NA,"1532","Udulutsch, R.G.; Forster, W.; Mazine, F.F.; Souza, V.C.",2003,1,24,"Brazil","São Paulo","Cananéia","Parque Estadual Ilha do Cardoso. Restinga.",NA,NA,NA,"BRA:ESALQ:ESA:0ESA088466","Xylopia langsdorfiana A.St.-Hil. & Tul.",NA,NA,NA,NA,NA
"6",NA,"Escola Superior de Agricultura Luiz de Queiroz, ESALQ","ESA","ESA072644","Xylopia langsdorfiana A.St.-Hil. & Tul.","Annonaceae","Xylopia","langsdorfiana","A.St.-Hil. & Tul.",NA,NA,NA,"263","Sztutman, M. et al.",1999,1,11,"Brazil","São Paulo","Pariquera-açu",NA,NA,NA,NA,"BRA:ESALQ:ESA:0ESA072644","Xylopia langsdorfiana A.St.-Hil. & Tul.",NA,NA,NA,NA,NA
"7",NA,"UNICAMP","UEC","107376","Xylopia langsdorfiana A.St.-Hil. & Tul.","Annonaceae","Xylopia","langsdorfiana","A.St.-Hil. & Tul.","Tamashiro, J.Y.","1999-01-01T00:00:00.000+0000",NA,"48","Sampaio, D.; Maltez, H.M.; Silva, C.; Almeida, A.; Silva, M.M.R.",1999,1,6,"Brazil","São Paulo","Iguape","Estação Ecológica de Chauás, Trilha de acesso pelo sítio do SR. João Caçador, no km 78 da Rodovia Pariquera-Iguape.",-47.7,-24.783333,"fruto, Floresta ombrófila densa, apresentando fortes sinais de perturbação antrópica. Árvore de 5m, frutos maduros com endocarpo vermelho, sementes negras e arilo alvo. NV: cedrinho.","BRA:UNICAMP:UEC:0000107376","Xylopia langsdorfiana A.St.-Hil. & Tul.",NA,NA,NA,NA,NA
"8",NA,"Instituto de Botânica, IBT","SP","337863","Xylopia langsdorfiana A.St.-Hil. & Tul.","Annonaceae","Xylopia","langsdorfiana","A.St.-Hil. & Tul.","Martins, SE","1999-09-01T00:00:00.000+0000",NA,"550","Martins, SE; Magenta, MAG",1999,9,16,"Brazil","São Paulo","Bertioga","Guaratuba, Fazenda Três Marias, estrada da captação.",0,0,NA,"BRA:IBt:SP:0000337863","Xylopia langsdorfiana A.St.-Hil. & Tul.",NA,NA,NA,NA,NA
"9",NA,"UNISANTA","HUSC","2280","Xylopia langsdorfiana A.St.-Hil. & Tul.","Annonaceae","Xylopia","langsdorfiana","A.St.-Hil. & Tul.","Mello-Silva, R.","2000-03-01T00:00:00.000+0000",NA,"596","Martins, S.E.; Sampaio, P.S.P.",1999,11,18,"Brazil","São Paulo","Bertioga","Guaratuba, Fazenda Três Marias, estrada da captação.",0,0,"Arvoreta co 7m de altura. Botões florais castanhos e frutos verdes imaturos. Frquente; Sub-bosque. Floresta de restinga seca alta.","BRA:UNISANTA:HUSC:0000002280","Xylopia langsdorfiana A.St.-Hil. & Tul.",NA,NA,NA,NA,NA
"10",NA,"Instituto de Botânica, IBT","SP","334753","Xylopia langsdorfiana A.St.-Hil. & Tul.","Annonaceae","Xylopia","langsdorfiana","A.St.-Hil. & Tul.","Mello-Silva, R","1999-05-01T00:00:00.000+0000",NA,"349","Martins, SE; Sampaio, PSP; Magenta, M",1998,11,26,"Brazil","São Paulo","Bertioga","Guaratuba, Fazenda Três Marias, estrada da captação.",0,0,NA,"BRA:IBt:SP:0000334753","Xylopia langsdorfiana A.St.-Hil. & Tul.",NA,NA,NA,NA,NA
"11",NA,"UNICAMP","UEC","129407","Xylopia langsdorfiana A.St.-Hil. & Tul.","Annonaceae","Xylopia","langsdorfiana","A.St.-Hil. & Tul.","Sugiyama, M.",NA,NA,"s.n.","Passos, L.C.",1998,12,18,"Brazil","São Paulo","Cananéia","Ilha do Cardoso, Mata de Restinga.",0,0,"Árvore, ca. 4,0 m, flroes (externamente) amarelas, com odor de banana, pétalas brancas com base vinho. Frutos imaturos verdes, maduros vermelhos. Sementes pretas com arilo branco.","BRA:UNICAMP:UEC:0000129407","Xylopia langsdorfiana A.St.-Hil. & Tul.",NA,NA,NA,NA,NA
"12",NA,"MA","MA","582110-1","Xylopia langsdorfiana A.St.-Hil. & Tul.","Annonaceae","Xylopia","langsdorfiana","A.St.-Hil. & Tul.",NA,NA,NA,"1050","O.S. Ribas",1996,1,20,"Brazil",NA,NA,"Balneario Shangri-la (mun. Paranagu ) Paran",NA,NA,"restinga arborea da planicie litorƒnea",NA,"Xylopia langsdorfiana A.St.-Hil. & Tul.",NA,NA,NA,NA,NA
"13",NA,"UFPR","UPCB","31314","Xylopia langsdorfiana A.St.-Hil. & Tul.","Annonaceae","Xylopia","langsdorfiana","A.St.-Hil. & Tul.","Silva, S.M.","1997-02-01T00:00:00.000+0000",NA,NA,"Silva, S.M.",1996,1,19,"Brazil","Paraná","Paranaguá","Morro da Baleia - Ilha do Mel",NA,NA,"Arvoreta de 6m, com flores castanhas (creme)..","BRA:UFPR:UPCB:0000031314","Xylopia langsdorfiana A.St.-Hil. & Tul.",NA,NA,NA,NA,NA
"14",NA,"MBM","MBM","225959","Xylopia langsdorfiana A.St.-Hil. & Tul.","Annonaceae","Xylopia","langsdorfiana","A.St.-Hil. & Tul.","Ivanauskas, MN",NA,NA,"1556","Ivanauskas, MN; Rodrigues, RR; Tamashiro, JY; Van den Berg; Árbocz, GF",1996,6,22,"Brazil","São Paulo","Pariquera-Açu","Parque Estadual de Pariquera-Açu",0,0,"Árvore de 7m; frutos imaturos verdes.; Floresta de Turfeira.","BRA:MBM:MBM:0000225959","Xylopia langsdorfiana A.St.-Hil. & Tul.",NA,NA,NA,NA,NA
"15","2017-10-24T19:18:52.000+0000","JBRJ","RB","RB01217866","Xylopia langsdorfiana A.St.-Hil. & Tul.","Annonaceae","Xylopia","langsdorfiana","A.St.-Hil. & Tul.","N.M. Ivanauskas",NA,NA,"1556","N.M. Ivanauskas; R.R. Rodrigues; J.Y. Tamashiro; C. van den Berg; G.F. Árbocz",1996,6,22,"Brazil","São Paulo","Pariquera-Açu","Parque Estadual da Pariquera-çu, Mata do Encantado. Floresta de Estadual de Pariquera-Açu, Mata do Encantado. Floresta de Turfeira.",NA,NA,NA,"urn:catalog:JBRJ:RB:1217866","Xylopia langsdorfiana A.St.-Hil. & Tul.",NA,NA,NA,NA,NA
"16",NA,"Universidade Federal do Paraná, UFPR","EFC","209","Xylopia langsdorfiana A.St.-Hil. & Tul.","Annonaceae","Xylopia","langsdorfiana","A.St.-Hil. & Tul.","Silva, S.M.",NA,NA,NA,"Rotta, E.",1996,12,19,"Brazil","Paraná","Paranaguá","Floresta Estadual do Palmito",-48.5558,-25.5917,"__COMMOM_NAME__: Canela-branca","BRA:UFPR:EFC:0000000209","Xylopia langsdorfiana A.St.-Hil. & Tul.",NA,NA,NA,NA,NA
"17",NA,"Instituto de Botânica, IBT","SP","276105","Xylopia langsdorfiana A.St.-Hil. & Tul.","Annonaceae","Xylopia","langsdorfiana","A.St.-Hil. & Tul.",NA,NA,NA,"1099","Bernacci, LC; Andrade, PRP; Belinello, R; Falivene, SMP; Silva, AMC",1995,1,11,"Brazil","São Paulo",NA,"Rodovia Pariquera-Açu a Cananéia",0,0,NA,"BRA:IBt:SP:0000276105","Xylopia langsdorfiana A.St.-Hil. & Tul.",NA,NA,NA,NA,NA
"18",NA,"Instituto de Botânica, IBT","SP","276104A","Xylopia langsdorfiana A.St.-Hil. & Tul.","Annonaceae","Xylopia","langsdorfiana","A.St.-Hil. & Tul.","Lobão, A","2004-08-01T00:00:00.000+0000",NA,"1105","Bernacci, LC; Andrade, PRP; Belinello, R; Falivene, SMP; Silva, AMC",1995,1,11,"Brazil","São Paulo",NA,"Rodovia pariquera-Açu a Cananéia",0,0,NA,"BRA:IBt:SP:000276104A","Xylopia langsdorfiana A.St.-Hil. & Tul.",NA,NA,NA,NA,NA
"19",NA,"UNICAMP","UEC","72605","Xylopia langsdorfiana A.St.-Hil. & Tul.","Annonaceae","Xylopia","langsdorfiana","A.St.-Hil. & Tul.",NA,NA,NA,"32626","Sakai, L.",1995,2,7,"Brazil","São Paulo","Cananéia","Estrada Pariquera-Açu., 4km estrada de terra.",-47.858333,-24.879444,"flor e fruto, Transição restinga mata de encosta, árvore 12m, flores creme.","BRA:UNICAMP:UEC:0000072605","Xylopia langsdorfiana A.St.-Hil. & Tul.",NA,NA,NA,NA,NA
"20",NA,"Instituto de Botânica, IBT","SP","279506","Xylopia langsdorfiana A.St.-Hil. & Tul.","Annonaceae","Xylopia","langsdorfiana","A.St.-Hil. & Tul.",NA,NA,NA,"32626","Sakai, L; et al.",1995,2,7,"Brazil","São Paulo","Cananéia","Estrada pariquera-Açu, 4 km da estrada de terra",-47.850833,-24.879444,NA,"BRA:IBt:SP:0000279506","Xylopia langsdorfiana A.St.-Hil. & Tul.",NA,NA,NA,NA,NA
"21",NA,"Escola Superior de Agricultura Luiz de Queiroz, ESALQ","ESA","ESA023292","Xylopia langsdorfiana A.St.-Hil. & Tul.","Annonaceae","Xylopia","langsdorfiana","A.St.-Hil. & Tul.",NA,NA,NA,"32626","Sakai, L. et al.",1995,2,7,"Brazil","São Paulo","Cananéia",NA,NA,NA,NA,"BRA:ESALQ:ESA:0ESA023292","Xylopia langsdorfiana A.St.-Hil. & Tul.",NA,NA,NA,NA,NA
"22",NA,"Escola Superior de Agricultura Luiz de Queiroz, ESALQ","ESA","ESA029587","Xylopia langsdorfiana A.St.-Hil. & Tul.","Annonaceae","Xylopia","langsdorfiana","A.St.-Hil. & Tul.","Ivanauskas, N.M.",NA,NA,"1099","Ivanauskas, N.M.",1995,9,28,"Brazil","São Paulo","Pariquera-Açu",NA,NA,NA,NA,"BRA:ESALQ:ESA:0ESA029587","Xylopia langsdorfiana A.St.-Hil. & Tul.",NA,NA,NA,NA,NA
"23",NA,"IF","SPSF","19604","Xylopia langsdorfiana A.St.-Hil. & Tul.","Annonaceae","Xylopia","langsdorfiana","A.St.-Hil. & Tul.",NA,NA,NA,"111","S.E.Martins & O.T. Aguiar",1993,11,4,"Brazil","Sp","Cubatão","P.E.da Serra do Mar",NA,NA,"COLETA: XLS: SPSFAntigo; GEOGRAFIA: area poluida&nf;;","BRA:IF:SPSF:0000019604","Xylopia langsdorfiana A.St.-Hil. & Tul.",NA,NA,NA,NA,NA
"24",NA,"MBM","MBM","159300","Xylopia langsdorfiana A.St.-Hil. & Tul.","Annonaceae","Xylopia","langsdorfiana","A.St.-Hil. & Tul.","Mello-Silva, R; Lopes, JC","2012-01-01T00:00:00.000+0000",NA,"22870","Grombone, MT; Sales, MF; Silveira, LT",1989,11,29,"Brazil","São Paulo","Guarujá",NA,0,0,"Árvore com cerca de 6m, flores creme, frutos róseos amarelados.","BRA:MBM:MBM:0000159300","Xylopia langsdorfiana A.St.-Hil. & Tul.",NA,NA,NA,NA,NA
"25",NA,"UNICAMP","UEC","54731","Xylopia langsdorfiana A.St.-Hil. & Tul.","Annonaceae","Xylopia","langsdorfiana","A.St.-Hil. & Tul.","Pontes Pires, A.F.","2015-08-11T00:00:00.000+0000",NA,"22870","Grombone-Guaratini, M.T.; Sales, M.F.; Silveira, L.T.",1989,11,29,"Brazil","São Paulo","Guarujá",NA,0,0,"flor, Grupo C. Árvore com ca. 6m alt., flores creme, frutos róseos amarelados.","BRA:UNICAMP:UEC:0000054731","Xylopia langsdorfiana A.St.-Hil. & Tul.",NA,NA,NA,NA,NA
"26",NA,"Escola Superior de Agricultura Luiz de Queiroz, ESALQ","ESA","ESA011171","Xylopia langsdorfiana A.St.-Hil. & Tul.","Annonaceae","Xylopia","langsdorfiana","A.St.-Hil. & Tul.","Lopes, J.C.","2012-01-01T00:00:00.000+0000",NA,"22558","Passos, F.C.",1989,11,27,"Brazil","São Paulo","Santos",NA,NA,NA,NA,"BRA:ESALQ:ESA:0ESA011171","Xylopia langsdorfiana A.St.-Hil. & Tul.",NA,NA,NA,NA,NA
"27",NA,"UNICAMP","UEC","54164","Xylopia langsdorfiana A.St.-Hil. & Tul.","Annonaceae","Xylopia","langsdorfiana","A.St.-Hil. & Tul.",NA,NA,NA,"22427","Assis, M.A.",1989,11,27,"Brazil","São Paulo","Bertioga","Boracéia",0,0,"flor e fruto, Grupo 3. Restinga arbórea. Árvore, 8m, fl. castanho fruto verde.","BRA:UNICAMP:UEC:0000054164","Xylopia langsdorfiana A.St.-Hil. & Tul.",NA,NA,NA,NA,NA
"28",NA,"MBM","MBM","178766","Xylopia langsdorfiana A.St.-Hil. & Tul.","Annonaceae","Xylopia","langsdorfiana","A.St.-Hil. & Tul.","Silva, SM","1987-01-01T00:00:00.000+0000",NA,"1907","Britez, RM",1987,11,6,"Brazil","Paraná","Paranaguá","Ilha do Mel, Morro do Forte",0,0,"Árvore de 5m com frutos imaturos.; Floresta pluvial do morro.","BRA:MBM:MBM:0000178766","Xylopia langsdorfiana A.St.-Hil. & Tul.",NA,NA,NA,NA,NA
"29",NA,"Universidade Estadual de Londrina, UEL","FUEL","9510","Xylopia langsdorfiana A.St.-Hil. & Tul.","Annonaceae","Xylopia","langsdorfiana","A.St.-Hil. & Tul.","Silva, SM","1987-12-01T00:00:00.000+0000",NA,"1907","Britez, RM",1987,11,6,"Brazil","Paraná","Paranaguá","Ilha do Mel, Morro do Forte",0,0,"Arvore de 5,0m de alt.; com frutos imaturos. Em floresta plu vial do morro.","BRA:UEL:FUEL:0000009510","Xylopia langsdorfiana A.St.-Hil. & Tul.",NA,NA,NA,NA,NA
"30",NA,"Comissão Executiva do Plano da Lavoura Cacaueira (CEPLAC)","CEPEC","22464","Xylopia langsdorfiana A.St.-Hil. & Tul.","Annonaceae","Xylopia","langsdorfiana","A.St.-Hil. & Tul.","D. M. Johnson",NA,NA,"4050","T. S. dos Santos",NA,NA,NA,"Brazil","Bahia","una","Ramal entr. Km 5.7 Rod. S. Jose/Una, ao N 1,8Km . Faz. Sta. Rosa.",-38.283333,-15.05,"Ambiente: Mata Higrofila da Serra. Habito: Árvore","BRA:CEPLAC:CEPEC:0000022464","Xylopia langsdorfiana A.St.-Hil. & Tul.",NA,NA,NA,NA,NA
"31","2010-06-02T00:00:00.000+0000","E","E","E00373472","Xylopia langsdorfiana A.St.-Hil. & Tul.","Annonaceae","Xylopia","langsdorfiana","A.St.-Hil. & Tul.",NA,NA,"TYPE",NA,"St. Hilaire, A.de",NA,NA,NA,"Brazil","Rio de Janeiro",NA,NA,NA,NA,NA,"http://data.rbge.org.uk/herb/E00373472","Xylopia langsdorfiana A.St.-Hil. & Tul.",NA,NA,NA,NA,NA
"32",NA,"Escola Superior de Agricultura Luiz de Queiroz, ESALQ","ESA","ESA109306","Xylopia langsdorfiana A.St.-Hil. & Tul.","Annonaceae","Xylopia","langsdorfiana","A.St.-Hil. & Tul.",NA,NA,NA,"120","Sampaio, D.",NA,NA,NA,"Brazil","São Paulo","Cananéia",NA,NA,NA,NA,"BRA:ESALQ:ESA:0ESA109306","Xylopia langsdorfiana A.St.-Hil. & Tul.",NA,NA,NA,NA,NA
"33",NA,"Escola Superior de Agricultura Luiz de Queiroz, ESALQ","ESA","ESA109305","Xylopia langsdorfiana A.St.-Hil. & Tul.","Annonaceae","Xylopia","langsdorfiana","A.St.-Hil. & Tul.",NA,NA,NA,"120","Sampaio, D.",NA,NA,NA,"Brazil","São Paulo","Cananéia",NA,NA,NA,NA,"BRA:ESALQ:ESA:0ESA109305","Xylopia langsdorfiana A.St.-Hil. & Tul.",NA,NA,NA,NA,NA
"34","2015-10-11T02:13:41.000+0000","MNHN","P","P00734906","Xylopia langsdorfiana A.St.-Hil. & Tul.","Annonaceae","Xylopia","langsdorfiana","A.St.-Hil. & Tul.",NA,NA,"ISOTYPE",NA,"Langsdorff",NA,NA,NA,"Brazil",NA,NA,NA,NA,NA,"Cueilli par Langsdorff et donné par lui à Louis Claude Richard","http://coldb.mnhn.fr/catalognumber/mnhn/p/p00734906","Xylopia langsdorfiana A.St.-Hil. & Tul.",NA,NA,NA,NA,NA
"35","2015-09-04T14:38:02.000+0000","MNHN","P","P00734905","Xylopia langsdorfiana A.St.-Hil. & Tul.","Annonaceae","Xylopia","langsdorfiana","A.St.-Hil. & Tul.",NA,NA,"HOLOTYPE",NA,"Langsdorff",NA,NA,NA,"Brazil",NA,NA,NA,NA,NA,NA,"http://coldb.mnhn.fr/catalognumber/mnhn/p/p00734905","Xylopia langsdorfiana A.St.-Hil. & Tul.",NA,NA,NA,NA,NA
"36","2017-11-17T12:39:16.000+0000","JBRJ","RB","RB01225451","Xylopia langsdorfiana A.St.-Hil. & Tul.","Annonaceae","Xylopia","langsdorfiana","A.St.-Hil. & Tul.",NA,NA,NA,"120","D. Sampaio",NA,NA,NA,"Brazil","São Paulo","Cananéia","Arredores do Centro de Pesquisa - Perequê P.E Ilha do Cardoso.",NA,NA,NA,"urn:catalog:JBRJ:RB:1225451","Xylopia langsdorfiana A.St.-Hil. & Tul.",NA,NA,NA,NA,NA
"37",NA,"UFRGS","ICN","090680","Xylopia langsdorfiana A.St.-Hil. & Tul.","Annonaceae","Xylopia","langsdorfiana","A.St.-Hil. & Tul.","Dias, MC","1998-03-25T00:00:00.000+0000",NA,"6617","Sobral, M; Attili, D",1991,1,NA,"Brazil","Sp","Peruíbe","Parque Estadual da Juréia",0,0,"Arvoreta 7 m; frutos imaturos; Região de mata atlântica; em interior de mata junto ao rio Guilherme","BRA:UFRGS:ICN:0000090680","Xylopia langsdorfiana A.St.-Hil. & Tul.",NA,NA,NA,NA,NA
"38",NA,"UNICAMP","UEC","22231","Xylopia langsdorfiana A.St.-Hil. & Tul.","Annonaceae","Xylopia","langsdorfiana","A.St.-Hil. & Tul.","Mello-Silva, R.","1990-03-01T00:00:00.000+0000",NA,"10745","Leitão Filho, H.F.",1979,12,11,"Brazil","São Paulo","Cananéia","Ilha do Cardoso",0,0,"flor, Arvoreta ca. 1,8m. Flores creme. Em restinga.","BRA:UNICAMP:UEC:0000022231","Xylopia langsdorfiana A.St.-Hil. & Tul.",NA,NA,NA,NA,NA
"39",NA,"HUCP",NA,"3398","Xylopia langsdorfiana A.St.-Hil. & Tul.","Annonaceae","Xylopia","langsdorfiana","A.St.-Hil. & Tul.","Silva, SM",NA,NA,"1907","Britez, RM",NA,NA,NA,"Brazil","Paraná",NA,"Ilha do Mel, Morro do Forte.",0,0,NA,"3425","Xylopia langsdorfiana A.St.-Hil. & Tul.",NA,NA,NA,NA,NA
