"","modified","institutionCode","collectionCode","catalogNumber","scientificName","identificationQualifier","family","genus","specificEpithet","scientificNameAuthorship","identifiedBy","dateIdentified","typeStatus","recordNumber","fieldNumber","recordedBy","year","month","day","country","stateProvince","municipality","locality","decimalLongitude","decimalLatitude","occurrenceRemarks","occurrenceID","bibliographicCitation","acceptedNameUsage"
"209","2014-07-08T02:57:45.000+0000","JBRJ","RB","RB00042607","Guatteria ferruginea A.St.-Hil.",NA,"Annonaceae","Guatteria","ferruginea","A.St.-Hil.","Adriana Quintella Lobão",NA,NA,"24",NA,"Antonio Eli P. Rosas; et al.",1993,12,28,"Brazil","Bahia","Jaguaripe","Margem da Estrada Barra dos Garcês/Camaçandi.",NA,NA,"Árvore pequena, cauliflora/turnuflora com flores amarelo esverdeados, graúdas, em almofadas florais densas quando no tronco.","urn:catalog:JBRJ:RB:42607",NA,"Guatteria ferruginea A.St.-Hil."
"210",NA,"Instituto Amazónico de Investigaciones Científicas SINCHI","COAH","47836","Guatteria ferruginea A.St.-Hil.",NA,"Annonaceae","Guatteria","ferruginea","A.St.-Hil.","Cárdenas, D.","2004-08-01T00:00:00.000+0000",NA,"3142",NA,"Duque, A.",1992,1,1,"Colombia","Amazonas",NA,"comunidad indígena de Villazul, tierra firme",-72.1,-0.53333,"Ejemplar botánico","SINCHI:COAH:47836",NA,"Guatteria ferruginea A.St.-Hil."
"211",NA,"Universidad de Antioquia (UdeA)","HUA","128589","Guatteria ferruginea A.St.-Hil.",NA,"Annonaceae","Guatteria","ferruginea","A.St.-Hil.","Posada A.","1993-01-01T00:00:00.000+0000",NA,"82",NA,"Duque A. | Posada A.",1992,4,1,"Colombia","Amazonas",NA,"""Región de Araracuara, Villa Azul, Resguardo Indígena Muinane""",-72.1,-0.933333,NA,"UdeA:HUA:128589",NA,"Guatteria ferruginea A.St.-Hil."
"212",NA,NA,"Botany","U.1064084","Guatteria ferruginea A.St.-Hil.",NA,"Annonaceae","Guatteria","ferruginea","A.St.-Hil.","Maas PJM",NA,NA,NA,NA,"Amorim AM; et al.",1992,9,15,"Brazil","Bahia",NA,NA,NA,NA,NA,"http://data.biodiversitydata.nl/naturalis/specimen/U.1064084",NA,"Guatteria ferruginea A.St.-Hil."
"213",NA,"MBM","MBM","284842","Guatteria burchellii R.E.Fr.",NA,"Annonaceae","Guatteria","burchellii","R.E.Fr.","Mello-Silva, R","2002-01-01T00:00:00.000+0000",NA,"737",NA,"Amorim, AM; Carvalho, AM; Sant'Ana, SC; Jardim, JC",1992,9,15,"Brazil","Bahia","Una","Ca. 43 km na estrada Ilhéus para Una.",0,0,"Árvore com até 8,0 metros de altura. Folhas verdes levemente discolores. Flores c/corola esverdeada. Frutos verdes com pedunculo vinoso, bastante vistoso.; Restinga arbórea.","BRA:MBM:MBM:0000284842",NA,"Guatteria burchellii R.E.Fr."
"214",NA,NA,"Botany","WAG0115334","Guatteria ferruginea A.St.-Hil.",NA,"Annonaceae","Guatteria","ferruginea","A.St.-Hil.","Maas PJM",NA,NA,NA,NA,"Amorim AM; et al.",1992,10,6,"Brazil","Bahia",NA,NA,NA,NA,NA,"http://data.biodiversitydata.nl/naturalis/specimen/WAG0115334",NA,"Guatteria ferruginea A.St.-Hil."
"215","2013-08-23T04:12:00.000+0000","MO","MO","3402875","Guatteria ferruginea A.St.-Hil.",NA,"Annonaceae","Guatteria","ferruginea","A.St.-Hil.","Maas","1998-01-01T00:00:00.000+0000",NA,"Amorim 818",NA,"André M. Amorim",1992,10,6,"Brazil","Bahia",NA,"Município de Urucuca. Distrito de Serra Grande. 7,3 km na estrada Serra Grande/Itacaré. Fazenda Lagoa do Conjunto Faz. Santa Cruz. W. Mata Higrofila sul baiana.",-39.01666,-14.41666,NA,"urn:catalog:MO:Tropicos:3402875","http://www.tropicos.org/Specimen/3402875","Guatteria ferruginea A.St.-Hil."
"216",NA,"NY","NY","378920","Guatteria ferruginea A.St.-Hil.",NA,"Annonaceae","Guatteria","ferruginea","A.St.-Hil.","P. J. M. Maas","2001-01-01T00:00:00.000+0000",NA,"818",NA,"A. M. Amorim",1992,10,8,"Brazil","Bahia",NA,"Estrada Sao JosÃ©-Una. Coletas efetuadas entre os kms 40 e 45 a partir da BR",-39.0751882637406,-15.2970177652254,NA,"3b04f631-adfa-485a-9840-1f66860f811b",NA,"Guatteria ferruginea A.St.-Hil."
"217",NA,NA,"Botany","U.1064082","Guatteria ferruginea A.St.-Hil.",NA,"Annonaceae","Guatteria","ferruginea","A.St.-Hil.","Maas PJM",NA,NA,NA,NA,"Amorim AM; et al.",1992,10,6,"Brazil","Bahia",NA,NA,NA,NA,NA,"http://data.biodiversitydata.nl/naturalis/specimen/U.1064082",NA,"Guatteria ferruginea A.St.-Hil."
"218",NA,"Universidade Federal da Bahia (UFBA)","ALCB","64464","Guatteria burchellii R.E.Fr.",NA,"Annonaceae","Guatteria","burchellii","R.E.Fr.","Mello-Silva, R de","2002-01-01T00:00:00.000+0000",NA,"818",NA,"Amorim, AMA; Maas, PJM; Van Zuilen, CM; Santos, TS dos; Sant'Ana, SC de; Duarte, J",1992,10,8,"Brazil","Bahia","Una","Litoral Sul, Estrada São José-Una. Km 40-45 a partir da BR",-39.066667,-15.283333,"ca. 10m x 0,20m DAP, cauliflora. Folhas verde-opaco na face superior secundárias imensas. Face superior verde-claro com nervuras marrom-claro. Pedicelo verde, cálice e corola verde-claro, estipes avermelhados, frutíulos verde-brilhant","BRA:UFBA:ALCB:0000064464",NA,"Guatteria burchellii R.E.Fr."
"219","2014-07-22T14:58:51.000+0000","JBRJ","RB","RB00448864","Guatteria ferruginea A.St.-Hil.",NA,"Annonaceae","Guatteria","ferruginea","A.St.-Hil.","A.Lobão",NA,NA,"519",NA,"M. Gomes; et al",1992,10,26,"Brazil","Rio de Janeiro","Guapimirim","Estação Ecológica Estadual de Paraíso. Proximidades do alojamento.",-42.45,-22.35,"Árvore, folhas coriáceas discolores, escuras; frutos imaturos verdes com abase das estipites vinosas","urn:catalog:JBRJ:RB:448864",NA,"Guatteria ferruginea A.St.-Hil."
"220",NA,NA,"Botany","U.1064083","Guatteria ferruginea A.St.-Hil.",NA,"Annonaceae","Guatteria","ferruginea","A.St.-Hil.","Maas PJM",NA,NA,NA,NA,"Amorim AM; et al.",1992,10,6,"Brazil","Bahia",NA,NA,NA,NA,NA,"http://data.biodiversitydata.nl/naturalis/specimen/U.1064083",NA,"Guatteria ferruginea A.St.-Hil."
"221",NA,"MBM","MBM","273570","Guatteria burchellii R.E.Fr.",NA,"Annonaceae","Guatteria","burchellii","R.E.Fr.","Mello-Silva, R","2002-01-01T00:00:00.000+0000",NA,"818",NA,"Amorim, AM; Maas, PJM; Van Zuilen, CM; Santos, TS; Sant' Ana, SC; Duarte, J",1992,10,8,"Brazil","Bahia","Una","Estrada São José-Una, entre os Kms 40 e 45.",0,0,"Árvore com ca. 10m x 0,2 de DAP, cauliflora. Folhas verde-opaco na face superior, secundárias, imensas. Face superior verde claro com nervuras marrom claro. Pedicelo verde, cálice e corola verde claros, estipes avermelhados, frotícul","BRA:MBM:MBM:0000273570",NA,"Guatteria burchellii R.E.Fr."
"222",NA,"NY","NY","1019402","Guatteria burchellii R.E.Fr.",NA,"Annonaceae","Guatteria","burchellii","R.E.Fr.","A. Q. LobÃ£o","2006-01-01T00:00:00.000+0000",NA,"2224",NA,"R. R. Guedes-Bruni",1991,2,28,"Brazil","Rio de Janeiro",NA,"EstaÃ§Ã£o EcolÃ³gica Estadual de Paraiso, em Ã¡rea prÃ³xima ao capinzal, SÃ­tio Sainclair. Ãrea FP41.",-42.88333,-22.41667,NA,"05038c5e-1b9e-4483-bfd5-da9ad49f22b0",NA,"Guatteria burchellii R.E.Fr."
"223","2017-10-15T08:40:45.000+0000","JBRJ","RB","RB00448881","Guatteria ferruginea A.St.-Hil.",NA,"Annonaceae","Guatteria","ferruginea","A.St.-Hil.","A.Lobão",NA,NA,"2224",NA,"R. Guedes",1991,2,28,"Brazil","Rio de Janeiro","Guapimirim","Estação Ecológica Estadual de Paraiso, em área próxima ao capinzal, Sítio Sainclair.",-42.833333,-22.383333,"Arvoreta; folhas verdes, levemente discolores, verticilos florais externos ferrugíneos; frutos imaturos verdes com pedunculos vinosos","urn:catalog:JBRJ:RB:448881",NA,"Guatteria ferruginea A.St.-Hil."
"224",NA,"Universidade Federal da Bahia (UFBA)","ALCB","27458","Guatteria burchellii R.E.Fr.",NA,"Annonaceae","Guatteria","burchellii","R.E.Fr.","Lobão, A","2005-08-01T00:00:00.000+0000",NA,"s/n",NA,"Ribeiro, AJ",1991,6,28,"Brazil","Bahia","Valença","Litoral Sul, praia de guaimbim",-39.066667,-13.366667,"folhas coiráceas, sem pontos translúcidos.","BRA:UFBA:ALCB:0000027458",NA,"Guatteria burchellii R.E.Fr."
"225","2017-10-15T09:27:41.000+0000","JBRJ","RB","RB00448893","Guatteria ferruginea A.St.-Hil.",NA,"Annonaceae","Guatteria","ferruginea","A.St.-Hil.","A.Lobão",NA,NA,"2210",NA,"R. Guedes; et al",1991,8,27,"Brazil","Rio de Janeiro","Guapimirim","Estaçào Ecológica Estadual de Paraíso.",-42.833333,-22.383333,"Árvore; folhas verdes discolores; frutificação densa (intensa) ao longo do caule, pedunculo vinoso, frutos imaturos verdes","urn:catalog:JBRJ:RB:448893",NA,"Guatteria ferruginea A.St.-Hil."
"226",NA,"MBM","MBM","352596","Guatteria burchellii R.E.Fr.",NA,"Annonaceae","Guatteria","burchellii","R.E.Fr.","Lobão, A","2006-04-01T00:00:00.000+0000",NA,"2220",NA,"Guedes, R",1991,8,28,"Brazil","Rio de Janeiro","Guapimirim","Estação Ecológica Estadual de Paraíso",0,0,"Árvore com folhas verdes discolores, frutos imaturos, altura 6m.; Mata seca regenerada.","BRA:MBM:MBM:0000352596",NA,"Guatteria burchellii R.E.Fr."
"227",NA,NA,"Botany","U.1064073","Guatteria ferruginea A.St.-Hil.",NA,"Annonaceae","Guatteria","ferruginea","A.St.-Hil.","Lobao A","2002-12-01T00:00:00.000+0000",NA,NA,NA,"Guedes R",1991,8,28,"Brazil","Rio de Janeiro",NA,NA,NA,NA,NA,"http://data.biodiversitydata.nl/naturalis/specimen/U.1064073",NA,"Guatteria ferruginea A.St.-Hil."
"228",NA,NA,"Botany","U.1064074","Guatteria ferruginea A.St.-Hil.",NA,"Annonaceae","Guatteria","ferruginea","A.St.-Hil.","Lobao A","2002-12-01T00:00:00.000+0000",NA,NA,NA,"Guedes R",1991,8,28,"Brazil","Rio de Janeiro",NA,NA,NA,NA,NA,"http://data.biodiversitydata.nl/naturalis/specimen/U.1064074",NA,"Guatteria ferruginea A.St.-Hil."
"229","2017-10-15T09:41:21.000+0000","JBRJ","RB","RB00448884","Guatteria ferruginea A.St.-Hil.",NA,"Annonaceae","Guatteria","ferruginea","A.St.-Hil.","A.Lobão",NA,NA,"2220",NA,"R. Guedes; et al",1991,8,28,"Brazil","Rio de Janeiro","Guapimirim","Estação Ecológica Estadual de Paraíso.",-42.833333,-22.383333,"Árvore; folhas verdes discolores; frutos imaturos","urn:catalog:JBRJ:RB:448884",NA,"Guatteria ferruginea A.St.-Hil."
"230","2013-11-06T14:42:46.000+0000","JBRJ","RB","RB00815811","Guatteria ferruginea A.St.-Hil.",NA,"Annonaceae","Guatteria","ferruginea","A.St.-Hil.","A. Lobão",NA,NA,"7017",NA,"D.C. Daly et. al.;",1991,10,30,"Brazil","Acre","Brasiléia","Seringal Poromgaba, Colocação São José. 25km N of km 4 Brasiléia-Assis Brasil road.",-68.75,-10.75,"Tree outer bark brow thin pitted. Flowers pendent, perianth cream. Androecium orange, stigmas green","urn:catalog:JBRJ:RB:815811",NA,"Guatteria ferruginea A.St.-Hil."
"231","2014-07-22T14:58:52.000+0000","JBRJ","RB","RB00448874","Guatteria ferruginea A.St.-Hil.",NA,"Annonaceae","Guatteria","ferruginea","A.St.-Hil.","A.Lobão",NA,NA,"4310",NA,"H.C. de Lima; et al",1991,11,20,"Brazil","Rio de Janeiro","Guapimirim","Margem do rio Paraiso, Reserva da CEDAE.",-42.083333,-22.45,"Árvore, flores com tépalos verde-ferrugíneos, estames amarelos e gineceu esverdeado. Folhas jovens ferrugineas. Ocasional","urn:catalog:JBRJ:RB:448874",NA,"Guatteria ferruginea A.St.-Hil."
"232",NA,"Instituto de Investigación de Recursos Biológicos Alexander von Humboldt (IAvH)","FMB","FMB-57613","Guatteria ferruginea A.St.-Hil.","cf. ferruginea","Annonaceae","Guatteria","ferruginea","A.St.-Hil.","Anónimo",NA,NA,"2746",NA,"Cárdenas, Dairon | Ramírez, J.",1990,4,12,"Colombia","Antioquia",NA,"Vereda La Josefina, Quebrada La Mariola",-74.916667,6,NA,"IAvH:FMB-57613",NA,"Guatteria ferruginea A.St.-Hil."
"233",NA,"MBM","MBM","334323","Guatteria ferruginea A.St.-Hil.",NA,"Annonaceae","Guatteria","ferruginea","A.St.-Hil.","Lobão, A","2002-01-01T00:00:00.000+0000",NA,"122",NA,"Kurtz, BC; Costa, A",1990,10,20,"Brazil","Rio de Janeiro","Santa Maria Madalena","Ribeirão Vermelho, Elev. 700/800m.",0,0,"Pequena árvore, ca 6m alt., folhas verdes levemente discolores, frutículos verdes com a base do pedícelo rosada.; Na mata.","BRA:MBM:MBM:0000334323",NA,"Guatteria ferruginea A.St.-Hil."
"234",NA,"UEM","HUEM","5509","Guatteria ferruginea A.St.-Hil.",NA,"Annonaceae","Guatteria","ferruginea","A.St.-Hil.",NA,NA,NA,"s.n.",NA,"Assis, M.A.",1989,3,30,"Brazil","Mato Grosso do Sul",NA,"lagoa Finado Raimundo",0,0,"Árvore com 5,0 m.","BRA:UEM:HUEM:0000005509",NA,"Guatteria ferruginea A.St.-Hil."
"235",NA,NA,"Botany","L.3729087","Guatteria ferruginea A.St.-Hil.",NA,"Annonaceae","Guatteria","ferruginea","A.St.-Hil.",NA,NA,NA,NA,NA,"Londono AC; Alvarez E; Moreno E; Londono O",1989,11,10,"Colombia",NA,NA,"Colombia-Amazonas. Araracuara. Villazul, rio caqueta, margen izquierda frente isla sumaeta.",-72.133333,-0.566667,NA,"http://data.biodiversitydata.nl/naturalis/specimen/L.3729087",NA,"Guatteria ferruginea A.St.-Hil."
"236",NA,"UEM","HUEM","5510","Guatteria ferruginea A.St.-Hil.",NA,"Annonaceae","Guatteria","ferruginea","A.St.-Hil.",NA,NA,NA,"115",NA,"Silvio Mendes",1988,8,25,"Brazil","Paraná","Porto Rico","L. F. Raimundo,",0,0,"Arbórea; frutos de coloração amarela, perímetro de 55 cm e altura de 8,0 m","BRA:UEM:HUEM:0000005510",NA,"Guatteria ferruginea A.St.-Hil."
"237",NA,NA,"Botany","U.1064078","Guatteria ferruginea A.St.-Hil.",NA,"Annonaceae","Guatteria","ferruginea","A.St.-Hil.",NA,NA,NA,NA,NA,"Barbosa MR",1988,10,4,"Brazil","Rio de Janeiro",NA,NA,NA,NA,NA,"http://data.biodiversitydata.nl/naturalis/specimen/U.1064078",NA,"Guatteria ferruginea A.St.-Hil."
"238",NA,"ICN","COL","298199","Guatteria ferruginea A.St.-Hil.",NA,"Annonaceae","Guatteria","ferruginea","A.St.-Hil.","G. Galeano","1986-01-01T00:00:00.000+0000",NA,"937",NA,"G. Galeano",1986,4,19,"Colombia","Amazonas",NA,"Corrg. Araracuara. Trocha en el camino a Puerto Arturo.",NA,NA,NA,"5f927262-25e7-11e3-add6-000c29c9b582",NA,"Guatteria ferruginea A.St.-Hil."
"239",NA,"Universidade Federal Rural de Pernambuco, UFRPE","HST","8939","Guatteria ferruginea A.St.-Hil.",NA,"Annonaceae","Guatteria","ferruginea","A.St.-Hil.","M.L.Bazante","2014-09-10T00:00:00.000+0000",NA,"8413",NA,"C.A.Cid",1986,10,4,"Brazil","Amazonas","Fonte Boa","Rio Solimões, margem direita, lago do Aurá",NA,NA,"Árvore de 20m alt. x 80cm de diâmetro; botões florais verde-ferrginosos.","BRA:UFRPE:HST:0000008939",NA,"Guatteria ferruginea A.St.-Hil."
"240",NA,"Reserva Natural Vale (CVRD)","CVRD","1346","Guatteria ferruginea A.St.-Hil.",NA,"Annonaceae","Guatteria","ferruginea","A.St.-Hil.","Lopes, J.C.","2011-11-17T00:00:00.000+0000",NA,"132",NA,"Farias, G.L.",1986,11,4,"Brazil","Es","LINHARES","Córrego Dourado.",NA,NA,"<ll>dwc_commonname:</ll> Pindaíba coração","BRA:CVRD:CVRD:0000001346",NA,"Guatteria ferruginea A.St.-Hil."
"241",NA,NA,"Botany","U.1064069","Guatteria ferruginea A.St.-Hil.",NA,"Annonaceae","Guatteria","ferruginea","A.St.-Hil.","Lobao A","2002-12-01T00:00:00.000+0000",NA,NA,NA,"Farney C",1985,2,6,"Brazil","Rio de Janeiro",NA,"Brasil. Rio de Janeiro. Macaé. Faz. Crubixaes, prox. ao Pico do Frade.",NA,NA,NA,"http://data.biodiversitydata.nl/naturalis/specimen/U.1064069",NA,"Guatteria ferruginea A.St.-Hil."
"242",NA,"UNICAMP","UEC","41410","Guatteria ferruginea A.St.-Hil.",NA,"Annonaceae","Guatteria","ferruginea","A.St.-Hil.",NA,NA,NA,"3505",NA,"Peixoto; Peixoto, O.; Zardini, E.; Proença, C.; Gentry, A.",1985,2,5,"Brazil","Espírito Santo","Santa Teresa","Reserva Biológica de Nova Lombardia.",0,0,"flor, Árvore ca. 10m alt. Frutos maduros verdes e flores amareladas. Mata atlântica.","BRA:UNICAMP:UEC:0000041410",NA,"Guatteria ferruginea A.St.-Hil."
"243",NA,NA,"Botany","U.1064070","Guatteria ferruginea A.St.-Hil.",NA,"Annonaceae","Guatteria","ferruginea","A.St.-Hil.","Lobao A","2002-12-01T00:00:00.000+0000",NA,NA,NA,"Farney C",1985,2,6,"Brazil","Rio de Janeiro",NA,"Brasil. Rio de Janeiro. Macaé. Faz. Crubixaes, prox. ao Pico do Frade.",NA,NA,NA,"http://data.biodiversitydata.nl/naturalis/specimen/U.1064070",NA,"Guatteria ferruginea A.St.-Hil."
"244",NA,"MBM","MBM","334322","Guatteria ferruginea A.St.-Hil.",NA,"Annonaceae","Guatteria","ferruginea","A.St.-Hil.","Lobão, A","2002-01-01T00:00:00.000+0000",NA,"548",NA,"Farney, C",1985,2,6,"Brazil","Rio de Janeiro","Macaé","Fazenda Crubixaes, Próximo ao Pico do Frade, elev 600-650m.",0,0,"Arvoreta, 3m alt., folhas levemente coriáceas, verdes discolores, flores amareladas.; Mata primária.","BRA:MBM:MBM:0000334322",NA,"Guatteria ferruginea A.St.-Hil."
"245",NA,"NY","NY","378970","Guatteria ferruginea A.St.-Hil.",NA,"Annonaceae","Guatteria","ferruginea","A.St.-Hil.","D. M. Johnson","1988-01-01T00:00:00.000+0000",NA,"1766",NA,"L. A. Mattos Silva",1984,10,24,"Brazil","Bahia",NA,"Ramal para o Povoado de Itiúca. Ramal com entrada no km da Rodovia Nilo Peçanha/Cairu (BA 250), lado direito",-39.1065911627556,-13.603080123677,NA,"410dc646-35df-4363-9269-6865672084a8",NA,"Guatteria ferruginea A.St.-Hil."
"246",NA,NA,"Botany","U.1069524","Guatteria ferruginea A.St.-Hil.",NA,"Annonaceae","Guatteria","ferruginea","A.St.-Hil.","Maas PJM; Westra LYT",NA,NA,NA,NA,"Mattos Silva LA; Santos TS dos",1984,10,24,"Brazil","Bahia",NA,"Brasil. Municipio de Nilo Peçanha. Ramal para o Povoado de Itiúca. Ramal com entrada no Km da Rodovia Nilo Peçanha/Cairu (BA 250), lado direito.",NA,NA,NA,"http://data.biodiversitydata.nl/naturalis/specimen/U.1069524",NA,"Guatteria ferruginea A.St.-Hil."
"247","2017-10-16T23:14:31.000+0000","JBRJ","RB","RB00448860","Guatteria ferruginea A.St.-Hil.",NA,"Annonaceae","Guatteria","ferruginea","A.St.-Hil.","A.Lobão",NA,NA,"2210",NA,"H.C. de Lima; et al.",1984,10,17,"Brazil","Rio de Janeiro","Guapimirim","Estação Ecológica Estadual de Paraíso, área do Centro de Primatologia do RJ. Centro de Primatologia",NA,NA,"Árvore. Flores caulinares, cálice e corola verde claro com endumento ferrugíneo. Frutículo imaturos esverdeado e maduros nigrescentes com polpa e pedicelo vinoso","urn:catalog:JBRJ:RB:448860",NA,"Guatteria ferruginea A.St.-Hil."
"248",NA,"MBM","MBM","105668","Guatteria burchellii R.E.Fr.",NA,"Annonaceae","Guatteria","burchellii","R.E.Fr.","Lobão, A","2002-07-01T00:00:00.000+0000",NA,"2210",NA,"Lima, HC",1984,10,17,"Brazil","Rio de Janeiro","Majé","Paraiso, Área do centro de primatologia do RJ.",0,0,"Árvore pequena +- 6m de alt. Flores caulinares, cálice e corola verde claros com edumento ferrugíneo. Frutículos imaturos esverdeados e maturos nigrescentes com polpa e pedicelo vinosos.; Sub-mata.","BRA:MBM:MBM:0000105668",NA,"Guatteria burchellii R.E.Fr."
"249","2017-10-17T14:11:48.000+0000","JBRJ","RB","RB00559076","Guatteria ferruginea A.St.-Hil.",NA,"Annonaceae","Guatteria","ferruginea","A.St.-Hil.","A.Lobão",NA,NA,"2358",NA,"H.C.de Lima; et al.",1984,10,23,"Brazil","Rio de Janeiro","Guapimirim","Estação Ecológica Estadual de Paraíso.Área do Centro de Primatologia do RJ. Sopé di Focinho de Porco.",-42.833333,-22.433333,"Árvore pequena. Inflorescência caulineares e ou no ápice dos ramos. Flores castanho-esverdeadas. Frutículo novos esverdeados. ocasional na submata de floresta de encosta próximo do rio paraíso.","urn:catalog:JBRJ:RB:559076",NA,"Guatteria ferruginea A.St.-Hil."
"250",NA,"NY","NY","02698959","Guatteria ferruginea A.St.-Hil.",NA,"Annonaceae","Guatteria","ferruginea","A.St.-Hil.",NA,NA,NA,"2210",NA,"H. C. de Lima",1984,10,17,"Brazil","Rio de Janeiro",NA,"Paraiso, Ã¡rea do Centro de Primatologia do RJ",-43.0407567361808,-22.6569559555097,NA,"53cb41f0-7a55-4cbb-b5ee-cb8a2911eaf5",NA,"Guatteria ferruginea A.St.-Hil."
"251","2017-10-16T23:17:19.000+0000","JBRJ","RB","RB00448852","Guatteria ferruginea A.St.-Hil.",NA,"Annonaceae","Guatteria","ferruginea","A.St.-Hil.","A.Lobão",NA,NA,"10408",NA,"G. Martinelli; G. Bromley et E. de Lamare",1984,11,23,"Brazil","Rio de Janeiro","Guapimirim","Estação Ecológica de Paraíso. Centro de Primatologia do RJ, rio Paraiso. Centro de Primatologia",NA,NA,"Arvore, próximo do rio, folhas discolores, inflorescência cauliflora, flores com pedicelo verde, cálice verde-amarelado, corola amarelada, estames em disco amarelo, estigma verde, frutos imaturos de cor verde com sementes amarelo-claro","urn:catalog:JBRJ:RB:448852",NA,"Guatteria ferruginea A.St.-Hil."
"252",NA,"MBM","MBM","111909","Guatteria burchellii R.E.Fr.",NA,"Annonaceae","Guatteria","burchellii","R.E.Fr.","Lobão, A","2002-07-01T00:00:00.000+0000",NA,"10408",NA,"Martinelli, G; Bromley, G; Lamare, E",1984,11,23,"Brazil","Rio de Janeiro","Bajé","Centro de Primatologia do RJ, Rio Paraiso.",0,0,"Árvore c/ 9m de altura, folhas discolores, infl., cauliflora, flores c/ pedicelo verde, cálice verde-amarelado, corola amarelada, estames em disco amarelos, estigma verde, frutos imaturos de cor verde c/ sementes amarelo claras.; Mat","BRA:MBM:MBM:0000111909",NA,"Guatteria burchellii R.E.Fr."
"253","2014-07-22T19:25:41.000+0000","JBRJ","RB","RB00524487","Guatteria ferruginea A.St.-Hil.","aff.","Annonaceae","Guatteria","ferruginea","A.St.-Hil.","D. M. Johnson","1988-01-01T00:00:00.000+0000",NA,"48583",NA,"G. Hatschbach; J. M. Silva",1984,12,4,"Brazil","Minas Gerais","Leopoldina","Rodovia BR 116.",NA,NA,"Árvore de 8 m.","urn:catalog:JBRJ:RB:524487",NA,"Guatteria ferruginea A.St.-Hil."
"254",NA,"MBM","MBM","100742","Guatteria ferruginea A.St.-Hil.",NA,"Annonaceae","Guatteria","ferruginea","A.St.-Hil.","Johnson, DM","1988-01-01T00:00:00.000+0000",NA,"48583",NA,"Hatschbach, G; Silva, JM",1984,12,4,"Brazil","Minas Gerais","Leopoldina","Rodovia BR-116.",0,0,"Árvore 8 m.; Mata pluvial.","BRA:MBM:MBM:0000100742",NA,"Guatteria ferruginea A.St.-Hil."
"255","2011-02-02T12:34:22.000+0000","COL","COL","351919","Guatteria ferruginea A.St.-Hil.",NA,"Annonaceae","Guatteria","ferruginea","A.St.-Hil.","Prance, G. T.","1983-01-01T00:00:00.000+0000",NA,NA,NA,"Franco R., P.",1983,1,24,"Colombia","Chocó",NA,"Vereda La Badea.",-76.2706,4.89833,NA,"4428360",NA,"Guatteria ferruginea A.St.-Hil."
"256",NA,NA,"Botany","U.1069523","Guatteria ferruginea A.St.-Hil.",NA,"Annonaceae","Guatteria","ferruginea","A.St.-Hil.","Maas PJM; Westra LYT",NA,NA,NA,NA,"Carvalho AMV de; Plowman TC",1983,2,6,"Brazil","Bahia",NA,"Brasil. Bahia. Município de Valença, km 9 da estrada Valença/Guaibim.",NA,NA,NA,"http://data.biodiversitydata.nl/naturalis/specimen/U.1069523",NA,"Guatteria ferruginea A.St.-Hil."
"257","2014-07-08T02:46:48.000+0000","JBRJ","RB","RB00042518","Guatteria ferruginea A.St.-Hil.",NA,"Annonaceae","Guatteria","ferruginea","A.St.-Hil.","A. Lobão",NA,NA,"3874",NA,"C.A. Cid; J.L. Zarucchi, S.R. Hill, C.A.Todzia, B.W. Nelson, J.L. dos Santos & J.G. de Oliveira",1983,6,23,"Brazil","Amazonas","Borba","Rio Madeira, afluente do rio Amazonas, estrada da cidade de Borba, km 15 lugar denominado Puchurisal.",NA,NA,"Arvoreta de 9m de altura; flores esverdeadas; frutos imaturos verdes.","urn:catalog:JBRJ:RB:42518",NA,"Guatteria ferruginea A.St.-Hil."
"258",NA,"UNICAMP","UEC","47787","Guatteria ferruginea A.St.-Hil.",NA,"Annonaceae","Guatteria","ferruginea","A.St.-Hil.","Lobão, A.","2002-03-01T00:00:00.000+0000",NA,"1869",NA,"Peixoto; Peixoto, O.L.",1983,7,5,"Brazil","Rio de Janeiro","Barra Do Pirai","Ribeirão das Lajes.",0,0,"fruto, Árvore com ca. 6m de altura, muito ramificada. Flores com pilosidade densa, ferrugínea. Frutos imaturos verde-acastanhado com estípite vermelho.","BRA:UNICAMP:UEC:0000047787",NA,"Guatteria ferruginea A.St.-Hil."
"259","2014-07-08T02:47:24.000+0000","JBRJ","RB","RB00043159","Guatteria ferruginea A.St.-Hil.",NA,"Annonaceae","Guatteria","ferruginea","A.St.-Hil.","A. Lobão",NA,NA,"4092",NA,"C.A.Cid",1983,7,6,"Brazil","Amazonas","Borba","Rio Abacaxis, Vila Uaxiní.",NA,NA,"Árvoreta de 7m de altura; frutos imaturos vedes, pedicelo purpúreo.","urn:catalog:JBRJ:RB:43159",NA,"Guatteria ferruginea A.St.-Hil."
"260",NA,NA,"Botany","U.1069526","Guatteria ferruginea A.St.-Hil.",NA,"Annonaceae","Guatteria","ferruginea","A.St.-Hil.","Maas PJM; Westra LYT",NA,NA,NA,NA,"Carvalho AMV de; Lewis GP",1982,1,9,"Brazil","Bahia",NA,"Brasil. Bahia. Município de Valença. Ramal e esquerda no km 13 da rodovia Valença/Guaibim.",NA,NA,NA,"http://data.biodiversitydata.nl/naturalis/specimen/U.1069526",NA,"Guatteria ferruginea A.St.-Hil."
"261",NA,NA,"Botany","U.1064076","Guatteria ferruginea A.St.-Hil.",NA,"Annonaceae","Guatteria","ferruginea","A.St.-Hil.","Lobao A","2002-12-01T00:00:00.000+0000",NA,NA,NA,"Mayo SJ; et al.",1981,2,18,"Brazil","Rio de Janeiro",NA,NA,NA,NA,NA,"http://data.biodiversitydata.nl/naturalis/specimen/U.1064076",NA,"Guatteria ferruginea A.St.-Hil."
"262",NA,NA,"Botany","U.1064072","Guatteria ferruginea A.St.-Hil.",NA,"Annonaceae","Guatteria","ferruginea","A.St.-Hil.","Lobao A",NA,NA,NA,NA,"Alves LC",1981,3,17,"Brazil","Rio de Janeiro",NA,NA,NA,NA,NA,"http://data.biodiversitydata.nl/naturalis/specimen/U.1064072",NA,"Guatteria ferruginea A.St.-Hil."
"263",NA,NA,"Botany","U  0009582","Guatteria ferruginea A.St.-Hil.",NA,"Annonaceae","Guatteria","ferruginea","A.St.-Hil.","Lobao A",NA,NA,NA,NA,"Souza DS",1981,3,17,"Brazil","Rio de Janeiro",NA,NA,NA,NA,NA,"http://data.biodiversitydata.nl/naturalis/specimen/U%20%200009582",NA,"Guatteria ferruginea A.St.-Hil."
"264",NA,NA,"Botany","U  0009584","Guatteria ferruginea A.St.-Hil.",NA,"Annonaceae","Guatteria","ferruginea","A.St.-Hil.","Lobao A",NA,NA,NA,NA,"Barbosa MR",1981,3,17,"Brazil","Rio de Janeiro",NA,NA,NA,NA,NA,"http://data.biodiversitydata.nl/naturalis/specimen/U%20%200009584",NA,"Guatteria ferruginea A.St.-Hil."
"265",NA,NA,"Botany","U  0009583","Guatteria ferruginea A.St.-Hil.",NA,"Annonaceae","Guatteria","ferruginea","A.St.-Hil.","Lobao A",NA,NA,NA,NA,"Silva MN",1981,3,17,"Brazil","Rio de Janeiro",NA,NA,NA,NA,NA,"http://data.biodiversitydata.nl/naturalis/specimen/U%20%200009583",NA,"Guatteria ferruginea A.St.-Hil."
"266",NA,"NY","NY","538635","Guatteria burchellii R.E.Fr.",NA,"Annonaceae","Guatteria","burchellii","R.E.Fr.","A. Q. LobÃ£o; R. de Mello-Silva","2007-01-01T00:00:00.000+0000",NA,"661",NA,"A. M. V. de Carvalho",1981,4,29,"Brazil","Bahia",NA,"Estrada OlivenÃ§a / Vila Brasil, km 33 a SW de OlivenÃ§a. Maruim, fazenda 2 de julho",-39.120249,-15.114892,NA,"81d00b60-8956-4f7e-ac7e-408f44b863fd",NA,"Guatteria burchellii R.E.Fr."
