"","modified","institutionCode","collectionCode","catalogNumber","scientificName","identificationQualifier","family","genus","specificEpithet","scientificNameAuthorship","identifiedBy","dateIdentified","typeStatus","recordNumber","fieldNumber","recordedBy","year","month","day","country","stateProvince","municipality","locality","decimalLongitude","decimalLatitude","occurrenceRemarks","occurrenceID","bibliographicCitation","acceptedNameUsage"
"156",NA,"USP","SPF","221769","Guatteria ferruginea A.St.-Hil.",NA,"Annonaceae","Guatteria","ferruginea","A.St.-Hil.","Lopes, JC","2013-01-01T00:00:00.000+0000",NA,"1553",NA,"Mello-Silva, R",1999,2,10,"Brazil","Espírito Santo","Linhares","Reserva Natural Vale",0,0,NA,"BRA:USP:SPF:0000221769",NA,"Guatteria ferruginea A.St.-Hil."
"157",NA,"Instituto Amazónico de Investigaciones Científicas SINCHI","COAH","38319","Guatteria ferruginea A.St.-Hil.",NA,"Annonaceae","Guatteria","ferruginea","A.St.-Hil.","Suárez, S.","2000-01-01T00:00:00.000+0000",NA,"62",NA,"López, J.A.",1999,2,2,"Colombia","Caquetá",NA,NA,-72.45139,0.00111,"Ejemplar botánico","SINCHI:COAH:38319",NA,"Guatteria ferruginea A.St.-Hil."
"158",NA,"USP","SPF","212257","Guatteria ferruginea A.St.-Hil.",NA,"Annonaceae","Guatteria","ferruginea","A.St.-Hil.","Lopes, JC","2012-01-01T00:00:00.000+0000",NA,"2586",NA,"Kollmann, L",1999,6,16,"Brazil","Espírito Santo","Santa Teresa","Aparecidinha, Terreno de L. Bringhenti.",0,0,NA,"BRA:USP:SPF:0000212257",NA,"Guatteria ferruginea A.St.-Hil."
"159","2014-07-07T22:09:07.000+0000","JBRJ","RB","RB00679339","Guatteria ferruginea A.St.-Hil.",NA,"Annonaceae","Guatteria","ferruginea","A.St.-Hil.","A. Lobão",NA,NA,"1703",NA,"M.G. Bovini; J.M.A. Braga",1999,8,1,"Brazil","Rio de Janeiro","Xerém","Barragem de Saracuruna, trilha para a Pedra Branca.",NA,NA,"Árvore ca. 2,0m, semi-heliófila. Folhas cartáceas levemente discolores. Frutos imaturos verdes.","urn:catalog:JBRJ:RB:679339",NA,"Guatteria ferruginea A.St.-Hil."
"160",NA,"Instituto Amazónico de Investigaciones Científicas SINCHI","COAH","41338","Guatteria ferruginea A.St.-Hil.",NA,"Annonaceae","Guatteria","ferruginea","A.St.-Hil.","Suárez, S.","2000-01-01T00:00:00.000+0000",NA,"524",NA,"Eusse, A.",1999,9,13,"Colombia","Caquetá",NA,"estación biológica Puerto Abeja, bosque de tierra firme, sector SE PNN serranía de Chiribiquete",-72.45139,0.07416,"Ejemplar botánico","SINCHI:COAH:41338",NA,"Guatteria ferruginea A.St.-Hil."
"161","2017-10-18T14:20:24.000+0000","JBRJ","RB","RB00744226","Guatteria ferruginea A.St.-Hil.",NA,"Annonaceae","Guatteria","ferruginea","A.St.-Hil.",NA,NA,NA,"5477",NA,"J.M.A. Braga",1999,10,17,"Brazil","Rio de Janeiro","Duque de Caxias","Distrito de Xerém, APA de Petrópolis, bairro da Mantiqueira, proximidades da margem do rio Pedra Branca. Sopé da Serra dos Órgãos. .",NA,NA,"Árvore, ca. 7m de altura. Folhas membranáceas, pêlos- castanho-claros. Caulifloria. Flores verdes e carnosas com base no perianto revestido de pêlos castanho-claros. Frutos imaturos verdes.","urn:catalog:JBRJ:RB:744226",NA,"Guatteria ferruginea A.St.-Hil."
"162","2014-07-07T18:34:24.000+0000","JBRJ","RB","RB00553829","Guatteria ferruginea A.St.-Hil.",NA,"Annonaceae","Guatteria","ferruginea","A.St.-Hil.","A. Lobão",NA,NA,"430",NA,"M.C.F. dos Santos; P.W. Feteira; L.O.F. Sousa; A.P.M. Guimarães;  A.A.M. de Barros, L.J.S. Pinto; J.A.L. Pontes et al.",1999,11,13,"Brazil","Rio de Janeiro","Santa Maria Madalena","Parque Estadual do Desengano , Trilha da Rifa, início da mata, lado esquerdo. Mata Atlântica secundária.",NA,NA,"Árvore com cerca de 4,5 m de altura, heliófila, folhas coriáceas discolores verdes, flores esverdeadas, frutos imaturos vinosos.","urn:catalog:JBRJ:RB:553829",NA,"Guatteria ferruginea A.St.-Hil."
"163",NA,"Instituto Amazónico de Investigaciones Científicas SINCHI","COAH","41334","Guatteria ferruginea A.St.-Hil.",NA,"Annonaceae","Guatteria","ferruginea","A.St.-Hil.","Eusse, A.M.","1999-11-05T00:00:00.000+0000",NA,"758",NA,"Eusse, A.",1999,11,5,"Colombia","Caquetá",NA,"estación biológica Puerto Abeja, bosque de tierra firme, sector SE PNN serranía de Chiribiquete",-72.45139,0.07416,"Ejemplar botánico","SINCHI:COAH:41334",NA,"Guatteria ferruginea A.St.-Hil."
"164",NA,"Instituto Amazónico de Investigaciones Científicas SINCHI","COAH","41298","Guatteria ferruginea A.St.-Hil.",NA,"Annonaceae","Guatteria","ferruginea","A.St.-Hil.","Eusse, A.M.","1999-11-05T00:00:00.000+0000",NA,"758",NA,"Eusse, A.",1999,11,5,"Colombia","Caquetá",NA,"estación biológica Puerto Abeja, bosque de tierra firme, sector SE PNN serranía de Chiribiquete",-72.45139,0.07416,"Ejemplar botánico","SINCHI:COAH:41298",NA,"Guatteria ferruginea A.St.-Hil."
"165",NA,"Instituto Amazónico de Investigaciones Científicas SINCHI","COAH","41448","Guatteria ferruginea A.St.-Hil.",NA,"Annonaceae","Guatteria","ferruginea","A.St.-Hil.","Murillo, J. & J.G. Ramírez","2002-04-01T00:00:00.000+0000",NA,"843",NA,"Eusse, A.",1999,12,7,"Colombia","Caquetá",NA,"estación biológica Puerto Abeja, bosque de tierra firme, sector SE PNN serranía de Chiribiquete",-72.45139,0.07416,"Ejemplar botánico","SINCHI:COAH:41448",NA,"Guatteria ferruginea A.St.-Hil."
"166",NA,"Instituto Amazónico de Investigaciones Científicas SINCHI","COAH","41447","Guatteria ferruginea A.St.-Hil.",NA,"Annonaceae","Guatteria","ferruginea","A.St.-Hil.","Ramírez, J.G.","2001-11-01T00:00:00.000+0000",NA,"843",NA,"Eusse, A.",1999,12,7,"Colombia","Caquetá",NA,"estación biológica Puerto Abeja, bosque de tierra firme, sector SE PNN serranía de Chiribiquete",-72.45139,0.07416,"Ejemplar botánico","SINCHI:COAH:41447",NA,"Guatteria ferruginea A.St.-Hil."
"167",NA,"NY","NY","00932358","Guatteria ferruginea A.St.-Hil.",NA,"Annonaceae","Guatteria","ferruginea","A.St.-Hil.","P. J. M. Maas","2017-01-01T00:00:00.000+0000",NA,"1238",NA,"J. G. Jardim",1998,1,15,"Brazil","Bahia",NA,"Rod. Almadina/Ibitupa, entrada a 5 km W da sede do municÃ­pio. Fazenda Cruceiro do Sul. Serra do Sete-paus; ca. 8 km da entrada",-39.696111,-14.735,NA,"34c1b1aa-a80b-4494-bfb1-4e5193ca59ca",NA,"Guatteria ferruginea A.St.-Hil."
"168","2014-07-08T03:14:33.000+0000","JBRJ","RB","RB00417064","Guatteria ferruginea A.St.-Hil.",NA,"Annonaceae","Guatteria","ferruginea","A.St.-Hil.","Adriana Quintella Lobão",NA,NA,"1238",NA,"J.G. Jardim; T.S. dos Santos, J.L. da Pixão e H.D. Pengel",1998,1,15,"Brazil","Bahia","Almadina","Rodovia Almadina/Ibitupã, entrada ca. 5 km W da sede do município. Fazenda Cruzeiro do Sul. Serra do Sete-Paus; ca. 8 km da entrada. Área do Inventário Florestal e Fitossociológico.",NA,NA,"Arvoreta ca. 5 m de altura. Folhas verdes pouco discolores com face inferior mais clara. Flores com pétalas cremes algo dourado. Frutos imaturos de cor vinosa.","urn:catalog:JBRJ:RB:417064",NA,"Guatteria ferruginea A.St.-Hil."
"169",NA,"UFV","VIC","20625","Guatteria ferruginea A.St.-Hil.",NA,"Annonaceae","Guatteria","ferruginea","A.St.-Hil.","Lobão, A.Q.","2006-10-01T00:00:00.000+0000",NA,"1428",NA,"Bovini, M.G.; et al.",1998,7,16,"Brazil","Minas Gerais","Marliéria","Parque Estadual do Rio Doce (PERD), Trilha da Campolina.",0,0,"Árvore c.a. de 10 metros de altura, umbrófila. Folhas cartáceas levemente discolores. Frutos imaturos verdes.","BRA:UFV:VIC:0000020625",NA,"Guatteria ferruginea A.St.-Hil."
"170","2017-10-12T23:01:40.000+0000","JBRJ","RB","RB00703601","Guatteria ferruginea A.St.-Hil.",NA,"Annonaceae","Guatteria","ferruginea","A.St.-Hil.","A.Lobão",NA,NA,"87",NA,"A.Quinet; et al.",1998,10,21,"Brazil","Rio de Janeiro","Duque de Caxias","Trilha em direção ao alto do morro que é circundado pelo lago. Reserva da Petrobras",-43.266667,-22.55,"Arbusto com ca. de 2,0 m alt., tronco de casca lisa, folhas cartaceas, flores com calice aureo-tomentoso, corola imbrincada aureo-tomentosa, frutos com carpidios livres, quando maduros avinosados, imaturos verdes. Ciofila.","urn:catalog:JBRJ:RB:703601",NA,"Guatteria ferruginea A.St.-Hil."
"171",NA,"Universidade Federal da Bahia (UFBA)","ALCB","025847","Guatteria burchellii R.E.Fr.",NA,"Annonaceae","Guatteria","burchellii","R.E.Fr.","Mello-Silva, R de","2002-08-01T00:00:00.000+0000",NA,"4632",NA,"Guedes, ML; Passos Júnior, LA; Passos Júnior, LA; et al.",1997,3,14,"Brazil","Bahia","Eunápolis","Extremo Sul, Projeto Cedro",-39.566667,-16.366667,"ca. 8m, com caulifloria. Folhas concolores, coriáceas, com face abaxail ferruginosa com tomentos. Flores ferrugíneas. Ocasional.; Estágio médio de recuperação.","BRA:UFBA:ALCB:0000025847",NA,"Guatteria burchellii R.E.Fr."
"172","2017-10-18T13:49:45.000+0000","JBRJ","RB","RB00443620","Guatteria ferruginea A.St.-Hil.",NA,"Annonaceae","Guatteria","ferruginea","A.St.-Hil.",NA,NA,NA,"908",NA,"C.M.Vieira; et al.",1997,4,23,"Brazil","Rio de Janeiro","Silva Jardim","Mata na beira do rio Preto. Reserva Biológica de Poço das Antas",-42.25,-22.5,"Arvoreta 3m altura. Ramos verde-ferrugíneos. Folhas discolores, face abaxial verde-ferrugínea. Cálice ferrugíneo, corola esverdeada, estames amarelos, pistilos esverdeados.","urn:catalog:JBRJ:RB:443620",NA,"Guatteria ferruginea A.St.-Hil."
"173","2017-10-18T15:46:00.000+0000","JBRJ","RB","RB00703610","Guatteria ferruginea A.St.-Hil.",NA,"Annonaceae","Guatteria","ferruginea","A.St.-Hil.","A.Lobão",NA,NA,"4034",NA,"J, M. A. Braga; et al.",1997,5,6,"Brazil","Rio de Janeiro","Duque de Caxias","Rio Pedra Branca. Reserva da Petrobras",-43.266667,-22.55,"Arbusto, ca. 0,8 m. de alt., ciófila. Folhas membranáceas e discolores. Carpelos imaturos verdes. Mata densa. (Frutíolos)","urn:catalog:JBRJ:RB:703610",NA,"Guatteria ferruginea A.St.-Hil."
"174",NA,"Universidade Tecnológica Federal do Paraná (UTFPR)","HCF","19066","Guatteria ferruginea A.St.-Hil.",NA,"Annonaceae","Guatteria","ferruginea","A.St.-Hil.","A. Lobão","2001-09-01T00:00:00.000+0000",NA,"979",NA,"S.J. Silva Neto",1997,8,28,"Brazil","Rj","Duque de Caxias","Reserva da Petrobrás. Trilha para a",NA,NA,"arvoreta ciófila, ca. 4 m de altura; folhas concolores cartáceas; frutos jovens amarronzados com cálice persistente esverdeados; frutos imaturos verdes. 22°33'00"" S, 43°16'00"" W/ 22°31'00"" S, 43°14'00"" W.","BRA:UTFPR:HCF:0000019066",NA,"Guatteria ferruginea A.St.-Hil."
"175",NA,"MBM","MBM","378754","Guatteria ferruginea A.St.-Hil.",NA,"Annonaceae","Guatteria","ferruginea","A.St.-Hil.","Lobão, A","2001-09-01T00:00:00.000+0000",NA,"979",NA,"Silva Neto, SJ",1997,8,28,"Brazil","Rio de Janeiro","Duque de Caxias","Reserva da Petrobras, Trilha para estrada Rio-Petropolis.",0,0,"Arvoreta ciófila, ca. 4m de altura. Folhas concolores cartáceas. Frutos jovens amarronzados com cálice persistente esverdeado, frutos imaturos verdes.","BRA:MBM:MBM:0000378754",NA,"Guatteria ferruginea A.St.-Hil."
"176","2014-07-07T22:09:18.000+0000","JBRJ","RB","RB00679451","Guatteria ferruginea A.St.-Hil.",NA,"Annonaceae","Guatteria","ferruginea","A.St.-Hil.","A. Lobão",NA,NA,"4326",NA,"J.M.A. Braga; J.A. Lira Neto et C.H.R. de Paula",1997,8,5,"Brazil","Rio de Janeiro","Duque de Caxias","Distrito de Xerém, Refinaria Duque de Caxias (REDUC), Pedra Branca, margem do rio Pedra Branca.",NA,NA,"Árvore, ca. 5 m de altura. Folhas discolores e cartáceas. Flores acastanhadas com verticilos férteis amarelos. Frutíolos (caulifloria) imaturos verdes.","urn:catalog:JBRJ:RB:679451",NA,"Guatteria ferruginea A.St.-Hil."
"177","2017-10-19T11:34:37.000+0000","JBRJ","RB","RB00703604","Guatteria ferruginea A.St.-Hil.",NA,"Annonaceae","Guatteria","ferruginea","A.St.-Hil.","A.Lobão",NA,NA,"979",NA,"S.J.Silva Neto; et al.",1997,8,28,"Brazil","Rio de Janeiro","Duque de Caxias","Trilha para estrada Rio-Petropolis. Reserva da Petrobras",-43.266667,-22.55,"Arvoreta ciófila, ca. 4,0 m de altura; folhas concolores cartáceas; frutos jovens amarronzados com cálice persistente esverdeados; frutos imaturos verdes.","urn:catalog:JBRJ:RB:703604",NA,"Guatteria ferruginea A.St.-Hil."
"178",NA,"UEFS","HUEFS","186202","Guatteria ferruginea A.St.-Hil.",NA,"Annonaceae","Guatteria","ferruginea","A.St.-Hil.",NA,NA,NA,"979",NA,"Silva Neto, S.J.",1997,8,28,"Brazil","Rio de Janeiro","Duque de Caxias","Reserva da Petrobras. Trilha para estrada Rio-Petropolis.",-43.266667,-22.55,NA,"BRA:UEFS:HUEFS:0000186202",NA,"Guatteria ferruginea A.St.-Hil."
"179","2017-10-19T11:27:06.000+0000","JBRJ","RB","RB00703622","Guatteria ferruginea A.St.-Hil.",NA,"Annonaceae","Guatteria","ferruginea","A.St.-Hil.","A.Lobão",NA,NA,"4326",NA,"J, M. A. Braga; et al.",1997,8,5,"Brazil","Rio de Janeiro","Duque de Caxias","Rio Pedra Branca. Reserva da Petrobras",-43.266667,-22.55,"Arvore, ca 5,0m. alt. Folhas discolores e cartaceas. Flores acastanhadas com verticilos ferteis amarelos. Frutiolo (caulifloria) imaturos verdes.","urn:catalog:JBRJ:RB:703622",NA,"Guatteria ferruginea A.St.-Hil."
"180",NA,"Instituto Amazónico de Investigaciones Científicas SINCHI","COAH","28017","Guatteria ferruginea A.St.-Hil.",NA,"Annonaceae","Guatteria","ferruginea","A.St.-Hil.","Cárdenas, D.","1997-11-01T00:00:00.000+0000",NA,"141",NA,"Arcila, J.",1997,9,30,"Colombia","Casanare",NA,"vda. Cupiagua",-72.61602,5.19059,"Ejemplar botánico","SINCHI:COAH:28017",NA,"Guatteria ferruginea A.St.-Hil."
"181",NA,"UEFS","HUEFS","29706","Guatteria ferruginea A.St.-Hil.",NA,"Annonaceae","Guatteria","ferruginea","A.St.-Hil.","A.Lobão","2005-08-01T00:00:00.000+0000",NA,"2363",NA,"França, F.",1997,9,21,"Brazil","Bahia","Santa Terezinha","Serra da Jibóia.",NA,NA,NA,"BRA:UEFS:HUEFS:0000029706",NA,"Guatteria ferruginea A.St.-Hil."
"182",NA,"Universidade Federal da Bahia (UFBA)","ALCB","032092","Guatteria burchellii R.E.Fr.",NA,"Annonaceae","Guatteria","burchellii","R.E.Fr.","Lobão, A","2005-08-01T00:00:00.000+0000",NA,"3614",NA,"Mattos Silva, LA; Pinh; Pinheiro, RS; Jorda, Jr; JB; Araújo, M; Santos, SG; Martins, LSS",1997,10,30,"Brazil","Bahia","Una","Litoral Sul, Fazenda São Rafael (antiga Faz. Dendhevea). Ramal à esquerda, aproximadamente a 1 Km da sede, rumo ao Córrego do Tucum",-39.066667,-15.283333,"7-8m de altura x 10cm de diâmetro. flores caulinares, cor esverdeado a amarelo-pálido.; Higrófila Sul Baiana (Mata Atlântica). Argiloso.","BRA:UFBA:ALCB:0000032092",NA,"Guatteria burchellii R.E.Fr."
"183",NA,"UEFS","HUEFS","31966","Guatteria burchellii R.E.Fr.",NA,"Annonaceae","Guatteria","burchellii","R.E.Fr.","A.Lobão","2005-08-01T00:00:00.000+0000",NA,"3614",NA,"Mattos-Silva, L.A.",1997,10,30,"Brazil","Bahia","Una","Fazenda São Rafael (antiga fazenda Dendhevea). Ramal à esquerda, aproximadamente a 1km da Séde, rumo ao Córrego do Tucum.",NA,NA,"Mata Higrófila Sul Baiana (Mata Atlântica). Solo argiloso.","BRA:UEFS:HUEFS:0000031966",NA,"Guatteria burchellii R.E.Fr."
"184","2017-10-18T23:09:50.000+0000","JBRJ","RB","RB00744234","Guatteria ferruginea A.St.-Hil.",NA,"Annonaceae","Guatteria","ferruginea","A.St.-Hil.","A. Lobão",NA,NA,"1719",NA,"J.M.A. Braga; M.G. Bovini; J.R. de Figueiredo",1995,1,18,"Brazil","Rio de Janeiro","Guapimirim","Granja Monte Olivete, trilha das Andorinhas. .",NA,NA,"Árvore, ca. 8 metros de altura. Folhas sub-cartáceas. Caulifloria. Flores com cálice castanho, corola amarelada e estames amarelos.","urn:catalog:JBRJ:RB:744234",NA,"Guatteria ferruginea A.St.-Hil."
"185","2017-10-18T14:20:24.000+0000","JBRJ","RB","RB00744207","Guatteria ferruginea A.St.-Hil.",NA,"Annonaceae","Guatteria","ferruginea","A.St.-Hil.","A. Lobão",NA,NA,"1697",NA,"J.M.A. Braga; M.G. Bovini; J.R. de Figueiredo",1995,1,18,"Brazil","Rio de Janeiro","Guapimirim","Granja Monte Olivete, trilha das Andorinhas.",NA,NA,"Arvoreta, ca. 4 metros de altura, umbrófila. Folhas cartáceas. Flores com cálice verde-claro, corola castanho-esverdeada e estames amarelos.","urn:catalog:JBRJ:RB:744207",NA,"Guatteria ferruginea A.St.-Hil."
"186",NA,NA,"Botany","U.1064077","Guatteria ferruginea A.St.-Hil.",NA,"Annonaceae","Guatteria","ferruginea","A.St.-Hil.",NA,NA,NA,NA,NA,"Braga JMA; et al.",1995,1,18,"Brazil","Rio de Janeiro",NA,NA,NA,NA,NA,"http://data.biodiversitydata.nl/naturalis/specimen/U.1064077",NA,"Guatteria ferruginea A.St.-Hil."
"187",NA,"Pontificia Universidad Javeriana (PUJ)","HPUJ","8992","Guatteria ferruginea A.St.-Hil.","aff. ferruginea","Annonaceae","Guatteria","ferruginea","A.St.-Hil.","Betancur J.",NA,NA,"1369",NA,"Córdoba M. P. et al.",1995,4,8,"Colombia","Vichada",NA,"Sin datos",-67.485591,6.184197,NA,"PUJ:HPUJ:008992",NA,"Guatteria ferruginea A.St.-Hil."
"188","2017-10-19T10:41:55.000+0000","JBRJ","RB","RB00441588","Guatteria ferruginea A.St.-Hil.",NA,"Annonaceae","Guatteria","ferruginea","A.St.-Hil.","A.Lobão",NA,NA,"2673",NA,"J.M.A. Braga; et al.",1995,8,16,"Brazil","Rio de Janeiro","Silva Jardim","Estrada para Juturnaiba, trilha da Pelonha. Reserva Biológica de Poço das Antas",-42.25,-22.5,"Arvore, ca. 5 metros de altura. Folhas membran ceas revestidas de pêlos castanhos. Raque vin cea. Frutos imaturos verdes. Mata de baixada.","urn:catalog:JBRJ:RB:441588",NA,"Guatteria ferruginea A.St.-Hil."
"189","2014-07-08T00:43:14.000+0000","JBRJ","RB","RB00744210","Guatteria ferruginea A.St.-Hil.",NA,"Annonaceae","Guatteria","ferruginea","A.St.-Hil.","A. Lobão",NA,NA,"790",NA,"C.M. Vieira; J.M.A. Braga; J.A.L. Neto; M.G. Bovini; J.R. de Figueiredo",1995,12,20,"Brazil","Rio de Janeiro","Guapimirim","Monte Olivete, trilha das Andorinhas.",NA,NA,"Árvore 9m de altura. Caulifloria presente. Folhas verdes discolores. Flores com pedicelo esverdeado, perianto verde-amarelado, frutos imaturos verdes, maduros vermelho nigrescentes.","urn:catalog:JBRJ:RB:744210",NA,"Guatteria ferruginea A.St.-Hil."
"190","2017-10-17T18:31:19.000+0000","JBRJ","RB","RB00442486","Guatteria ferruginea A.St.-Hil.",NA,"Annonaceae","Guatteria","ferruginea","A.St.-Hil.",NA,NA,NA,"124",NA,"D.S.Farias; et al.",1994,1,24,"Brazil","Rio de Janeiro","Silva Jardim","Margens do Rio São João, entre a BR101 e a ponte da linha férrea. Reserva Biológica de Poço das Antas",-42.25,-22.5,"Arbusto com 3,0m de alt. e 1,0cm de DAP. Flores alvo-esverdeadas.","urn:catalog:JBRJ:RB:442486",NA,"Guatteria ferruginea A.St.-Hil."
"191",NA,"NY","NY","01404542","Guatteria ferruginea A.St.-Hil.",NA,"Annonaceae","Guatteria","ferruginea","A.St.-Hil.",NA,NA,NA,"531",NA,"J. A. Kallunki",1994,2,13,"Brazil","Bahia",NA,"Fazenda das Almas, 18 km from BR-101 on road to ItacarÃ©, forest behind main buildings of fazenda",0,0,NA,"e8fa496c-9982-416c-a3b8-7e4fae93387c",NA,"Guatteria ferruginea A.St.-Hil."
"192",NA,"ASU","ASUPlants","230958","Guatteria ferruginea A.St.-Hil.",NA,"Annonaceae","Guatteria","ferruginea","A.St.-Hil.",NA,NA,NA,NA,NA,"G. Hatschbach",1994,4,12,"Brazil","Minas Gerais",NA,"Rod. BR-116 (mun. Leopoldina) Minas Gerais",NA,NA,NA,NA,NA,"Guatteria ferruginea A.St.-Hil."
"193","2017-10-18T17:12:38.000+0000","JBRJ","RB","RB00442650","Guatteria ferruginea A.St.-Hil.",NA,"Annonaceae","Guatteria","ferruginea","A.St.-Hil.",NA,NA,NA,"471",NA,"C.Luchiari; et al.",1994,7,26,"Brazil","Rio de Janeiro","Silva Jardim","Trilha da Casa do Aristídes,esquerda. Reserva Biológica de Poço das Antas",-42.25,-22.5,"1m, arbusto, sombreado,folha discolor, face superior verde escuro, face inferior verde com nervuras principal e secundária ferrugínea, pecíolo do fruto vinho e fruto imaturo verde.","urn:catalog:JBRJ:RB:442650",NA,"Guatteria ferruginea A.St.-Hil."
"194","2012-02-17T14:22:00.000+0000","MO","MO","3403294","Guatteria ferruginea A.St.-Hil.",NA,"Annonaceae","Guatteria","ferruginea","A.St.-Hil.","Mello-Silva","1994-01-01T00:00:00.000+0000",NA,"Hatschbach 48583",NA,"Gert G. Hatschbach|J.M. Silva",1994,12,4,"Brazil","Minas Gerais",NA,"Rod. BR-116 (mun. Leopoldina ) Minas Gerais.",NA,NA,NA,"urn:catalog:MO:Tropicos:3403294","http://www.tropicos.org/Specimen/3403294","Guatteria ferruginea A.St.-Hil."
"195",NA,NA,"Botany","WAG.1434086","Guatteria ferruginea A.St.-Hil.",NA,"Annonaceae","Guatteria","ferruginea","A.St.-Hil.","Maas PJM","2011-06-06T00:00:00.000+0000",NA,NA,NA,"Hatschbach GG; Silva JM",1994,12,4,"Brazil","Minas Gerais",NA,"Rod. BR-116 (mun. Leopoldina).",-42.633333,-21.533333,NA,"http://data.biodiversitydata.nl/naturalis/specimen/WAG.1434086",NA,"Guatteria ferruginea A.St.-Hil."
"196",NA,"ASU","ASUPlants","230957","Guatteria ferruginea A.St.-Hil.",NA,"Annonaceae","Guatteria","ferruginea","A.St.-Hil.",NA,NA,NA,NA,NA,"G. Hatschbach",1994,12,4,"Brazil","Minas Gerais",NA,"Rod. BR-116 (mun. Leopoldina) Minas Gerais",NA,NA,NA,NA,NA,"Guatteria ferruginea A.St.-Hil."
"197",NA,"NY","NY","00836786","Guatteria ferruginea A.St.-Hil.",NA,"Annonaceae","Guatteria","ferruginea","A.St.-Hil.","R. de Mello-Silva","1994-01-01T00:00:00.000+0000",NA,"48583",NA,"G. G. Hatschbach",1994,12,4,"Brazil","Minas Gerais",NA,"Rod. BR-116",-42.614861,-21.517389,NA,"36580afc-06bb-4bd8-8ccc-7d0708c5eb6a",NA,"Guatteria ferruginea A.St.-Hil."
"198","2017-10-17T19:11:35.000+0000","JBRJ","RB","RB00441117","Guatteria ferruginea A.St.-Hil.",NA,"Annonaceae","Guatteria","ferruginea","A.St.-Hil.","Adriana Lobão",NA,NA,NA,NA,"H.C.de Lima; et al.",1993,1,9,"Brazil","Rio de Janeiro","Silva Jardim","Trilha do Morro do Calcario, ponto 1000. Reserva Biológica de Poço das Antas",-42.25,-22.5,NA,"urn:catalog:JBRJ:RB:441117",NA,"Guatteria ferruginea A.St.-Hil."
"199",NA,NA,"Botany","U.1064052","Guatteria ferruginea A.St.-Hil.",NA,"Annonaceae","Guatteria","ferruginea","A.St.-Hil.","Maas PJM",NA,NA,NA,NA,"Sant'Ana SC da",1993,7,28,"Brazil","Bahia",NA,NA,NA,NA,NA,"http://data.biodiversitydata.nl/naturalis/specimen/U.1064052",NA,"Guatteria ferruginea A.St.-Hil."
"200",NA,"MBM","MBM","284843","Guatteria burchellii R.E.Fr.",NA,"Annonaceae","Guatteria","burchellii","R.E.Fr.","Mello-Silva, R","2002-01-01T00:00:00.000+0000",NA,"327",NA,"Sant' Ana, SC; Carvalho, AM; Jardim, JG; Santos, EB; Lisboa, S; Gois Neto, A",1993,7,28,"Brazil","Bahia","Una","Entrada à direita, no km 10,4 da Rodovia Una/Ilhéus.",0,0,"Árvore com ca. 12 m altura. Flores com sépalas e pétalas esverdeados. Frutos imaturos verdes.; Restinga Arbórea.","BRA:MBM:MBM:0000284843",NA,"Guatteria burchellii R.E.Fr."
"201",NA,"MBM","MBM","238727","Guatteria burchellii R.E.Fr.",NA,"Annonaceae","Guatteria","burchellii","R.E.Fr.","Lobão, A","2006-10-01T00:00:00.000+0000",NA,"15713",NA,"Jardim, JG; Mattos Silva, LA; Sant ' Ana, SC; Santos, EB",1993,7,14,"Brazil","Bahia","Una","Reserva Biológica do Mico-leão (IBAMA), Entrada no km 46 da Rodovia BA-001 Ilhéus/Una. 15°09'S e 39°05'W",0,0,"Árvore com ca. 8m de altura. Folhas discolores, verde-escuro na face superior e coberta po pelos marrons na inferior. Frutos imaturos verdes, tornando-se arroxeados.; Região da Mata Higrófila Sul Baiana.","BRA:MBM:MBM:0000238727",NA,"Guatteria burchellii R.E.Fr."
"202",NA,"NY","NY","538633","Guatteria ferruginea A.St.-Hil.",NA,"Annonaceae","Guatteria","ferruginea","A.St.-Hil.","P. J. M. Maas","2001-01-01T00:00:00.000+0000",NA,"157",NA,"J. G. Jardim",1993,7,13,"Brazil","Bahia",NA,"Una Biological Reserve. Entrada no km 46 da Rod. BA-001 IlhÃ©us-Una",-39.08,-15.15,"Site: R","14ede823-ea70-47a9-bf6a-5a4b0141598d",NA,"Guatteria ferruginea A.St.-Hil."
"203",NA,NA,"Botany","U.1064051","Guatteria ferruginea A.St.-Hil.",NA,"Annonaceae","Guatteria","ferruginea","A.St.-Hil.","Maas PJM",NA,NA,NA,NA,"Jardim JG; et al.",1993,7,14,"Brazil","Bahia",NA,NA,NA,NA,NA,"http://data.biodiversitydata.nl/naturalis/specimen/U.1064051",NA,"Guatteria ferruginea A.St.-Hil."
"204",NA,"NY","NY","538631","Guatteria ferruginea A.St.-Hil.",NA,"Annonaceae","Guatteria","ferruginea","A.St.-Hil.","P. J. M. Maas","2001-01-01T00:00:00.000+0000",NA,"327",NA,"S. C. de Sant'Ana",1993,7,28,"Brazil","Bahia",NA,"Entrada a direita, no km 10,4 da Rod. Una/IlhÃ©us",-39.0751882637406,-15.2970177652254,NA,"47c8e8a6-f999-42ca-97db-17e8b1139d39",NA,"Guatteria ferruginea A.St.-Hil."
"205",NA,"MBM","MBM","254615","Guatteria burchellii R.E.Fr.",NA,"Annonaceae","Guatteria","burchellii","R.E.Fr.","Lobão, A","2006-10-01T00:00:00.000+0000",NA,"1418",NA,"Amorim, AM; Sant ' Ana, SC; Jardim, JC; Santos, EB",1993,11,9,"Brazil","Bahia","Una","Reserva Biológica do Mico-leão (IBAMA), Entrada no km 46 da Rodovia BA-001 Ilhéus/Una. 15°09'S e 39°05'W.",0,0,"Arvoreta alcançando 8,0 m de altura. Folhas verdes, a face inferior algo castanha. Frutos vistosos, caulifloros; núcleo negro e pedúnculos vermelho carmim.; Região da mata Higrófila Sul Baiana.","BRA:MBM:MBM:0000254615",NA,"Guatteria burchellii R.E.Fr."
"206",NA,"NY","NY","538634","Guatteria ferruginea A.St.-Hil.",NA,"Annonaceae","Guatteria","ferruginea","A.St.-Hil.","P. J. M. Maas","2001-01-01T00:00:00.000+0000",NA,"1418",NA,"A. M. Amorim",1993,11,9,"Brazil","Bahia",NA,"Una Biological Reserve. Entrada no km 46 da Rod. BA-001 IlhÃ©us/Una",-39.08,-15.15,"Site: R","30f4c14e-c083-42f7-90a8-6fdef24d101d",NA,"Guatteria ferruginea A.St.-Hil."
"207",NA,NA,"Botany","U.1064079","Guatteria ferruginea A.St.-Hil.",NA,"Annonaceae","Guatteria","ferruginea","A.St.-Hil.","Maas PJM",NA,NA,NA,NA,"Amorim AM; et al.",1993,11,9,"Brazil","Bahia",NA,NA,NA,NA,NA,"http://data.biodiversitydata.nl/naturalis/specimen/U.1064079",NA,"Guatteria ferruginea A.St.-Hil."
"208","2014-09-26T00:00:00.000+0000","Instituto Nacional de Pesquisas da Amazônia (INPA)","Coleção Botânica, Instituto Nacional de Pesquisas da Amazônia (INPA)","212269","Guatteria ferruginea A.St.-Hil.",NA,"Annonaceae","Guatteria","ferruginea","A.St.-Hil.","Lobão, A.Q.","2011-09-01T00:00:00.000+0000",NA,"24",NA,"Mike Hopkins",1993,12,28,"Brazil","Bahia",NA,"Margem da estrada Barra dos Garcês/Camaçandi.",NA,NA,NA,"urn:catalog:inpa:herbarium:167493",NA,"Guatteria ferruginea A.St.-Hil."
